PT OMYA INDONESIA,2
PT ONE MEDIA DIGITAL,1
PT ONE MEDIA KREATIF,1
PT ONE MEDIA SERVICES,1
PT ONIGROUP GLOBAL INDONESIA,0
PT ONIX INVESTAMA,2
PT ONIX SEKURITAS,2
PT ONSTOCK SOLUSI INDONESIA,1
PT ONYX MARITIME,0
PT OPTIMA COAL,1
PT OPTIMA DAYA KAPITAL,1
PT OPTIMA PERSADA ENERGI,1
PT OPTIMA PRIMA METAL SINERGI TBK,1
PT OPTIMA TIRTA ENERGY,1
PT OPTIMAL TATA MANDIRI,2
PT ORGANON PHARMA INDONESIA TBK,2
PT ORICA MINING SERVICES,2
PT ORIENTAL SHEET PILING,1
PT ORINDO ALAM AYU,0
PT ORION GLOBAL DEVELOPMENT,0
PT ORION MULTI BUANA,2
PT ORKIDA MAKMUR,1
PT ORLIE INDONESIA,2
PT OSCAR MITRA SUKSES SEJAHTERA TBK,0
PT OSHA ASIA,1
PT OSO JASA MEDIKA,2
PT OTO MULTIARTHA,1
PT OUT OF ASIA,2
PT OWEN PETRO BITUMEN,0
PT OWEN STRATEGIK MEDIA,0
PT OXYGEN INFRASTRUKTUR INDONESIA,2
PT OXYGEN MULTIMEDIA INDONESIA,2
PT PABRIK MINYAK PERNIAGAAN DAN INDUSTRI IKAN DORANG,1
PT PACIFIC EXINTRACO,1
PT PACIFIC GLOBAL UTAMA,1
PT PACIFIC INDOPALM INDUSTRIES,0
PT PACIFIC STAR SYNERGY,0
PT PACKET SYSTEMS INDONESIA,1
PT PACRIM NUSANTARA LESTARI FOODS,1
PT PADA IDI,1
PT PADANG GOLF CIKARANG,1
PT PADI FLOUR NUSANTARA,0
PT PADI RAYA SEJAHTERA,0
PT PADJADJARAN RAYA,0
PT PADMA SUASA,1
PT PAFA MANDIRI SAKTI,1
PT PAGAR BATU LESTARI,2
PT PAHALA AGUNG,1
PT PAHALAMAS SEJAHTERA,0
PT PAITON ENERGY,1
PT PAKKODIAN,2
PT PAKOAKUINA,1
PT PAKUAN TBK,1
PT PAKUWON ARTHANIAGA,1
PT PAKUWON DARMA,1
PT PAKUWON NUSANTARA ABADI,1
PT PAKUWON PERMAI,1
PT PAKUWON REGENSI,1
PT PAKUWON SENTOSA ABADI,1
PT PALAPA RING BARAT,2
PT PALAPA TIMUR TELEMATIKA,2
PT PALARAN INDAH LESTARI,1
PT PALARAN SINERGI MAS,1
PT PALEMBANG JAYA KUSUMA,1
PT PALKO SARI EKA,1
PT PALM AGRO KATULISTIWA,1
PT PALM MAS ASRI,1
PT PALMA CONTE MAS,1
PT PALMA PLANTASINDO,1
PT PALMA SEJAHTERA,1
PT PALMA SERASIH INTERNASIONAL,2
PT PALMA SERASIH TBK,2
PT PALMA TIMUR SEJAHTERA,2
PT PALOMA SUASA MANAJEMEN,1
PT PALTAC TRADING INDONESIA,1
PT PALU GRAHA SEJAHTERA,0
PT PAM METALINDO,2
PT PAM MINERAL TBK,2
PT PAMAPERSADA NUSANTARA,2
PT PAN INDO RESOURCES,1
PT PAN MARITIME WIRA PRAWITRA,1
PT PANAH DUNIA PERKASA,0
PT PANAH PERDANA LOGISINDO,2
PT PANASONIC GOBEL INDONESIA,0
PT PANATA JAYA MANDIRI,2
PT PANCA AGUNG GEMILANG,2
PT PANCA AMARA UTAMA,0
PT PANCA ANUGRAH WISESA TBK,1
PT PANCA BOGA PARAMITA,1
PT PANCA BUDI IDAMAN TBK,0
PT PANCA BUDI NIAGA,0
PT PANCA BUDI PRATAMA,0
PT PANCA GLOBAL KAPITAL TBK,1
PT PANCA GLOBAL SEKURITAS,1
PT PANCA KARYA MALINDO,0
PT PANCA MAKMUR BARU,1
PT PANCA MUARA JAYA,2
PT PANCA PACKINDO MAKMUR,0
PT PANCA SURYA GEMILANG,1
PT PANCAKUSUMA DIRGANTARA,2
PT PANCAPURI INDOPERKASA,1
PT PANCAR TEKNIK UTAMA MANDIRI,1
PT PANCARAN ARINDO SELARAS,0
PT PANCARAN INDONESIA,1
PT PANCARAN SAMUDERA TRANSPORT,2
PT PANCAWARNA SEMESTA,1
PT PANDA MAS KIMIA ABADI,2
PT PANDEGA CITRANIAGA,1
PT PANDEGA LAYAR PRIMA,1
PT PANDJI WARINGIN,1
PT PANDORA MULTI ARTHA,1
PT PANDU BIOSAINS,1
PT PANDUNEKA SEJAHTERA,1
PT PANDURASA KHARISMA,0
PT PANEN ARTHA NUSA,0
PT PANEN GL INDONESIA,2
PT PANEN KOSMETIK ADIPERKASA,2
PT PANEN KREASI INDONESIA,2
PT PANEN LESTARI INDONESIA,2
PT PANEN LESTARI INTERNUSA,2
PT PANEN MAS SURYA ABADI,0
PT PANEN MODE INDONESIA,2
PT PANEN PRIMA ADIPERKASA,2
PT PANEN SEHAT ADIPERKASA,2
PT PANEN SELARAS ADIPERKASA,2
PT PANEN SELARAS INTIBUANA,2
PT PANEN SPORTS LESTARI,2
PT PANEN SUBUR ABADI,0
PT PANEN SWALAYAN ADIPERKASA,2
PT PANEN TATAGRIYA INDONEISA,2
PT PANEN WANGI ABADI,2
PT PANGAN CITARASA NUSANTARA,0
PT PANGAN LESTARI,0
PT PANGAN NIKMAT ABADI,1
PT PANGAN SEJAHTERA INVESTAMA,0
PT PANGERAN PUTRA PERKASA,1
PT PANGKAL MULTIKARYA,2
PT PANI BERSAMA JAYA,1
PT PANIN ASSET MANAGEMENT,0
PT PANIN DAI-ICHI LIFE DIMILIKI PANIN INTERNASIONAL,1
PT PANIN GENINHOLDCO,1
PT PANIN INTERNASIONAL,0
PT PANINKORP,1
PT PANJI NUGRAHA SAKTI,1
PT PANJI RAYA ALAMINDO,1
PT PANJUNAN,0
PT PANORAMA APLIKASI NUSANTARA,2
PT PANORAMA DESTINASI INDONESIA,2
PT PANORAMA EKA TUNGGAL,2
PT PANORAMA EVENINDO,2
PT PANORAMA HOSPITALITY MANAGEMENT,1
PT PANORAMA JTB TOURS INDONESIA,2
PT PANORAMA MEDIA,2
PT PANORAMA MITRA SARANA,2
PT PANORAMA PRIMAKENCANA TRANSINDO,2
PT PANORAMA TIRTA ANUGERAH,2
PT PANORAMA VENTURA INDONESIA,2
PT PANTAI INDAH KAPUK DUA TBK,2
PT PANTJA SURYA,0
PT PANTJA TIRTA DRAWANA,2
PT PANYINDANGAN,2
PT PAPUA SAWITA RAYA,1
PT PAPUA SUPPLIES AND SERVICES,1
PT PAPUA TIMBER JAYA,1
PT PARA AMARTHA GASINDO,2
PT PARA AMARTHA LNG,1
PT PARAGA ARTA MIDA,1
PT PARAGON TECHNOLOGY AND INNOVATION,1
PT PARAMARTA ROLAS JAYA,0
PT PARAMATA INDAH LESTARI,2
PT PARAMITA ADHI PERKASA,2
PT PARAMITA ANDALAN STRUKTUR,2
PT PARAMITA BANGUN SARANA TBK,2
PT PARAMITA MULTI SARANA,2
PT PARAMITRA INTIMEGA,2
PT PARAMITRA MEDIA INTERAKTIF,2
PT PARAMOUNT BED INDONESIA,0
PT PARAS CANTIK KENANGA,1
PT PARATAMA INVESTAMA JAYA,2
PT PARIT PADANG GLOBAL,0
PT PARIWARA DIGITAL MEDIA,1
PT PARKIT FILM,1
PT PARMON PRIMA LESTARI,1
PT PARSAORAN GLOBAL DATATRANS,2
PT PARTOGI DAYA TIRTA,2
PT PARTOGI TIRTA ENERGI,2
PT PARVI INDAH PERSADA,0
PT PARVUS MEDICA INDONESIA,1
PT PASANGKAYU,1
PT PASARAYA INTERNATIONAL HEDONISARANA,1
PT PASIFIC MOBIL,0
PT PASIFIC PRIMA MENTARI,1
PT PASIFIK INTERNUSA,1
PT PASIFIK MASINDO,1
PT PASIFIK ORIENTAL MASINDO,1
PT PASIR BARA PRIMA,2
PT PASIR LUHUR,1
PT PASIR TENGAH,2
PT PASKOMNAS NIAGA UTAMA,2
PT PASOKA SUMBER KARYA,1
PT PASTI BALI,1
PT PATEN ALAM LESTARI,0
PT PATIN RESOURCES,1
PT PATOKA SARANA,1
PT PATRA DRILLING CONTRACTOR,0
PT PATRA JASA,1
PT PATRA NIAGA,0
PT PATRA NUSA DATA,0
PT PATRA SUPPLIES AND SERVICES,1
PT PATRIA INVESTAMA,0
PT PATRIA MARITIM PERKASA,1
PT PATRIA NUSA ADAMAS,0
PT PATRIAMANUNGGAL JAYA,1
PT PATRINDO JAYA MAKMUR,2
PT PAW PIC STUDIO INDONESIA,2
PT PBM ADIPURUSA,0
PT PBM OLAH JASA ANDAL,0
PT PBM WIN SURABAYA,0
PT PEARL MARITIME,0
PT PEDAGANG ASET KRIPTO,0
PT PEGADAIAN,1
PT PEGADAIAN (PERSERO),1
PT PEGAUNIHAN TECHNOLOGY INDONESIA,2
PT PEJATEN SEMESTA RAYA,0
PT PEKANBARU PERMAI PROPERTINDO,1
PT PELABUHAN BUANA REJA,2
PT PELABUHAN BUKIT PRIMA,1
PT PELABUHAN INDONESIA (PERSERO),1
PT PELABUHAN INDONESIA INVESTAMA,1
PT PELABUHAN LAUT SRIWIJAYA,2
PT PELABUHAN TALENTA BUMI,1
PT PELABUHAN TANJUNG PRIOK,0
PT PELABUHAN TEMAS NUSANTARA,1
PT PELANDUK JAYA BERSAMA,2
PT PELANGGAN SETIA INDONESIA,0
PT PELANGI ANUGERAH BUANA,1
PT PELANGI INTIPERTIWI,1
PT PELAYARAN BAHTERA ADHIGUNA,1
PT PELAYARAN BAHTERAADHIGUNA (PERSERO),1
PT PELAYARAN BHARUNA SAMUDERA PERSADA,1
PT PELAYARAN HASKO HANLY GLOBAL,1
PT PELAYARAN KARANA LINE,1
PT PELAYARAN KARTIKA SAMUDRA ADIJAYA,1
PT PELAYARAN LAUTAN BERKAT,1
PT PELAYARAN LINGGA MARINTAMA,1
PT PELAYARAN MANA LAGI,1
PT PELAYARAN MARINDO PACIFIC,1
PT PELAYARAN MARINDO PACIFIC SMD,1
PT PELAYARAN MERAH PUTIH,2
PT PELAYARAN NASIONAL EKALYA PURNAMASARI,1
PT PELAYARAN NASIONAL INDONESIA (PERSERO),0
PT PELAYARAN NELLY ANUGRAH,1
PT PELAYARAN ROYLEA MARINE LINE,0
PT PELAYARAN SAMUDRA KARANA LINE,1
PT PELAYARAN SENGGORA,1
PT PELAYARAN SINAR SHIPPING,1
PT PELAYARAN SKREN SARANA SAMUDERA,0
PT PELAYARAN STRAITS PERDANA,1
PT PELAYARAN TAHTA BAHTERA,0
PT PELAYARAN TAMARIN SAMUDRA TBK,1
PT PELAYARAN TRANSPENINSULAR,1
PT PELINDO ENERGI LOGISTIK,1
PT PELINDO JASA MARITIM,1
PT PELINDO MARINE SERVICE,1
PT PELINDO MULTI TERMINAL,1
PT PELITA AGUNG AGRINDUSTRI,0
PT PELITA GLOBAL LOGISTIK,2
PT PELITA MULIA PERKASA,0
PT PELITA SAMUDERA SHIPPING,2
PT PELITA SAMUDERA SREEYA,2
PT PELITA SUKSES SEJATI,0
PT PELITA TATAMAS JAYA,1
PT PELITAMAJU MULTISWAKARSA,1
PT PEMALANG BATANG TOLL ROAD,1
PT PEMBANGKIT ENERGI TERBARUKAN,1
PT PEMBANGKIT INDONESIA ALFA,1
PT PEMBANGKIT INDONESIA DELTA,1
PT PEMBANGKIT INDONESIA EPSILON,1
PT PEMBANGKIT INDONESIA ETA,1
PT PEMBANGKIT INDONESIA GAMMA,1
PT PEMBANGKIT INDONESIA ZETA,1
PT PEMBANGKIT JAWA-BALI,2
PT PEMBANGUNAN DELTAMAS,0
PT PEMBANGUNAN JAYA,1
PT PEMBANGUNAN PERUMAHAN PRESISI,0
PT PEMBANGUNAN PERUMAHAN URBAN,1
PT PEMBANGUNAN PROPERTY NUSANTARA,1
PT PEMBINA GALINDRA ELECTRIC,0
PT PEMENANG NUSANTARA INTERNASIONAL,1
PT PEMENANG PROPERTI NASIONAL,1
PT PEMENANG YABES PROPERTI,1
PT PEMUDA BAJA RAYA,0
PT PENAJAM INTERNASIONAL TERMINAL,1
PT PENASCOP MARITIM INDONESIA,1
PT PENDANAAN EFEK INDONESIA,0
PT PENDAWA LESTARI PERKASA,0
PT PENDOPO ENERGI BATUBARA,1
PT PENGEMBANGAN INDUSTRI LOGAM,1
PT PENGEMBANGAN LISTRIK NASIONAL GAS & GEOMETRAL,1
PT PENGEMBANGAN PARIWISATA INDONESIA (PERSERO),1
PT PENTA ARTHA IMPRESSI,1
PT PENTA COSMOPOLITAN,0
PT PENTA OKTONEATAMA,1
PT PENTA VALENT TBK,0
PT PENTA WIDJAJA INVESTINDO,0
PT PENTABIZ INTERNATIONAL,2
PT PENTAKENCANA PAKARPERDANA,1
PT PENTAWIRA AGRAHA SAKTI,2
PT PERDANA ADILOKA,1
PT PERDANA CITRA SEJAHTERA,1
PT PERDANA KENCANA MANDIRI,1
PT PERDANA MULIA MAKMUR,1
PT PERDONI,1
PT PERFETTI VAN MELLE,0
PT PERINDO AMBON,0
PT PERINDUSTRIAN SAWIT SYNERGI,1
PT PERINTIS DINAMIKA SEKATAMA,1
PT PERINTIS NIAGA INDONESIA,2
PT PERINTIS TEKNOPRIMA,2
PT PERINTIS TRINITI PROPERTI TBK,2
PT PERKASA ALUMINA INDONESIA,1
PT PERKASA ANUGERAH MINERAL,1
PT PERKASA BETON BATAM,1
PT PERKASA INAKAKERTA,1
PT PERKASA INVESTAMA MINERAL,1
PT PERKASA MAKMUR AMARA,1
PT PERKASALESTARI PERMAI,1
PT PERKASALESTARI UTAMA,1
PT PERKEBUNAN BITING,1
PT PERKEBUNAN INDUTSRI SEGAJUNG,1
PT PERKEBUNAN KALTIM UTAMA I,2
PT PERKEBUNAN KROEWOEK,1
PT PERKEBUNAN LEMBAH BHAKTI,1
PT PERKEBUNAN NUSANTARA II,1
PT PERKEBUNAN NUSANTARA III,0
PT PERKEBUNAN NUSANTARA IV,2
PT PERKEBUNAN NUSANTARA IX,1
PT PERKEBUNAN NUSANTARA VI,0
PT PERKEBUNAN NUSANTARA VIII,0
PT PERKEBUNAN NUSANTARA XIII,2
PT PERKOM INDAH MURNI,1
PT PERMA PLASINDO TBK,0
PT PERMADANI KHATULISTIWA NUSANTARA,1
PT PERMATA AGRO PERSADA,1
PT PERMATA ALAM PROPERTI,1
PT PERMATA BARITO SHIPYARD&ENGINEERING,1
PT PERMATA BERLIAN REALTY,1
PT PERMATA BINTANG BORNEO,1
PT PERMATA BIRAMA SAKTI,2
PT PERMATA BUSANA MAS,0
PT PERMATA DUNIA SUKSES UTAMA,0
PT PERMATA FOOD INDONESIA,0
PT PERMATA GRAHA NUSANTARA,0
PT PERMATA HIJAU,2
PT PERMATA INDAH KEDATON,1
PT PERMATA KARYA PERDANA,2
PT PERMATA KEMBANG SENTOSA,1
PT PERMATA KHATULISTIWA REGAS,1
PT PERMATA LINTAS ABADI,1
PT PERMATA NUSANTARA HOTELINDO,2
PT PERMATA PUTERA MANDIRI,1
PT PERMATA SAWIT NUSANTARA,2
PT PERMODALAN NASIONAL MADANI,1
PT PERSADA CAPITAL INVESTAMA,1
PT PERSADA CENTRA MAXINDO,1
PT PERSADA DINAMIKA LESTARI,1
PT PERSADA HIDRO LESTARI,2
PT PERSADA MAKMUR INDONESIA,1
PT PERSADA MAKMUR SEJAHTERA,1
PT PERSADA MAKMUR SELARAS DUA,1
PT PERSADA MANDIRI SUKSES,1
PT PERSADA NUSANTARA STEEL,1
PT PERSADA SOKKA TAMA,2
PT PERSADABINA NUSANTARAABADI,1
PT PERSEBAYA INDONESIA,0
PT PERSIJA JAYA JAKARTA,0
PT PERSIS SOLO SAESTU,0
PT PERSONEL ALIH DAYA,2
PT PERTAMINA (PERSERO),1
PT PERTAMINA BINA MEDIKA,0
PT PERTAMINA DRILLING SERVICES INDONESIA,0
PT PERTAMINA EP,0
PT PERTAMINA GAS,1
PT PERTAMINA GEOTHERMAL ENERGY TBK,0
PT PERTAMINA HULU ENERGI,0
PT PERTAMINA HULU INDONESIA,0
PT PERTAMINA HULU KALIMANTAN TIMUR,1
PT PERTAMINA HULU KALTIM,1
PT PERTAMINA HULU MAHAKAM,1
PT PERTAMINA HULU ROKAN,1
PT PERTAMINA HULU SANGA SANGA,1
PT PERTAMINA INTERNASIONAL MARKETING & DISTRIBUSI,0
PT PERTAMINA INTERNATIONAL SHIPPING,1
PT PERTAMINA LUBRICANTS,2
PT PERTAMINA PATRA NIAGA,0
PT PERTAMINA PERTAGAS NIAGA,2
PT PERTAMINA PETROCHEMICAL TRADING,0
PT PERTAMINA RETAIL,0
PT PERTAMINA TRAINING & CONSULTING,0
PT PERTAMINA TRANS KONTINENTAL,1
PT PERTAMINIA ENERGI TERMINAL,1
PT PERTIWI AGRO SEJAHTERA,2
PT PERUSAHAAN BONGKAR MUAT OLAH JASA ANDAL,0
PT PERUSAHAAN BONGKAR MUAT WAHANA INTRADERMAGA NIAGA,0
PT PERUSAHAAN BONGKAR MUAT WAHANA INTRADERMAGA NIAGA MAKASSAR,0
PT PERUSAHAAN BONGKAR MUAT WAHANA INTRADERMAGA NIAGA MEDAN,0
PT PERUSAHAAN BONGKAR MUAT WAHANA INTRADERMAGA NIAGA TAPIN,0
PT PERUSAHAAN DAGANG DAN INDUSTRI PANAMAS,1
PT PERUSAHAAN DAGANG MENDJANGAN,0
PT PERUSAHAAN DAGANG TEMPO,1
"PT PERUSAHAAN DAGANG,PERKEBUNANDAN INDUSTRI SERIKAT PUTRA",1
PT PERUSAHAAN GAS NEGARA TBK,0
PT PERUSAHAAN PELAYARAN CUMAWIS,1
PT PERUSAHAAN PELAYARAN RUSIANTO BERSAUDARA,1
PT PERUSAHAAN PENGELOLA ASET,2
PT PERUSAHAAN PERDAGANGAN INDONESIA (PERSERO),0
PT PERUSAHAAN PERKEBUNAN LONDON SUMATRA INDONESIA,1
"PT PERUSAHAAN PERKEBUNAN, PERINDUSTRIAN DAN PERDAGANGAN UMUM PASIR LUHUR",1
"PT PERUSAHAAN PERKEBUNAN,INDUSTRI DAN DAGANG INDRIPLANT",1
PT PESONA AGUNG LESTARI,1
PT PESONA ALAM BUNAKEN,0
PT PESONA BALI RAYA ABADI,1
PT PESONA CITRA PROPERTINDO,1
PT PESONA GERBANG KARAWANG,1
PT PESONA KARYA BANGSA,1
PT PESONALINTAS SURASEJATI,1
PT PET WORLD INDONESIA,1
PT PETRAMAS HARJA SEJAHTERA,1
PT PETRO ANDALAN NUSANTARA,1
PT PETRO ENERGY,1
PT PETRO HIDRO OPTIMA,1
PT PETRO NIAGA MANDIRI,1
PT PETRO NUSA KITA,0
PT PETRO PUTRA PERKASA,2
PT PETRO UTAMA ENERGI,1
PT PETROFINDO NIAGA SUKSES,2
PT PETROKIMIA GRESIK,2
PT PETROMINE ENERGY TRADING,2
PT PETRONIKA,0
PT PETROSEA INFRASTRUKTUR NUSANTARA,2
PT PETROTECH PENTA NUSA,1
PT PGAS SOLUTION,0
PT PGAS TELEKOMUNIKASI NUSANTARA,2
PT PGN LNG INDONESIA,0
PT PHAPROS TBK,0
PT PHARMA HEALTH CARE,0
PT PHERISSA BANGKIT BERSAMA,1
PT PHILIP MORRIS INDONESIA,1
PT PHILIP MORRIS SAMPOERNA INTERNATIONAL SERVICE CENTER,1
PT PHOENIX RESOURCES INTERNATIONAL,1
PT PIGEON INDONESIA,2
PT PIGIJO TRAVELINDO SAKTI,0
PT PILAR DAYA SINERGI,2
PT PILAR GAPURA NUSA,1
PT PILAR PRATAMA DINAMIKA,0
PT PILAR PUTRA MAHAKAM,1
PT PILAR SUKSES UTAMA,1
PT PILAR TEGUH UTAMA,1
PT PILAR UTAMA LABUAN,1
PT PILAR WANAPERSADA,2
PT PILOFICE,1
PT PINAGO UTAMA TBK,1
PT PINDAD (PERSERO),1
PT PINDO DELI PULP AND PAPER MILLS,1
PT PINS INDONESIA,2
PT PINTU ILMU,1
PT PINTU TIGA RAHARJA,1
PT PIONEERINDO SUGAKICO INDONESIA,2
PT PIONIR ELEKTRIK INDONESIA,0
PT PIONIRBETON INDUSTRI,1
PT PIRANTI TEKNOLOGI UNGGUL,1
PT PIRUS PLATINUM MURNI,0
PT PLANET MERAH DELAPAN,1
PT PLANET MERAH DEPOK,1
PT PLANET MERAH SEMBILAN,1
PT PLANET MERAH SEPULUH,1
PT PLANET PROPERINDO JAYA TBK,1
PT PLASINDO LESTARI,0
PT PLASTIK KARAWANG FLEXINDO,1
PT PLASTMART RITEL PRATAMA,0
PT PLATINUM SURYA ABADI SENTOSA,0
PT PLATINUM TEKNOLOGI,2
PT PLAZA AUTO PRIMA,1
PT PLAZA INDONESIA INVESTAMA,2
PT PLAZA INDONESIA MANDIRI,2
PT PLN (PERSERO),1
PT PLN BATUBARA NIAGA,1
PT PLN ENERGI PRIMER INDONESIA,1
PT PLN GAS & GEOTHERMAL,1
PT PLN INDONESIA POWER,1
PT PLN NUSANTARA POWER,1
PT PLUIT PROPERTINDO,1
PT PODO MEKAR JAYA SENTOSA,0
PT PODOMORO BANGUN ABADI,1
PT PODOMORO BATUNUNGGAL INDAH,1
PT PODOMORO CENTRAL SEJAHTERA,1
PT PODOMORO SUKSES LESTARI,1
PT POIN MULTI MEDIA,1
PT POIN MULTI MEDIA NUSANTARA,1
PT POLA INTI PERKASA,1
PT POLARI LIMUNUSAINTI,1
PT POLARISWEB,0
PT POLIKEMAS SANPUTRA,1
PT POLITEK GRIN PACKINDO,0
PT POLLUX HOTELS GROUP TBK,1
PT POLLUX PROPERTI INDONESIA TBK,1
PT POLONIA ANUGERAH JAYA,0
PT POLYPLEX FILMS INDONESIA,1
PT POLYTECH INDO HAUSEN,0
PT PONDOK GEMILANG SEJAHTERA,1
PT PONDOK INDAH HOTEL,0
PT PONDOK KARYA MEDIKA,0
PT PONGKERU MINERAL UTAMA,1
PT POOL ADVISTA FINANCE TBK,1
PT POOL ADVISTA INDONESIA TBK,1
PT POP PROPERTI INDONESIA,1
PT PORTCO INFRANUSANTARA,1
PT POS LOGISTIK,1
PT POS LOGISTIK INDONESIA,1
PT POSB INFRASTRUCTURE INDONESIA,2
PT POSB REKSABUMI INDONESIA,1
PT POSCO INDONESIA JAKARTA PROCESSING CENTRE,1
PT POSO ENERGY,1
PT POTUM MUNDI INFRANUSANTARA,1
PT POU YUEN INDONESIA,1
PT POWER ALAM LESTARI,1
PT PP ENERGI,2
PT PP INFRASTRUKTUR,2
PT PP PRESISI TBK,1
PT PP PROPERTI JABABEKA RESIDEN,1
PT PP PROPERTI SURAMADU,1
PT PP PROPERTI TBK,2
PT PP SEMARANG DEMAK,1
PT PP URBAN,2
PT PPRO BIJB AEROCITY DEVELOPMENT,1
PT PPRO SAMPURNA JAYA,1
PT PRABA KUMALA SAJATI,1
PT PRABANGKARA SANGKARA,0
PT PRADIKSI GUNATAMA TBK,1
PT PRADIPA DARPA BANGSA,0
PT PRAGYA TATA ASRI,1
PT PRAJA BALI TRANSPORTASI,0
PT PRAJAMITA INTERNUSA,1
PT PRAKARSA NUSA CEMERLANG,1
PT PRAKARSA TANISEJATI SCRIPLESS,1
PT PRAKARSA TANISEJATI WARKAT,1
PT PRAKINDO INVESTAMA,1
PT PRAMBANAN BIZLAND INDONESIA,0
PT PRAMBANAN INVESTASI SUKSES,1
PT PRAPAT TUNGGAL CIPTA,2
PT PRASARANA ENERGI CIREBON,1
PT PRASARANA ENERGI INDONESIA,1
PT PRASETIA DWIDHARMA,1
PT PRASETYA GEMAMULIA,2
PT PRASIDHA,1
PT PRATAMA ABADI SENTOSA,2
PT PRATAMA BETON NUSANTARA,1
PT PRATAMA CITRA GEMILANG,1
PT PRATAMA GALUR USAHA,2
PT PRATAMA INVESTAMA KURNIA,1
PT PRATAMA KENCANA PERKASA,1
PT PRATAMA LANDASAN USAHA SEJAHTERA,1
PT PRATAMA LOGISTIC SYSTEM,1
PT PRATAMA SATYA PRIMA,1
PT PRATAMA SATYA TUNGGAL,1
PT PRATAMA UNGGUL LESTARI,1
PT PRATAMA WANA MOTOR,1
PT PRATAMA WIDYA ENGINEERING,1
PT PRATAMA WIDYA TBK,1
PT PRATITA PRAMA NUGRAHA,1
PT PRATIWI MEDIKA UTAMA,0
PT PRAWARA RANAJAYA CATRA,0
PT PRAWEDA SARANA INFORMATIKA,1
PT PRAWIRA TATA SEMESTA,1
PT PRAWIRAWIDJAJA PRAKARSA,1
PT PRECISE PACIFIC REALTY,1
PT PREMIER CAPITAL INDONESIA,2
PT PREMIER CAPITAL INVESTMENT,2
PT PREMIER DOUGHNUT INDONESIA,2
PT PREMIERA ANGGADA,2
PT PRESTASI PIRANTI INFORMASI,2
PT PRESTISIUS INDONESIA,0
PT PRIMA ANDALAN MANDIRI TBK,1
PT PRIMA ANDALAN UTAMA,1
PT PRIMA ARMADA SAMUDRA,1
PT PRIMA ARTHA UTAMA,1
PT PRIMA BETON BANGUN PERSADA,1
PT PRIMA BISNIS UTAMA,2
PT PRIMA BUANA PERKASA,2
PT PRIMA BUANA PERKASA RITEL,2
PT PRIMA CAKRAWALA ABADI TBK,1
PT PRIMA CAKRAWALA SENTOSA,0
PT PRIMA CIPTA KONSTRUKSI,1
PT PRIMA CITRA PERDANA,1
PT PRIMA DENTAL MEDIKA,1
PT PRIMA ECOMMERCE GLOBAL,0
PT PRIMA ENERGI BAWEAN,1
PT PRIMA FAJAR,1
PT PRIMA GLOBALINDO LOGISTIK TBK,1
PT PRIMA GRAHA HIBURAN,1
PT PRIMA HONEYCOMB INTERNATIONAL,2
PT PRIMA INTIPANGAN SEJATI,0
PT PRIMA ISMAYA SEJAHTERA,0
PT PRIMA JASINDO,0
PT PRIMA JAYA PERSADA NUSANTARA,2
PT PRIMA KARYA GARMINDO,2
PT PRIMA KARYA MANUNGGAL,1
PT PRIMA MEDIA MALANG,1
PT PRIMA MINERAL INVESTINDO,2
PT PRIMA MITRA ELEKTRINDO,1
PT PRIMA MODA KREASINDO,0
PT PRIMA MUGI JAYA,1
PT PRIMA PACK INDONESIA,1
PT PRIMA PERMATA CAKRAWALA,0
PT PRIMA PERMATA SEJAHTERA,1
PT PRIMA POLYCON INDAH,1
PT PRIMA RASA INTI,0
PT PRIMA SARANA BAHARI,1
PT PRIMA SARANA GEMILANG,1
PT PRIMA SARANA MUSTIKA,1
PT PRIMA SARIJATI AGUNG,0
PT PRIMA SAWIT ANDALAN,2
PT PRIMA SENTOSA GANDA,1
PT PRIMA SENTRA MEGAH,1
PT PRIMA SUKSES SEJAHTERA ABADI,1
PT PRIMA TRANSPORTASI SERVIS INDONESIA,0
PT PRIMA TUNAS INVESTAMA,0
PT PRIMA VISUALINDO,1
PT PRIMA WIGUNA PARAMA,2
PT PRIMA WIRA UTAMA,0
PT PRIMAFOOD INTERNATIONAL,1
PT PRIMAGRAHA KERAMINDO,1
PT PRIMAINTI PERMATA,1
PT PRIMANTARA UTAMA SEJAHTERA,0
PT PRIMARAJULI SUKSES,1
PT PRIME ASIA CAPITAL,1
PT PRIMERINDO KENCANA,0
PT PRIMERINDO SEJAHTERA,0
PT PRIMUS SANUS COOKING OIL INDUSTRIAL,2
PT PRINTINDO UTAMA,1
PT PRISMATAMA NUGRAHA,1
PT PRISTINE AFTERMARKET INDONESIA,1
PT PRITHO,1
PT PRO 8 INDONESIA,1
PT PRO ENERGY,1
PT PROCTER & GAMBLE HOME PRODUCTS,0
PT PROCTER & GAMBLE HOME PRODUCTS INDONESIA,0
PT PRODIA DIACRO LABORATORIES,0
PT PRODIA DIAGNOSTIC LINE,0
PT PRODIA DIGITAL INDONESIA,0
PT PRODIA OCCUPATIONAL HEALTH INDONESIA (PT PRODIA OHI),0
PT PRODIA OHI INTERNATIONAL,1
PT PRODIA STEMCELL INDONESIA,0
PT PRODIA UTAMA,0
PT PRODIA WIDYAHUSADA TBK,0
PT PRODIGY ENERGY RESOURCES,1
PT PROFASHION APPAREL,1
PT PROFESIONAL TELEKOMUNIKASI INDONESIA,2
PT PROFESSIONAL HUMAN RESOURCES,1
PT PROGRESMAX,1
PT PROINVESTINDO,2
PT PROLINDO CIPTA NUSANTARA,1
PT PROMEDRAHARDJO FARMASI INDUSTRI,0
PT PROPAN RAYA ICC,2
PT PROPERTI BALI BENOA,1
PT PROPERTI GOTONG ROYONG,1
PT PROPERTINDO LINE SEMESTA,1
PT PROPERTINDO PRIMA INVESTAMA,1
PT PROSIS CHEMINDO NUSANTARA PRIMA,1
PT PROSPEK DUTA SUKSES,1
PT PROTEINDO CIPTA PANGAN,1
PT PROTEINDO KARYASEHAT,0
PT PROTEKSI USAHA INDONESIA,1
PT PROTELINDO MENARA PERMATA,2
PT PROVICES INDONESIA,2
PT PROVICES KARYA MANDIRI,2
PT PROVICES LINTAS MANDIRI,2
PT PROVICES PRIMA MANDIRI,2
PT PROVICES TOTAL MANDIRI,2
PT PROVIDENT CAPITAL INDONESIA,1
PT PROVIDENT INVESTASI BERSAMA TBK,1
PT PROWELL ENERGI INDONESIA,1
PT PRUDENTIAL LIFE ASSURANCE,0
PT PRYSMIAN CABLES INDONESIA,0
PT PSV INDONESIA,1
PT PUDJI YAKSINDO INTERNUSA,1
PT PUDJIADI GAPURA VILLA ARBELAH,1
PT PUDJIADI GAPURA VILLA MARBELLA,1
PT PULAU INTAN LESTARI,2
PT PULAU KELAPA PERKASA,1
PT PULAU KENCANA OILFIELD SERVICE,1
PT PULAU KENCANA RAYA,1
PT PULAU MAHONI,1
PT PULAU MUTIARA PERSADA,2
PT PULAU PULAU MEDIA,1
PT PULAU SEROJA JAYA,1
PT PULOGADUNG PAWITRA LAKSANA,1
PT PUMA CAT INDONESIA,2
PT PUNDI ARTHA LESTARI,1
PT PUNDI INDOKAYU INDUSTRI,2
PT PUNDI KENCANA,1
PT PUNGGAWA NAGATA DINAMIKA HIDRO,2
PT PUNGGAWA UTAMA SORONG MEDIA,1
PT PUNGUT PERMAI PERKASA,0
PT PUNINAR JAYA,1
PT PUPUK INDONESIA (PERSERO),1
PT PUPUK KALIMANTAN TIMUR,1
PT PUPUK SRIWIDJAJA,1
PT PURA BARUTAMA,0
PT PURA MAYUNGAN,2
PT PURADELTA LESTARI TBK,0
PT PURAGRAHA DIAN PERTIWI,1
PT PURANTARA MITRA ANGKASA DUA,1
PT PURI AMANI MULIA,1
PT PURI GLOBAL SUKSES TBK,1
PT PURI KARYA BERSAMA,1
PT PURI PERMAI INTISENTOSA SUKSES,1
PT PURI PRIMA DEVELOPMENT,2
PT PURI SARANA DAMAI,0
PT PURI SURYA ABADI,1
PT PURI TRINITI BATAM,2
PT PURISENTOSA UNGGUL,1
PT PURNABUANA YUDHA,1
PT PURNOMO INVESTAMA,0
PT PUSAKA BERSATU,0
PT PUSAKA BUANA UTAMA,0
PT PUSAKA CITRA DJOKOSOETONO,0
PT PUSAKA LAUTAN BERLIAN,2
PT PUSAKA MAS PERSADA,0
PT PUSAKA MITRA MOBILINDO,0
PT PUSAKA NURI UTAMA,0
PT PUSAKA PRIMA TRANSPORT,0
PT PUSAKA SATRIA UTAMA,0
PT PUSAT BISNIS PONOROGO,1
PT PUSAT BISNIS SORONG,1
PT PUSAT SARANA BARUNA,1
PT PUSPITA BISNISPURI,0
PT PUTERA BATU MULIA KALIMANTAN,1
PT PUTERA MANUNGGAL PERKASA,1
PT PUTERA MULIA INDONESIA,1
PT PUTERA UTAMA MULIA,0
PT PUTRA ADHI PRIMA,1
PT PUTRA AGUNG LESTARI,2
PT PUTRA AGUNG RITEL,2
PT PUTRA ASIA PERDANA INDAH,2
PT PUTRA ASIH LAKSANA,0
PT PUTRA BORNEO AGRO LESTARI,1
PT PUTRA BORNEO SEJATI,0
PT PUTRA BUANA INDONESIA WOOD INDUSTRY,0
PT PUTRA JASINDO BERSAUDARA,0
PT PUTRA KARYA GEMILANG,1
PT PUTRA KATINGAN PRATAMA,0
PT PUTRA KENDARI SEJAHTERA,1
PT PUTRA MAGA NANDITAMA,1
PT PUTRA MAKMUR LESTARI,0
PT PUTRA MANDIRI JEMBAR TBK,0
PT PUTRA MANDIRI KREASINDO,0
PT PUTRA MOROWALI SEJAHTERA,1
PT PUTRA MULIA TELECOMMUNICATION,0
PT PUTRA MUSTIKA PRIMA,0
PT PUTRA PERKASA ABADI,1
PT PUTRA RAJAWALI KENCANA TBK,0
PT PUTRA REJEKI GARMINDO,2
PT PUTRA SINAR PERMAJA,1
PT PUTRA SLEMAN SEMBADA,0
PT PUTRA TAMBAK UTAMA,1
PT PUTRA TARO PALOMA,0
PT PUTRA TUNGGAL MANDIRITAMA,1
PT PUTRA UTAMA,1
PT PUTRA UTAMA LESTARI,2
PT PUTRA UTAMA LINE,1
PT PUTRA WELINDO INDONESIA,1
PT PUTRAGAYA WAHANA,1
PT PUTRAJAYA SUKSES MAKMUR,1
PT PUTRI DAYA USAHATAMA,0
PT PUTRI DAYA USAHATAMA (PDU),0
PT PYFA AETHERIA INDONESIA,1
PT PYFA INVESTAMA MEDIKA,1
PT PYFA SEHAT INDONESIA,1
PT PYRIDAM FARMA TBK,1
PT PZ CUSSONS INDONESIA,1
PT QERJA MANFAAT BANGSA,1
PT QORSER TEKNOLOGI,0
PT QUADRA SAMUDRA PERKASA,1
PT QUAKER INDONESIA,1
PT QUALITY INDONESIA,1
PT QUANTEX,2
PT QUANTUM CLOVERA INVESTAMA TBK,1
PT QUANTUM TOSAN INTERNASIONAL,0
PT QUATTRO INTERNATIONAL,2
PT QUATTUOR ISLA ASSOCIATED,1
PT RADHIKA JANANTA RAYA,2
PT RADIAN PENINSULA INDONESIA,1
PT RADIANT NUSA INVESTAMA,1
PT RADIN MUTIARA INDONESIA,1
PT RADIO ARIEF RAHMAN HAKIM,1
PT RADIO ATTAHIRIYAH,0
PT RADIO CAMAR,0
PT RADIO EFKINDO,1
PT RADIO KIRANA INSAN SUARA,0
PT RADIO MANCASUARA,1
PT RADIO MERPATI DHARMAWANGSA,0
PT RADIO MUSTANG UTAMA,0
PT RADIO PRAPANCA BUANA SUARA,1
PT RADIO RAMAKO DJAJA RAYA,0
PT RADIO SABDA SOSOK SOHOR,1
PT RADIO SUARA MONALISA,1
PT RADIO SWARA BUKIT BALI INDAH,0
PT RADIO SWARA CARAKA RIA,1
PT RADIO TJAKRA AWIGRA,1
PT RADIO TRIDJAYA SHAKTI,1
PT RADITYA MULTI TEKNIKA,2
PT RAFFLES GRAHA PERSADA,1
PT RAFFLES GRIYA PERKASA,1
PT RAFFLES NIAGA KENCANA,1
PT RAGAM LOGAM,0
PT RAGAM VENTURINDO,1
PT RAGAMSEHAT MULTIFITA,0
PT RAHARDJA EKALANCAR,1
PT RAHARJA MITRA FAMILIA,1
PT RAHASIA GADIS NUSANTARA,0
PT RAINBOW TUBULARS MANUFACTURE,0
PT RAJA BESI,2
PT RAJAWALI ARIES KREASINDO,2
PT RAJAWALI BIMANTARA INDONESIA,0
PT RAJAWALI CAPITAL INTERNASIONAL,1
PT RAJAWALI CITRA INDONESIA,1
PT RAJAWALI CITRA TELEVISI INDONESIA,1
PT RAJAWALI CORPORA,1
PT RAJAWALI DIESEL,1
PT RAJAWALI DWIPUTRA INDONESIA,0
PT RAJAWALI INTI,0
PT RAJAWALI MAS ELASTIC,2
PT RAJAWALI MEGA PERSADA,0
PT RAJAWALI MITRA,0
PT RAJAWALI NUSANTARA INDONESIA (PERSERO),0
PT RAJAWALI NUSINDO,0
PT RAJAWALI PROPERTI KHATULISTIWA,1
PT RAJAWALI RESOURCES,0
PT RAMA DINAMIKA RAYA,1
PT RAMAKO DJAYA RAYA,0
PT RAMAYANA MAKMURSENTOSA,0
PT RAMBAH SAWIT MANDIRI,2
PT RANAR RAYA,1
PT RANS SURYA AKTIVASI,1
PT RANTAI DINGIN ASIA,1
PT RANTAI DINGIN INDONESIA,1
PT RANTAI JARINGAN SUKSES,1
PT RANTAI MULIA KENCANA,0
PT RAPEDIAN NUSANTARA,2
PT RAPID PLAST INDONESIA,1
PT RASHAL SIAR CAKRA MEDIKA,2
PT RASITA KERINA MULIA,2
PT RASKA ANUGERAH UTAMA,1
PT RASUNA RESIDENCE DEVELOPMENT,2
PT RASYA UTAMA,1
PT RAVINCO PROCESS & PACKAGING,0
PT RAY DELTA MANDIRI,1
PT RAYA BUMI NUSANTARA PERMAI,1
PT RAYA JAYA ASIA,1
PT RAYA JAYA ASIA (KIZUNA CLINIC),1
PT RAYON UTAMA MAKMUR,1
PT READYMIX CONCRETE INDONESIA,0
PT REBORN CAPITAL,0
PT REC,1
PT RECOMMERCE INTERNASIONAL INDONESIA,1
PT RED PLANET HOTEL BEKASI,1
PT RED PLANET HOTEL MAKASSAR,1
PT RED PLANET HOTEL PALEMBANG,1
PT RED PLANET HOTEL PEKANBARU,1
PT RED PLANET HOTEL SURABAYA,1
PT RED PLANET HOTELS INDONESIA,1
PT RED PLANET HOTELS SOLO,1
PT RED PLANET HOTELS TANGERANG,1
PT RED PLANET INDONESIA TBK,1
PT REDAL SEMESTA,1
PT REDCANDLE,1
PT REDECO PETROLIN UTAMA,1
PT REE DERMA INTERNATIONAL,1
PT REKACIPTA INDONESIA RAYA,1
PT REKADAYA ELEKTRIKA,1
PT REKAGUNATEK PERSADA,2
PT REKAJASA AKSES,2
PT REKAKARSA KARYA NUSANTARA,2
PT REKAMILENIUMINDO SELARAS,0
PT REKAN ANAK BANGSA,0
PT REKATA SEMBILAN BELAS,1
PT REKAYASA BUANA HIJAU,2
PT REKAYASA ENGINEERING,1
PT REKSA CIPTA INVESTAMA,2
PT REKSA PUSPITA KARYA,0
PT RELIANCE CAPITAL MANAGEMENT,1
PT RELIANCE MANAJER INVESTASI,1
PT REMALA ABADI,2
PT REMATE UTAMA PRIMA,1
PT REMCO,1
PT REMERKO WAHANA INDONESIA,2
PT RENALDI JAYA EKA INTI,2
PT RENALMED TIARA UTAMA,0
PT RENDAPLAS ANDIKA,0
PT REPOWER ASIA INDONESIA TBK,1
PT REPUBLIKA MEDIA MANDIRI,2
PT RESOURCE ALAM ENERGI,1
PT RESPATI KEMASINDAH,1
PT RESTOMART CIPTA USAHA,1
PT RESTU PURNA BHAKTI HUSADA,0
PT RESWARA MINERGI HARTAMA,2
PT RETAIL CERDAS INDONESIA,1
