PT BARAMULTI SUGIH SENTOSA,1
PT BARASENTOSA LESTARI,1
PT BARATAMA PUTRA PERKASA,1
PT BARCLAY PRODUCTS,1
PT BARCO,1
PT BARIA BULK TERMINAL,1
PT BARISAN NUSANTARA SENTOSA,2
PT BARITO INVESTA PRIMA,1
PT BARITO JAYA SARANA,1
PT BARITO MITRA INVESTAMA,1
PT BARITO PUTERA DOCKING,1
PT BARITO RENEWABLES ENERGY TBK,1
PT BARITO TEKNIK PRASARANA,1
PT BARITO WAHANA LESTARI,1
PT BARITO WANABINAR INDONESIA,1
PT BAROID INDONESIA,1
PT BARUNA DIRGA DHARMA,2
PT BARUNA PASIFIK RAYA,1
PT BARUNA POWER LINE,1
PT BARUNA RAYA LOGISTICS,1
PT BARUNA TELE NUSA,2
PT BASALT SINAR LESTARI,1
PT BASF CARE,1
PT BASF INDONESIA,1
PT BASIS UTAMA PRIMA,1
PT BASKARA ASRI GHAS,2
PT BASUKI RAHMANTA PUTRA,1
PT BATAM BINTANG BAHANA,1
PT BATAM ENERGI SURYA SENTOSA,2
PT BATAM KARYA MANDIRI,1
PT BATAM SARANA SURYA,1
PT BATAM SURYA ENERGI,1
PT BATAM TIRTA SURYA,2
PT BATAMINDO INVESTMENT CAKRAWALA,1
PT BATARA INDAH,0
PT BATARA INDAH MULIA,0
PT BATAVIA PROSPERINDO INTERNASIONAL TBK,2
PT BATAVIA PROSPERINDO LOGISTIK,2
PT BATAVIA PROSPERINDO TRANS TBK,2
PT BATAVIA PROSPERITY ECOTRANS,2
PT BATIQA HOTEL MANAJEMEN,1
PT BATOLA PRIMATAMA,1
PT BATU BINTANG TIMUR,1
PT BATU BORNEO PERDANA,2
PT BATU INVESTASI INDONESIA,0
PT BATU JAYA GEMILANG,0
PT BATUAN ANUGERAH SEMESTA,1
PT BATUBARA BUKIT KENDI,1
PT BATUBARA DUARIBU ABADI,1
PT BATUBARA GLOBAL ENERGY,1
PT BATULICIN BUMI BERSUJUD,2
PT BATULICIN ENAM SEMBILAN SECURITY,1
PT BATULICIN ENAM SEMBILAN TRANSPORTASI,1
PT BATULICIN NUSANTARA MARITIM TBK,1
PT BATURAJA DAYA INSANI,1
PT BATURAJA MULTI USAHA,1
PT BATURONA ADIMULYA,1
PT BATUTA CHEMICAL INDUSTRIAL PARK,1
PT BATUTUA ABADI JAYA,1
PT BATUTUA ALAM PERSADA,1
PT BATUTUA KHARISMA PERMAI,1
PT BATUTUA TEMBAGA RAYA,1
PT BAUER PRATAMA INDONESIA,1
PT BAWEN INVESTAMA PERDANA,1
PT BAYAN ENERGY,1
PT BAYER INDONESIA,0
PT BAYU ALAM SEJAHTERA,2
PT BAYU BUANA TRANSPORT,2
PT BAYU LESTARI TANAYA,0
PT BAYU SINERGI SAKTI,0
PT BCA FINANCE,2
PT BCA MULTI FINANCE,2
PT BCA SEKURITAS,0
PT BE WIN,1
PT BEAM MOBILITY INDONESIA,1
PT BECTON DICKINSON INDONESIA,1
PT BEI BEE WOO,2
PT BEIERSDORF INDONESIA,1
PT BEKASI KARYA BANGSA,1
PT BEKASI MATRA INDUSTRIAL ESTATE,1
PT BEKASI MEDIKA INSAN,1
PT BEKASI POWER,1
PT BEKASI SURYA PRATAMA,1
PT BEKO APPLIANCES INDONESIA,0
PT BELAJAR TUMBUH BERBAGI,1
PT BELAPUTERA INTILAND,1
PT BELAYAN RIVER TIMBER,1
PT BELEKONG MINERAL RESOURCES,1
PT BELFOODS INDONESIA,1
PT BELIDA KARYA LESTARI,0
PT BELINDO BINTANG BUANA,0
PT BELITUNG RESOR INTERNASIONAL,2
PT BELLA INDAH GAPURA,1
PT BENFOOD DINAMIKA SENTOSA,2
PT BENGAWAN KARYA SAKTI,0
PT BENOA MARITIM TRANSPORT,1
PT BENQ TEKNOLOGI INDONESIA,0
PT BENSON MEDIA KREASI,1
PT BENTENG CIPTA LAKSANA,1
PT BENTENG TERANG SEJAHTERA,1
PT BENTOEL DISTRIBUSI UTAMA,0
PT BENTOEL PRIMA,0
PT BENTONIT ALAM INDONESIA,1
PT BENUA ABADI MENTARI,2
PT BENUA AGUNG ABADI,2
PT BENUA ETAM JAYA MANDIRI,1
PT BENUA HAMPARAN LUAS,2
PT BENUA PRIMA ABADI,2
PT BENUA PRIMA AGUNG,2
PT BENUA PRIMA SURYA,2
PT BENUA SAMUDERA LOGISTICS,1
PT BENUA SAMUDERA PERKASA,1
PT BENUA SEJAHTERA MENTARI,2
PT BENUA SUMBER ABADI,2
PT BERANI CANTIK INDONESIA,1
PT BERAU COAL,2
PT BERAU COAL ENERGY TBK,2
PT BERAU MITRA SEJATI,1
PT BERCA HARDAYAPERKASA,2
PT BERCA SCHINDLER LIFTS,2
PT BERDIKARI INTI GEMILANG,1
PT BERDIKARI PONDASI PERKASA,1
PT BERDIKARI TUNGGAL PERKASA,2
PT BERHASIL INDONESIA GEMILANG,1
PT BERILL JAYA SEJAHTERA,0
PT BERJAYA AGUNG INDONESIA,1
PT BERJAYA DYNAMICS INDONESIA,0
PT BERJAYA TIGA BINTANG,2
PT BERKAH ALAM LESTARI ENERGI,1
PT BERKAH BUANA ENERGI,2
PT BERKAH DAYA MANDIRI,1
PT BERKAH DELAPAN SAMUDERA,1
PT BERKAH DIGITAL DISTRINDO,1
PT BERKAH HIKMAH ENERGI,1
PT BERKAH KARUNIA KREASI,1
PT BERKAH MANIS MAKMUR,1
PT BERKAH OMEGA SUKSES,1
PT BERKAH PRIMA PERKASA TBK,1
PT BERKAH RENEWABLE ENERGI,2
PT BERKAH SAMUDRA KHATULISTIWA,1
PT BERKAH TRIJAYA INDONESIA,1
PT BERKARYA SEJAHTERA GEMILANG,0
PT BERKAT AMADEUS SUKSES SENTOSA,0
PT BERKAT BERSAMA TEKNIK,2
PT BERKAT BUMI SAWIT,2
PT BERKAT INDOKARYA GEMILANG,0
PT BERKAT MANUNGGAL ENERGI,2
PT BERKAT MARITIME INDONESIA,1
PT BERKAT MITRA LESTARI,1
PT BERKAT MURAH REJEKI,2
PT BERKAT NIKEL INDONESIA,2
PT BERKAT NUSANTARA INDAH,2
PT BERKAT NUSANTARA PERMAI,1
PT BERKAT PERDANA MAKMUR,1
PT BERKAT SATRIA ABADI,1
PT BERKAT VALAS INDONESIA,1
PT BERLIAN CAHAYA INDAH,1
PT BERLIAN DJAYA NUSANTARA,1
PT BERLIAN DUMAI LOGISTICS,0
PT BERLIAN INTI MEKAR,1
PT BERLIAN KHATULISTIWA L,1
PT BERLIAN LIMATAMA,1
PT BERLIAN MANYAR SEJAHTERA,2
PT BERLIAN MITRA INTI,1
PT BERLIAN TAMBANG INDONESIA,1
PT BERLICO MULIA FARMA,2
PT BERNOFARM,0
PT BERSAMA KARUNIA MANDIRI,2
PT BERSAMA KARUNIA MANDIRI RITEL,2
PT BERSAMA LEMINDO ABADI,0
PT BERUA JAYA SEJAHTERA UTAMA,1
PT BERUANG MARITIM INDONESIA,1
PT BESAR CIPTA KARYA,1
PT BESAR INTI GLOBAL,0
PT BESEN CITRA PERMATA,1
PT BEST SINAR NUSANTARA,1
PT BEST TIRTA TECHNOLOGY,1
PT BESTAMA MEDIKACENTER INVESTAMA,0
PT BETA SUMATERA JAYA PLAST,1
PT BETHESDA RAJA KANU,1
PT BEYOND MEDIA,0
PT BEYOND MEDICAL INDONESIA,0
PT BHADRA CEMERLANG,1
PT BHADRA SUKSES,1
PT BHAKTI AGUNG PROPERTINDO TBK,1
PT BHAKTI ARTHA GLOBAL,0
PT BHAKTI BUANA MAKMUR DISTRIBUTOR,1
PT BHAKTI CAHAYA UTAMA,0
PT BHAKTI COAL RESOURCES,1
PT BHAKTI FINTEK INDONESIA,0
PT BHAKTI HARAPAN SEJAHTERA,0
PT BHAKTI MIGAS RESOURCES,1
PT BHAKTI MITRA USAHA,1
PT BHAKTI MULTI ARTHA TBK,0
PT BHAKTI PANJIWIRA,1
PT BHAKTI RAJAWALI MANDIRI,2
PT BHAKTI SARI PERKASA ABADI,1
PT BHANDA GHARA REKSA,1
PT BHARINTO EKATAMA,2
PT BHASKARA INTI SAMUDERA,1
PT BHASKARA MITRA MANUNGGAL,1
PT BHASKARA MUTU SENTOSA,1
PT BHINEKA ABADI INVESTAMA,1
PT BHINEKA CIPTABAHANA PURA,2
PT BHINEKA LIFE INDONESIA,1
PT BHIRAWA MITRA SENTOSA,1
PT BHIRAWA STEEL,1
PT BHUMI JATI POWER,1
PT BHUMI JEPARA SERVICE,0
PT BHUMI LESTARI MAKMUR,1
PT BHUMI RANTAU ENERGI,1
PT BHUMI SATU INTI,1
PT BHUMI SIMANGGARIS INDAH,1
PT BICC CABLE,1
PT BIG BIRD PUSAKA,0
PT BIG ECOMMERCE BERSAMA,0
PT BIJI KOPI INTERNUSA,0
PT BILAH BAJA MAKMUR ABADI,2
PT BILIK SINERGI INDONESIA,1
PT BIMA AGRI SAWIT,2
PT BIMA KALTIM UTAMA,1
PT BIMA MARITIMINDO,1
PT BIMA NATISA GRAHA,1
PT BIMA PALMA NUGRAHA,2
PT BIMA SAKTI PERTIWI TBK,1
PT BIMA SAKTI STUDIO,2
PT BIMANTARA CITRA,2
PT BIMANTARA DANAR DIPTA,0
PT BINA ARTA CHARISMA,0
PT BINA BAHTERA SEJATI,1
PT BINA BATULICIN USAHA,1
PT BINA CIPTA NUSANTARA,1
PT BINA CIPTA SEMESTA,1
PT BINA CIPTA TEKNOLOGI,1
PT BINA CITRA SENTOSA,0
PT BINA HUSADA GEMILANG,0
PT BINA ILMA HUSADA,0
PT BINA INDO RAYA,2
PT BINA INFRASTRUKTUR NUSANTARA,1
PT BINA KARNADA,1
PT BINA KARYA PRIMA,2
PT BINA MAKNA INDOPRATAMA,0
PT BINA MITRA INDOSEJAHTERA,1
PT BINA MUARA RAYA,2
PT BINA NUSA INDONESIA,1
PT BINA PERTIWI,1
PT BINA PERTIWI ENERGI,2
PT BINA SAN PRIMA,0
PT BINA SARANA SUKSES,1
PT BINA SEWANGI RAYA,2
PT BINA SINAR AMITY,0
PT BINA UNGGUL KENCANA,1
PT BINA YATRA SENTOSA,1
PT BINAJAYA RODAKARYA,1
PT BINARA GUNA MEDIKTAMA,1
PT BINARY VENTURA INDONESIA,1
PT BINASAWIT ABADI PRATAMA,2
PT BINASAWIT MAKMUR,2
PT BINATEK REKA KRUH,2
PT BINEXCOM MANDIRI BUANA,0
PT BINJAI HATUA MAKMUR,0
PT BINJAI JAYA INDAH,1
PT BINO DIGITAL SOLUSI,0
PT BINO MITRA SEJATI,0
PT BINTAI KINDENKO ENGINEERING INDONESIA,1
PT BINTANG AGUNG PERSADA,0
PT BINTANG ALAM REJEKI,1
PT BINTANG ANUGRAH SAMUELRENO,1
PT BINTANG ARTHA GLOBAL,1
PT BINTANG ARTHA GUNA,1
PT BINTANG BAHARI SEJATI,1
PT BINTANG BAJA HITAM,1
PT BINTANG BERSINAR CEMERLANG,2
PT BINTANG CIPTA SEJAHTERA,0
PT BINTANG DEWATA ABADI,1
PT BINTANG DIGITAL UTAMA,1
PT BINTANG DWI LESTARI,1
PT BINTANG GRAHA LOKA,1
PT BINTANG GRAHA MAKMUR,0
PT BINTANG GRAHA MANDIRI,0
PT BINTANG INTER GLOBAL,2
PT BINTANG INTERINDO GEMILANG INTERNASIONAL,0
PT BINTANG KANGURU,2
PT BINTANG KENCANA ARTHA,2
PT BINTANG LAJU SAMUDRA,1
PT BINTANG LANGIT,0
PT BINTANG LAUT TIMUR,1
PT BINTANG MEGA CEMERLANG,0
PT BINTANG MERAH PERKASA ABADI,0
PT BINTANG MITRA DANA,1
PT BINTANG OTO GLOBAL TBK,1
PT BINTANG PERDANA MULIA,1
PT BINTANG PERKASA MOBILINDO,1
PT BINTANG RAYA ANUGERAH LESTARI,2
PT BINTANG SAMUDERA MANDIRI LINES TBK,1
PT BINTANG SAMUDERA MANDIRI PERSADA,1
PT BINTANG SINAR FORTUNA,0
PT BINTANG SMELTER INDONESIA,2
PT BINTANG SUKSES ENERGI,1
PT BINTANI MEGAHINDAH,1
PT BINTARO ARKADE DUA,1
PT BINTARO SERPONG DAMAI,1
PT BINTORO ENERGI PERSADA,1
PT BINUANG MITRA BERSAMA BLOK DUA,2
PT BIO FARMA (PERSERO),0
PT BIO PERMAI,2
PT BIOFUEL INDO SUMATRA,1
PT BIOGEN SCIENTIFIC,1
PT BIOMASA JAYA ABADI,2
PT BIOMASSA ALAM ENERGI,2
PT BIOMASSA LESTARI NUSANTARA,2
PT BIP BOGA PERMAI,0
PT BIP LOKAKENCANA,0
PT BIP PROPERTI PERMAI,0
PT BIRA MINERAL NUSANTARA,1
PT BIRO KLASIFIKASI INDONESIA (PERSERO),1
PT BIROPAY INDOTEKNOLOGI GLOBAL,1
PT BIRU PERSADA UTAMA,1
PT BISA RUANG NUSWANTARA,2
PT BISMACINDO PERKASA,0
PT BIT TEKNOLOGI NUSANTARA,2
PT BITHEALTH TEKNOLOGI PINTAR,1
PT BITNET KOMUNIKASINDO,1
PT BITUNG GUNASEJAHTERA,1
PT BJB SEKURITAS JAWA BARAT,1
PT BLACKHAWK NETWORK INDONESIA,0
PT BLACKSTEEL PROPERTIES,1
PT BLDX KOMIK NUSANTARA,1
PT BLESS PLASTINDO UTAMA,1
PT BLESSINDO MAKMUR SENTOSA,2
PT BLESSINDO PRIMA SARANA,1
PT BLISS PEMBANGUNAN SEJAHTERA,1
PT BLISS PROPERTI INDONESIA TBK,1
PT BLOCKBUSTER MEDIA VISUAL,1
PT BLOOM TRADING INDONESIA,1
PT BLT INTERNATIONAL GROUP,0
PT BLUE BIRD PUSAKA,0
PT BLUE BIRD TAXI,0
PT BLUE BIRD TBK,0
PT BLUE GAS INDONESIA,0
PT BLUE STAR MEDIA,1
PT BMB & AKSESORIS KONSTRUKSI,0
PT BMHS DIKLAT INDONESIA,1
PT BNI LIFE INSURANCE,0
PT BNI MODAL VENTURA,1
PT BNI MULTIFINANCE,1
PT BNI SEKURITAS,1
PT BOGA ABADI PRIMA,0
PT BOGA CATUR RATA,2
PT BOGAMULIA NAGADI,1
PT BOGASARI FLOUR MILLS,1
PT BOGASARI SENTRA FLOUR MILLS,0
PT BOGORINDO CEMERLANG,0
PT BOJONG INDAH MANDIRI,1
PT BOLA NUSANTARA,0
PT BOLA NUSANTARA JAYA,1
PT BOLTTECH DEVICE PROTECTION INDONESIA,1
PT BONA DEKA JAVA,0
PT BONANZA MEGAH,1
PT BONT TECHNOLOGIES NUSANTARA,0
PT BORMINDO NUSANTARA,2
PT BORNEO ALUMINA INDONESIA,1
PT BORNEO AURA SUKSES,2
PT BORNEO BHAKTI SEJAHTERA,1
PT BORNEO EDO INTERNATIONAL,1
PT BORNEO EDO INTERNATIONAL AGRO,1
PT BORNEO EDO SEJAHTERA,1
PT BORNEO GUNA LAKSANA,1
PT BORNEO HYDRO ELECTRIC,1
PT BORNEO INDAH MARJAYA,1
PT BORNEO INDOBARA,1
PT BORNEO INTER AERO,1
PT BORNEO LANGGENG SEJAHTERA,1
PT BORNEO MITRA BERSAMA SEJATI,1
PT BORNEO SAMUDRA PERKASA,1
PT BORNEO SAWIT GEMILANG,1
PT BORNEO SENTANA GEMILANG,2
PT BORNEO SUKSES RAYA KALTIM,1
PT BOSSONGANG ENERGY PLANTATION,0
PT BOSTON CONSULTING INDONESIA,0
PT BOSTON FURNITURE INDUSTRIES TBK,1
PT BPR INTAN JABAR,1
PT BPR KREDIT MANDIRI CELEBES SEJAHTERA,2
PT BRAGA JAVAS KASTARA,2
PT BRAHMAYASA BAHTERA,1
PT BRAMASTA JAYA ABADI,1
PT BRANTAS ABIPRAYA (PERSERO),1
PT BRASALI INDUSTRI PRATAMA,1
PT BRAWIJAYA CAPITAL INVESTAMA,0
PT BREDERO SHAW INDONESIA,0
PT BRENNTAG,1
PT BRI ASURANSI INDONESIA (BRI INSURANCE,2
PT BRI DANAREKSA SEKURITAS,1
PT BRI MANAJEMEN INVESTASI,1
PT BRI MULTIFINANCE INDONESIA,1
PT BRI VENTURA INVESTAMA (BRI VENTURES,1
PT BRIAN ANJAT SENTOSA,1
PT BRIGHT GLAZE INDONESIA,1
PT BRIGHTY GLOBAL,1
PT BRILLIANT SAKTI PERSADA,1
PT BRINGIN INTI TEKNOLOGI,1
PT BRINGIN SEJAHTERA MAKMUR,2
PT BRINGIN WULANKI AYU,1
PT BROADBAND WAHANA ASIA,2
PT BROADBIZ ASIA,1
PT BROMO ALAM SENTOSA,0
PT BROTOJOYO MARITIME,1
PT BS INVESTASI PRATAMA,1
PT BST PERLAUTAN BALI,1
PT BTPN SYARIAH VENTURA,1
PT BTPNS VENTURA,1
PT BUANA ARTHA ANUGERAH TBK,0
PT BUANA BAJA BINA SEMESTA,1
PT BUANA BARA EKAPRATAMA,1
PT BUANA BARU PRIMA,0
PT BUANA BEJANA,1
PT BUANA BUMI ENERGI,1
PT BUANA CHANDRA MANDIRI,1
PT BUANA DIGDAYA SEJAHTERA,1
PT BUANA EKA PRIMA,2
PT BUANA GELAR PARIWICARA,2
PT BUANA GRAHA UTAMA,2
PT BUANA INTI CITRAPRIMA,1
PT BUANA INTI GEMILANG STATIONERY,1
PT BUANA KONSTRUKSI ELEKTRINDO,1
PT BUANA KONTENINDO EXPRESS,0
PT BUANA LAUTAN LINE,0
PT BUANA LINTAS LAUTAN TBK,0
PT BUANA MAKMUR INDAH,1
PT BUANA MAS SEJAHTERA,1
PT BUANA MEGAWISATAMA,1
PT BUANA NIAGA ENERGI,1
PT BUANA PACIFIC INTERNATIONAL,1
PT BUANA SURYA MAKMUR,1
PT BUANACITRA INTERNUSA,1
PT BUANAGRAHA ARTHAPRIMA,1
PT BUANASARANA SEJATIINDAH,1
PT BUANATATA ADISENTOSA,0
PT BUDHI BERSAUDARA MANUNGGAL,1
PT BUDI DELTA SWAKARYA,1
PT BUDI DERMAGA PERKASA,1
PT BUDI DWIYASA PERKASA,1
PT BUDI GEMA GEMPITA,0
PT BUDI GRAHAREALTY,1
PT BUDI LUMBUNG CIPTA TANI,1
PT BUDI MULYA JAYA,2
PT BUDI STARCH & SWEETENER TBK,1
PT BUDIJAYA MAKMURSENTOSA,2
PT BUDIMAN KENCANA LESTARI,0
PT BUDIMULIA INVESTAMA,1
PT BUDINUSA CIPTAWAHANA,1
PT BUDITAMA NIRWANA,0
PT BUILDERS SHOP,1
PT BUKA BANGUNAN INDONESIA,1
PT BUKA INVESTASI BERSAMA,1
PT BUKA INVESTASI DIGITAL,1
PT BUKA INVESTASI NUSANTARA,1
PT BUKA MITRA INDONESIA,1
PT BUKA MITRA PROPERTI,1
PT BUKA PENGADAAN INDONESIA,1
PT BUKA USAHA INDONESIA,1
PT BUKAKA ENERGI,1
PT BUKAKA FORGING INDUSTRIES,1
PT BUKAKA KOKARINDO,1
PT BUKAKA MANDIRI SEJAHTERA,1
PT BUKAKA MEGA INVESTAMA,1
PT BUKAKA MINYU INDUSTRIES,1
PT BUKAKA TEKNIK UTAMA BALIKPAPAN,1
PT BUKALAPAK.COM TBK,1
PT BUKIT ANDALAN SUKSES,1
PT BUKIT ASAM BANKO,1
PT BUKIT ASAM MEDIKA,1
PT BUKIT ASAM METANA ENIM,1
PT BUKIT ASAM METANA OMBILIN,1
PT BUKIT ASAM PRIMA,1
PT BUKIT BAIDURI ENERGI,2
PT BUKIT BALI PERMAI,1
PT BUKIT BARA ALAM,0
PT BUKIT BATU MULIA,1
PT BUKIT ENERGI INVESTAMA,1
PT BUKIT ENERGI SERVICE TERPADU,1
PT BUKIT HEDAMA PERMAI,1
PT BUKIT INTAN SEDJATI INTERNATIONAL,1
PT BUKIT INTI LESTARI,0
PT BUKIT JAYA SEMESTA,1
PT BUKIT JONGGOL ASRI,1
PT BUKIT LAGOI VILLA,1
PT BUKIT MAHKOTA,1
PT BUKIT MAKMUR INTERNASIONAL,2
PT BUKIT MAKMUR MANDIRI UTAMA,2
PT BUKIT MULTI INVESTAMA,1
PT BUKIT MULTI PROPERTI,1
PT BUKIT PALEM,1
PT BUKIT PALMA PRIMA,2
PT BUKIT PEMBANGKIT INNOVATIVE,1
PT BUKIT PRIMA BAHARI,1
PT BUKIT PROPERTI LOGISTIK,0
PT BUKIT SMELTER INDONESIA,2
PT BUKIT SURYA MAS,1
PT BUKIT TEKNOLOGI DIGITAL,2
PT BUKIT ULUWATU VILLA TBK,1
PT BUKIT WELIRANG INDAH,1
PT BUKITASAM TRANSPACIFIC RAILWAY,1
PT BUKITMEGA MASABADI,1
PT BULL LAUTAN LINE,0
PT BULL PELAYARAN INTERNASIONAL,0
PT BULUNGAN HIJAU PERKASA,1
PT BUMA INTERNASIONAL GRUP TBK,2
PT BUMEN DUTACIPTA SARANA,2
PT BUMEN REDJA ABADI,2
PT BUMI AGRO INDONESIA,1
PT BUMI AGUNG PERKASA INDAH,1
PT BUMI ALAM RAYA,1
PT BUMI ALAM SERAYA,1
PT BUMI AMAN SEJAHTERA,1
PT BUMI ANDALAS PERMAI,1
PT BUMI BENOWO SUKSES SEJAHTERA TBK,2
PT BUMI BERKAT LESTARI RAYA,1
PT BUMI CIPTA RASA,1
PT BUMI CITRA INVESTINDO,1
PT BUMI DAYA MAKMUR,2
PT BUMI DHANA INDONESIA,2
PT BUMI GRESIK SUKSES,1
PT BUMI HIDRO ENERGI,1
PT BUMI HIJAU ASRI,1
PT BUMI INDAWA NIAGA,1
PT BUMI KARSA,1
PT BUMI KARUNIA PERTIWI,1
PT BUMI KENCANA EKA SEJAHTERA,1
PT BUMI KONAWE ABADI,1
PT BUMI KREASI BARU,1
PT BUMI MAJALENGKA PERMAI,2
PT BUMI MAS INDO SAWIT,1
PT BUMI MEKAR HIJAU,1
PT BUMI MEKAR TANI,1
PT BUMI MINERAL INDONUSA,1
PT BUMI MINERAL SENTOSA,1
PT BUMI MINERAL SULAWESI,1
PT BUMI MULIA INDAH,2
PT BUMI MULIA PERKASA,1
PT BUMI NUSANTARA JAYA,1
PT BUMI NUSARAYA UTAMA,1
PT BUMI PANGAN ASRI,1
PT BUMI PANGAN INTI,1
PT BUMI PANGAN MULIA,1
PT BUMI PANGAN SEJAHTERA,1
PT BUMI PANGAN UTAMA,1
PT BUMI PASIFIK KENCANA,1
PT BUMI PERANGAT HIJAU,1
PT BUMI PERKASA GEMILANG,1
PT BUMI PERSADA PERMAI,1
PT BUMI PETANGIS,2
PT BUMI PETRA MAKMUR,1
PT BUMI PRADA,1
PT BUMI RAYA OPTIMA,1
PT BUMI RAYA SAKTI,1
PT BUMI RAYA UTAMA WOOD INDUSTRIES,1
PT BUMI SAWINDO PERMAI,1
PT BUMI SAWIT PERKASA,1
PT BUMI SEKUNDANG ENIM ENERGY,1
PT BUMI SENTOSA ABADI,1
PT BUMI SENTRA INVESTAMA,2
PT BUMI SERPONG DAMAI TBK,1
PT BUMI SHANGRIL LA JAYA,0
PT BUMI SRIWIJAYA HARAPAN,1
PT BUMI SUBUR LESTARI TANI,1
PT BUMI SUKSESINDO,1
PT BUMI SUMBER ANDALAN,0
PT BUMI SUMBERDAYA SEMESTA,1
PT BUMI TARA PERDANA,1
PT BUMI TARA PERKASA,1
PT BUMI TARA PRATAMA,1
PT BUMI TARA SINERGI,1
PT BUMI UNGGUL PERSADA,1
PT BUMI WARDANA,1
PT BUMIASRI LESTARI,1
PT BUMIFOOD AGRO INDUSTRI,0
PT BUMIHUTANI LESTARI,1
PT BUMILANGGENG PERDANATRADA,1
PT BUMILANGIT DIGITAL MEDIATAMA,1
PT BUMIMULIA INDAH LESTARI,1
PT BUMINDO MEKAR WIBAWA,2
PT BUMIPRATAMA KHATULISTIWA,1
PT BUMIPUTERA MAHA TERPERCAYA,2
PT BUMIRAYA ENERGI NUSANTARA,1
PT BUMIRAYA HIJAU LESTARI,1
PT BUMIRESIK NUSANTARA RAYA,1
PT BUNDA GLOBAL PHARMA,1
PT BUNDA GRAHA PROPERTI,1
PT BUNDA INVESTAMA INDONESIA,1
PT BUNDA MEDIKA BEKASI,1
PT BUNDA MEDIKA DEWATA,1
PT BUNDA MEDIKA KLINIK,1
PT BUNDA MEDIKA WISESA,1
PT BUNDA MINANG CITRA,1
PT BUNDAMEDIK,1
PT BUNDAMEDIK TBK,1
PT BUNGA MATAHARI SOLUSINDO,1
PT BUNGASARI FLOUR MILLS INDONESIA,0
PT BUNGO BARA MAKMUR,2
PT BUNGO BARA UTAMA,2
PT BURDA CONTRACO,1
PT BUTON MINERAL INDONESIA,1
PT BUYUNG INVESTAMA GEMILANG,0
PT BUYUNG POETRA SEMBADA TBK,0
PT BUYUNG PUTRA ENERGI,0
PT BYD AUTO INDONESIA,1
PT CABOT INDONESIA,1
PT CAHAYA ABADI LESTARI ENERGI,1
PT CAHAYA ALAM,1
PT CAHAYA AMANAH SENTOSA,1
PT CAHAYA BAJA SUKSES,1
PT CAHAYA BARA PRATAMA,1
PT CAHAYA BERLIAN TEKNIK,1
PT CAHAYA GEMILANG INDAH CEMERLANG,2
PT CAHAYA GEMPITA UTAMA,1
PT CAHAYA GUNUNG FOODS,1
PT CAHAYA INDAH SANGSURYA,0
PT CAHAYA INTERKONTINENTAL PEMEGANG SAHAM PENGENDALI,1
PT CAHAYA INTI SENTOSA,2
PT CAHAYA INVESTAMA,0
PT CAHAYA KENCANA INDAH,2
PT CAHAYA LESTARI SEJAHTERA,0
PT CAHAYA METAL PERKASA,1
PT CAHAYA NUSA PRATAMA,1
PT CAHAYA NUSA SENTOSA,1
PT CAHAYA PLASTINDO SEJAHTERA,0
PT CAHAYA POWER INDONESIA,2
PT CAHAYA RETILINDO,1
PT CAHAYA ROYAL INDONUSA,1
PT CAHAYA SAKTI GEMILANG,1
PT CAHAYA SAMOEDERA BERSAUDARA,1
PT CAHAYA SEJAHTERA ABADI,0
PT CAHAYA SEMESTA INVESTA,1
PT CAHAYA SOLUSINDO PERKASA,0
PT CAHAYA SUKSES TEHNIK UTAMA,1
PT CAHAYA USAHA BERSAMA,0
PT CAHAYA UTAMA NUSANTARA,2
PT CAHAYAPUTRA ASA KERAMIK TBK,1
PT CAHAYASAKTI INVESTINDO SUKSES TBK,0
PT CAHYA VIDI ABADI,1
PT CAKRA ALAM MAKMUR,1
PT CAKRA BHAKTI PARA PUTRA,2
PT CAKRA BUMI ENERGI,0
PT CAKRA INDO PRATAMA,1
PT CAKRA INTI UTAMA,0
PT CAKRA KENCANA,0
PT CAKRA LIMA,2
PT CAKRA MANUNGGAL SEMESTA,1
PT CAKRADENTA AGUNG PERTIWI,1
PT CAKRAWALA ANDALAS TELEVISI,1
PT CAKRAWALA ANDALAS TELEVISI BALI DAN MATARAM,1
PT CAKRAWALA ANDALAS TELEVISI BANDUNG DAN BENGKULU,1
PT CAKRAWALA ANDALAS TELEVISI BANJARMASIN DAN PADANG,1
PT CAKRAWALA ANDALAS TELEVISI LAMPUNG DAN KENDARI,1
PT CAKRAWALA ANDALAS TELEVISI MAKASSAR DAN PALU,1
PT CAKRAWALA ANDALAS TELEVISI MANADO DAN GORONTALO,1
PT CAKRAWALA ANDALAS TELEVISI MEDAN DAN BATAM,1
PT CAKRAWALA ANDALAS TELEVISI PALEMBANG DAN BANGKA BELITUNG,1
PT CAKRAWALA ANDALAS TELEVISI PEKANBARU DAN PAPUA,1
PT CAKRAWALA ANDALAS TELEVISI SEMARANG DAN PALANGKARAYA,1
PT CAKRAWALA ANDALAS TELEVISI SURABAYA DAN SAMARINDA,1
PT CAKRAWALA ANDALAS TELEVISI YOGYAKARTA DAN AMBON,1
PT CAKRAWALA BHAYANGKARA PERDANA,1
PT CAKRAWALA LANGIT SEJAHTERA,1
PT CAKRAWALA MEGA INDAH,1
PT CAKRAWALA SAKTI KENCANA,2
PT CAKRAWALA SEJAHTERA SEJATI,1
PT CAKUNG PERMATA NUSA,1
PT CALORIE VIVA UTAMA,1
PT CANARY TRANSPORT,2
PT CANDRAKARYA MULTIKREASI,2
PT CANGKUL BUMISUBUR,1
PT CANTIKA PUSPA PESONA,1
PT CAPITAL ASSET MANAGEMENT,1
PT CAPITAL DIGITAL CREATIVE,1
PT CAPITAL DIGITAL TRANS,1
PT CAPITAL FINANCIAL ASIA,1
PT CAPITAL FINANCIAL INDONESIA TBK,1
PT CAPITAL FINANCIAL SHARIA,1
PT CAPITAL FINANCIAL TECHNOLOGIES,1
PT CAPITAL GLOBAL FINANCIAL,1
PT CAPITAL GLOBAL INVESTAMA,1
PT CAPITAL GLOBAL INVESTMENTS,1
PT CAPITAL GLOBAL STRATEGIC,1
PT CAPITAL GLOBAL VENTURA,1
PT CAPITAL LIFE INDONESIA,1
PT CAPITAL LIFE SYARIAH,1
PT CAPITAL NET INDONESIA,1
PT CAPITAL SHARIA INDONESIA,1
PT CAPITAL STRATEGIC INDONESIA,1
PT CAPITAL STRATEGIC INVESCO,1
PT CAPITAL STRATEGIC INVESTMENTS,1
PT CAPITAL TECHNOLOGIES INDONESIA,1
PT CAPITAL TRANS GLOBAL,1
PT CARAKA REKSA OPTIMA,2
PT CARDIG AERO SARANA DIRGANTARA,1
PT CARDIG ANUGRA SARANA BERSAMA,1
PT CARDIG ANUGRAH SARANA CATERING,1
PT CARDIG EXPRESS NUSANTARA,1
PT CARDIG GARDA UTAMA,1
PT CARDIG INTERNATIONAL,1
PT CAREFASTINDO,1
PT CARGILL INDONESIA,0
PT CARINDO,1
PT CASA PRIMA INDONESIA,1
PT CASHLEZ WORLDWIDE INDONESIA TBK,2
PT CATUR BERKAT BERSAMA,0
PT CATUR HASIL SENTOSA,0
PT CATUR KARDA SENTOSA,0
PT CATUR KUSUMA ABADI SEJAHTERA,1
PT CATUR LOGAMINDO,0
PT CATUR LOGAMINDO SENTOSA,1
PT CATUR MITRA SEJATI SENTOSA,0
PT CATUR PUTRA MANUNGGAL,2
PT CATUR SENTOSA ANUGERAH,0
PT CATUR SENTOSA BERHASIL,0
PT CATURADILUHUR SENTOSA,0
PT CATURADITYA SENTOSA,0
PT CATURDAYA SEMBADA,1
PT CATURGRIYA NARADIPA,1
PT CATURKARDA DEPO BANGUNAN TBK,1
PT CATURKARSA MEGATUNGGAL,1
PT CATURKARTIKA PERDANA,0
PT CATURMAS KARSAUDARA,1
PT CCSI KONEKTIVITAS DIGITAL,2
PT CCSI NIAGATAMA DIGITAL,2
PT CEDEFINDO,1
PT CELEBES AGRO SEMESTA,1
PT CELEBES ENERGI LESTARI,2
PT CELEBES KONSTRUKSINDO,1
PT CELEBEST INDONESIA ANDAL,0
PT CELLA ARGYA LESTARI,0
PT CELLA ARGYA LOGISTIK,0
PT CELLA CAKRA LOGISTIK,0
PT CELLA EMERALD LOGISTIK,0
PT CELLA GEMILANG LOGISTIK,0
PT CELLA MANAGEMENT LOGISTIK,0
PT CEMANI TOKA,1
PT CEMERLANG INDO PROPERTI,1
PT CEMERLANG SENTOSA MULIA,1
PT CEMINDO BANGUN PERSADA,1
PT CEMINDO GEMILANG TBK,1
PT CEMPAKA SINERGY REALTY,1
PT CENDANAWATI LOGISTIK INDONESIA,1
PT CENDRAWASIH FARIN,1
PT CENDRAWASIH PERTIWIJAYA,0
PT CENKO KORPORINDO INTERNATIONAL,1
PT CENTERRA MANAJEMEN PROPERTI,1
PT CENTRAL BALI BAHARI,0
PT CENTRAL CAPITAL VENTURA,0
PT CENTRAL CIPTA BERSAMA,1
PT CENTRAL ENERGI PRATAMA,1
PT CENTRAL INDAH PALACE,1
PT CENTRAL NAGA EUROPINDO,0
PT CENTRAL PANGAN PRIMA,0
PT CENTRAL PANGANPERTIWI,0
PT CENTRAL RESIK BANTEN,0
PT CENTRAL SAHABAT BARU,1
PT CENTRAL SOLE AGENCY,1
PT CENTRAL TATA MAKMUR,1
PT CENTRALPERTIWI BAHARI,0
PT CENTRALWINDU SEJATI,0
PT CENTRANUSA MAJUPERMAI,1
PT CENTRATAMA MENARA INDONESIA,2
PT CENTRATAMA TELEKOMUNIKASI INDONESIA TBK,1
PT CENTREPARK CITRA CORPORA,0
PT CENTRINDO HARDWARE,1
PT CENTRUM UTAMA PRIMA,1
PT CENTURY BATTERIES INDONESIA,1
PT CENTURY FRANCHISINDO UTAMA,1
PT CENTURY MITRA SUKSES SEJATI,1
PT CERANA ARTHA PUTRA,0
PT CETAK BIRU KAPITAL,1
PT CEVE LESTIANI,0
PT CGS CIMB SEKURITAS INDONESIA,1
PT CGS INTERNATIONAL SEKURITAS INDONESIA,1
PT CHAKRA JAWARA,2
PT CHAMP RESTO INDONESIA TBK,0
PT CHAMPION MULTI USAHA,0
PT CHAN BROTHERS TRAVEL INDONESIA,2
PT CHANDRA ASRI ALKALI,1
PT CHANDRA ASRI KONSULTASI,1
PT CHANDRA ASRI PACIFIC TBK,1
PT CHANDRA ASRI PERKASA,1
PT CHANDRA ASRI PORT,1
PT CHANDRA CILEGON PORT,1
PT CHANDRA DAYA INVESTASI,1
PT CHANDRA INVESTAMA,0
PT CHANDRA MITRA STRUKTURINDO,2
PT CHANDRA PELABUHAN NUSANTARA,1
PT CHANDRA PERSADA,2
PT CHANDRA SAKTI UTAMA LEASING,2
PT CHANDRA SAMUDRA PORT,1
PT CHANDRA SHIPPING INTERNATIONAL,1
PT CHANG JUI FANG INDONESIA,2
PT CHANGHONG ELECTRIC INDONESIA,0
PT CHARNIC CAPITAL TBK,1
PT CHARNIC LAND INVESTMENT,1
PT CHAT BOT NUSANTARA,1
PT CHEMICO SURABAYA,0
PT CHINA GLAZE INDONESIA,1
PT CHINA SONANGOL MEDIA INVESTMENT,2
PT CHITATEX PENI,2
PT CHITOSE C-ENGINEERING INDONESIA,0
PT CHITOSE INTERNASIONAL TBK,0
PT CHITRA PARATAMA,2
PT CHIYODA INTERNATIONAL INDONESIA,1
PT CIANJUR ARTA MAKMUR,2
PT CIAWI MEGAH INDAH,1
PT CIBALIUNG SUMBERDAYA,1
PT CIBALIUNG TUNGGAL PLANTATIONS,1
PT CIBITUNG TANJUNG PRIOK PORT TOLLWAYS,1
PT CIDAS SUPRA METALINDO,1
PT CIKARANG GERBANG SOLUSI,1
PT CIKARANG INLAND PORT,1
PT CIKARANG LISTRINDO TBK,1
PT CIKARANG PRIMATEX,2
PT CIKEL ABADI,0
PT CIKONDANG KANCANA PRIMA,0
PT CILIANDRA PERKASA,1
PT CIMANGGIS CIBITUNG TOLLWAYS,1
PT CIMB NIAGA AUTO FINANCE,1
PT CIMB NIAGA SEKURITAS,1
PT CINDARA PRATAMA LINES,0
PT CINEMAXX GLOBAL PASIFIK,0
PT CINERE SERPONG JAYA,1
PT CINTA AIRPORT FLORES,1
PT CIOMAS ADISATWA,1
PT CIPANYUSUHAN,1
PT CIPTA AGRO NUSANTARA,1
PT CIPTA ARMADA BERSAMA,1
PT CIPTA ASET DIGITAL,1
PT CIPTA GLOBAL INTERNASIONAL,0
PT CIPTA HIDRO ENERGI,1
PT CIPTA HIJAU BUMI ETAM,2
PT CIPTA KARYA MULTIGUNA,1
PT CIPTA KARYA SUKSES ABADI,0
PT CIPTA KARYA TEKNIK,1
PT CIPTA KRIDA BAHARI,2
PT CIPTA KRIDATAMA,2
PT CIPTA MAHAKARYA HARMONI,1
PT CIPTA MANDIRI INVESTAMA,0
PT CIPTA MAPAN LOGISTIK,1
PT CIPTA MULTI BUANA PERKASA,1
PT CIPTA MULTI PRIMA,1
PT CIPTA NARADA LESTARI,1
PT CIPTA PESONA ARMADA,1
PT CIPTA PESONA KARYA,1
PT CIPTA PILAR PERSADA,1
PT CIPTA PRIMA ENERGI INDONESIA,1
PT CIPTA RASA JUARA,0
PT CIPTA SARANA NUSANTARA,0
PT CIPTA SATURASA GEMILANG,2
PT CIPTA SEDAYA DIGITAL INDONESIA,1
PT CIPTA SELARAS MAJU JAYA,0
PT CIPTA SELERA SEMESTA,1
PT CIPTA SOLUSI ELEKTRINDO,1
PT CIPTA TELEVISI PENDIDIKAN INDENESIA,1
PT CIPTA UTAMA ANDALAN NUSANTARA,2
PT CIPTADANA CAPITAL,0
PT CIPTAJAYA SEJAHTERA ABADI,2
PT CIPTAKARYA TIRTA CEMERLANG,1
PT CIPTANUGRAH INDONESIA,0
PT CIPTATANI KUMAI SEJAHTERA,1
PT CIPUTRA ADIBUANA,1
PT CIPUTRA ADIGRAHA,1
PT CIPUTRA CITAKARYA NUSANTARA,1
PT CIPUTRA CORPORA,1
PT CIPUTRA GRAHA MITRA,1
PT CIPUTRA INDAH GRIYA ASRI,1
PT CIPUTRA MULTI DATA,1
PT CIPUTRA NIRVANADWIPA,1
PT CIPUTRA NUSANTARA,1
PT CIPUTRA PURI TRISULA,2
PT CIPUTRA RAYA SEJAHTERA,1
PT CIPUTRA RESIDENCE,1
PT CIPUTRA SEMARANG,1
PT CIPUTRA SENTRA,1
PT CIREBON ELECTRIC POWER,1
PT CIREBON ENERGI PRASARANA,1
PT CISADANE RIVER PARK,1
PT CISADANE SAWIT RAYA TBK,1
PT CISANGGIRI HYDRO,1
PT CISARUA MOUNTAIN DAIRY TBK,2
PT CISONO HYDRO,1
PT CITA ASA MAJU,0
PT CITILINK INDONESIA,1
PT CITRA AGRO KENCANA,1
PT CITRA AGRO RAYA,1
PT CITRA AGUNG PRATAMA,1
PT CITRA ALAM CAHAYA,1
PT CITRA ALAM INDAH,1
PT CITRA ANANDA,1
PT CITRA ANUGRAH SUKSES ABADI,2
PT CITRA ARTHA PERDANA,1
PT CITRA BAHARI SHIPYARD,1
PT CITRA BARU STEEL,1
PT CITRA BERDIKARI BERSAMA,2
PT CITRA BORNEO GLOBAL FEEDS,1
PT CITRA BORNEO INDAH,1
PT CITRA BORNEO UTAMA TBK,1
PT CITRA BUMI AGUNG,2
PT CITRA CAKRALOGAM,2
PT CITRA CIKAL MAPAN,1
PT CITRA DAMAI AGUNG,1
PT CITRA ENERGI BORNEO,2
PT CITRA GEMILANG INTERNASIONAL,1
PT CITRA GEMILANG NUSANTARA,1
PT CITRA HARAPAN INTI CEMERLANG,2
PT CITRA INDAH PRIMA,1
PT CITRA KALBAR SARANA,1
PT CITRA KARYA JABAR TOL,1
PT CITRA KARYA KREASI MANDIRI,1
PT CITRA KARYA MANDIRI SUKSES,1
PT CITRA KREASI MAJU,1
PT CITRA KREASI MAKMUR,2
PT CITRA LAUTAN TEDUH,1
PT CITRA MAKMUR RITAILINDO,2
PT CITRA MANDIRI PRIMA,0
PT CITRA MARGA LINTAS JABAR,1
PT CITRA MARGA NUSANTARA PROPERTINDO,1
