Nama,Degree
INDOMOBIL SUKSES INTERNASIONAL TBK,165.0
DIAN SWASTATIKA SENTOSA TBK,155.0
PT MITRA ADIPERKASA TBK,139.0
PT SILOAM INTERNATIONAL HOSPITALS TBK,108.0
INDIKA ENERGY TBK,100.0
PT BUKALAPAK.COM TBK,95.0
GOLDEN ENERGY MINES TBK,90.0
CITY RETAIL DEVELOPMENTS TBK,89.0
PT SURYA SEMESTA INTERNUSA TBK,88.0
SHANTOU MARIA INVESTMENT CO LTD,84.0
PT M CASH INTEGRASI TBK,83.0
PT WASKITA KARYA (PERSERO) TBK,79.0
PT ADHI KARYA (PERSERO) TBK,76.0
PT MEDIKALOKA HERMINA TBK,72.0
PT INDOMOBIL MULTI JASA TBK,69.0
ABM INVESTAMA TBK,69.0
BUKAKA TEKNIK UTAMA TBK,69.0
PT NFC INDONESIA TBK,68.0
BUKIT ASAM TBK,67.0
PT TBS ENERGI UTAMA TBK,67.0
PT WIJAYA KARYA (PERSERO) TBK,65.0
ASTRA INTERNATIONAL TBK,64.0
ASTRA AGRO LESTARI TBK,64.0
MEDIA NUSANTARA CITRA TBK,63.0
FKS MULTI AGRO TBK,62.0
EAGLE HIGH PLANTATIONS TBK,60.0
PT IMPACK PRATAMA INDUSTRI TBK,56.0
PT DIGITAL MEDIATAMA MAXIMA TBK,56.0
PT SUPREME CABLE MANUFACTURING & COMMERCE TBK,56.0
SARANA MENARA NUSANTARA TBK,56.0
PT WIJAYA KARYA BANGUNAN GEDUNG TBK,55.0
PT WASKITA BETON PRECAST TBK,55.0
PT FKS FOOD SEJAHTERA TBK,55.0
SALIM IVOMAS PRATAMA TBK,54.0
HARUM ENERGY TBK,52.0
PT DIAGNOS LABORATORIUM UTAMA TBK,52.0
PT MODERNLAND REALTY TBK,51.0
MNC TOURISM INDONESIA TBK,51.0
PT BUANA LINTAS LAUTAN TBK,50.0
ANEKA TAMBANG TBK,49.0
RESOURCE ALAM INDONESIA TBK,49.0
ERAJAYA SWASEMBADA TBK,49.0
INTILAND DEVELOPMENT TBK,48.0
TEMPO SCAN PACIFIC TBK,48.0
ELNUSA TBK,47.0
PT PRIMA ANDALAN MANDIRI TBK,47.0
PT BLUE BIRD TBK,47.0
PT SOECHI LINES TBK,46.0
KOBEXINDO TRACTORS TBK,46.0
PT DHARMA SATYA NUSANTARA TBK,46.0
PT SURYA BIRU MURNI ACETYLENE TBK,46.0
PT BUMA INTERNASIONAL GRUP TBK,45.0
PT SHIELD ON SERVICE TBK,44.0
WIJAYA KARYA BETON,43.0
PT SUPER ENERGY TBK,43.0
MARTINA BERTO TBK,43.0
VOKSEL ELECTRIC TBK,43.0
PT MEGA MANUNGGAL PROPERTY TBK,42.0
PT BALI BINTANG SEJAHTERA TBK,42.0
PT NUSA RAYA CIPTA TBK,42.0
ELANG MAHKOTA TEKNOLOGI TBK,42.0
PT CEMINDO GEMILANG TBK,42.0
LEYAND INTERNATIONAL TBK,42.0
PT ACSET INDONUSA TBK,42.0
PT AGUNG PODOMORO LAND TBK,42.0
PT KIRANA MEGATARA TBK,41.0
PT ASPIRASI HIDUP INDONESIA TBK,41.0
PT TRANSCOAL PACIFIC TBK,41.0
PT KETROSDEN TRIASMITRA TBK,41.0
PT PERMA PLASINDO TBK,40.0
ANCORA INDONESIA RESOURCES TBK,40.0
JAPFA COMFEED INDONESIA TBK,40.0
PT SUMBER TANI AGUNG RESOURCES TBK,40.0
KIMIA FARMA TBK,40.0
PT MAP AKTIF ADIPERKASA TBK,40.0
SEMEN INDONESIA (PERSERO) TBK,40.0
ALAMTRI RESOURCES INDONESIA TBK,40.0
PT INDONESIA PONDASI RAYA TBK,39.0
PT SINGARAJA PUTRA TBK,39.0
PT RMK ENERGY TBK,39.0
PT ERA MANDIRI CEMERLANG TBK,39.0
KAWASAN INDUSTRI JABABEKA TBK,39.0
PT LOGINDO SAMUDRAMAKMUR TBK,39.0
CITRA TUBINDO TBK,38.0
BUMI RESOURCES MINERALS TBK,38.0
PETROSEA TBK,38.0
INDOCEMENT TUNGGAL PRAKARSA TBK,38.0
BAKRIELAND DEVELOPMENT TBK,38.0
PT PUTRA MANDIRI JEMBAR TBK,38.0
PT ATELIERS MECANIQUES D INDONESIE TBK,38.0
PT KINO INDONESIA TBK,37.0
INTANWIJAYA INTERNASIONAL TBK,37.0
PT ANABATIC TECHNOLOGIES TBK,37.0
PT MITRA KELUARGA KARYASEHAT TBK,37.0
ENSEVAL PUTERA MEGATRADING TBK,36.0
INDOFOOD SUKSES MAKMUR TBK,36.0
PT PRIMA GLOBALINDO LOGISTIK TBK,36.0
PT HASNUR INTERNASIONAL SHIPPING TBK,36.0
BAYAN RESOURCES TBK,36.0
PT SAWIT SUMBERMAS SARANA TBK,36.0
PT VISI MEDIA ASIA TBK,36.0
PT FORMOSA INGREDIENT FACTORY TBK,36.0
PT PRODIA WIDYAHUSADA TBK,35.0
PT TOWER BERSAMA INFRASTRUCTURE TBK,35.0
DARMA HENWA TBK,35.0
J RESOURCES ASIA PASIFIK TBK,35.0
ARWANA CITRAMULIA TBK,34.0
PT SUMBER GLOBAL ENERGY TBK,34.0
BERLINA TBK,34.0
PT CHANDRA ASRI PACIFIC TBK,33.0
PT MD ENTERTAINMENT TBK,33.0
PT MAHKOTA GROUP TBK,33.0
PT TRIMEGAH KARYA PRATAMA TBK,33.0
PT KENCANA ENERGI LESTARI TBK,33.0
RADIANT UTAMA INTERINSCO TBK,33.0
PT SAMPOERNA AGRO TBK,32.0
ASTRA OTOPARTS TBK,32.0
PT PRATAMA WIDYA TBK,32.0
BHUWANATALA INDAH PERMAI TBK,32.0
HM SAMPOERNA TBK,32.0
PT FAP AGRI TBK,32.0
INDO TAMBANGRAYA MEGAH TBK,32.0
TRANS POWER MARINE TBK,32.0
RICKY PUTRA GLOBALINDO TBK,32.0
TRISULA INTERNATIONAL TBK,31.0
SENTUL CITY TBK,31.0
BERLIAN LAJU TANKER TBK,31.0
PT ULIMA NITRA TBK,31.0
PT SOLUSI BANGUN INDONESIA TBK,31.0
PT GARUDA METALINDO TBK,30.0
BUMI RESOURCES TBK,30.0
PT PARAMITA BANGUN SARANA TBK,30.0
PT ARMADA BERJAYA TRANS TBK,30.0
PT SATRIA MEGA KENCANA TBK,30.0
MITRABAHTERA SEGARA SEJATI TBK,29.0
PT DAMAI SEJAHTERA ABADI TBK,29.0
COLORPAK INDONESIA TBK,29.0
PT METRO HEALTHCARE INDONESIA TBK,28.0
PT FAST FOOD INDONESIA TBK,28.0
PT CAPITAL FINANCIAL INDONESIA TBK,28.0
PT GOLDEN FLOWER TBK,28.0
JAYA AGRA WATTIE TBK,28.0
GOZCO PLANTATIONS TBK,28.0
SEJAHTERARAYA ANUGRAHJAYA TBK,28.0
PT TRIPUTRA AGRO PERSADA TBK,28.0
PT TIMAH TBK,27.0
PT ARKORA HYDRO TBK,27.0
PT INDO OIL PERKASA TBK,27.0
EXPLOITASI ENERGI INDONESIA TBK,27.0
PT BATAVIA PROSPERINDO TRANS TBK,27.0
PT OSCAR MITRA SUKSES SEJAHTERA TBK,27.0
PT SENTRAL MITRA INFORMATIKA TBK,27.0
PT JAYA SUKSES MAKMUR SENTOSA TBK,27.0
PT MINERAL SUMBERDAYA MANDIRI TBK,27.0
PT VICTORIA CARE INDONESIA TBK,27.0
PT GALVA TECHNOLOGIES TBK,27.0
UNITED TRACTORS TBK,26.0
PT BALI TOWERINDO SENTRA TBK,26.0
PT SILLO MARITIME PERDANA TBK,26.0
PT ALAMTRI MINERALS INDONESIA TBK,26.0
PT GRAHA LAYAR PRIMA TBK,26.0
CHAMPION PACIFIC INDONESIA TBK,26.0
PT MURNI SADAR TBK,26.0
PT SEMEN BATURAJA TBK,26.0
PT SUPERKRANE MITRA UTAMA TBK,26.0
PT TRANSKON JAYA TBK,26.0
PT PERINTIS TRINITI PROPERTI TBK,25.0
PT ARITA PRIMA INDONESIA TBK,25.0
PT INTERMEDIA CAPITAL TBK,25.0
MERCK TBK,25.0
PT CENTRATAMA TELEKOMUNIKASI INDONESIA TBK,25.0
PT POLLUX HOTELS GROUP TBK,25.0
NUSA KONSTRUKSI ENJINIRING TBK,25.0
PT GAYA ABADI SEMPURNA TBK,25.0
PT GLOBE KITA TERANG TBK,25.0
PT DISTRIBUSI VOUCHER NUSANTARA TBK,25.0
GARUDA INDONESIA (PERSERO) TBK,24.0
BAKRIE SUMATERA PLANTATIONS TBK,24.0
PT BLISS PROPERTI INDONESIA TBK,24.0
INDOFOOD CBP SUKSES MAKMUR TBK,24.0
PT MNC DIGITAL ENTERTAINMENT TBK,24.0
PT PAM MINERAL TBK,24.0
PANORAMA SENTRAWISATA TBK,24.0
JAKARTA INTERNATIONAL HOTELS & DEVELOPMENT TBK,24.0
PT DAYAMITRA TELEKOMUNIKASI TBK,24.0
PELANGI INDAH CANINDO TBK,24.0
ALKINDO NARATAMA TBK,24.0
PT KURNIAMITRA DUTA SENTOSA TBK,24.0
POLYCHEM INDONESIA TBK,23.0
PT SENTRA FOOD INDONESIA TBK,23.0
PT MULTIPOLAR TECHNOLOGY TBK,23.0
PT MITRABARA ADIPERDANA TBK,23.0
PT MERDEKA COPPER GOLD TBK,23.0
PT PP PROPERTI TBK,23.0
INDOSPRING TBK,23.0
PT KEDOYA ADYARAYA TBK,23.0
PT SARASWANTI ANUGERAH MAKMUR TBK,23.0
SONA TOPAS TOURISM INDUSTRY TBK,23.0
SMR UTAMA TBK,22.0
MITRA INVESTINDO TBK,22.0
MNC KAPITAL INDONESIA TBK,22.0
PT JAYA TRISHINDO TBK,22.0
ISLAND CONCEPTS INDONESIA TBK,22.0
PT ESTIKA TATA TIARA TBK,22.0
PT MORENZO ABADI PERKASA TBK,22.0
PT QUANTUM CLOVERA INVESTAMA TBK,22.0
PT PHAPROS TBK,22.0
WICAKSANA OVERSEAS INTERNATIONAL TBK,21.0
PT LINK NET TBK,21.0
NEGARA REPUBLIK INDONESIA,21.0
PT CATURKARDA DEPO BANGUNAN TBK,21.0
CIPUTRA DEVELOPMENT TBK,21.0
PT INDORITEL MAKMUR INTERNASIONAL TBK,21.0
PT PALMA SERASIH TBK,21.0
SURYA CITRA MEDIA TBK,21.0
PT MEGALESTARI EPACK SENTOSARAYA TBK,21.0
PT TRIMUDA NUANSA CITRA TBK,21.0
PT MEGA PERINTIS TBK,21.0
PT SARATOGA INVESTAMA SEDAYA TBK,20.0
PT GTS INTERNASIONAL TBK,20.0
SEKAR BUMI TBK,20.0
MULTIPOLAR TBK,20.0
MULTI PRIMA SEJAHTERA TBK,20.0
PT AGRO YASA LESTARI TBK,20.0
SAMINDO RESOURCES TBK,20.0
SOLUSI TUNAS PRATAMA TBK,20.0
PT VISI TELEKOMUNIKASI INFRASTRUKTUR TBK,20.0
SHANTOU JINJIA TRADING CO LTD,20.0
PT PYRIDAM FARMA TBK,20.0
PT NUSANTARA PELABUHAN HANDAL TBK,19.0
PT ARCHI INDONESIA TBK,19.0
MANDOM INDONESIA TBK,19.0
PT KIOSON KOMERSIAL INDONESIA TBK,19.0
KRAKATAU STEEL (PERSERO) TBK,19.0
PT GOTO GOJEK TOKOPEDIA TBK,19.0
TOTAL BANGUN PERSADA TBK,19.0
PT IMC PELITA LOGISTIK TBK,19.0
PT ARKADIA DIGITAL MEDIA TBK,19.0
PT PERUSAHAAN GAS NEGARA TBK,19.0
PT CHITOSE INTERNASIONAL TBK,19.0
PT CHAMP RESTO INDONESIA TBK,18.0
PT NATURA CITY DEVELOPMENTS TBK,18.0
TRIKOMSEL OKE TBK,18.0
PT GARUDAFOOD PUTRA PUTRI JAYA TBK,18.0
PT BUNDAMEDIK TBK,18.0
BARITO PACIFIC TBK,18.0
PELAT TIMAH NUSANTARA TBK,18.0
ADI SARANA ARMADA TBK,18.0
SAMUDERA INDONESIA TBK,18.0
PT TERREGRA ASIA ENERGY,18.0
WINTERMAR OFFSHORE MARINE TBK,18.0
EXPRESS TRANSINDO UTAMA TBK,18.0
ESSA INDUSTRIES INDONESIA TBK,18.0
PIKKO LAND DEVELOPMENT TBK,18.0
CAHAYA AERO SERVICES TBK,18.0
PT LANCARTAMA SEJATI TBK,18.0
INDONESIAN PARADISE PROPERTY TBK,18.0
PT JASA ARMADA INDONESIA TBK,18.0
PT JASA MARGA TBK,17.0
PT HARAPAN DUTA PERTIWI TBK,17.0
PT MENTENG HERITAGE REALTY TBK,17.0
PT SUMMARECON AGUNG TBK,17.0
PT ADHI COMMUTER PROPERTI TBK,17.0
PT GRAHA ANDRASENTRA PROPERTINDO TBK,17.0
ASAHIMAS FLAT GLASS TBK,17.0
METROPOLITAN LAND TBK,17.0
PT MAHARAKSA BIRU ENERGI TBK,17.0
PARAGON KARYA PERKASA TBK,17.0
PT ZYREXINDO MANDIRI BUANA TBK,17.0
BUMI CITRA PERMAI TBK,16.0
PT TRISULA TEXTILE INDUSTRIES TBK,16.0
PT LIMA DUA LIMA TIGA TBK,16.0
INTER-DELTA TBK,16.0
PT AGUNG SEMESTA SEJAHTERA TBK,16.0
TUNAS BARU LAMPUNG TBK,16.0
PT TEMAS TBK,16.0
PT TELKOM INDONESIA (PERSERO) TBK,16.0
PT OBM DRILCHEM TBK,16.0
GAJAH TUNGGAL TBK,16.0
SELAMAT SEMPURNA TBK,16.0
ERATEX DJAJA TBK,16.0
PT ELECTRONIC CITY INDONESIA TBK,15.0
PT IFISHDECO TBK,15.0
PT WINNER NUSANTARA JAYA TBK,15.0
PT INTEGRA INDOCABINET TBK,15.0
ALAM SUTERA REALTY TBK,15.0
KABELINDO MURNI TBK,15.0
SIDOMULYO SELARAS TBK,15.0
CATUR SENTOSA ADIPRANA TBK,15.0
PT AKR CORPORINDO TBK,15.0
INDAL ALUMINIUM INDUSTRY TBK,15.0
PT PANCA BUDI IDAMAN TBK,15.0
PT PRADIKSI GUNATAMA TBK,15.0
DESTINASI TIRTA NUSANTARA TBK,14.0
PT GLOBAL MEDIACOM TBK,14.0
PT GREENWOOD SEJAHTERA TBK,14.0
PELAYARAN NASIONAL BINA BUANA RAYA TBK,14.0
MNC SKY VISION TBK,14.0
PT BINTANG SAMUDERA MANDIRI LINES TBK,14.0
PT MNC VISION NETWORKS TBK,14.0
INTI BANGUN SEJAHTERA TBK,14.0
PT MAHAKA RADIO INTEGRA TBK,14.0
PT BANK RAKYAT INDONESIA (PERSERO) TBK,14.0
CITA MINERAL INVESTINDO TBK,14.0
CENTRAL PROTEINA PRIMA TBK,13.0
PT INDOINTERNET TBK,13.0
PT PANTAI INDAH KAPUK DUA TBK,13.0
PRASIDHA ANEKA NIAGA TBK,13.0
PT RED PLANET INDONESIA TBK,13.0
SAT NUSAPERSADA TBK,13.0
SUMBER ENERGI ANDALAN TBK,13.0
EQUITY DEVELOPMENT INVESTMENT TBK,13.0
PT BATULICIN NUSANTARA MARITIM TBK,13.0
INTRACO PENTA TBK,13.0
PT ASIA SEJAHTERA MINA TBK,13.0
PT NIPPON INDOSARI CORPINDO TBK,13.0
PT LAUTAN LUAS TBK,13.0
TEMBAGA MULIA SEMANAN TBK,13.0
GOLDEN EAGLE ENERGY TBK,12.0
PT CITRA PUTRA REALTY TBK,12.0
SEPATU BATA TBK,12.0
PT WEHA TRANSPORTASI INDONESIA TBK,12.0
PAKUWON JATI TBK,12.0
PT ROCKFIELDS PROPERTI INDONESIA TBK,12.0
PT BINTANG OTO GLOBAL TBK,12.0
PP LONDON SUMATRA INDONESIA TBK,12.0
PT MAP BOGA ADIPERKASA TBK,12.0
PT DANANTARA ASSET MANAGEMENT (PERSERO),12.0
ALAKASA INDUSTRINDO TBK,12.0
PT AUSTINDO NUSANTARA JAYA TBK,12.0
FORTUNE MATE INDONESIA TBK,12.0
GUDANG GARAM TBK,12.0
PT GUNA TIMUR RAYA TBK,12.0
PUDJIADI PRESTIGE TBK,11.0
PT KRIDA JARINGAN NUSANTARA TBK,11.0
UOB KAY HIAN PTE LTD,11.0
PT VICTORIA INVESTAMA TBK,11.0
MUSTIKA RATU TBK,11.0
MAYORA INDAH TBK,11.0
PELAYARAN NELLY DWI PUTRI TBK,11.0
PEMBANGUNAN GRAHA LESTARI INDAH TBK,11.0
SEKAR LAUT TBK,11.0
ARGO PANTES TBK,11.0
PT COMMUNICATION CABLE SYSTEMS INDONESIA TBK,11.0
PT SARIGUNA PRIMATIRTA TBK,11.0
FIRST MEDIA TBK,11.0
PT BANK MANDIRI (PERSERO) TBK,11.0
PT ASABRI (PERSERO),10.0
PT AVIA AVIAN TBK,10.0
PT SLJ GLOBAL TBK,10.0
DHARMA SAMUDERA FISHING IND TBK,10.0
DARYA-VARIA LABORATORIA TBK,10.0
INDO STRAITS TBK,10.0
BANK OF SINGAPORE LIMITED,10.0
PT BANK CENTRAL ASIA TBK,10.0
BEKASI FAJAR INDUSTRIAL ESTATE TBK,10.0
PT INDO KOMODITI KORPORA TBK,10.0
TOBA PULP LESTARI TBK,10.0
PT INDOSAT TBK,10.0
JAYA REAL PROPERTY TBK,10.0
JAKARTA SETIABUDI INTERNASIONAL TBK,10.0
PT PELAYARAN TAMARIN SAMUDRA TBK,10.0
STAR PACIFIC TBK,10.0
CHAROEN POKPHAND INDONESIA TBK,10.0
PT GEOPRIMA SOLUSI TBK,10.0
DUTA ANGGADA REALTY TBK,10.0
WAHANA PRONATURAL TBK,9.0
PT SUMBER ALFARIA TRIJAYA TBK,9.0
BAYU BUANA TBK,9.0
PT BANK NEGARA INDONESIA (PERSERO) TBK,9.0
PT WIJAYA KUSUMA RAJAWALI,9.0
PT BERKAH PRIMA PERKASA TBK,9.0
SURYAMAS DUTAMAKMUR TBK,9.0
MAHAKA MEDIA TBK,9.0
CENTRAL OMEGA RESOURCES TBK,9.0
PT DHARMA POLIMETAL TBK,9.0
MPY GLOBAL SDN BHD,9.0
PT EASTPARC HOTEL TBK,9.0
PT OMNI INOVASI INDONESIA TBK,9.0
SURYA TOTO INDONESIA TBK,9.0
PT WILMAR CAHAYA INDONESIA TBK,9.0
PERDANA GAPURA PRIMA TBK,9.0
PT CASHLEZ WORLDWIDE INDONESIA TBK,9.0
WILMAR INTERNATIONAL LIMITED,9.0
MALINDO FEEDMILL TBK,9.0
MULTISTRADA ARAH SARANA TBK,8.0
PT TELEFAST INDONESIA TBK,8.0
NUSANTARA INFRASTRUCTURE TBK,8.0
DELTA DJAKARTA TBK,8.0
PT KENCANA PUTRA KENDARI,8.0
MIDI UTAMA INDONESIA TBK,8.0
RUKUN RAHARJA TBK,8.0
BUKALAPAK,8.0
SARANA MEDITAMA METROPOLITAN TBK,8.0
METRODATA ELECTRONICS TBK,8.0
PT ANDALAN PERKASA ABADI TBK,8.0
PT SURYA PERMATA ANDALAN TBK,8.0
PT GRAHA VENTURA MILENIAL GROUP,8.0
CITRA MARGA NUSAPHALA PERSADA TBK,8.0
PT CAHAYASAKTI INVESTINDO SUKSES TBK,8.0
PABRIK KERTAS TJIWI KIMIA TBK,8.0
PT BIMA SAKTI PERTIWI TBK,8.0
PT MITRA ENERGI PERSADA TBK,8.0
PT INDONESIA FIBREBOARD INDUSTRY TBK,8.0
PT ROYALINDO INVESTA WIJAYA TBK,8.0
PEMBANGUNAN JAYA ANCOL TBK,8.0
PT INDAH PRAKASA SENTOSA TBK,7.0
PT STEEL PIPE INDUSTRY OF INDONESIA TBK,7.0
PT MNC ASIA HOLDING TBK,7.0
PT PINAGO UTAMA TBK,7.0
PT GIHON TELEKOMUNIKASI INDONESIA TBK,7.0
APEXINDO PRATAMA DUTA TBK,7.0
PT ANDALAN SAKTI PRIMAINDO TBK,7.0
PT KAPUAS PRIMA COAL TBK,7.0
BANK PAN INDONESIA TBK,7.0
PT INDAH AGUNG MANDIRI,7.0
MERATUS JASA PRIMA TBK,7.0
PT INTI ANUGERAH PRATAMA,7.0
PT WAHANA INTERFOOD NUSANTARA TBK,7.0
PT META EPSI TBK,7.0
PT NUSATAMA BERKAH TBK,7.0
INDONESIA PRIMA PROPERTY TBK,7.0
PT OPTIMA PRIMA METAL SINERGI TBK,7.0
INDOPOLY SWAKARSA INDUSTRY TBK,7.0
TIRTA MAHAKAM RESOURCES TBK,7.0
TIGARAKSA SATRIA TBK,7.0
ALUMINDO LIGHT METAL INDUSTRY TBK,6.0
PT INDO-RAMA SYNTHETICS TBK,6.0
JEMBO CABLE COMPANY TBK,6.0
MITRA INTERNATIONAL RESOURCES TBK,6.0
PT MORA TELEMATIKA INDONESIA TBK,6.0
PT MITRA PINASTHIKA MUSTIKA TBK,6.0
PT ORGANON PHARMA INDONESIA TBK,6.0
INDOFOOD,6.0
PT WIDODO MAKMUR PERKASA TBK,6.0
PT YELOOO INTEGRA DATANET TBK,6.0
FORTUNE INDONESIA TBK,6.0
PT TRIMITRA PRAWARA GOLDLAND TBK,6.0
PT DIAMOND FOOD INDONESIA TBK,6.0
PT TRIMEGAH SEKURITAS INDONESIA TBK,6.0
MEGAPOLITAN DEVELOPMENTS TBK,6.0
PT HENSEL DAVEST INDONESIA TBK,6.0
BARAMULTI SUKSESSARANA TBK,6.0
PT BANK SMBC INDONESIA TBK,6.0
PT BUKIT ULUWATU VILLA TBK,6.0
PT DMS PROPERTINDO TBK,6.0
LIONMESH PRIMA TBK,6.0
RISTIA BINTANG MAHKOTASEJATI TBK,6.0
PT PRIMA CAKRAWALA ABADI TBK,6.0
PT SURYA FAJAR CAPITAL TBK,5.0
PT EMDEKI UTAMA TBK,5.0
SHANTOU HIGH-TECH INDUSTRIAL DEVELOPMENT ZONE,5.0
JAYA KONSTRUKSI MANGGALA PRATAMA TBK,5.0
PT SELARAS CITRA NUSANTARA PERKASA TBK,5.0
SUNSON TEXTILE MANUFACTURER TBK,5.0
PT BRAWIJAYA CAPITAL INVESTAMA,5.0
PT CISARUA MOUNTAIN DAIRY TBK,5.0
RAMAYANA LESTARI SENTOSA TBK,5.0
BANK PEMBANGUNAN DAERAH JAWA BARAT DAN BANTEN TBK,5.0
MULTI INDOCITRA TBK,5.0
PT KOTA SATU PROPERTI TBK,5.0
PT INDUSTRI JAMU DAN FARMASI SIDO MUNCUL TBK,5.0
PT SOHO GLOBAL HEALTH TBK,5.0
PANINVEST TBK,5.0
JASUINDO TIGA PERKASA TBK,5.0
KEDAUNG INDAH CAN TBK,5.0
PT CAHAYAPUTRA ASA KERAMIK TBK,5.0
SHANTOU ZHONGFU ELECTRONIC TECHNOLOGY CO LTD,5.0
PT SINERGI INTI PLASTINDO TBK,5.0
PT XLSMART TELECOM SEJAHTERA TBK,5.0
BINTANG MITRA SEMESTARAYA TBK,5.0
PT BANK CIMB NIAGA TBK,5.0
BUMI TEKNOKULTURA UNGGUL TBK,5.0
BETONJAYA MANUNGGAL TBK,5.0
PT BUMI SERPONG DAMAI TBK,4.0
GUNAWAN DIANJAYA STEEL TBK,4.0
PT BUDI STARCH & SWEETENER TBK,4.0
PT SIGMA ENERGY COMPRESSINDO TBK,4.0
PT BASIS UTAMA PRIMA,4.0
ATLAS RESOURCES TBK,4.0
BAOTOU TUOLITUO TECHNOLOGY CO LTD,4.0
SARANACENTRAL BAJATAMA TBK,4.0
PT SIANTAR TOP TBK,4.0
PT TUNAS ALFIN TBK,4.0
TRIAS SENTOSA TBK,4.0
PT MAHA PROPERTI INDONESIA TBK,4.0
PT PANCA ANUGRAH WISESA TBK,4.0
MULIA INDUSTRINDO TBK,4.0
PT PERSADA CAPITAL INVESTAMA,4.0
INDAH KIAT PULP & PAPER TBK,4.0
PT BHAKTI MULTI ARTHA TBK,4.0
PT ARTHA MAHIYA INVESTAMA TBK,4.0
PT MINERAL INDUSTRI INDONESIA (PERSERO),4.0
PT ULTRAJAYA MILK INDUSTRY & TRADING COMPANY TBK,4.0
PT DYANDRA MEDIA INTERNATIONAL TBK,4.0
SHANTOU ZHONGBIN HETAI IMPORT AND EXPORT TRADE,4.0
PT ESTA MULTI USAHA TBK,4.0
PT LOTTE CHEMICAL TITAN TBK,4.0
PT MULIA BOGA RAYA TBK,4.0
PT BUYUNG POETRA SEMBADA TBK,4.0
PT HARTADINATA ABADI TBK,4.0
PT BERKAH HIKMAH ENERGI,4.0
PT KAWAN LAMA SEJAHTERA,3.0
PT DELTA WIBAWA BERSAMA,3.0
PT ANUGERAH KAGUM KARYA UTAMA TBK,3.0
PT SEMACOM INTEGRATED TBK,3.0
PT SREEYA SEWU INDONESIA TBK,3.0
PT BUNDA INVESTAMA INDONESIA,3.0
MNC CORPORATION,3.0
PT BANK MAYBANK INDONESIA TBK,3.0
GLAS TRUST SINGAPORE LTD,3.0
PT BAKRIE CAPITAL INDONESIA,3.0
PT ASIA PACIFIC INVESTAMA TBK,3.0
PT PROVIDENT INVESTASI BERSAMA TBK,3.0
PT TOURINDO GUIDE INDONESIA TBK,3.0
PT GRAHA SENTOSA PERSADA,3.0
PT DWIMURIA INVESTAMA ANDALAN,3.0
UOB KAY HIAN HONG KONG LTD,3.0
HT INVESTMENT DEVELOPMENT LTD,3.0
DBS BANK LTD,3.0
BISI INTERNATIONAL TBK,3.0
PT SAKTI GENERASI PERDANA,3.0
PT ARGO MANUNGGAL LAND DEVELOPMENT,3.0
PT ARKHA JAYANTI PERSADA TBK,3.0
ARTHAVEST TBK,3.0
PT ASURANSI JIWA KRESNA,3.0
TANAH LAUT TBK,3.0
PT APP PURINUSA EKAPERSADA,3.0
PT PEMBANGUNAN JAYA,3.0
PT MARK DYNAMICS INDONESIA TBK,3.0
PANIN SEKURITAS TBK,3.0
MODERN INTERNASIONAL TBK,3.0
PT MADUSARI MURNI INDAH TBK,3.0
PT BUANA ARTHA ANUGERAH TBK,3.0
PT DANA BRATA LUHUR TBK,3.0
TIRA AUSTENITE TBK,3.0
GEMA GRAHASARANA TBK,3.0
KMI WIRE AND CABLE TBK,3.0
PT HIMALAYA ENERGI PERKASA TBK,3.0
HUMPUSS INTERMODA TRANSPORTASI TBK,3.0
PT GRAND HOUSE MULIA TBK,3.0
PT MNC ENERGY INVESTMENTS TBK,3.0
PT IDEA INDONESIA AKADEMI TBK,3.0
PT WIRA GLOBAL SOLUSI TBK,3.0
YANAPRIMA HASTAPERSADA TBK,3.0
GRUP LIPPO,3.0
MATAHARI DEPARTMENT STORE TBK,3.0
WISMILAK INTI MAKMUR TBK,3.0
ASIA PACIFIC FIBERS TBK,3.0
PT ASURANSI JIWA IFG,3.0
PT MUARA SEJAGAT ABADI,3.0
PT DJASA UBERSAKTI TBK,3.0
SUPRA BOGA LESTARI TBK,3.0
PT FKS FOOD AND INGREDIENTS,3.0
PT TRIPUTRA INVESTINDO ARYA,3.0
YULIE SEKURITAS INDONESIA TBK,3.0
EKADHARMA INTERNATIONAL TBK,3.0
PT ENVY TECHNOLOGIES INDONESIA TBK,3.0
KALBE FARMA TBK,3.0
PT KARYA DWIMANUNGGAL SEJAHTERA,3.0
PT HARITA JAYARAYA,3.0
BNP PARIBAS SINGAPORE BRANCH WEALTH MANAGEMENT,3.0
PT AIRASIA INDONESIA TBK,3.0
PT 1 INTI DOT COM,3.0
PT GRAHATAMA KREASIBARU,2.0
FIDELITY FD SICAV,2.0
PT TRITIRTA INTI MANDIRI,2.0
PT TANCORP GLOBAL SENTOSA,2.0
PT BUANATATA ADISENTOSA,2.0
NIPPON STEEL CORPORATION,2.0
YAYASAN TUNAS INDONESIA JAYA,2.0
PT DAFAM PROPERTY INDONESIA TBK,2.0
REKSADANA NARADA SAHAM INDONESIA,2.0
PT GLOBAL DINAMIKA KENCANA,2.0
INDOFOOD AGRI RESOURCES LTD,2.0
PT BEYOND MEDIA,2.0
COMPAGNIE GENERALE DES ETABLISSEMENTS MICHELIN,2.0
PT SUWARNA ARTA MANDIRI,2.0
PT CIPUTRA CORPORA,2.0
PT DWITUNGGAL PERMATA,2.0
PT SANURHASTA MITRA TBK,2.0
METROPOLITAN KENTJANA TBK,2.0
MULTI BINTANG INDONESIA TBK,2.0
FURUKAWA ELECTRIC CO LTD,2.0
PT AUTUM PRIMA INDONESIA,2.0
FJ CAPITAL PTE LTD,2.0
GREEN RESOURCES INVESTMENTS PTE LTD,2.0
PT SURYA PERTIWI TBK,2.0
PT MULTIFORTUNA ASINDO,2.0
PT SURYAPARAMITRA ABADI,2.0
PT IMAGO MULIA PERSADA TBK,2.0
PT KI EMPORIUM,2.0
PT TIARA MARGA TRAKINDO,2.0
PT BANK DANAMON INDONESIA TBK,2.0
PT SATYA MULIA GEMA GEMILANG,2.0
PT ASURANSI CENTRAL ASIA,2.0
PT BATULICIN ENAM SEMBILAN TRANSPORTASI,2.0
PT GESIT PERKASA,2.0
PT GUNA INVESTINDO,2.0
PT MARINDO INVESTAMA,2.0
PT MULINDO INVESTAMA,2.0
PT MASPION,2.0
PT HUSIN INVESTAMA,2.0
PT PRAKINDO INVESTAMA,2.0
PT ALIM INVESTINDO,2.0
PT MAKMUR BERKAH AMANDA TBK,2.0
PT ANUGERAH PERKASA SEMESTA,2.0
PT CENTRAL ENERGI PRATAMA,2.0
PT KREASI REGALINO INDONESIA,2.0
PT ADRINDO INTI PERKASA,2.0
PT BIO FARMA (PERSERO),2.0
VALE INDONESIA TBK,2.0
PT PELABUHAN INDONESIA INVESTAMA,2.0
PT TIGA TELEKOMUNIKASI INDONESIA,2.0
HUTCHISON ASIA TELECOMMUNICATIONS LIMITED,2.0
PT CAKRA BHAKTI PARA PUTRA,2.0
PEMBERTON ASIAN OPPORTUNITIES FUND,2.0
INDONESIA INVESTMENT AUTHORITY,2.0
PT BATAVIA PROSPERINDO INTERNASIONAL TBK,2.0
INDO KORDSA TBK,2.0
PT CGS INTERNATIONAL SEKURITAS INDONESIA,2.0
PT MAYBANK SEKURITAS INDONESIA,2.0
CGS INTERNATIONAL SECURITIES SINGAPORE PTE LTD,2.0
PT DWI SATRYA UTAMA,2.0
PT SINAR MAS MULTIARTHA TBK,2.0
PT WAHANA SENTOSA CEMERLANG,2.0
UBS AG SINGAPORE,2.0
SUMITOMO MITSUI BANKING CORPORATION,2.0
PT SUNGAI BUDI,2.0
PT BUDI DELTA SWAKARYA,2.0
PT ASTRINDO NUSANTARA INFRASTRUKTUR TBK,2.0
WATIGA TRUST LTD,2.0
GOTO,2.0
FIRST PACIFIC,2.0
BIRCHWOOD OMNIA LIMITED,2.0
OOREDOO,2.0
PT NGRUMAT BONDO UTOMO,2.0
ASTRA GRAPHIA TBK,2.0
JARDINE MATHESON,2.0
FUJIAN TANGZHONG INTERNATIONAL TRADING CO LTD,2.0
PT DAYA ADICIPTA MUSTIKA,2.0
PT PRIMA CAKRAWALA SENTOSA,2.0
UNION BANCAIRE PRIVEE UBP SA SINGAPORE BRANCH,2.0
BANK JULIUS BAER AND CO LTD SINGAPORE,2.0
PT MEGA CORPORA,2.0
PT BANK KB INDONESIA TBK,2.0
PT BUMI BENOWO SUKSES SEJAHTERA TBK,2.0
PT AKULAKU SILVRR INDONESIA,2.0
MUFG BANK LTD,2.0
PT SOUTHERN CROSS TEXTILE INDUSTRY,2.0
PT TRISULA INSAN TIARA,2.0
EQUITY GLOBAL INTERNATIONAL LIMITED,2.0
PT INDOLIFE PENSIONTAMA,2.0
UBS AG,2.0
PT BOSTON FURNITURE INDUSTRIES TBK,2.0
YAYASAN DANAR DANA SWADHARMA,2.0
GLENWOOD CORPORATION,2.0
OCBC SECURITIES PTE LTD,2.0
ONIX CAPITAL TBK,2.0
BANQUE PICTET AND CIE SA,2.0
PT SENTOSA BERSAMA MITRA,2.0
PT PERTAMINA (PERSERO),2.0
PT SOTERIA WICAKSANA INVESTAMA,2.0
PEMERINTAH DAERAH DKI JAKARTA,2.0
PT ARTHA GRAHA NETWORK,2.0
JPMCB NA RE JPMCB SINGAPORE BRANCH,2.0
EVER SHINE TEXTILE INDUSTRY TBK,2.0
AXIATA INVESTMENTS (INDONESIA) SDN BHD,2.0
PT FKS CORPORINDO INDONESIA,2.0
YAYASAN FILADELFIA,2.0
PT ADHIMIX PRECAST INDONESIA,2.0
PT CARDIG INTERNATIONAL,2.0
PT HOTEL FITRA INTERNATIONAL TBK,2.0
PT SUPER CAPITAL INDONESIA,2.0
PT CHARNIC CAPITAL TBK,2.0
PT GARUDA MAINTENANCE FACILITY AERO ASIA TBK,2.0
GOWA MAKASSAR TOURISM DEVELOPMENT TBK,2.0
PT TUDUNG PUTRA PUTRI JAYA,2.0
PT OWEN PETRO BITUMEN,2.0
DANA PENSIUN KARYAWAN PANIN BANK,2.0
PT GRAHA MULIA INDOTAMA,2.0
INDO ACIDATAMA TBK,2.0
PT CITRA BORNEO INDAH,2.0
PT JAYA SWARASA AGUNG TBK,2.0
PT WIDJAJATUNGGAL SEJAHTERA,2.0
TEMPO INTI MEDIA TBK,2.0
PT INTI NUSA DAMAI,2.0
PT TRINITI DINAMIK TBK,2.0
MARIA FORBIS INTERNASIONAL,2.0
KEDAWUNG SETIA INDUSTRIAL TBK,2.0
PT GEMA LINTAS BENUA,2.0
KERAMIKA INDONESIA ASSOSIASI TBK,2.0
PT LCK GLOBAL KEDATON TBK,2.0
LION METAL WORKS TBK,2.0
LION HOLDINGS PTE LTD,2.0
PT UNI-CHARM INDONESIA TBK,2.0
PT URBAN JAKARTA PROPERTINDO TBK,2.0
PT TRANSPORTASI GAS INDONESIA,2.0
MITSUBISHI CORPORATION,2.0
PANIN FINANCIAL TBK,2.0
PT ISTANA KUTA RATU PRESTIGE,2.0
PT CIKARANG LISTRINDO TBK,2.0
PP (PERSERO) TBK,2.0
PIONEERINDO GOURMET INTERNATIONAL TBK,2.0
PT PURI GLOBAL SUKSES TBK,2.0
PT SRIBOGA RATURAYA,2.0
MATHIAS SPORT ACADEMY,2.0
PT INTERPORT MANDIRI UTAMA,2.0
CJ GLOBAL HOLDINGS LIMITED,2.0
IBM INTERNATIONAL GROUP BV,1.0
COCACOLA AMATIL LIMITED,1.0
PT COCACOLA BOTTLING INDONESIA,1.0
PT TENE CAPITAL,1.0
PT ALITA DINAMIKA PERSADA,1.0
OJI HOLDINGS CORPORATION,1.0
PT TRIMEGAH BANGUN PERSADA,1.0
MATAHARI,1.0
AURIC DIGITAL RETAIL PTE LTD,1.0
PT LENOX PASIFIK INVESTAMA TBK,1.0
PT LORENA,1.0
PT GADING DANALESTARI,1.0
PT CATURKARSA MEGATUNGGAL,1.0
SERIAL SYSTEM PTE LTD,1.0
PT LEONG HUP JAYAINDO,1.0
DRAGON AMITY PTE LTD,1.0
LEONG HUP SINGAPORE UOB KAYHIAN PTE LTD,1.0
GA ROBUSTA F B COMPANY PTE LTD,1.0
PT PREMIER CAPITAL INVESTMENT,1.0
PT MAHAKA MEDIA,1.0
TECABLE HK CO LIMITED,1.0
PT MARK CAPITAL INDO,1.0
PT DYNA CAPITAL INDO,1.0
SOCGEN SA COMPAGNIE GENERALE DES ETABLISSEMENTS MICHELIN,1.0
PT HALIM SAKTI,1.0
PT MULTI ANEKADANA SAKTI,1.0
PT DANABINA SENTANA,1.0
GALASCO INVESTMENTS LIMITED,1.0
PT MAYAPADA KARUNIA CORPORATION,1.0
JPMCB NA RE CATHAY LIFE LNSURANCE CO LTD,1.0
PT GATSU GRIYA MEGATAMA,1.0
PT MAYAPADA KASIH CORPORATION,1.0
PT WAHANA BATUBARA INDONESIA,1.0
PT GALLEY ADHIKA ARNAWAMA,1.0
PT MARTHANA MEGAHAYU INTI,1.0
PT BRINGIN WULANKI AYU,1.0
PT KARYA KARUNIA PERSADA,1.0
ABELL TECHNOLOGY GLOBAL PTE LTD,1.0
PT PRIMA ANDALAN UTAMA,1.0
PT EDIKA AGUNG MANDIRI,1.0
CHINA CONSTRUCTION BANK CORPORATION,1.0
PT MITRA DAYA MUSTIKA,1.0
ISV SA HONGKONG BRUNP & CATL CO.,1.0
PT BUDIMULIA INVESTAMA,1.0
PT MEGAH CIPTA INVESTAMA,1.0
PT EMDE INDUSTRI INVESTAMA,1.0
WOODSIDE GLOBAL VENTURES INC,1.0
PT HONORIS CORPORINDO PRATAMA,1.0
AA LAND PTE LTD,1.0
CS AG SG ASIALINK ELECTRONICS,1.0
CIMBGNT SA CIMBPE,1.0
PT BUKIT HEDAMA PERMAI,1.0
DIAMOND BRIDGE PTE LTD,1.0
PT MEDCO DAYA ABADI LESTARI,1.0
EMEDIA EXPORT COMPANY MBH,1.0
MERCK HOLDING GMBH,1.0
PT METRO PACIFIC TOLLWAYS INDONESIA SERVICES,1.0
MULTIFILING MITRA INDONESIA TBK,1.0
IRON MOUNTAIN HONG KONG LIMITED,1.0
PT TRIJAYA WISESA MAKMUR,1.0
MGI INTERNATIONAL HOLDINGS LTD,1.0
PT MAHKOTA GLOBAL INVESTAMA,1.0
PT BUANA GRAHA UTAMA,1.0
PT HOKI INVESTASI SEJATI,1.0
PT GRIYAINSANI CAKRASADAYA,1.0
PT INTIKENCANA PRANAJATI,1.0
PT MITRA MURNI EXPRESSINDO,1.0
PT INTI BINA UTAMA,1.0
PT PRIME ASIA CAPITAL,1.0
PT APRATIMA SEJAHTERA,1.0
PT KARUNA PARAMITA PROPERTINDO,1.0
PT PENTA COSMOPOLITAN,1.0
PT BUDITAMA NIRWANA,1.0
HEINEKEN INTERNATIONAL BV,1.0
PT MULIA GRAHAPERMAI,1.0
PT EKA GUNATAMA MANDIRI,1.0
BRIDGE LEED LIMITED,1.0
PT CROPSCO PANEN INDONUSA,1.0
PT SEJAHTERA INVESTAMA INDAH,1.0
PT CANDRAKARYA MULTIKREASI,1.0
BINA PURI POWER SDN BHD,1.0
PT MEGAPOWER MAKMUR TBK,1.0
PHILLIP SECURITIES PTE LTD,1.0
MATAHARI PUTRA PRIMA TBK,1.0
CONSILIUM FRONTIER EQUITY FUND,1.0
PT MARISSI IDOLA SUMBER SEJAHTERA,1.0
PT KOBIN KERAMIK INDUSTRI,1.0
PT TANCORP BANGUN INDONESIA,1.0
PT METRO HEALTHCARE INTERNATIONAL,1.0
PT CAPITAL STRATEGIC INVESCO,1.0
PT CAPITAL GLOBAL STRATEGIC,1.0
PT ROKET CIPTA SENTOSA,1.0
SATS INVESTMENT II PTE LTD,1.0
PT SAPTADAYA BUMITAMA PERSADA,1.0
CENTRAL BUSINESS ALLIANCE,1.0
PT LINGKAR MATRA,1.0
PT SENTRATAMA NIAGA INDONESIA,1.0
CLOVER UNIVERSAL ENTERPRISE LIMITED,1.0
EP ID HOLDINGS PTE LTD,1.0
PT TRIMAS SARANA GARMENT INDUSTRY,1.0
PT TRIMEX SARANA TRISULA,1.0
PT BALI HOPE,1.0
PT PURI SARANA DAMAI,1.0
NIVEN HOLDING LIMITED,1.0
