Nama,Degree
PT MEDIATE INDONESIA,0.0
PT MEDIAWISATA SARIASIH,0.0
PT MNC ANIMASI INDONESIA,0.0
PT MNC DIGITAL INDONESIA,0.0
PT MNC INFOTAINMENT INDONESIA,0.0
PT MNC LISENSI INTERNASIONAL,0.0
PT MNC MEDIA INVESTASI,0.0
PT MNC METUBE INDONESIA,0.0
PT MNC MOVIELAND INDONESIA,0.0
PT MNC MULTIMEDIA NETWORKS,0.0
PT MNC OKEZONE NETWORK,0.0
PT MNC OTT NETWORK,0.0
PT MNC PICTURES,0.0
PT MNC PORTAL INDONESIA,0.0
PT MNC TELEVISI INDONESIA,0.0
PT MNC TELEVISI NETWORK,0.0
PT MULTI MEDIA INTEGRASI,0.0
PT RADIO ARIEF RAHMAN HAKIM,0.0
PT RADIO EFKINDO,0.0
PT RADIO MANCASUARA,0.0
PT RADIO PRAPANCA BUANA SUARA,0.0
PT RADIO SABDA SOSOK SOHOR,0.0
PT RADIO SUARA MONALISA,0.0
PT RADIO SWARA CARAKA RIA,0.0
PT RADIO TJAKRA AWIGRA,0.0
PT RADIO TRIDJAYA SHAKTI,0.0
PT RAJAWALI CITRA TELEVISI INDONESIA,0.0
PT SINDONEWS PORTAL INDONESIA,0.0
PT STAR CIPTA MUSIKINDO,0.0
PT STAR MEDIA NUSANTARA,0.0
PT SUARA MAS ABADI,0.0
PT SWARA BINTANG ABADI,0.0
PT TIVI BURSA INDONESIA,0.0
PT MOLINDO INTI GAS,0.0
PT MOLINDO RAYA INDUSTRIAL,0.0
PT SUMBER KITA INDAH,0.0
MORATEL INTERNATIONAL PTE LTD,0.0
PT INDO PRATAMA TELEGLOBAL,0.0
PT OXYGEN INFRASTRUKTUR INDONESIA,0.0
PT OXYGEN MULTIMEDIA INDONESIA,0.0
PT PALAPA RING BARAT,0.0
PT PALAPA TIMUR TELEMATIKA,0.0
PT ARMADA MAHA KARYA,0.0
PT ASURANSI MITRA PELINDUNG MUSTIKA,0.0
PT MITRA PERTAMA MULIA,0.0
PT MITRA PINASTHIKA MULIA,0.0
PT MITRA PINASTHIKA MUSTIKA AUTO,0.0
PT PUTRA MUSTIKA PRIMA,0.0
PT MATAHARI SUPER EKONOMI,0.0
PT BINTANG DWI LESTARI,0.0
PT CREATIVE SOFTHOUSE,0.0
PT TRIXINDO SELARAS,0.0
PT MUSTIKA INTERNATIONAL LABORATORIES,0.0
PT MUSTIKA RATU ENTERTAINMENT,0.0
PT MUSTIKA RATU SDN BHD,0.0
PT MUSTIKA RATUBUANA INTERNATIONAL,0.0
PT PARAS CANTIK KENANGA,0.0
PT ANEKA TEKNOLOGI UTAMA,0.0
PT MITRA INTEGRASI INFORMATIKA,0.0
PT MY ICON TECHNOLOGY,0.0
PT SENTRA MODAL MANDIRI,0.0
PT SINERGI TRANSFORMASI DIGITAL,0.0
PT SOLTIUS INDONESIA,0.0
PT SYNNEX METRODATA INDONESIA,0.0
PT SYNNEX METRODATA TECHNOLOGY AND SERVICES,0.0
PT PERSADA SOKKA TAMA,0.0
PT AGUS NUSA PENIDA,0.0
PT BANGUN SUBANG SEJAHTERA,0.0
PT FAJARPUTERA DINASTI,0.0
PT KEMBANG GRIYA CAHAYA,0.0
PT METROPOLITAN DETA GRAHA,0.0
PT METROPOLITAN GLOBAL MANAGEMENT,0.0
PT METROPOLITAN GRAHA KERTAJATI,0.0
PT METROPOLITAN GRAHA MANAGEMENT,0.0
PT METROPOLITAN KARYADEKA DEVELOPMENT,0.0
PT METROPOLITAN KERTAJATI DEVELOPMENT,0.0
PT METROPOLITAN LAMPUNG GRAHA,0.0
PT METROPOLITAN MANAJEMEN,0.0
PT METROPOLITAN PERMATA DEVELOPMENT,0.0
PT PERMATA KEMBANG SENTOSA,0.0
PT SUMBER SELERA INDONESIA,0.0
PT SUMBER TATA LESTARI,0.0
PT SUMBERSENTOSA GUNA LESTARI,0.0
PT ANUGERAH CAKRAWALA FARMAKA,0.0
PT GAMALIEL ELIA TUA,0.0
PT HORAS INSANI ABADI,0.0
PT MEDIKARYA AMINAH UTAMA,0.0
PT MURNI SADAR KASIH ABADI,0.0
PT RIAU SARANA MEDIKA,0.0
PT RUMAH SAKIT IBU DAN ANAK ROSIVA,0.0
PT SAHID SAHIRMAN MEMORIAL HOSPITAL,0.0
PT SETIA UTAMA REALTI,0.0
PT BORNEO SENTANA GEMILANG,0.0
PT MINTEC ABADI,0.0
PT MULTI PERKASA INDONESIA,0.0
PT SAMINDO UTAMA KALTIM,0.0
PT SIMS JAYA KALTIM,0.0
PT TRASINDO MURNI PERKASA,0.0
PT APAC INTI CORPORA,0.0
PT AKASA LEGIAN KARYA,0.0
PT ANDARA INDONESIA,0.0
PT AYANA HOTEL INDONESIA,0.0
PT AYANA PROPERTI INTERNASIONAL,0.0
PT DUTA NUSANTARA UTAMA KARYA,0.0
PT DUTA NUSANTARA UTAMARAYA,0.0
PT GALUH KENCANA UTAMARAYA,0.0
PT MANDIRI BERDIKARI JAYARAYA,0.0
PT ANEKA DIAN PERKASA,0.0
PT CITRA MULTI JAYA,0.0
PT MIMPI DESIGN,0.0
PT MITRA GRAHA TANGGUHPERKASA,0.0
PT NUSANTARA JAYA REALTI,0.0
PT NUSANTARA MANDALA PRIMA,0.0
PT PELANGI ANUGERAH BUANA,0.0
PT ROKU BALI INTERNASIONAL INDONESIA,0.0
PT NEL;LY GAYA KREASI,0.0
PATUM VEGETABLE OILS CO LTD,0.0
PREMIUM VEGETABLE OILS SDN BHD,0.0
SENA MILLS REFINERIES PVT LTD,0.0
SOMAPRO MADAGASCAR,0.0
CV GOLDEN MONKEY,0.0
PT BIRU PERSADA UTAMA,0.0
PT PANCA MAKMUR BARU,0.0
PT SAHATI HAMPARAN TANGGUH,0.0
PT SIONCHEM GLOBAL INDO,0.0
PT TRIJAYA TANGGUH,0.0
PT WISMAYA ONKAR NUSANTARA,0.0
AGRI OILS PACKAGING SDN BHD,0.0
PT ASIAN AGRO AGUNG JAYA,0.0
PT ASIANAGRO AGUNGJAYA,0.0
PT BARCO,0.0
PT BONANZA MEGAH,0.0
PT KUSUMA MUKTI REMAJA,0.0
PT PABRIK MINYAK PERNIAGAAN DAN INDUSTRI IKAN DORANG,0.0
PT PALKO SARI EKA,0.0
PT SARI MAS PERMAI,0.0
PT SILK CHAINS INDONESIA,0.0
PT BERKAT MANUNGGAL ENERGI,0.0
PT CLARIANT KUJANG CATALYSTS,0.0
DNX AUSTRALIA PTY LIMITED,0.0
PT KALTIM NITRATE INDONESIA,0.0
PT WAHANA LOGISTIK SEMESTA,0.0
PT WAHANABHARA BHAKTI,0.0
SOLAR INDUSTRIES INDIA LTD,0.0
TAMAN BUKIT MAS,0.0
PT ALAM JAYABARA PRATAMA,0.0
PT ASMIN BARA BRONANG,0.0
PT GANDA ALAM MAKMUR,0.0
PT HASNUR RIUNG SINERGI,0.0
PT MEXIS,0.0
PT SUPRABARI MAPANINDO MINERAL,0.0
PT DEKORUMA INOVASI LESTARI,0.0
PT LAZADA INDONESIA,0.0
PT RITEL BERSAMA NASIONAL,0.0
PT YAMAHA MOTOR INDONESIA,0.0
CV DELLA SUKSES,0.0
PT BAGUS INDAH LESTARI,0.0
PT BESAR INTI GLOBAL,0.0
PT BINTANG INTERINDO GEMILANG INTERNASIONAL,0.0
PT GADING MAS WIRAJAYA,0.0
PT GARUDA SEJAHTERA FURINTRACO,0.0
PT GRAHA SERIBUSATU JAYA,0.0
PT HALIM JAYA PRATAMA,0.0
PT MULTI NUGRAHA KENCANA,0.0
PT PUNGUT PERMAI PERKASA,0.0
PT QUANTUM TOSAN INTERNASIONAL,0.0
PT SINAR KIRANA MULIA,0.0
PT SUKSES TEKNIK INOVASI,0.0
PT TANDITAMA MANDIRI,0.0
PT UNIVERSAL FURNITECH INDUSTRI,0.0
PT INDONESIA VODA STEEL,0.0
PT DAYA RADAR HAURA,0.0
PT EVERAGE VALVES METAL,0.0
PT ISPAT INDO,0.0
PT JATIM TAMAN STEEL,0.0
PT LUCKY TOP METALS,0.0
PT PRIMA BETON BANGUN PERSADA,0.0
PT BAHAGIA SUKSES LESTARI,0.0
PT FAJAR UTAMA NUANSA,0.0
PT JATRA MANDIRI INDONESIA,0.0
PT KERTA JAYA UTAMA,0.0
PT MEGA DEPARTMENT STORE,0.0
PT SECURINDO PACKATAMA,0.0
PT CAHAYA PLASTINDO SEJAHTERA,0.0
PT GUNADAYA INTI SEJATI,0.0
PT INOVASI RITEL INDONESIA,0.0
PT MULTI GLOBAL PLASINDO,0.0
PT PLASTMART RITEL PRATAMA,0.0
CV MAHKOTA MAS PRATAMA,0.0
PT RENDAPLAS ANDIKA,0.0
CV ADIPURA MAS PLASTINDO,0.0
PT STELLARWAY INDONESIA,0.0
CV GOLDEN LEAF,0.0
MUAR BAN LEE,0.0
NANJING HAICHUAN INTERNATIONAL TRADE CO LTD,0.0
PT ANDALAN TEKNIK PERKASA,0.0
PT ARTHA SUKSES LANCAR,0.0
PT KARYAWAJA EKAMULIA,0.0
PT MANORIAN ENGINEERING PERKASA,0.0
PT NAN YANG TECHNOLOGY INDONESIA,0.0
PT PURA MAYUNGAN,0.0
PT ROFINDO JAYATAMA,0.0
PT UNGGUL PRAKARSA PRISMA,0.0
PT SUMBER INDAH PERKASA,0.0
PT UNILEVER OLEOCHEMICAL INDONESIA,0.0
CRUSTACEA SEAFOOD COMPANY INC,0.0
NEWPORT INTERNATIONAL OF TIERRA VERDE INC,0.0
PT KARYA MINA PUTRA,0.0
PT ASIAN TRAILS INDONESIA,0.0
PT PANORAMA EVENINDO,0.0
PT PANORAMA HOSPITALITY MANAGEMENT,0.0
PT PANORAMA MEDIA,0.0
HIKMAT HANIFI CO LTD,0.0
PACIFIC PHARMACHEUTICAL PTE LTD,0.0
PBF MENJANGAN ENAM,0.0
PT PODO MEKAR JAYA SENTOSA,0.0
PT PROMEDRAHARDJO FARMASI INDUSTRI,0.0
PT SEHAT INTI PERKASA,0.0
PT WITA LARAS KIRANA,0.0
SEKRETARIAT DITJEN KESEHATAN,0.0
PT KIMIA FARMA DIAGNOSTIK,0.0
PT SINKONA INDAH LESTARI,0.0
KPI OCEAN CONNECT PTE LTD,0.0
PT PATRA DRILLING CONTRACTOR,0.0
PT KEUMALA SARANA WISATA,0.0
PT MARECO PRIMA MANDIRI,0.0
PT ANEKA CIPTA,0.0
PT SEMPANA JAYA AGUNG,0.0
PT TAPANULI INVESTASI AGRO,0.0
UNIVERSAL GRAFINDO,0.0
PT JHONLIN AGRO RAYA TBK,0.0
PT KODECO AGROJAYA MANDIRI,0.0
PT SAWITA ANTARIS MAKMUR,0.0
KOPERASI LANGGAI BERSAMA,0.0
KOPERASI LANGGAI JAYA MAKMUR,0.0
KOPERASI PLASMA MAHAMAYA,0.0
KOPERASI PLASMA SUKSES PERTIWI,0.0
PALMITECO ENGINEERING (M) SDN BHD,0.0
PLASMA SUKSES PERTIWI,0.0
PT AGRITAMA MULTI SARANA,0.0
PT PERMATA BUSANA MAS,0.0
PT PRIMA MODA KREASINDO,0.0
PT SAVANA LESTARI,0.0
PT SINAR ABADI CITRANUSA,0.0
PT TRICITRA BUSANAMAS,0.0
PT TRIMAS BELLINDO APAREL MANUFAKTUR,0.0
PT ENAM SEMBILAN GEO ENERGI,0.0
PT BEKASI MATRA INDUSTRIAL ESTATE,0.0
PT BEKASI SURYA PRATAMA,0.0
PT BEST SINAR NUSANTARA,0.0
PT FINANSIAL INTEGRASI TEKNOLOGI,0.0
PT ASURANSI JIWA NASIONAL,0.0
PT BHAKTI CAHAYA UTAMA,0.0
PT BHAKTI FINTEK INDONESIA,0.0
PT NASIONAL INVESTINDO PERKASA,0.0
BINO DIGITAL SOLUTION PTE LTD,0.0
PT ANUGRAHA KARSA SOLUSI INDUSTRIA,0.0
PT APLI STATIONERY,0.0
PT BATARA INDAH,0.0
PT BATARA INDAH MULIA,0.0
PT BINO DIGITAL SOLUSI,0.0
PT BINO MITRA SEJATI,0.0
BIP HOLDINGS INTERNATIONAL PTE LTD,0.0
PT ASRI KENCANA GEMILANG,0.0
PT BIP BOGA PERMAI,0.0
PT BIP LOKAKENCANA,0.0
PT BIP PROPERTI PERMAI,0.0
PT MAGNA INVESTAMA MANDIRI TBK,0.0
PT PUTRA ASIH LAKSANA,0.0
PT TRI DAYA INVESTINDO,0.0
PT UDYANA RAYJA SENTOSA,0.0
PT BALAI LELANG CAREADY,0.0
PT BIG BIRD PUSAKA,0.0
PT BLUE BIRD PUSAKA,0.0
PT CENDRAWASIH PERTIWIJAYA,0.0
PT CENTRAL NAGA EUROPINDO,0.0
PT IRDAWAN MULTITRANS,0.0
PT LAYANAN PUSAKA PRIMA,0.0
PT LINTAS BUANA TAKSI,0.0
PT LOMBOK TAKSI UTAMA,0.0
PT LUHUR SATRIA SEJATI KENCANA,0.0
PT MORANTE JAYA,0.0
PT PRAJA BALI TRANSPORTASI,0.0
PT PRIMA SARIJATI AGUNG,0.0
PT PUSAKA MITRA MOBILINDO,0.0
PT PUSAKA NURI UTAMA,0.0
PT PUSAKA PRIMA TRANSPORT,0.0
PT PUSAKA SATRIA UTAMA,0.0
PT SILVER BIRD,0.0
PT TRANS ANTAR NUSABIRD,0.0
PT BINA CIPTA TEKNOLOGI,0.0
PT MULTI SARANA INDOTANI,0.0
PT TANINDO INTERTRACO,0.0
PT BANK JABAR BANTEN SYARIAH,0.0
PT BANK PEMBANGUNAN DAERAH BENGKULU,0.0
PT BANK PEMBANGUNAN DAERAH JAMBI,0.0
PT BJB SEKURITAS JAWA BARAT,0.0
PT BPR INTAN JABAR,0.0
PT AFTANESIA RAYA,0.0
PT BINTANG PERDANA MULIA,0.0
PT BUKIT JONGGOL ASRI,0.0
PT CENTERRA MANAJEMEN PROPERTI,0.0
PT FAUNA LAND,0.0
PT FAUNA LAND SENTUL,0.0
PT GAZELLE INDONESIA,0.0
PT GRAHA SEJAHTERA ABADI,0.0
PT GUNUNG GEULIS ELOK ABADI,0.0
PT JASA SELARAS GEMILANG,0.0
PT JASA SELARAS UTAMA,0.0
PT JAYA SELARAS GEMILANG,0.0
PT JAYA SELARAS UTAMA,0.0
PT KARYA MEGAH SUKSES,0.0
PT KENCANA PONDOK ABADI,0.0
PT KENCANA PONDOK SEJAHTERA,0.0
PT LANGGENG SAKTI MANDIRI,0.0
PT MULYA CAHAYA PERMATA,0.0
PT NATURA NIAGA BERJAYA,0.0
PT PONDOK GEMILANG SEJAHTERA,0.0
PT SENTUL AIR NUSANTARA,0.0
PT SENTUL CITY PROPERTI,0.0
PT SENTUL GRAHA SEJAHTERA,0.0
PT SENTUL PP PROPERTI,0.0
PT SERPONG NATURA HIJAU SENTOSA,0.0
PT SUKAPUTRA GRAHA CEMERLANG,0.0
ASEAN MARITIME CORPORATION,0.0
BERLIAN LAJU TANKER CORPORATION,0.0
BLT FINANCE B.V,0.0
BLT LNG TANGGUH CORPORATION,0.0
DIAMOND PACIFIC INTERNATIONAL CORPORATION,0.0
FAST MARINE TRADING LIMITED,0.0
FREESIA NAVIGATION S.A,0.0
GOLD BRIDGE SHIPPING LTD,0.0
HOPEWAY MARINE INC,0.0
INDIGO PACIFIC CORPORATION,0.0
IRIS MARITIME INTERNATIONAL S.A,0.0
PT ASWATAMA SAMUDERA NUSANTARA,0.0
PT BERLIAN LIMATAMA,0.0
PT BROTOJOYO MARITIME,0.0
PT CENDANAWATI LOGISTIK INDONESIA,0.0
PT DEWI SRI MARITIM,0.0
PT NIAGA GLOBAL MODERN INDONESIA,0.0
PT PULAU KELAPA PERKASA,0.0
PT SEBATIK MARIN SERVIS,0.0
QUIMERA MARITIME S.A,0.0
SEAPEAK BLT CORPORATION,0.0
THAI PETRA TRANSPORT CO LTD,0.0
PT GRAHA LAYAR MITRA,0.0
PT BMHS DIKLAT INDONESIA,0.0
PT BUNDA GLOBAL PHARMA,0.0
PT BUNDA GRAHA PROPERTI,0.0
PT BUNDA MEDIKA BEKASI,0.0
PT BUNDA MEDIKA DEWATA,0.0
PT BUNDA MEDIKA KLINIK,0.0
PT BUNDA MEDIKA WISESA,0.0
PT BUNDA MINANG CITRA,0.0
PT CITRA ANANDA,0.0
PT EMERGENCY RESPONSE INDONESIA,0.0
PT JOLIN SAPTA MEDIKA BEKASI,0.0
PT MORULA INDONESIA,0.0
PT PINTU ILMU,0.0
PT PRIMA DENTAL MEDIKA,0.0
PT SASANA MITRA BUNDA,0.0
PT VISISCAN INDONESIA,0.0
BANK MANDIRI LIMITED,0.0
MANDIRI INTERNATIONAL REMITTANCE SENDIRIAN BERHAD,0.0
PT AXA MANDIRI FINANCIAL SERVICES,0.0
PT BANK MANDIRI TASPEN,0.0
PT MANDIRI CAPITAL INDONESIA,0.0
PT BHASKARA MITRA MANUNGGAL,0.0
PT DIGI BINTANG SINERGI,0.0
PT PARKIT FILM,0.0
PT REDCANDLE,0.0
PT SORAYA INTERCINE FILMS,0.0
PT SPECTRUM FILM,0.0
PRECIOUS METALS GLOBAL MARKETS (HSBC),0.0
PT CNGR DING XING NEW ENERGY,0.0
JAMIPOL LIMITED,0.0
AGODA COMPANY PTE LTD,0.0
DINAS PERPUSTAKAAN DAN KEARSIPAN DAERAH,0.0
MERCURE JAKARTA BATAVIA,0.0
PT AEON MALL INDONESIA,0.0
PT BALI DAKSINA WISATA,0.0
PT BHINEKA CIPTABAHANA PURA,0.0
PT DANINDO TAPE PACKAGING INDUSTRY,0.0
PT GRAMAR JAYA,0.0
PT MITRA GLOBAL HOLIDAY,0.0
PT MULTI KENCANA NIAGATAMA,0.0
PT RUMAH MEBEL NUSANTARA,0.0
PT SEKAWAN INDONESIA WISATA,0.0
PT SISTEMATIS BANGUN INDONESIA,0.0
PT UNITAMA SINERGI SUKSES,0.0
PT YIHUA INDOCHINA TRADING,0.0
PT BUDI MULYA JAYA,0.0
PT CHANDRA MITRA STRUKTURINDO,0.0
PT CHANDRA PERSADA,0.0
PT GREENSTAR ARTEK INDONESIA,0.0
PT KARYA CIPTA BANGUN MANDIRI,0.0
PT KOKOH BANGKIT PERKASA,0.0
PT LANCAR LAJU MEMBANGUN,0.0
PT MITRA GARDA PERKASA,0.0
PT MITRA TATA ABADI BERSAMA,0.0
PT MODERN GRIYA REKSA,0.0
PT PAGAR BATU LESTARI,0.0
PT RAJAWALI ARIES KREASINDO,0.0
PT TANGGUH KARYA UNGGUL,0.0
PT TIGA JAYA ANDALAN,0.0
PT VICTORY UTAMA KARYA,0.0
MERCK LIFE SCIENCE PRIVATE LIMITED,0.0
MERCK LTD KOREA,0.0
MERCK SDN BHD,0.0
PT BAYER INDONESIA,0.0
PT GLOBAL SATRIA AJI,0.0
PT KALBIO GLOBAL MEDIKA,0.0
PT PERFETTI VAN MELLE,0.0
PT PHARMA HEALTH CARE,0.0
PT PROCTER & GAMBLE HOME PRODUCTS,0.0
PT SETIAJAYA ERA UNGGUL,0.0
ARES TRADING SA,0.0
MERCK BUSINESS SOLUTIONS ASIA INC,0.0
MERCK FINANCIAL SERVICES GMBH JERMAN,0.0
MERCK HEALTHCARE KGAA,0.0
MERCK KGAA,0.0
MERCK SANTE SAS,0.0
MERCK INC PHILIPPINES,0.0
MERCK SHARP & DOHME LLC,0.0
PT TATARASA PRIMATAMA,0.0
PT IRON MOUNTAIN INDONESIA,0.0
CV JASA SAHABAT ABADI,0.0
CV MITRA KERJA LESTARI,0.0
CV RINDASIWI MAKMUR JAYA,0.0
CV SRI REZEKI,0.0
KOPERASI UNIT DESA SUPER,0.0
PT ANDERSON UNEDO,0.0
PT BERLIAN MITRA INTI,0.0
PT BUKIT MAHKOTA,0.0
PT DUTARAYA SEJATI,0.0
PT INTAN SIAK LESTARI,0.0
PT JAYA UTAMA RAMOS,0.0
PT KARYA MITRA ANDALAN,0.0
PT KARYABADI SAMASEJATI,0.0
PT KAWASAN INDUSTRI BANYUASIN RAYA,0.0
PT MAHKOTA ANDALAN SAWIT,0.0
PT MEGA SAWIT SRIWIJAYA,0.0
PT MULINDO RAYA SEJATI,0.0
PT SAMUDERA MANDIRI LESTARI,0.0
PT SERUMPUN INDAH LESTARI,0.0
PT SUKSES SENTOSA,0.0
PT SUROPATI JAYA ABADI,0.0
PT WAHANA TIRTASARI,0.0
PT WIRA JAYA MANDIRI,0.0
SAWIPAC SDN BHD,0.0
AGRI OILS PTE LTD,0.0
MAHKOTA OILS FATS PTE LTD,0.0
PT GREEN PRODUCT INTERNATIONAL,0.0
PT INTIBENUA PERKASATAMA,0.0
PT BENFOOD DINAMIKA SENTOSA,0.0
PT INTISUMBER HASIL SEMPURNA GLOBAL,0.0
PT KEBAYORAN PHARMA,0.0
PT MERAPI UTAMA PHARMA,0.0
PT MILLENIUM PHARMACON,0.0
PT REKAMILENIUMINDO SELARAS,0.0
BAYSWATER SHIPPING & FORWADING PTE LTD,0.0
GLOBAL MARINE SERVICE CO LTD,0.0
ORIENT OVERSEAS CONTAINER LINE,0.0
PT BARUNA RAYA LOGISTICS,0.0
PT MARINA LOGISTIK SEJAHTERA,0.0
PT PELAYARAN SAMUDRA KARANA LINE,0.0
PT POSCO INDONESIA JAKARTA PROCESSING CENTRE,0.0
PT SAMUDERA ENERGI TANGGUH,0.0
PT SINOKOR INTERNATIONAL,0.0
PT UNIONINDO STEEL INDUSTRY,0.0
CV BUKAHA GROUP,0.0
PT BIMA KALTIM UTAMA,0.0
PT LAUTAN BERKAH AMANAH,0.0
EASTERN CAR LINER LTD,0.0
CONCORD BUILDING MATERIALS PTE LTD,0.0
MULIA INC,0.0
PT MULIAKERAMIK INDAHRAYA,0.0
PT FIRST MEDIA NEWS,0.0
YAYASAN UNIVERSITAS PELITA HARAPAN,0.0
LIPPO CIKARANG TBK,0.0
PT LIPPO LIFE ASSURANCE,0.0
ALPHA INVESTMENTS PARTNERS LIMITED,0.0
KEPPEL FUND MANAGEMENT LIMITED,0.0
PT INDO LOG ONE,0.0
PT KADAKA ADHI LOGISTIK,0.0
PT KAMADJAJA LOGISTICS,0.0
PT LF SERVICES INDONESIA,0.0
PT SYNGENTA INDONESIA,0.0
PT TANI SUPPLY INDONESIA,0.0
PT BMB & AKSESORIS KONSTRUKSI,0.0
PT GLITTERINDO PRATAMA,0.0
PT NELLY ENERGI LESTARINDO,0.0
PT PELAYARAN HASKO HANLY GLOBAL,0.0
PT PELAYARAN NELLY ANUGRAH,0.0
PT PERMATA BARITO SHIPYARD&ENGINEERING,0.0
PT CHARNIC LAND INVESTMENT,0.0
PT INDRABAKTI MUSTIKA,0.0
ALPHA HOLDING CELLA PTE LTD,0.0
BETA HOLDING CELLA PTE LTD,0.0
BNWP CELLA HOLDING PTE LTD,0.0
CAESAR HOLDING CELLA PTE LTD,0.0
CELLA MANAGEMENT PTE LTD,0.0
CHARLIE HOLDING CELLA PTE LTD,0.0
DYNASTY HOLDING CELLA PTE LTD,0.0
EPSILON HOLDING CELLA PTE LTD,0.0
GAMMA HOLDING CELLA PTE LTD,0.0
MASTER HOLDING CELLA PTE LTD,0.0
NWP RETAIL PTE LTD,0.0
PT ABHINAYA BADASA BADI,0.0
PT ADHINATA SANGKARA PRATAMA,0.0
PT ADHIRAJASA HANASTA PRATAMA,0.0
PT ADHIWANGSA SATATA EKATRA,0.0
PT ANANTARA BENGAWAN HARJA,0.0
PT ANEKA JAYA USAHA MAJU TERUS,0.0
PT ANGGARAKSA LOKESWARA,0.0
PT BIMANTARA DANAR DIPTA,0.0
PT BINJAI HATUA MAKMUR,0.0
PT BUANA BARU PRIMA,0.0
PT BUKIT INTI LESTARI,0.0
PT CELLA ARGYA LESTARI,0.0
PT CELLA ARGYA LOGISTIK,0.0
PT CELLA CAKRA LOGISTIK,0.0
PT CELLA EMERALD LOGISTIK,0.0
PT CELLA GEMILANG LOGISTIK,0.0
PT CELLA MANAGEMENT LOGISTIK,0.0
PT CITY MALLS INDONESIA,0.0
PT CRE BIL INDONESIA,0.0
PT DANADIPA ALUWUNG,0.0
PT DHANIKA SEJAHTERA MAKMUR,0.0
PT DWIMEGAH MIRI SENTOSA,0.0
PT GARDAPATI SAHARDAYA,0.0
PT GENTA NIRVANA MAHAPUTRA,0.0
PT GRAHITA DANA,0.0
PT KALINGGA KARA DANESWARA,0.0
PT KALINGGA MURDA,0.0
PT KALINGGA MURDA PRATAMA,0.0
PT KALINGGA MURDA RAJA,0.0
PT KARYA BERSAMA TAKAROB,0.0
PT LINTANG BUWANA EKATRA,0.0
PT MAHAWIRA RAJENDRA JAYA,0.0
PT MAHITALA WILIS AMERTA,0.0
PT MELIA ARJUNA BEJANA,0.0
PT NARENDRA DAKSA LESTARI,0.0
PT NIRVANA INFRASTRUCTURE,0.0
PT NIRVANA WASTU AMERTA,0.0
PT NIRVANA WASTU ANARGYA KASTARA,0.0
PT NIRVANA WASTU DANAPATI GARWITA,0.0
PT NIRVANA WASTU GUNADHAYA JAYENDRA,0.0
PT NIRVANA WASTU JAYA,0.0
PT NIRVANA WASTU JAYA PRATAMA,0.0
PT NIRVANA WASTU KARYA PRATAMA,0.0
PT NIRVANA WASTU KARYA UTAMA,0.0
PT NIRVANA WASTU KASTARA KASYAPI,0.0
PT NIRVANA WASTU KENCANA,0.0
PT NIRVANA WASTU KUSUMA,0.0
PT NIRVANA WASTU MAHARDIKA,0.0
PT NIRVANA WASTU MANGGALA LAKSITA,0.0
PT NIRVANA WASTU NARTHANA,0.0
PT NIRVANA WASTU PASTIKA PRABADWIPA,0.0
PT NIRVANA WASTU PRADANA,0.0
PT NIRVANA WASTU PRASISTA RAHARDJA,0.0
PT NIRVANA WASTU PRATAMA,0.0
PT NIRVANA WASTU PRAWARA RADIKA,0.0
PT NIRVANA WASTU SAGARA BHADRIKA,0.0
PT NIRVANA WASTU USAHA KARYA,0.0
PT NIRVANA WASTU UTAMA,0.0
PT NUANSA CITRA PESONA,0.0
PT PALU GRAHA SEJAHTERA,0.0
PT PARAMARTA ROLAS JAYA,0.0
PT PEJATEN SEMESTA RAYA,0.0
PT POLONIA ANUGERAH JAYA,0.0
PT PRABANGKARA SANGKARA,0.0
PT PRAWARA RANAJAYA CATRA,0.0
PT PRIMERINDO SEJAHTERA,0.0
PT PRIMERINDO KENCANA,0.0
PT SEKALA BRAHA SEMESTA,0.0
PT SENTRAYASA KARYA BILANG,0.0
PT TARANGGA HANASTA,0.0
PT TIRTA ANUGRAH BUANA,0.0
PT TRISTAR LAND,0.0
PT TUNAS MITRA USAHA,0.0
PT WAHANA CIPTA PERSADAJAYA,0.0
PT WIPALA MADANG UTAMA,0.0
PT YODYA MEGAH KARTA,0.0
PT YOJA MEGAH KARTA,0.0
TWO MASTER HOLDING CELLA PTE LTD,0.0
PT OCBC NISP VENTURA,0.0
PT SUMBAWA RAYA CIPTA,0.0
PT PILAR PRATAMA DINAMIKA,0.0
PT SERENA INTI SEJATI,0.0
PT INDOPLAS MAKMUR LESTARI,0.0
PT MENTARI BIRU BIOMASSA,0.0
PT MENTARI BIRU ENERGI,0.0
PT TELESYS INDONESIA,0.0
PT ONIX INVESTAMA,0.0
PT ONIX SEKURITAS,0.0
PT INDO KELAPA PERKASA,0.0
PT INDOSENA PERKASA REFINERIES,0.0
INDOTAN LOMBOK PTE LTD,0.0
PT ANCORA INDONESIA MINING,0.0
PT ANCORA SHIPPING,0.0
PT ANEKA NITRATE INDUSTRI,0.0
PT BORMINDO NUSANTARA,0.0
PT INDOTAN LOMBOK BANGKIT BARAT,0.0
PT INSPIRA GLOBAL KARYA,0.0
PT KEMITRAAN MNK BME,0.0
PT KREASI SINERGI TEKNIKINDO,0.0
PT MULTI KIMIA SOLUSINDO,0.0
PT MULTI NITRODETO INDONESIA,0.0
PT MULTI NITROPRIMER INDONESIA,0.0
PT MULTI NITROTAMA KIMIA,0.0
PT MULTI SINERGI SUMBERDAYA,0.0
PT ANAK SRIBU PULAU,0.0
PT ARCHIPELAGO KHATULISTIWA PERSADA,0.0
AURORA EQUITY PTE LTD,0.0
PT ANGKASA INTERLAND,0.0
PT GRAHA MITRASANTOSA,0.0
PT JAKARTA THAMRIN PERSADA,0.0
PT LANGGENG AYOMLESTARI,0.0
PT BERAU COAL ENERGY TBK,0.0
PT BINARA GUNA MEDIKTAMA,0.0
PT HEWLETT PACKARD INDONESIA,0.0
PT JASA DIGITAL NUSANTARA,0.0
PT PUTRA JASINDO BERSAUDARA,0.0
PT BANGGA TEKNOLOGI INDONESIA,0.0
PT LANGGENG KARYA PERDANA,0.0
PT MICROVISION INDONESIA,0.0
PT SAPTA TUNAS TEKNOLOGI,0.0
PT BINTANG GRAHA MAKMUR,0.0
PT BINTANG GRAHA MANDIRI,0.0
PT CIKEL ABADI,0.0
PT DANAU BUMI MANDRI,0.0
PT ESHAM DIMA MANDIRI,0.0
PT KARYA AGUNG RETAIL,0.0
PT KERTA ANGGUR SEJAHTERA,0.0
PT LIM SIANG HUAT BALINDO,0.0
PT MUDA MULIA SENTOSA,0.0
PT MULIATAMA MAKMUR SENTOSA,0.0
PT NEXUS DISTRIBUSI NUSANTARA,0.0
PT PANEN ARTHA NUSA,0.0
PT PELITA MULIA PERKASA,0.0
PT SUMBER TIRTA SENTOSA,0.0
PT SEHAT CERAH INDONESIA,0.0
LEONG HUP DISTRIBUTION PTE LTD,0.0
MAP ACTIVE THAILAND LTD,0.0
PT SPORTS DIRECT INDONESIA,0.0
PT SDI AKTIF INDONESIA,0.0
PT SAMSONITE INDONESIA,0.0
PT MEDIA NETWORK ATLAS INDONESIA,0.0
MICHELIN ASIA-PACIFIC IMPORT-EXPORT (SG) PTE LTD,0.0
OMNI UNITED (S) PTE LTD,0.0
PT MULTI KUSUMA CEMERLANG,0.0
BORNEO TECHNICAL CO(M) SDNBHD,0.0
PT BUMI SEKUNDANG ENIM ENERGY,0.0
PT ARMADA INDONESIA MANDIRI,0.0
PT CIPTA MAHAKARYA HARMONI,0.0
PT GLOBAL STEVEDORING INDONESIA,0.0
PT GLOBAL TRANS ENERGY INTERNATIONAL,0.0
PT KARYA BUMI PRIMA,0.0
PT SARANA KELOLA SEJAHTERA,0.0
PT WAHANA NIAGA CEMERLANG,0.0
PT WAHANA YASA INTERNATIONAL SHIPPING,0.0
EAST PROFIT INTERNATIONAL ENTERPRISES LTD,0.0
IDEMITSU KOSAN CO LTD,0.0
KCH ENERGY CO LTD,0.0
PT BARAMULTI SUGIH SENTOSA,0.0
PT PAITON ENERGY,0.0
PT RAY DELTA MANDIRI,0.0
PT ANAGA SHIPPING INDONESIA,0.0
PT ARTHA DAYA COALINDO,0.0
PT BENOA MARITIM TRANSPORT,0.0
PT BUMI MINERAL SENTOSA,0.0
PT GERBANG MULTI SEJAHTERA,0.0
PT GUONENG MINING INVESTMENT,0.0
PT KEMALA SHIPPING,0.0
PT SUMBER DAYA ENERGI,0.0
PT TATA MINERAL NUSANTARA,0.0
PT TRANS ENERGY OPTIMA,0.0
PT TRINISYAH ERSA PRATAMA,0.0
PT ADHIKA ARNAWAMA AGENSI,0.0
PT ATABA GROUP INDONESIA,0.0
PT DAIDAN ADITAMA YAKSA,0.0
PT DAIDAN UTAMA PIALANG ASURANSI,0.0
PT BERANI CANTIK INDONESIA,0.0
PT BRIGHTY GLOBAL,0.0
PT CANTIKA PUSPA PESONA,0.0
PT CREATIVE STYLE MANDIRI,0.0
PT DOSNI ROHA INDONESIA TBK,0.0
PT ERHA CLINIC INDONESIA,0.0
PT KEVA COSMETICS INTERNASIONAL,0.0
PT KREASI KEBANGGAN BANGSA,0.0
PT KREASI MULTICAHAYA ESTETIK,0.0
PT KREASIBOGA PRIMATAMA,0.0
PT MARTHA BEAUTY GALLERY,0.0
PT MULTITREND INDO TBK,0.0
PT NAMA CANTIK ABADI,0.0
PT NU SKIN DISTRIBUTION,0.0
PT PZ CUSSONS INDONESIA,0.0
PT SAI INDONESIA,0.0
PT SINERGI GLOBAL SERVIS,0.0
PT SURYAPANA,0.0
WIDURI SDN BHD,0.0
CV INDAH KENCANA,0.0
PT ARISU INDONESIA,0.0
PT CRODA TRADING INDONESIA,0.0
PT DWI PARDI,0.0
PT GIVAUDAN INDONESIA,0.0
PT GULBRANDSEN TECHNOLOGIES INDONESIA,0.0
PT LAWANGMAS PRIMAPACK INDONESIA,0.0
PT PERDONI,0.0
PT PRIMA PACK INDONESIA,0.0
PT TRITUNGGAL ARTHAMAKMUR,0.0
SHENZHEN ANFA INDUSTRY CO LTD,0.0
PT DIGITAL ARTHA MEDIA,0.0
PT DJARUM,0.0
PT GOTION GREEN ENERGY SOLUTION INDONESIA,0.0
PT NUGEN FARMA MEDIKA,0.0
BLACK SAND COMMODITIES FZ LLC,0.0
CARAVEL CARBONS LIMITED,0.0
HK GOLDEN SAND INTERNATIONAL LTD,0.0
PT BAHTERA ENERGI INDONESIA,0.0
PT EKASA YAD ENERGY,0.0
PT GEMILANG ASIA SEJAHTERA,0.0
PT HARDAYA MINING ENERGY,0.0
PT INDONESIA GUANG CHING NICKEL AND STAINLESS STEEL INDUSTRY,0.0
PT LESTARI BANTEN ENERGI,0.0
PT OCEAN SKY METAL INDUSTRY,0.0
XIAMEN ITG ENERGY CO LTD,0.0
CV NOVENA TRACTOR,0.0
PT ALAT BUMI PERMAI,0.0
PT ERAINDO SARANA JAYA,0.0
PT ETAM WIRATAMA,0.0
PT GLOBAL MINING SERVICES,0.0
PT GURITA LINTAS SAMUDERA,0.0
PT KALIANDA GOLDEN BUNKER,0.0
PT KALTIM MULTI TRAKTOR,0.0
PT KARYA TEKNIK UTAMA,0.0
PT MASABARU GUNAPERSADA,0.0
PT PETRO ANDALAN NUSANTARA,0.0
PT UNICO TRACTOR INDONESIA,0.0
PT WEIR MINERALS INDONESIA,0.0
ADANI GLOBAL PTE LTD,0.0
PT PETRO NIAGA MANDIRI,0.0
CV CIPTA KREASI UTAMA,0.0
PT GADJAH RUKU,0.0
PT HAVEA MK II,0.0
PT HOK TONG,0.0
PT REMCO,0.0
PT SUNAN RUBBER,0.0
PT TANJUNG ENIM LESTARI,0.0
BC FINE LIVING LIMITED,0.0
DP ARCHITECTS PTE LTD,0.0
PT CATURGRIYA NARADIPA,0.0
PT EFA SEJAHTERA ABADI,0.0
PT FAJAR GELORA INTI,0.0
PT GRANT SURYA PONDASI,0.0
PT GUO WIJAYA MULYO,0.0
PT IMECON ANUGERAH PERKASA,0.0
PT INDO MITRA PRATAMA,0.0
PT JAGA CITRA INTI,0.0
PT KONE INDO ELEVATOR,0.0
PT KRAKATAU WAJATAMA OSAKA STEEL,0.0
PT MEDIA NUSANTARA INFORMASI,0.0
PT RESTOMART CIPTA USAHA,0.0
PT SANIHARTO ENGGALHARJO,0.0
PT SOLOBHAKTI TRADING & CONTRACTOR,0.0
PT VEKOMA RIDES MANUFACTURING BV,0.0
PT KRAKATAU DAYA LISTRIK,0.0
PT KRAKATAU TIRTA INDUSTRI,0.0
PT KRAKATAU TIRTA OPERASI DAN PEMELIHARAAN,0.0
PT INDOJAPAN STEEL CENTRE,0.0
PT KRAKATAU ARGO LOGISTICS,0.0
PT KRAKATAU NIPPON STEEL SUMIKIN,0.0
PT KRAKATAU POSCO,0.0
PT ALPHANOVATION DIGITAL TEKNINDO,0.0
PT LOGITEK DIGITAL NUSANTARA,0.0
PT SICEPAT MCASH INDONESIA,0.0
PT SINERGI DIGITAL TEKNOLOGI,0.0
PT SURYA TEKNOLOGI PERKASA,0.0
PT V2 INDONESIA,0.0
CV RAYA DIPTA SWASTIKA,0.0
PT BEI BEE WOO,0.0
PT GAYA POETRA BANGKIT,0.0
PT JAYA PUTRA PANIPAHAN,0.0
PT NATASHA SUSU,0.0
PT NICESO SUKSES INDONESIA,0.0
PT PELANDUK JAYA BERSAMA,0.0
PT RUSCO ONLINE DISTRIBUSI,0.0
PT SCORPICANUS GEPI JOVINDO,0.0
TOKO MITRA HARMONI,0.0
TOKO SUSU CS,0.0
TOKO SUSU PASIR JAYA,0.0
CV KARYA USAHA ANEKA TEKNIK,0.0
HARVEST ARCHIVE LTD,0.0
HONG KONG SHIPYARD LTD,0.0
PT ASIA SAKTI WAHID,0.0
PT ASSINDO PERNIAGAAN INTERNASIONAL,0.0
PT BINTANG INTER GLOBAL,0.0
PT ENERGIZER INDONESIA,0.0
PT FOKUS RITEL INDOPRIMA,0.0
PT FOKUS RITEL NUSAPRIMA,0.0
PT LUCKY MOM INDONESIA,0.0
PT MEGA LIGHTER INTERNUSA,0.0
PT MIWON INDONESIA,0.0
PT MULTINA INSPINDO,0.0
PT ORION MULTI BUANA,0.0
PT RIODI JAYA,0.0
PT SINBAD KARYA PERDAGANGAN,0.0
CV BABY WISE INDONESIA,0.0
PT BLESSINDO MAKMUR SENTOSA,0.0
PT PENTABIZ INTERNATIONAL,0.0
SEJADAH GROCERY,0.0
TOKO BEI BEE WOO,0.0
TOKO HBS,0.0
TOKO NATASHA SUSU,0.0
PT FIBERHOME TECHNOLOGIES INDONESIA,0.0
PT LASMANA SWASTI PRASHIDA,0.0
FRANKLIN OFFSHORE INTERNATIONAL PTE LTD,0.0
PT BAHARI LAJU ANUGERAH,0.0
PT BAHTERA NIAGA INTERNATIONAL,0.0
PT BATUTUA KHARISMA PERMAI,0.0
PT EKA NUSANTARA LINE,0.0
PT MAHAKARYA GEO SURVEY,0.0
PT MEINDO ELANG INDAH,0.0
PT PRIMA ENERGI BAWEAN,0.0
PT STEADFAST MARINE,0.0
PT SUKSES MAKMUR SAMUDRA BERJAYA,0.0
PT TRIJAYA GLOBAL MARINDO,0.0
AKSBERG MARINE CONSULTANT PTE LTD,0.0
CV GABRIEL INTI MARINDO,0.0
LCH INSURANCE BROKERS PTE LTD,0.0
PT ANUGERAH LUBRINDO RAYA,0.0
PT CARINDO,0.0
PT GLOBAL OFFSHORE INDONESIA,0.0
PT KARYA JAYA SAMUDERA,0.0
PT MAKSINDO DIESEL UTAMA,0.0
PT NOBEL RIGGINDO SAMUDRA,0.0
PT RADIAN PENINSULA INDONESIA,0.0
PT SERVEWELL OFFSHORE,0.0
PT TRIBARA KARYA,0.0
STRATO MARITIME SERVICES PTE LTD,0.0
PT LAUTAN BERKAH UTAMA,0.0
PT PELAYARAN NASIONAL EKALYA PURNAMASARI,0.0
PT ARYADUTA INTERNATIONAL MANAGEMENT,0.0
PT AXIATA DIGITAL LAB INDONESIA,0.0
PT ARYADUTA HOTELS TBK,0.0
PT LIPPO MALLS INDONESIA,0.0
PT BANTRUNK MURNI INDONESIA,0.0
PT LANGGENG INVESTINDO,0.0
PT BUMI AGUNG PERKASA INDAH,0.0
PT INDOMULTI JAYA STEEL,0.0
PT MASTER STEEL,0.0
PT ROYAL INDAH PERKASA,0.0
DIE-NAMIC INC,0.0
FEDERAL MOGUL INDIA,0.0
FEDERAL MOGUL YURA QINGDAO IGNITION CO LTD,0.0
FOSHAN LIANGTAO HAREWARE CO LTD,0.0
PD LADANG KIMIA,0.0
PT ALFA GEMILANG,0.0
PT MEGAH PRATAMA,0.0
PT PRIMA JASINDO,0.0
