Nama,Degree
PT FUTURA ENERGI SEMESTA,0.0
PT GLOBAL KENCANA PROPERTINDO,0.0
PT GLOBAL KRIYA PROPERTINDO,0.0
PT HELIOS BERKAT TEKNOLOGI,0.0
PT INDOPAY MERCHANT SERVICES,0.0
PT INDOSURYA MENARA BERSAMA,0.0
PT INOVASI PERMATA OXYGEN,0.0
PT INTEGRAL PERTAMA PERSADA,0.0
PT OMNI INTIVISION,0.0
PT PARIWARA DIGITAL MEDIA,0.0
PT PRATAMA LANDASAN USAHA SEJAHTERA,0.0
PT SELANCAR FORMULA SEJAHTERA,0.0
PT TANGARA MITRAKOM,0.0
PT TEKNOLOGI OPTIMAL PRIORITAS SENTOSA,0.0
PT ENVY KAPITAL INTERNASIONAL,0.0
PT ENVY UNITY INDONESIA,0.0
PT RITEL GLOBAL SOLUSI,0.0
PT MUTIARA LAUT ABADI,0.0
EPAC FLEXIBLES ASIA PTE LTD,0.0
PT EPAC FLEXIBLES INDONESIA,0.0
PT EMOS GLOBAL DIGITAL,0.0
PT ENSEVAL MEDIKA PRIMA,0.0
PT FORSTA KALMEDIC GLOBAL,0.0
PT GLOBAL CHEMINDO MEGATRADING,0.0
PT GLOBAL KARSA MEDIKA,0.0
PT MEDIKA RENAL CITRAPRIMA,0.0
PT MILLENIA DHARMA INSANI,0.0
PT MITRA ANANDA MEGADISTRINDO,0.0
PT MOSTRANS GLOBAL DIGILOG,0.0
PT RENALMED TIARA UTAMA,0.0
PT TRI SAPTA JAYA,0.0
ERAJAYA HOLDING PTE LTD,0.0
PT AZEC INDONESIA MANAGEMENT SERVICES,0.0
PT ERA BOGA NUSANTARA,0.0
PT ERA PRIMA INDONESIA,0.0
PT ERA SUKSES ABADI,0.0
PT ERAFONE ARTHA RETAILINDO,0.0
PT INDONESIA ORISINIL TEKNOLOGI,0.0
PT SINAR EKA SELARAS TBK,0.0
PT ERATEX,0.0
PT ERATEX GARMENT,0.0
PT ESSA CHEMICAL INDONESIA,0.0
PT ESSA SAF MAKMUR,0.0
PT ESSA SUSTAINABLE INDONESIA,0.0
PT OGSPIRAS BASYA PRATAMA,0.0
PT PANCA AMARA UTAMA,0.0
PT ESTA PRIMA INVESTAMA,0.0
PT INDOYONGTEX JAYA,0.0
PT PRIMARAJULI SUKSES,0.0
PT DATA ENKRIPSI INFORMASI TEKNOLOGI,0.0
PT HIPERNET INDODATA,0.0
XL AXIATA SINGAPORE PTE LTD,0.0
PT BHUMI SIMANGGARIS INDAH,0.0
PT BORNEO BHAKTI SEJAHTERA,0.0
PT BULUNGAN HIJAU PERKASA,0.0
PT FAJAR NIAGA BERJAYA,0.0
PT KARANGJUANG HIJAULESTARI,0.0
PT KETAPANG HIJAU LESTARI,0.0
PT MARSAM CITRA ADIPERKASA,0.0
PT RIAU AGUNG KARYA ABADI,0.0
PT SETIA AGRO UTAMA,0.0
PT TIRTA MADU SAWIT JAYA,0.0
PT JAGONYA AYAM INDONESIA,0.0
PT DAYASA ARIA PRIMA,0.0
PT BARAKUDA FILM GALERI INDONESIA,0.0
PT JAKARTA FILM STUDIO,0.0
PT PAW PIC STUDIO INDONESIA,0.0
PT FKS MART NUSANTARA,0.0
PT FKS NIKMAT NUSANTARA,0.0
PT FKS PANGAN NUSANTARA,0.0
PT FKS PANGAN SEGAR,0.0
PT FKS RAGI NUSANTARA,0.0
PT FKS SOLUSI LOGISTIK,0.0
PT FKS TRUKINDO UTAMA,0.0
PT NUSA PRIMA LOGISTIK,0.0
PT PADI RAYA SEJAHTERA,0.0
PT PBM WIN SURABAYA,0.0
PT PERUSAHAAN BONGKAR MUAT WAHANA INTRADERMAGA NIAGA,0.0
PT PERUSAHAAN BONGKAR MUAT WAHANA INTRADERMAGA NIAGA MAKASSAR,0.0
PT PERUSAHAAN BONGKAR MUAT WAHANA INTRADERMAGA NIAGA MEDAN,0.0
PT PERUSAHAAN BONGKAR MUAT WAHANA INTRADERMAGA NIAGA TAPIN,0.0
PT SENTRAL GRAIN TERMINAL,0.0
PT SENTRAL GUDANG TERMINAL,0.0
PT TERMINAL BANGSA MANDIRI,0.0
PT WAHANA GLOBAL LOGISTIK,0.0
PT BUMI MAJALENGKA PERMAI,0.0
PT FITRA AMANAH WISATA,0.0
PT INDOSURYO WAHYUPAHALA,0.0
PT MULTI BANGUN SARANA,0.0
PT KEMANG FOOD INDUSTRIES,0.0
PT SAP BEVERAGES INDONESIA,0.0
PT FORTUNA NETWORK INDONESIA,0.0
PT FORTUNE ADWICIPTA,0.0
PT FORTUNE PRAMANA RANCANG,0.0
PT LOTTE CHEMICAL TITAN NUSANTARA,0.0
PT LAMINATECH KREASI SARANA,0.0
PT PRASETYA GEMAMULIA,0.0
PT VIVERE MULTI KREASI,0.0
GALAXY PRIME LTD,0.0
PT GRAHA SURYA MEDIA,0.0
PT SURYA ABADI SEMESTA,0.0
PT SURYA AIR,0.0
PT SURYA DHOHO INVESTAMA,0.0
PT SURYA INTI TEMBAKAU,0.0
PT SURYA KERTA AGUNG,0.0
PT SURYA MADISTRINDO,0.0
PT SURYA PAMENANG,0.0
PT SURYA SAPTA AGUNG TOL,0.0
PT INDOMOBIL GLOBAL TRANSPORTASI,0.0
PT INDOMOBIL JASA LINTAS RAYA,0.0
PT INDOMOBIL MANUFACTURING INDONESIA,0.0
PT INDOMOBIL MULTI TRADA,0.0
PT INDOMOBIL NATIONAL DISTRIBUTOR,0.0
PT INDOMOBIL PRIMA ENERGI,0.0
PT INDOMOBIL PRIMA NIAGA,0.0
PT INDOMOBIL SOMPO JAPAN,0.0
PT INDOMOBIL SUKSES ENERGI,0.0
PT INDOMOBIL SUMBER BARU,0.0
PT INDOMOBIL TRADA NASIONAL,0.0
PT INDOMOBIL VKTR TRANSPORTASI,0.0
PT INDOMOBIL WAHANA TRADA,0.0
PT INDOMURAYAMA PRESS & DIES INDUSTRIES,0.0
PT INDOSENTOSA TRADA,0.0
PT INDOTAMA MAJU SEJAHTERA,0.0
PT INDOTRUCK UTAMA,0.0
PT ISMAC,0.0
PT JASA KENCANA UTAMA,0.0
PT JASA LOGISTIK UTAMA,0.0
PT KHARISMA MUDA,0.0
PT KRETA INDO ARTHA,0.0
PT KYOKUTO INDOMOBIL DISTRIBUTOR INDONESIA,0.0
PT LIPPO INDORENT,0.0
PT MARVIA MULTI TRADA,0.0
PT MCA JASA UTAMA,0.0
PT MULTICENTRAL ARYAGUNA,0.0
PT NATIONAL ASSEMBLERS,0.0
PT NISSAN MOTOR DISTRIBUTOR INDONESIA,0.0
PT PENTA ARTHA IMPRESSI,0.0
PT PRIMA SARANA GEMILANG,0.0
PT PRIMA SARANA MUSTIKA,0.0
PT RODAMAS MAKMUR MOTOR,0.0
PT SEINO INDOMOBIL LOGISTICS,0.0
PT SENTRA TRADA INDOSTATION,0.0
PT SOLUSI INDOMOBIL PERKASA,0.0
PT UNICOR PRIMA MOTOR,0.0
PT UNITED INDO SURABAYA,0.0
PT WAHANA ADIDAYA KUDUS,0.0
PT WAHANA DELTA PRIMA BANJARMASIN,0.0
PT WAHANA INDO TRADA,0.0
PT WAHANA INDO TRADA MOBILINDO,0.0
PT WAHANA INTI CENTRAL MOBILINDO,0.0
PT WAHANA INTI NUSA PONTIANAK,0.0
PT WAHANA INTI SELARAS,0.0
PT WAHANA INVESTASINDO SALATIGA,0.0
PT WAHANA JAYA INDAH JAMBI,0.0
PT WAHANA JAYA TASIKMALAYA,0.0
PT WAHANA LESTARI BALIKPAPAN,0.0
PT WAHANA MEGAH PUTRA MAKASAR,0.0
PT WAHANA NIAGA LOMBOK,0.0
PT WAHANA PERSADA JAKARTA,0.0
PT WAHANA PERSADA LAMPUNG,0.0
PT WAHANA PRIMA TRADA TANGERANG,0.0
PT WAHANA REJEKI MOBILINDO CIREBON,0.0
PT WAHANA SENJAYA JAKARTA,0.0
PT WAHANA SUGI TERRA,0.0
PT WAHANA SUMBER BARU YOGYA,0.0
PT WAHANA SUMBER LESTARI SAMARINDA,0.0
PT WAHANA SUMBER MOBIL YOGYA,0.0
PT WAHANA SUMBER TRADA TANGERANG,0.0
PT WAHANA SUN HUTAMA BANDUNG,0.0
PT WAHANA SUN MOTOR SEMARANG,0.0
PT WAHANA SUN SOLO,0.0
PT WAHANA TRANS LESTARI MEDAN,0.0
PT WAHANA WIRAWAN,0.0
PT WAHANA WIRAWAN MANADO,0.0
PT WAHANA WIRAWAN PALEMBANG,0.0
PT WAHANA WIRAWAN RIAU,0.0
TEACHCAST GLOBAL PTE LTD,0.0
PT HINO FINANCE INDONESIA,0.0
ALSYNITE ONE NZ LIMITED,0.0
IMPACK INTERNATIONAL PTE LTD,0.0
IMPACK ONE PTE LTD,0.0
IMPACK VIETNAM COMPANY LIMITED,0.0
IMPACKONE PTY LTD,0.0
IMPACKONE SDN BHD,0.0
MULFORD HOLDINGS PTY LTD,0.0
MULFORD PLASTICS LIMITED,0.0
MULFORD PLASTICS PTY LTD,0.0
MULFORD PLASTICS SDN BHD,0.0
OCI INTERNATIONAL SDN BHD,0.0
PT ALDERON PRATAMA INDONESIA,0.0
PT ALSYNITE INDONESIA,0.0
PT KREASI DASATAMA,0.0
PT MULFORD INDONESIA,0.0
PT OCI MATERIAL PRATAMA,0.0
PT SINAR GRAHAMAS LESTARI,0.0
PT SIRKULAR KARYA INDONESIA,0.0
PT UNIPACK PLASINDO,0.0
PT INDOFARMA GLOBAL MEDIKA,0.0
PT INDAL INVESTINDO,0.0
PT INDAL REIWA AUTO,0.0
PT INDAL SERVIS SENTRA,0.0
PT INDALEX,0.0
PT WARNA CEMERLANG INDUSTRI,0.0
PT SAMPIT INTERNATIONAL,0.0
PT INTAN ALAM PERTIWI,0.0
INDOFOOD SINGAPORE HOLDINGS PTE LTD,0.0
OCEAN 21 PTE LTD,0.0
PACSARI PTE LTD,0.0
PT ARGHA GIRI PERKASA,0.0
PT ARTHANUGRAHA MANDIRI,0.0
PT BOGASARI FLOUR MILLS,0.0
PT BOGASARI SENTRA FLOUR MILLS,0.0
PT INDOBAHTERA ERA SEJAHTERA,0.0
PT INDOMARCO ADI PRIMA,0.0
PT INTI ABADI KEMASINDO,0.0
PT MILEVA MAKMUR MANDIRI,0.0
PT PELAYARAN TAHTA BAHTERA,0.0
PT PRIMA INTIPANGAN SEJATI,0.0
PT PUTRI DAYA USAHATAMA,0.0
PT TRADING INTERNASIONAL MANDIRI,0.0
PT CAHAYA NUSA SENTOSA,0.0
PT CAHAYA ROYAL INDONUSA,0.0
PT CAHAYA SEMESTA INVESTA,0.0
PT MULIA ARTA NUSANTARA,0.0
PT SEMANGAT BANGUN NUSANTARA,0.0
PT SEMANGAT PANGERAN ABADI,0.0
PT SEMANGAT PANGERAN INDONUSA,0.0
PT SEMANGAT PANGERAN JAYAKARTA,0.0
FE INDORAMA KOKAND TEXTILE LLC,0.0
INDORAMA INDUSTRY PTE LTD,0.0
INDORAMA IPLIK SANAYI VE TICARET A.S,0.0
IRS GLOBAL PTE LTD,0.0
PT CIKONDANG KANCANA PRIMA,0.0
PT INDORAMA TRADE AND DEVELOPMENT SERVICES,0.0
PT MEDIKALOKA BANYUMANIK,0.0
PT MEDIKALOKA BOGOR,0.0
PT MEDIKALOKA CILEUNGSI,0.0
PT MEDIKALOKA CIPUTAT,0.0
PT MEDIKALOKA DAAN MOGOT,0.0
PT MEDIKALOKA GALAXY,0.0
PT MEDIKALOKA GRAND BEKASI,0.0
PT MEDIKALOKA HUSADA,0.0
PT MEDIKALOKA INTERNUSA,0.0
PT MEDIKALOKA MALANG,0.0
PT MEDIKALOKA MITRA ARCAMANIK,0.0
PT MEDIKALOKA MITRA BANYUMANIK,0.0
PT MEDIKALOKA MITRA CILEUNGSI,0.0
PT MEDIKALOKA MITRA CIPUTAT,0.0
PT MEDIKALOKA MITRA GALAXY,0.0
PT MEDIKALOKA MITRA GRAND BEKASI,0.0
PT MEDIKALOKA MITRA PALEMBANG,0.0
PT MEDIKALOKA MITRA PANDANARAN,0.0
PT MEDIKALOKA MITRA PASTEUR,0.0
PT MEDIKALOKA MITRA SERPONG,0.0
PT MEDIKALOKA MITRA SOLO,0.0
PT MEDIKALOKA MITRA SUKABUMI,0.0
PT MEDIKALOKA MITRA TANGERANG,0.0
PT MEDIKALOKA PALEMBANG,0.0
PT MEDIKALOKA PANDANARAN,0.0
PT MEDIKALOKA PASTEUR,0.0
PT MEDIKALOKA SEJAHTERA,0.0
PT MEDIKALOKA SERPONG,0.0
PT MEDIKALOKA SUKABUMI,0.0
PT MEDIKALOKA TANGERANG,0.0
PT KOMALA INDONESIA,0.0
PT HUMPUSS TRANSPORTASI KIMIA,0.0
PT LIS INTERNASIONAL,0.0
PT GOLF TAMAN DAYU,0.0
PT HARAPAN KARYA SEMBILAN,0.0
PT HARAPAN MAJU SENTOSA,0.0
PT PERSADA MAKMUR INDONESIA,0.0
PT PERUSAHAAN DAGANG DAN INDUSTRI PANAMAS,0.0
PT SAMPOERNA INDONESIA SEMBILAN,0.0
PT SRC INDONESIA SEMBILAN,0.0
PT TAMAN DAYU,0.0
PT WAHANA SAMPOERNA,0.0
SAMPOERNA INTERNATIONAL PTE LTD,0.0
PT BUYUNG PUTRA ENERGI,0.0
PT HOKI DISTRIBUSI NIAGA,0.0
PT BERKAT INDOKARYA GEMILANG,0.0
PT VIVA INDOJAYA PERKASA,0.0
PT WINNER INDOKARYA NUSANTARA,0.0
PT HARAPAN ENERGI KONSTRUKSI,0.0
PT GLOBAL SAMUDRA NUSANTARA,0.0
PT WIJAYA WISESA BAKTI,0.0
PT WIJAYA WISESA DEVELOPMENT,0.0
PT EMAS KARYA ABADI,0.0
PT EMAS MURNI ABADI,0.0
PT GEMILANG HARTADINATA ABADI,0.0
HARUM ASIA CAPITAL PTE LTD,0.0
HARUM ENERGY AUSTRALIA LTD,0.0
NICKEL INTERNATIONAL CAPITAL PTE LTD,0.0
PT BUMI KARUNIA PERTIWI,0.0
PT HARUM NICKEL INDUSTRY,0.0
PT HARUM NICKEL PERKASA,0.0
PT INFEI METAL INDUSTRY,0.0
PT KARYA USAHA PERTIWI,0.0
PT LAYAR LINTAS JAYA,0.0
PT MAHAKAM SUMBER JAYA,0.0
PT SANTAN BATUBARA,0.0
PT TANITO HARUM NICKEL,0.0
PT WESTRONG METAL INDUSTRY,0.0
PT BHAKTI COAL RESOURCES,0.0
PT BHAKTI MIGAS RESOURCES,0.0
PT MNC INFRASTRUKTUR UTAMA,0.0
DRAYTON PTE LTD,0.0
INDOFOOD FOOD INDUSTRIES SDN BHD,0.0
PINEHILL COMPANY LIMITED,0.0
PINEHILL INVESTMENT HOLDING LIMITED,0.0
PT ANUGERAH INDOFOOD BAROKAH MAKMUR,0.0
PT INDOFOOD COMSA SUKSES MAKMUR,0.0
PT INDOFOOD FORTUNA MAKMUR,0.0
PT INDOFOOD PROSPERICH SUKSES MAKMUR,0.0
PT NUGRAHA INDAH CITARASA INDONESIA,0.0
PT SUKSES ARTHA JAYA,0.0
PT SURYA RENGO CONTAINERS,0.0
PT BHUMI LESTARI MAKMUR,0.0
PT PATRA SUPPLIES AND SERVICES,0.0
PT AIDIA INDONESIA PROPERTINDO,0.0
PT IDEA HOSPITALITY MANAGEMENT,0.0
PT GEMA BAHANA UTAMA,0.0
PT REKAGUNATEK PERSADA,0.0
PT BERKAT NIKEL INDONESIA,0.0
PT BINTANG SMELTER INDONESIA,0.0
PT GHANI VOLTRON INDONESIA,0.0
PT HANGTIAN NUR CAHAYA,0.0
PT PATRINDO JAYA MAKMUR,0.0
PT SARANA BUMI MINERINDO,0.0
PT SILICA NUSANTARA MINERAL,0.0
PT TINANGGEA KAWASAN INDUSTRI,0.0
PT AVESTA CONTINENTAL PACK,0.0
PT INDOGRAVURE,0.0
PT AION INDOMOBIL DISTRIBUTION INDONESIA,0.0
PT AUTOPARTS INDOMOBIL INDONESIA,0.0
PT CENTRAL SOLE AGENCY,0.0
PT CSM CORPORATAMA,0.0
PT DATA ARTS XPERIENCE,0.0
PT DUTA INTI JASA,0.0
PT EKA DHARMA JAYA SAKTI,0.0
PT FLUID SERVICE SOLUTION,0.0
PT FURUKAWA INDOMOBIL BATTERY SALES,0.0
PT GARUDA MATARAM MOTOR,0.0
PT GOODCAR INDO CIPTAKREASI,0.0
PT IMG BINA TRADA,0.0
PT IMG CASH MANAGEMENT,0.0
PT IMG SEJAHTERA LANGGENG,0.0
PT INDO AUTO CARE,0.0
PT INDO TRADA SUGIRON,0.0
PT INDO TRAKTOR UTAMA,0.0
PT INDOBUANA AUTORAYA,0.0
PT INDOJAYA TATALESTARI,0.0
PT INDOMATSUMOTO PRESS & DIES INDUSTRIES,0.0
PT INDOMOBIL BINTAN CORPORA,0.0
PT INDOMOBIL BUSSAN PENSKE,0.0
PT INDOMOBIL BUSSAN TRUCKING,0.0
PT INDOMOBIL CAHAYA PRIMA,0.0
PT INDOMOBIL EDUKASI UTAMA,0.0
PT INDOMOBIL EKSPRES TRUK,0.0
PT INDOMOBIL EMOTOR INTERNASIONAL,0.0
PT INDOMOBIL ENERGI BARU,0.0
PT INDOMOBIL ENERGI LESTARI,0.0
PT INDOMOBIL FINANCE INDONESIA,0.0
PT SEMESTA INDUSTRI PRATAMA,0.0
PT SITIAGUNG MAKMUR,0.0
PT SUBANG SARANA INVESTASI,0.0
PT SUBANG SEJAHTERA INDONESIA,0.0
PT SURYA BAJO PROPERTI,0.0
PT SURYA CAHAYA PROPERTI,0.0
PT SURYA CENTRA INDUSTRI,0.0
PT SURYA CITRA PROPERTINDO,0.0
PT SURYA ENERGI PARAHITA,0.0
PT SURYA INTERNUSA HOTELS,0.0
PT SURYA INTERNUSA LESTARI,0.0
PT SURYA INTERNUSA PROPERTI,0.0
PT SURYA INTERNUSA TICON,0.0
PT SURYA SEMESTA REALTI,0.0
PT SURYA SITI INDOTAMA,0.0
PT SURYA SITI PRATAMA,0.0
PT SURYA SUBANG SMARTPOLITAN,0.0
PT SURYACIPTA SWADAYA,0.0
PT SURYACIPTA SWADAYA INFRASTRUKTUR,0.0
PT SURYALAYA ANINDITA INTERNATIONAL,0.0
PT TCP INTERNUSA,0.0
PT UNGASAN SEMESTA RESORT,0.0
PT CITRA BORNEO UTAMA TBK,0.0
PT KALIMANTAN SAWIT ABADI,0.0
PT MITRA MENDAWAI SEJATI,0.0
SAWIT SUMBERMAS INTERNATIONAL PTE LTD,0.0
SSMS PLANTATION HOLDING PTE LTD,0.0
PT BUMI SUMBER ANDALAN,0.0
PT DIPTA AGRO LESTARI,0.0
PT FLORA NUSA PERDANA,0.0
PT HANURABA SAWIT KENCANA,0.0
PT KARYA AGUNG SAWITA,0.0
PT KARYA SERASI JAYA ABADI,0.0
PT KARYASUKSES UTAMAPRIMA,0.0
PT MADINA AGROLESTARI,0.0
PT PATEN ALAM LESTARI,0.0
PT PUTRA BORNEO SEJATI,0.0
PT PUTRA MAKMUR LESTARI,0.0
PT SAWIT AGRO LESTARI,0.0
PT SUMATERA CANDI KENCANA,0.0
PT SUMBER AGRI ANDALAN,0.0
PT SUMBER TANI AGUNG,0.0
PT SUMBER TANI AGUNG OILS AND FATS,0.0
PT TANTAHAN PANDUHUP ASI,0.0
PT TRANSPACIFIC AGRO INDUSTRY,0.0
STA62 TRADING PTE LTD,0.0
PT FOSTER ASSET MANAGEMENT,0.0
PT STAR SEMESTA SEJAHTERA,0.0
PT TUNAS SURYA ABADI,0.0
PT SIANTAR MEGAH JAYA,0.0
SIANTAR INTERNATIONAL HOLDING CO LTD,0.0
PT GLOBAL INDONESIA KOMUNIKATAMA,0.0
PT SARANA INTI PERSADA,0.0
PT BAHTERA ABADI GAS,0.0
PT BAHTERA ANDALAN GAS,0.0
PT ENERGI SUBANG ABADI,0.0
PT ENERGY MINA ABADI,0.0
PT GASUMA FEDERAL INDONESIA,0.0
PT SUMBER ANEKA GAS,0.0
PT DHARMA ANUGERAH INDAH,0.0
PT SAMUDRA SUKSES GEMILANG,0.0
PT SENTRA TAMARIN SAMUDRA,0.0
PT AGRO MULTI PERSADA,0.0
PT BINA KARNADA,0.0
PT BUMI TARA PERDANA,0.0
PT BUMI TARA PERKASA,0.0
PT BUMI TARA PRATAMA,0.0
PT BUMI TARA SINERGI,0.0
PT CISADANE RIVER PARK,0.0
PT GEMILANG INTERNATIONAL,0.0
PT GRIYA CIPTA BERDIKARI,0.0
PT MANDIRI GITA PERTIWI,0.0
PT MENTARI DAYA SELARAS,0.0
PT PRATAMA KENCANA PERKASA,0.0
PT PROPERTINDO LINE SEMESTA,0.0
PT RAFFLES GRAHA PERSADA,0.0
PT RAFFLES GRIYA PERKASA,0.0
PT RAFFLES NIAGA KENCANA,0.0
PT USAHA MANDIRI SUKSES ABADI,0.0
PT EKSPRES JAKARTA JAYA,0.0
PT EKSPRES MULIA KENCANA,0.0
PT EKSPRES MULIA PERDANA,0.0
PT EKSPRES SABANA UTAMA,0.0
PT EKSPRESS SARANA BATU CEPER,0.0
PT EXPRESS KARTIKA PERDANA,0.0
PT EXPRESS KENCANA LESTARI,0.0
PT EXPRESS LIMO NUSANTARA,0.0
PT FAJAR MUTIARA TIMUR,0.0
PT INDO SEMESTA LUHUR,0.0
PT MUTIARA EXPRESS PERDANA,0.0
PT MUTIARA KENCANA SEJAHTERA,0.0
PT SATRIA EXPRESS PERDANA,0.0
PT SEMESTA INDO PRIMA,0.0
PT TULUS SINAR SELATAN,0.0
PT WAHYU MUSTIKA KINASIH,0.0
PT ALUNO FOOD INDONESIA,0.0
PT TAYS BOGAINTI SELARAS,0.0
PT MENARA BERSAMA TERPADU,0.0
PT METRIC SOLUSI INTEGRASI,0.0
PT SOLUSI MENARA INDONESIA,0.0
PT TELENET INTERNUSA,0.0
PT TOWER BERSAMA,0.0
PT TOWER ONE,0.0
PT TRIAKA BERSAMA,0.0
PT UNITED TOWERINDO,0.0
TBG GLOBAL PTE LTD,0.0
PT ADIKARYA GEMILANG,0.0
PT AGRO BUMI MAS,0.0
PT BANGUN NUSA INDAH LAMPUNG,0.0
PT BANGUN TATALAMPUNG ASRI,0.0
PT BUDI DERMAGA PERKASA,0.0
PT BUDI DWIYASA PERKASA,0.0
PT BUDINUSA CIPTAWAHANA,0.0
PT BUMI PERKASA GEMILANG,0.0
PT BUMI SENTOSA ABADI,0.0
PT DINAMIKA GRAHA SARANA,0.0
PT SAMORA USAHA JAYA,0.0
PT SOLUSI JAYA PERKASA,0.0
TBLA INTERNATIONAL PTE LTD,0.0
PT ALLIANCE COSMETICS,0.0
PT BAHARI MARITIM ENERGI,0.0
PT ENERGI LAUTAN KENCANA,0.0
PT ENERGY GEMILANG KENCANA,0.0
PT ENERGY TRANSPORTER INDONESIA,0.0
PT KANZ GEMILANG UTAMA,0.0
PT KARYA SAMUDERA INSANI,0.0
PT SENTRA MAKMUR LINES,0.0
GUNUNG STEEL CO LTD,0.0
PT GLOBAL PATRA SINERTAMA,0.0
GARUDA INDONESIA HOLIDAY FRANCE S.A.S,0.0
PT AERO SYSTEMS INDONESIA,0.0
PT AERO WISATA DAN ANAK PERUSAHAAN,0.0
PT CITILINK INDONESIA,0.0
PT SABRE TRAVEL NETWORK INDONESIA,0.0
PT FILAMENDO SAKTI,0.0
PT PRIMA SENTRA MEGAH,0.0
PT SPEEDWORK SOLUSI UTAMA,0.0
PT GLOBAL DISTRIBUTION,0.0
PT HERBAL GLOBE NATURAL,0.0
PT PERSADA CENTRA MAXINDO,0.0
PT LIBERA TECHNOLOGIES INDONESIA,0.0
PT GARUDA DAYA PRATAMA SEJAHTERA,0.0
PT GARUDA ENERGI LOGISTIK KOMERSIAL,0.0
PT GRIYA EKSOTIKA UTAMA,0.0
PT KENANGA ELOK ASRI,0.0
PT PERMATA KARYA PERDANA,0.0
GOLDENBIRD PACIFIC TRADING PTE LTD,0.0
PT GARUDA BEVERAGE SUKSES,0.0
PT GARUDA SEHAT JAYA,0.0
PT SINARNIAGA SEJAHTERA,0.0
GO-JEK SINGAPORE PTE LTD,0.0
GOPRODUCTS ENGINEERING INDIA LIMITED LIABILITY PARTNERSHIP,0.0
GOTO INTERNATIONAL FINANCE LIMITED,0.0
PT ANTAR MAKANAN ANAK BANGSA,0.0
PT APLIKASI MULTIMEDIA ANAK BANGSA,0.0
PT APLIKASI PERDAGANGAN ANAK BANGSA,0.0
PT DOMPET KARYA ANAK BANGSA,0.0
PT GO-JEK INDONESIA,0.0
PT GOTO SOLUSI NIAGA,0.0
PT JAYA DATA SEMESTA,0.0
PT LINTAS PROMOSI GLOBAL,0.0
PT PRADIPA DARPA BANGSA,0.0
PT REKAN ANAK BANGSA,0.0
PT SEMANGAT BAMBU RUNCING,0.0
PT SOLUSI ARTA ANAK BANGSA,0.0
VELOX TECHNOLOGY SOUTH-EAST ASIA,0.0
PT BELLA INDAH GAPURA,0.0
PT CIAWI MEGAH INDAH,0.0
PT DINAMIKA KARYA UTAMA,0.0
PT GAPURA PAKUAN PROPERTI,0.0
PT GRAHA AZURA,0.0
PT MANDIRI BANGUN KONSTRUKSI,0.0
PT MEGAPOLITAN GAPURAPRIMA,0.0
PT SUMBER DAYA NUSAPHALA,0.0
PT DATINDO ENTRYCOM,0.0
PT EQUITY ASET MANAJEMEN,0.0
PT EQUITY FINANCE INDONESIA,0.0
PT EQUITY LIFE INDONESIA,0.0
PT EQUITY SEKURITAS INDONESIA,0.0
PT LINTAS DUNIA TRAVELINDO,0.0
PT LUMBUNG SARI,0.0
PT MEDICOM PRIMA,0.0
PT VENTURA INVESTASI PRIMA,0.0
PT VENTURA INVESTASI UTAMA,0.0
GTBO INTERNATIONAL FZE,0.0
GTS ENERGY TRADING PTE LTD,0.0
PT ANOA SULAWESI REGAS,0.0
PT BHASKARA INTI SAMUDERA,0.0
PT HIKMAH SARANA BAHARI,0.0
PT HUMOLCO LNG INDONESIA,0.0
PT PERMATA KHATULISTIWA REGAS,0.0
PT SURYA GASCHEM PERKASA,0.0
PT SURYA LNG PERKASA,0.0
PT CITRA GEMILANG NUSANTARA,0.0
PT MANGGALA GELORA PERKASA,0.0
PT PLUIT PROPERTINDO,0.0
PT PRAKARSA NUSA CEMERLANG,0.0
PT SENTRA GRAHA KENCANA,0.0
PT TRISAKTI MAKMUR PERSADA,0.0
PT BUMI MAS INDO SAWIT,0.0
PT CAHYA VIDI ABADI,0.0
PT PALMA SEJAHTERA,0.0
PT SURYABUMI AGROLANGGENG,0.0
PT TELAGA SARI PERSADA,0.0
PT OPTIMA DAYA KAPITAL,0.0
PT BARITO JAYA SARANA,0.0
PT HASNUR MITRA SARANA,0.0
PT HASNUR MULTI SINERGI,0.0
PT HASNUR RESOURCES TERMINAL,0.0
PT BIROPAY INDOTEKNOLOGI GLOBAL,0.0
PT DOEKU PEDULI INDONESIA,0.0
PT EMPOSH SINERGI ASIA,0.0
PT MOTRANSFER OTORITAS INTERNASIONAL,0.0
PT STARLINK SOLUSI,0.0
PT STARLINK SOLUSI INTERNASIONAL,0.0
PT ANDINI RUMBAI,0.0
PT MEDIKA LOKA ACEH,0.0
PT MEDIKA LOKA AMBON,0.0
PT MEDIKA LOKA BALIKPAPAN,0.0
PT MEDIKA LOKA BITUNG,0.0
PT MEDIKA LOKA CIAWI,0.0
PT MEDIKA LOKA CIBITUNG,0.0
PT MEDIKA LOKA CILEDUG,0.0
PT MEDIKA LOKA CILEGON,0.0
PT MEDIKA LOKA CIRUAS,0.0
PT MEDIKA LOKA DENPASAR,0.0
PT MEDIKA LOKA INVESTAMA,0.0
PT MEDIKA LOKA JAKABARING,0.0
PT MEDIKA LOKA KARAWANG,0.0
PT MEDIKA LOKA KENDARI,0.0
PT MEDIKA LOKA KUPANG,0.0
PT MEDIKA LOKA KUTABUMI,0.0
PT MEDIKA LOKA LAMPUNG,0.0
PT MEDIKA LOKA MADIUN,0.0
PT MEDIKA LOKA MAKASSAR,0.0
PT MEDIKA LOKA MANADO,0.0
PT MEDIKA LOKA MANAJEMEN,0.0
PT MEDIKA LOKA MEDAN,0.0
PT MEDIKA LOKA MITRA FARMASI,0.0
PT MEDIKA LOKA PADANG,0.0
PT MEDIKA LOKA PASURUAN,0.0
PT MEDIKA LOKA PEKALONGAN,0.0
PT MEDIKA LOKA PEKANBARU,0.0
PT MEDIKA LOKA PENDIDIKAN PELATIHAN,0.0
PT MEDIKA LOKA PIK DUA,0.0
PT MEDIKA LOKA PODOMORO,0.0
PT MEDIKA LOKA PURWOKERTO,0.0
PT MEDIKA LOKA SALATIGA,0.0
PT MEDIKA LOKA SAMARINDA,0.0
PT MEDIKA LOKA SOREANG,0.0
PT MEDIKA LOKA SURABAYA,0.0
PT MEDIKA LOKA TASIKMALAYA,0.0
PT MEDIKA LOKA WONOGIRI,0.0
PT MEDIKA LOKA YOGYA,0.0
PT MEDIKALOKA ARCAMANIK,0.0
PT ANGKASA PURA I (PERSERO),0.0
PT ANGKASA PURA II,0.0
PT BALI DESA PURI,0.0
PT BUANA PACIFIC INTERNATIONAL,0.0
PT CHIYODA INTERNATIONAL INDONESIA,0.0
PT CIPTA PILAR PERSADA,0.0
PT HUTAMA KARYA (PERSERO),0.0
PT JASAMARGA JOGJA SOLO,0.0
PT MAHKOTA BERLIAN CEMERLANG,0.0
PT MEGAKARYA MAKMUR SENTOSA,0.0
PT PELABUHAN INDONESIA (PERSERO),0.0
PT PERKEBUNAN NUSANTARA IX,0.0
PT PERTAMINA HULU ROKAN,0.0
PT PROPERTI BALI BENOA,0.0
PT SEMESTA MARGA RAYA,0.0
PT SUMBER SEGARA PRIMADAYA,0.0
PT ADHIMIX RMC INDONESIA,0.0
PT BERLIAN DJAYA NUSANTARA,0.0
PT BHIRAWA STEEL,0.0
PT BRANTAS ABIPRAYA (PERSERO),0.0
PT CATUR PUTRA MANUNGGAL,0.0
PT DIRGANTARA YUDHA ARTHA,0.0
PT HAKAASTON,0.0
PT HANIL JAYA STEEL,0.0
PT KAWASAN BERIKAT NUSANTARA,0.0
PT KHI PIPE INDUSTRIES,0.0
PT KRAKATAU WAJATAMA OSAKA STEEL MARKETING,0.0
PT LEN INDUSTRI (PERSERO),0.0
PT PETRO UTAMA ENERGI,0.0
PT SEMEN INDONESIA INDUSTRI BANGUNAN (SOLUSI BANGUN BETON),0.0
PT SUMBER MITRA JAYA,0.0
PT THE MASTER STEEL MANUFACTURING,0.0
PT VARIA USAHA BETON,0.0
PT WIJAYA KARYA INDUSTRI & KONSTRUKSI,0.0
BANK INDONESIA,0.0
KEMENTERIAN KELAUTAN DAN PERIKANAN REPUBLIK INDONESIA,0.0
KEMENTERIAN KESEHATAN REPUBLIK INDONESIA,0.0
KEMENTERIAN PERHUBUNGAN REPUBLIK INDONESIA,0.0
KEPOLISIAN NEGARA REPUBLIK INDONESIA,0.0
PDAM TIRTA DUMAI BERSEMAI,0.0
PT BERLIAN MANYAR SEJAHTERA,0.0
PT HARRISMA DATA CITTA,0.0
PT INDAH KIAT KARAWANG,0.0
PT JOGJASOLO MARGA MAKMUR,0.0
PT KILANG PERTAMINA INTERNASIONAL,0.0
PT PUPUK SRIWIDJAJA,0.0
PT TRANSPORTASI JAKARTA,0.0
MARUBENI CORPORATION,0.0
PT AKTIF INDONESIA INDAH,0.0
PT INDO SUKSES SENTRA USAHA,0.0
PT KAO INDONESIA CHEMICALS,0.0
PT KARUNIA UNGGUL SEMESTA,0.0
PT MULTI INDOMANDIRI,0.0
PT POLYPLEX FILMS INDONESIA,0.0
PT SAYAP MAS UTAMA,0.0
KOLMAR SINGAPORE PTE LTD,0.0
MARUBENI ASEAN PTE LTD,0.0
PT ANUGRAH KIMIA ARIWIDYA,0.0
PT ECOGREEN OLEOCHEMICALS,0.0
PT GEMA PERSADA INDOTEKNIK,0.0
PT NOVO COMPLAST INDONESIA,0.0
PT RHEEM INDONESIA,0.0
PT SANTOSA RESOURCES,0.0
PT SUMBER MAJU PERKASA,0.0
SCIENTIFIC DESIGN COMPANY INC,0.0
TORI GLOBAL CV,0.0
ADARO INTERNATIONAL (SINGAPORE) PTE LTD,0.0
SQUARE TRADING SINGAPORE PTE LTD,0.0
TNB FUEL SERVICES SDN BHD,0.0
CEAMSA ASIA,0.0
EXTRACTOS NATURES GELYMAR,0.0
GREENWICH TECHNOLOGY DEVELOPMENT LTD,0.0
PT HONGXIN ALGAE INTERNATIONAL,0.0
SEAS INTERNATIONAL COMMERCIAL,0.0
VIET PHUONG,0.0
XIAMEN TIANYUANFOOD CO LTD,0.0
KOPERASI PARIPURNA TEKNOVASI INDONESIA,0.0
PT NUANSA MITRA LOGISTIK,0.0
PT SITC INDONESIA,0.0
PT SUMBER KURNIA ALAM,0.0
PT BUMI PETANGIS,0.0
PT ANSAF INTI RESOURCES,0.0
PT ANSAFINTI RESOURCES,0.0
PT AGUNG PERDANA SAKTI,0.0
BANGKIT CASSAVA MANDIRI,0.0
ENERFO SHANGHAI TRADING CO LTD,0.0
HIAP SENG HUAT FOOD STUFF SDN BHD,0.0
INTER WAHANA NUSANTARA,0.0
PT ATRI DISTRIBUSINDO,0.0
PT LANCAR SAKTI SEJAHTERA,0.0
PT PANJUNAN,0.0
PT ROYAL PACIFIC INDAH INTERNATIONAL,0.0
PT SARANA ABADI MAKMUR BERSAMA,0.0
PT TERMINAL UTAMA MAKASSAR,0.0
PT UNIRAMA DUTA NIAGA,0.0
ROYAL PACIFIC FOOD,0.0
SEMAR KENCANA SEJATI,0.0
SRIWIJAYA PANGANINDO PRIMA LESTARI,0.0
TATA MAKMUR SEJAHTERA,0.0
WORLD FOOD PROGRAMME,0.0
BUNGASARI FLOUR MILLS,0.0
CIPTA SEJAHTERA SUKSES MAKMUR,0.0
EASTERN PEARL FLOUR MILLS,0.0
HASSAN ALI RICE EXPORT COMPANY,0.0
KABULINCO JAYA,0.0
KARUNIA SELARAS ABADI,0.0
NP FOODS SINGAPORE PTE LTD,0.0
PT ALMINDO JAYA ABADI,0.0
PT ARENA AGRO ANDALAN,0.0
PT BUNGASARI FLOUR MILLS INDONESIA,0.0
PT DYNAMIC POLY INDUSTRY,0.0
PT ESSENCE INDONESIA,0.0
PT KABULINCO JAYA,0.0
PT PADI FLOUR NUSANTARA,0.0
PT PERMATA DUNIA SUKSES UTAMA,0.0
PT PLASINDO LESTARI,0.0
PT PURA BARUTAMA,0.0
PT SURYAKEMASINDO SEJATI,0.0
PT TEREOS FKS INDONESIA,0.0
PT TOPPAN PLASINDO LESTARI,0.0
SRIBOGA FLOUR MILL,0.0
SURABAYA PERDANA ROTOPACK,0.0
BERITO PANGAN MAKMUR,0.0
PT BANK OKE INDONESIA TBK,0.0
DUTA PERTIWI TBK,0.0
ENERGI MEGA PERSADA TBK,0.0
PT LATIVI MEDIAKARYA KENDARI DAN PONTIANAK,0.0
PT LATIVI MEDIAKARYA LOMBOK DAN PALU,0.0
PT LATIVI MEDIAKARYA MAKASSAR DAN AMBON,0.0
PT LATIVI MEDIAKARYA MANADO DAN SAMARINDA,0.0
PT LATIVI MEDIAKARYA MEDAN DAN PEKANBARU,0.0
PT LATIVI MEDIAKARYA PALEMBANG DAN PALANGKARAYA,0.0
PT LATIVI MEDIAKARYA SEMARANG DAN PADANG,0.0
PT LATIVI MEDIAKARYA SURABAYA DAN JAMBI,0.0
PT LATIVI MEDIAKARYA YOGYAKARTA DAN LAMPUNG,0.0
PT ONE MEDIA DIGITAL,0.0
PT ONE MEDIA KREATIF,0.0
PT ONE MEDIA SERVICES,0.0
PT REDAL SEMESTA,0.0
PT SARANA MEDIA USAHA,0.0
PT VENTURA KAPITAL ASIA,0.0
PT VIVA MEDIA BARU,0.0
PT BANGUN PRIMA SEMESTA,0.0
PT BUANA KONSTRUKSI ELEKTRINDO,0.0
PT CIPTA KARYA TEKNIK,0.0
PT PRIMA MITRA ELEKTRINDO,0.0
PT WEGE SOLUSI PROKLAMASI,0.0
PT CANARY TRANSPORT,0.0
PT DAY TRANS,0.0
PT DAY TRANS EXPRESS,0.0
PT KENCANA TRANSPORT,0.0
PT PANORAMA MITRA SARANA,0.0
PT PANORAMA PRIMAKENCANA TRANSINDO,0.0
PT RHADANA PRIMAKENCANA TRANSINDO,0.0
PT WEHA JALAN-JALAN,0.0
PT KIRANA TAMA TEKNOLOGI,0.0
PT QORSER TEKNOLOGI,0.0
PT SMOOETS TEKNOLOGI OUTSOURCING,0.0
PT WICAKSANA SUPRA EKATAMA,0.0
PT GALAN GELORA DJAJA,0.0
PT GAWIH JAYA,0.0
PT GELORA DJAJA,0.0
PT WIJAYA KARYA BITUMEN,0.0
PT WIJAYA KARYA INDUSTRI DAN KONSTRUKSI,0.0
PT WIJAYA KARYA REKAYASA KONSTRUKSI,0.0
PT WIJAYA KARYA SERANG-PANIMBANG,0.0
PT WIJAYA KARYA TIRTA JAYA JATILUHUR,0.0
PT KALIBAN BANGUN INDONESIA,0.0
PT KARYA SAPTA WIRA NUSANTARA,0.0
PT PEMENANG PROPERTI NASIONAL,0.0
PT PEMENANG YABES PROPERTI,0.0
PT PUTRA KARYA GEMILANG,0.0
PT WIJAYA NUSANTARA INTERNASIONAL,0.0
PTANGKASA PURA SANJAYA,0.0
PTGOSYEN INDO ASIA,0.0
NILA UTAMA PTE LTD,0.0
PT ALTO NAUTIKA TEKNOLOGI,0.0
PT ARIAL NIAGA NUSANTARA,0.0
PT AZUREUS SIMULATOR ASIA,0.0
PT FAST OFFSHORE INDONESIA,0.0
PT HAMMAR MARINE OFFSHORE,0.0
PT MARINE SOLUSINDO TEKNIK,0.0
PT NUSA MARITIM JAYA,0.0
PT PSV INDONESIA,0.0
PT SENTOSASEGARA MULIA SHIPPING,0.0
PT WIN MARITIM,0.0
PT WIN OFFSHORE,0.0
PT WINPAN OFFSHORE,0.0
PT WINTERMAR,0.0
PT WINTERMAR GEO OFFSHORE,0.0
PT WINTERMAR RAJAWALI ASIA,0.0
PT WM OFFSHORE,0.0
WINTERMAR SDN BHD,0.0
PT CIANJUR ARTA MAKMUR,0.0
PT LANGGENG MAKMUR PERKASA,0.0
PT PASIR TENGAH,0.0
PT WIDODOFOOD MAKMUR SEJAHTERA,0.0
PT ADIJAYA UNINDO PERKASA,0.0
CARBON RESOURCES ALLIANCE APS,0.0
PT BELAYAN RIVER TIMBER,0.0
PT INTEGRIYA DEKORINDO,0.0
PT INTER KAYU MANDIRI,0.0
PT INTERA INDONESIA,0.0
PT INTERKRAFT,0.0
PT INTERTREND UTAMA,0.0
PT NARKATA RIMBA,0.0
PT PEMALANG BATANG TOLL ROAD,0.0
PT TOL TELUK BALIKPAPAN,0.0
PT TRANS JABAR TOL,0.0
PT TRANSJAWA PASPRO JALAN TOL,0.0
PT WASKITA BUMI WIRA,0.0
PT WASKITA FIM PERKASA REALTI,0.0
PT WASKITA KARYA INFRASTRUKTUR,0.0
PT WASKITA KARYA REALTY,0.0
PT WASKITA MODERN REALTI,0.0
PT WASKITA SANGIR ENERGI,0.0
PT WASKITA SRIWIJAYA TOL,0.0
PT WASKITA TOLL ROAD,0.0
PT WASKITA TRANSJAWA TOLL ROAD,0.0
PT WASKITA WADO ENERGI,0.0
PT CITRA LAUTAN TEDUH,0.0
PT WIJAYA KARYA KOMPONEN BETON,0.0
PT WIJAYA KARYA KRAKATAU BETON,0.0
PT WIJAYA KARYA PRACETAK GEDUNG,0.0
PT ABDI HARAPAN UNGGUL,0.0
PT KOMUNIKASI PROFESIONAL INDONESIA,0.0
PT TANJUNG LESUNG RESORT,0.0
