BidangUsaha,JumlahAset,Lokasi,MataUang,Nama,Persentase,Satuan,StatusOperasi,TahunKomersil,KodeEmiten,NamaEmiten
KELAPA SAWIT,596853,KALIMANTAN TENGAH,IDR,PT AGRO MENARA RACHMAT,99.99,JUTAAN,AKTIF,1998,AALI,ASTRA AGRO LESTARI TBK
KELAPA SAWIT,1065236,SULAWESI TENGAH,IDR,PT AGRO NUSA ABADI,99.99,JUTAAN,AKTIF,2012,AALI,ASTRA AGRO LESTARI TBK
KELAPA SAWIT,477613,KALIMANTAN TENGAH,IDR,PT BHADRA CEMERLANG,99.99,JUTAAN,AKTIF,2010,AALI,ASTRA AGRO LESTARI TBK
KELAPA SAWIT,120365,SULAWESI BARAT,IDR,PT BHADRA SUKSES,99.8,JUTAAN,AKTIF,1997,AALI,ASTRA AGRO LESTARI TBK
KELAPA SAWIT,1019697,KALIMANTAN TIMUR,IDR,PT BORNEO INDAH MARJAYA,99.99,JUTAAN,AKTIF,2011,AALI,ASTRA AGRO LESTARI TBK
KELAPA SAWIT,44840,KALIMANTAN SELATAN,IDR,PT CAKRADENTA AGUNG PERTIWI,99.99,JUTAAN,AKTIF,2000,AALI,ASTRA AGRO LESTARI TBK
KELAPA SAWIT,41154,KALIMANTAN SELATAN,IDR,PT CAKUNG PERMATA NUSA,99.99,JUTAAN,AKTIF,1999,AALI,ASTRA AGRO LESTARI TBK
KELAPA SAWIT,395875,SULAWESI TENGAH,IDR,PT CIPTA AGRO NUSANTARA,99.99,JUTAAN,AKTIF,2012,AALI,ASTRA AGRO LESTARI TBK
KELAPA SAWIT,126011,KALIMANTAN TIMUR,IDR,PT CIPTA NARADA LESTARI,99.99,JUTAAN,AKTIF,2011,AALI,ASTRA AGRO LESTARI TBK
KELAPA SAWIT,1497107,RIAU,IDR,PT EKA DURA INDONESIA,99.99,JUTAAN,AKTIF,1994,AALI,ASTRA AGRO LESTARI TBK
LAINNYA,13259,RIAU,IDR,PT EKA DURA PERDANA,99.99,JUTAAN,AKTIF,1992,AALI,ASTRA AGRO LESTARI TBK
KELAPA SAWIT,597184,KALIMANTAN TENGAH,IDR,PT GUNUNG SEJAHTERA DUA INDAH,95.0,JUTAAN,AKTIF,1998,AALI,ASTRA AGRO LESTARI TBK
KELAPA SAWIT,733640,KALIMANTAN TENGAH,IDR,PT GUNUNG SEJAHTERA IBU PERTIWI,99.99,JUTAAN,AKTIF,1997,AALI,ASTRA AGRO LESTARI TBK
KELAPA SAWIT,686955,KALIMANTAN TENGAH,IDR,PT GUNUNG SEJAHTERA PUTI PESONA,95.0,JUTAAN,AKTIF,1999,AALI,ASTRA AGRO LESTARI TBK
KELAPA SAWIT,21972,KALIMANTAN TENGAH,IDR,PT GUNUNG SEJAHTERA RAMAN PERMAI,99.99,JUTAAN,AKTIF,2022,AALI,ASTRA AGRO LESTARI TBK
KELAPA SAWIT,254668,KALIMANTAN TENGAH,IDR,PT GUNUNG SEJAHTERAYOLI MAKMUR,95.0,JUTAAN,AKTIF,2001,AALI,ASTRA AGRO LESTARI TBK
KELAPA SAWIT,562050,ACEH,IDR,PT KARYA TANAH SUBUR,99.99,JUTAAN,AKTIF,1994,AALI,ASTRA AGRO LESTARI TBK
KELAPA SAWIT,1745912,KALIMANTAN TIMUR,IDR,PT KARYANUSA EKADAYA,99.99,JUTAAN,AKTIF,2009,AALI,ASTRA AGRO LESTARI TBK
KELAPA SAWIT,1330473,RIAU,IDR,PT KIMIA TIRTA UTAMA,75.0,JUTAAN,AKTIF,1999,AALI,ASTRA AGRO LESTARI TBK
KELAPA SAWIT,559956,SULAWESI TENGAH,IDR,PT LESTARI TANI TELADAN,94.99,JUTAAN,AKTIF,1998,AALI,ASTRA AGRO LESTARI TBK
KELAPA SAWIT,844925,SULAWESI BARAT,IDR,PT LETAWA,99.99,JUTAAN,AKTIF,1995,AALI,ASTRA AGRO LESTARI TBK
KELAPA SAWIT,413384,SULAWESI BARAT,IDR,PT MAMUANG,99.99,JUTAAN,AKTIF,1997,AALI,ASTRA AGRO LESTARI TBK
KARET,7547,KALIMANTAN TENGAH,IDR,PT MITRA BARITO GEMILANG,99.99,JUTAAN,AKTIF,2019,AALI,ASTRA AGRO LESTARI TBK
KELAPA SAWIT,834601,KALIMANTAN TENGAH,IDR,PT NIRMALA AGRO LESTARI,99.99,JUTAAN,AKTIF,2003,AALI,ASTRA AGRO LESTARI TBK
KELAPA SAWIT,535434,KALIMANTAN TIMUR,IDR,PT PALMA PLANTASINDO,99.99,JUTAAN,AKTIF,2011,AALI,ASTRA AGRO LESTARI TBK
KARET,16185,BANTEN,IDR,PT PANDJI WARINGIN,99.99,JUTAAN,AKTIF,1995,AALI,ASTRA AGRO LESTARI TBK
KELAPA SAWIT,628646,SULAWESI BARAT,IDR,PT PASANGKAYU,99.99,RIBUAN,AKTIF,1997,AALI,ASTRA AGRO LESTARI TBK
KELAPA SAWIT,857666,ACEH,IDR,PT PERKEBUNAN LEMBAH BHAKTI,99.99,JUTAAN,AKTIF,1994,AALI,ASTRA AGRO LESTARI TBK
KELAPA SAWIT,480394,KALIMANTAN SELATAN,IDR,PT PERSADA DINAMIKA LESTARI,99.99,JUTAAN,AKTIF,2013,AALI,ASTRA AGRO LESTARI TBK
KELAPA SAWIT,173292,KALIMANTAN TENGAH,IDR,PT PERSADABINA NUSANTARAABADI,95.0,JUTAAN,AKTIF,2002,AALI,ASTRA AGRO LESTARI TBK
KELAPA SAWIT,188631,SULAWESI TENGAH,IDR,PT RIMBUNAN ALAM SENTOSA,99.99,JUTAAN,AKTIF,2012,AALI,ASTRA AGRO LESTARI TBK
KELAPA SAWIT,623698,JAMBI,IDR,PT SARI ADITYA LOKA,90.0,JUTAAN,AKTIF,1995,AALI,ASTRA AGRO LESTARI TBK
KELAPA SAWIT,977284,RIAU,IDR,PT SARI LEMBAH SUBUR,85.0,JUTAAN,AKTIF,1993,AALI,ASTRA AGRO LESTARI TBK
KELAPA SAWIT,648813,RIAU,IDR,PT SAWIT ASAHAN INDAH,99.99,JUTAAN,AKTIF,1997,AALI,ASTRA AGRO LESTARI TBK
KELAPA SAWIT,676632,SULAWESI TENGAH,IDR,PT SAWIT JAYA ABADI,99.99,JUTAAN,AKTIF,2012,AALI,ASTRA AGRO LESTARI TBK
KELAPA SAWIT,411645,KALIMANTAN TIMUR,IDR,PT SUBUR ABADI PLANTATIONS,99.99,JUTAAN,AKTIF,2012,AALI,ASTRA AGRO LESTARI TBK
KELAPA SAWIT,1461557,KALIMANTAN SELATAN,IDR,PT SUBUR AGRO MAKMUR,99.99,JUTAAN,AKTIF,2013,AALI,ASTRA AGRO LESTARI TBK
KELAPA SAWIT,595571,KALIMANTAN TIMUR,IDR,PT SUKSES TANI NUSASUBUR,99.99,JUTAAN,AKTIF,2000,AALI,ASTRA AGRO LESTARI TBK
KELAPA SAWIT,537811,KALIMANTAN TIMUR,IDR,PT SUMBER KHARISMA PERSADA,99.99,JUTAAN,AKTIF,2006,AALI,ASTRA AGRO LESTARI TBK
KELAPA SAWIT,627659,KALIMANTAN TENGAH,IDR,PT SURYAINDAH NUSANTARAPAGI,95.0,JUTAAN,AKTIF,2000,AALI,ASTRA AGRO LESTARI TBK
KELAPA SAWIT,632786,SULAWESI BARAT,IDR,PT SURYARAYA LESTARI,99.99,JUTAAN,AKTIF,1997,AALI,ASTRA AGRO LESTARI TBK
PENYULINGAN MINYAK,98752,SULAWESI BARAT,IDR,PT TANJUNG BINA LESTARI,99.99,JUTAAN,AKTIF,2017,AALI,ASTRA AGRO LESTARI TBK
PENYULINGAN MINYAK,2590288,SULAWESI BARAT,IDR,PT TANJUNG SARANA LESTARI,99.99,JUTAAN,AKTIF,2014,AALI,ASTRA AGRO LESTARI TBK
KELAPA SAWIT,2670735,KALIMANTAN SELATAN,IDR,PT TRI BUANA MAS,99.99,JUTAAN,AKTIF,2016,AALI,ASTRA AGRO LESTARI TBK
KELAPA SAWIT,1369235,RIAU,IDR,PT TUNGGAL PERKASA PLANTATIONS,99.99,JUTAAN,AKTIF,1987,AALI,ASTRA AGRO LESTARI TBK
KELAPA SAWIT,914132,KALIMANTAN TIMUR,IDR,PT WARU KALTIM PLANTATION,99.99,JUTAAN,AKTIF,1995,AALI,ASTRA AGRO LESTARI TBK
PENGIRIMAN BARANG,1000000000,JAKARTA,IDR,PT AKASIA CEPAT INDONESIA,50.0,PENUH,AKTIF,2022,ABBA,MAHAKA MEDIA TBK
PENGEMBANGAN SOFTWARE,1268959209,JAKARTA,IDR,PT AKASIA CODE DIGITAL,50.0,PENUH,AKTIF,2022,ABBA,MAHAKA MEDIA TBK
PERDAGANGAN PERALATAN KOMUNIKASI,1183732288,JAKARTA,IDR,PT AKASIA DAMCORP WABA,50.0,PENUH,AKTIF,2022,ABBA,MAHAKA MEDIA TBK
PENGEMBANGAN SOFTWARE,2418959811,JAKARTA,IDR,PT ARCHYTECT TEKNOLOGI INDONESIA,70.0,PENUH,AKTIF,2022,ABBA,MAHAKA MEDIA TBK
PENYIARAN TELEVISI,5746289504,JAKARTA,IDR,PT DANAPATI ABINAYA INVESTAMA,50.0,PENUH,AKTIF,2005,ABBA,MAHAKA MEDIA TBK
PENGELOLAAN GEDUNG,30555528993,JAKARTA,IDR,PT GAMMA INVESTA LESTARI,99.98,PENUH,AKTIF,2006,ABBA,MAHAKA MEDIA TBK
EVENT ORGANIZER,20593960324,JAKARTA,IDR,PT KALYANAMITRA ADHARA MAHARDHIKA,80.0,PENUH,AKTIF,2007,ABBA,MAHAKA MEDIA TBK
KONTEN KREATIF AGENSI,4175365304,JAKARTA,IDR,PT KREATIF INTEL TEKNOLOGI,97.0,PENUH,AKTIF,2022,ABBA,MAHAKA MEDIA TBK
PENERBITAN PERS,20788859063,JAKARTA,IDR,PT REPUBLIKA MEDIA MANDIRI,95.64,PENUH,AKTIF,2004,ABBA,MAHAKA MEDIA TBK
REPARASI KENDARAAN,4601819,TANGERANG,IDR,PT ALTRA RAYA,99.0,RIBUAN,BEROPERASI,2014,ABDA,ASURANSI BINA DANA ARTA TBK
PERDAGANGAN/TRADING,20434574,JAKARTA,USD,PT AGATA NUGRAHA NASTARI,99.99,PENUH,OPERASI,2020,ABMM,ABM INVESTAMA TBK
TRANSPORTASI LAUT/SEA TRANSPORTATION,7691460,JAKARTA,USD,PT ALFA TRANS RAYA,99.99,PENUH,OPERASI,2007,ABMM,ABM INVESTAMA TBK
INDUSTRI PEMBANGKIT LISTRIK ENERGI YANG TERBARUKAN/RENEWABLE ENERGY IPP,982154,JAKARTA,USD,PT ANDARA CANDRIA ENERGI,99.12,PENUH,TIDAK DIKETAHUI,0,ABMM,ABM INVESTAMA TBK
INDUSTRI PEMBANGKIT LISTRIK ENERGI THERMAL/THERMAL ENERGY IPP,1931782,JAKARTA,USD,PT ANZARA JANITRA NUSANTARA,99.99,PENUH,TIDAK DIKETAHUI,0,ABMM,ABM INVESTAMA TBK
TRANSPORTASI LAUT DOMESTIK/DOMESTIC SEA TRANSPORTATION,35991893,JAKARTA,USD,PT BARUNA DIRGA DHARMA,99.99,PENUH,OPERASI,2011,ABMM,ABM INVESTAMA TBK
JASA LOGISTIK/LOGISTIC SERVICES,166678311,JAKARTA,USD,PT CIPTA KRIDA BAHARI,99.99,PENUH,OPERASI,1997,ABMM,ABM INVESTAMA TBK
KONTRAKTOR PERTAMBANGAN/MINING CONTRACTOR,1030928612,JAKARTA,USD,PT CIPTA KRIDATAMA,99.99,PENUH,OPERASI,1999,ABMM,ABM INVESTAMA TBK
BONGKAR MUAT BARANG DAN PELAYANAN KEPELABUHAN LAUT/STEVEDORING AND SEA PORT SERVICES,7884619,JAKARTA,USD,PT DIANTA DAYA EMBARA,99.99,PENUH,OPERASI,2017,ABMM,ABM INVESTAMA TBK
INDUSTRI PEMBANGKIT LISTRIK ENERGI YANG TERBARUKAN/RENEWABLE ENERGY IPP,3192534,JAKARTA,USD,PT NAGATA BIO ENERGI,98.42,PENUH,OPERASI,2020,ABMM,ABM INVESTAMA TBK
INDUSTRI PEMBANGKIT LISTRIK ENERGI YANG TERBARUKAN/RENEWABLE ENERGY IPP,5856,JAKARTA,USD,PT NAGATA BIOGAS DWIENERGI,98.32,PENUH,TIDAK DIKETAHUI,0,ABMM,ABM INVESTAMA TBK
INDUSTRI PEMBANGKIT LISTRIK ENERGI YANG TERBARUKAN/RENEWABLE ENERGY IPP,3491981,JAKARTA,USD,PT NAGATA DINAMIKA,99.51,PENUH,TIDAK DIKETAHUI,0,ABMM,ABM INVESTAMA TBK
INDUSTRI PEMBANGKIT LISTRIK ENERGI YANG TERBARUKAN/RENEWABLE ENERGY IPP,30009,JAKARTA,USD,PT NAGATA DINAMIKA HIDRO BUAKAYU ULU,98.51,PENUH,TIDAK DIKETAHUI,0,ABMM,ABM INVESTAMA TBK
INDUSTRI PEMBANGKIT LISTRIK ENERGI YANG TERBARUKAN/RENEWABLE ENERGY IPP,37045588,JAKARTA,USD,PT NAGATA DINAMIKA HIDRO PONGKO,98.51,PENUH,TIDAK DIKETAHUI,0,ABMM,ABM INVESTAMA TBK
"PENGEMBANGAN DAN PERTAMBANGAN SUMBERDAYA, TERUTAMA BATUBARA/DEVELOPMENT AND MINING RESOURCES PRINCIPALLY COAL",3003316,JAKARTA,USD,PT NIRMALA COAL NUSANTARA,70.0,PENUH,TIDAK DIKETAHUI,2017,ABMM,ABM INVESTAMA TBK
PELAYANAN JASA KAPAL/SHIP OPERATIONAL SERVICES,21550303,JAKARTA,USD,PT PELABUHAN BUANA REJA,99.99,PENUH,OPERASI,2018,ABMM,ABM INVESTAMA TBK
JASA DAN PERDAGANGAN UMUM/SERVICES AND GENERAL TRADING,81901896,JAKARTA,USD,PT PRIMA WIGUNA PARAMA,99.99,PENUH,OPERASI,2017,ABMM,ABM INVESTAMA TBK
INDUSTRI PEMBANGKIT LISTRIK ENERGI YANG TERBARUKAN/RENEWABLE ENERGY IPP,381356,JAKARTA,USD,PT PUNGGAWA NAGATA DINAMIKA HIDRO,83.59,PENUH,TIDAK DIKETAHUI,0,ABMM,ABM INVESTAMA TBK
PERDAGANGAN/TRADING,527710102,JAKARTA,USD,PT RADHIKA JANANTA RAYA,99.99,PENUH,OPERASI,2022,ABMM,ABM INVESTAMA TBK
PERDAGANGAN/TRADING,760817867,JAKARTA,USD,PT RESWARA MINERGI HARTAMA,99.99,PENUH,OPERASI,2010,ABMM,ABM INVESTAMA TBK
"PERENCANAAN REKAYASA MESIN, PENGEMBANGAN, DAN PEMBUATAN PERLENGKAPAN PENUNJANG ALAT- ALAT BERAT DAN ALAT ANGKUT BAHAN/ENGINEERING, DEVELOPMENT AND MANUFACTURE OF HEAVY EQUIPMENT ATTACHMENT AND MATERIALS HANDLING PRODUCTS",90217946,JAKARTA,USD,PT SANGGAR SARANA BAJA,99.99,PENUH,OPERASI,1977,ABMM,ABM INVESTAMA TBK
"PENGEMBANGAN DAN PERTAMBANGAN SUMBERDAYA, TERUTAMA BATUBARA/DEVELOPMENT AND MINING RESOURCES PRINCIPALLY COAL",56667334,JAKARTA,USD,PT TUNAS INTI ABADI,99.99,PENUH,OPERASI,2009,ABMM,ABM INVESTAMA TBK
INDUSTRI DAN PERDAGANGAN,0,JAKARTA,IDR,PT DAN SEBAGAINYA INDONESIA,0.0,PENUH,TIDAK AKTIF,0,ACES,PT ASPIRASI HIDUP INDONESIA TBK
INDUSTRI DAN PERDAGANGAN,69798754604,JAKARTA,IDR,PT KAWAN LAMA INOVASI,99.9767,PENUH,AKTIF,2017,ACES,PT ASPIRASI HIDUP INDONESIA TBK
INDUSTRI DAN PERDAGANGAN,30000000000,JAKARTA,IDR,PT KRISNA ASPIRASI SEJAHTERA,99.99,PENUH,AKTIF,2024,ACES,PT ASPIRASI HIDUP INDONESIA TBK
INDUSTRI DAN PERDAGANGAN,116914381588,JAKARTA,IDR,PT OMNI DIGITAMA INTERNUSA,30.0,PENUH,AKTIF,2016,ACES,PT ASPIRASI HIDUP INDONESIA TBK
INDUSTRI DAN PERDAGANGAN,353194049220,JAKARTA,IDR,PT TOYS GAMES INDONESIA,60.0,PENUH,AKTIF,2009,ACES,PT ASPIRASI HIDUP INDONESIA TBK
JASA KONSTRUKSI,220393,INDONESIA,IDR,PT ACSET PONDASI INDONUSA,100.0,JUTAAN,AKTIF,2020,ACST,PT ACSET INDONUSA TBK
JASA PENUNJANG KONSTRUKSI,116524,INDONESIA,IDR,PT ANEKA RAYA KONSTRUKSI MESINDO,99.94,JUTAAN,AKTIF,2016,ACST,PT ACSET INDONUSA TBK
JASA PENUNJANG KONSTRUKSI,49155,INDONESIA,IDR,PT ATMC PUMP SERVICES,100.0,JUTAAN,AKTIF,2015,ACST,PT ACSET INDONUSA TBK
JASA PENUNJANG KONSTRUKSI,409267,INDONESIA,IDR,PT BINTAI KINDENKO ENGINEERING INDONESIA,60.0,JUTAAN,AKTIF,2012,ACST,PT ACSET INDONUSA TBK
JASA PENUNJANG KONSTRUKSI,58191,INDONESIA,IDR,PT INNOTECH SYSTEMS,100.0,JUTAAN,AKTIF,2013,ACST,PT ACSET INDONUSA TBK
PERDAGANGAN BESAR ALAT BERAT,38830,INDONESIA,IDR,PT SACINDO MACHINERY,96.5,JUTAAN,AKTIF,2014,ACST,PT ACSET INDONUSA TBK
PROPERTI,280404435414,JAKARTA,IDR,PT MEGA GRAHA CITRA PERKASA,99.99,PENUH,BEROPERASIONAL,2019,ADCP,PT ADHI COMMUTER PROPERTI TBK
TIDAK AKTIF,1947107,JAKARTA,USD,PT SENTRA SINTETIKAJAYA,99.0,PENUH,TIDAK AKTIF,1998,ADMG,POLYCHEM INDONESIA TBK
INVESTASI,634655033,INDONESIA,USD,PT ADARO BATERAI INDONESIA,99.99,PENUH,NAN,0,ADMR,PT ALAMTRI MINERALS INDONESIA TBK
INVESTASI,629420541,INDONESIA,USD,PT ADARO INDO ALUMINIUM,100.0,PENUH,NAN,0,ADMR,PT ALAMTRI MINERALS INDONESIA TBK
INVESTASI,35769408,INDONESIA,USD,PT ALAM TRI CAKRA INDONESIA,90.84,PENUH,NAN,0,ADMR,PT ALAMTRI MINERALS INDONESIA TBK
INVESTASI,1342385877,INDONESIA,USD,PT ALAM TRI DAYA INDONESIA,99.99,PENUH,NAN,0,ADMR,PT ALAMTRI MINERALS INDONESIA TBK
"PENGGALIAN BATU, PASIR, DAN TANAH LIAT LAINNYA",6808,INDONESIA,USD,PT BASALT SINAR LESTARI,100.0,PENUH,BELUM BEROPERASI,0,ADMR,PT ALAMTRI MINERALS INDONESIA TBK
PERTAMBANGAN,2121307,INDONESIA,USD,PT BATUAN ANUGERAH SEMESTA,100.0,PENUH,BELUM BEROPERASI,0,ADMR,PT ALAMTRI MINERALS INDONESIA TBK
PERTAMBANGAN BATU KAPUR,1734314,INDONESIA,USD,PT BUMI ALAM SERAYA,100.0,PENUH,BEROPERASI,2024,ADMR,PT ALAMTRI MINERALS INDONESIA TBK
PERTAMBANGAN,26652668,INDONESIA,USD,PT JULOI COAL,99.99,PENUH,BELUM BEROPERASI,0,ADMR,PT ALAMTRI MINERALS INDONESIA TBK
PENGOLAHAN LOGAM,626343624,INDONESIA,USD,PT KALIMANTAN ALUMINIUM INDUSTRY,65.0,PENUH,BELUM BEROPERASI,0,ADMR,PT ALAMTRI MINERALS INDONESIA TBK
PERTAMBANGAN,2148319,INDONESIA,USD,PT KALTENG COAL,99.99,PENUH,BELUM BEROPERASI,0,ADMR,PT ALAMTRI MINERALS INDONESIA TBK
PERTAMBANGAN,110652469,INDONESIA,USD,PT LAHAI COAL,99.99,PENUH,BEROPERASI,2016,ADMR,PT ALAMTRI MINERALS INDONESIA TBK
PERTAMBANGAN,1210114618,INDONESIA,USD,PT MARUWAI COAL,99.99,PENUH,BEROPERASI,2020,ADMR,PT ALAMTRI MINERALS INDONESIA TBK
PERTAMBANGAN,2172542,INDONESIA,USD,PT SUMBER BARITO COAL,99.99,PENUH,BELUM BEROPERASI,0,ADMR,PT ALAMTRI MINERALS INDONESIA TBK
"TRANSMISI, DISTRIBUSI DAN PENJUALAN TENAGA LISTRIK",212,SINGAPURA,USD,ADARO SOLAR INTERNATIONAL PTE LTD,100.0,RIBUAN,NAN,0,ADRO,ALAMTRI RESOURCES INDONESIA TBK
PERDAGANGAN DAN JASA,0,INDONESIA,USD,PT ADARO ANDALAN INDONESIA TBK,15.0,RIBUAN,NAN,2007,ADRO,ALAMTRI RESOURCES INDONESIA TBK
INVESTASI,634655,INDONESIA,USD,PT ADARO BATERAI INDONESIA,84.0,RIBUAN,NAN,0,ADRO,ALAMTRI RESOURCES INDONESIA TBK
INVESTASI,102394,INDONESIA,USD,PT ADARO CLEAN ENERGY INDONESIA,100.0,RIBUAN,NAN,0,ADRO,ALAMTRI RESOURCES INDONESIA TBK
INVESTASI,166908,INDONESIA,USD,PT ADARO INDO ALUMINIUM,84.0,RIBUAN,NAN,0,ADRO,ALAMTRI RESOURCES INDONESIA TBK
JASA PERTAMBANGAN,2073595,INDONESIA,USD,PT ALAMTRI MINERALS INDONESIA TBK,84.0,RIBUAN,NAN,2016,ADRO,ALAMTRI RESOURCES INDONESIA TBK
INVESTASI,876078,INDONESIA,USD,PT ADARO POWER,87.0,RIBUAN,NAN,0,ADRO,ALAMTRI RESOURCES INDONESIA TBK
PENYEDIA TENAGA LISTRIK,261,INDONESIA,USD,PT ADARO SARANA ENERGI TERBARUKAN,100.0,RIBUAN,NAN,0,ADRO,ALAMTRI RESOURCES INDONESIA TBK
INVESTASI,273,INDONESIA,USD,PT ADARO WIND ENERGY,100.0,RIBUAN,NAN,0,ADRO,ALAMTRI RESOURCES INDONESIA TBK
INVESTASI,189616,INDONESIA,USD,PT ALAM TRI BANGUN INDONESIA,100.0,RIBUAN,NAN,0,ADRO,ALAMTRI RESOURCES INDONESIA TBK
INVESTASI,35769,INDONESIA,USD,PT ALAM TRI CAKRA INDONESIA,85.0,RIBUAN,NAN,0,ADRO,ALAMTRI RESOURCES INDONESIA TBK
INVESTASI,1342386,INDONESIA,USD,PT ALAM TRI DAYA INDONESIA,84.0,RIBUAN,NAN,0,ADRO,ALAMTRI RESOURCES INDONESIA TBK
"PENGGALIAN BATU, PASIR DAN TANAH LIAT LAINNYA",7,INDONESIA,USD,PT BASALT SINAR LESTARI,84.0,RIBUAN,NAN,0,ADRO,ALAMTRI RESOURCES INDONESIA TBK
PENYEDIAAN TENAGA LISTRIK,33146,INDONESIA,USD,PT BATAM SARANA SURYA,65.0,RIBUAN,NAN,0,ADRO,ALAMTRI RESOURCES INDONESIA TBK
INVESTASI,19,INDONESIA,USD,PT BATAM SURYA ENERGI,65.0,RIBUAN,NAN,0,ADRO,ALAMTRI RESOURCES INDONESIA TBK
PERTAMBANGAN,2121,INDONESIA,USD,PT BATUAN ANUGERAH SEMESTA,84.0,RIBUAN,NAN,0,ADRO,ALAMTRI RESOURCES INDONESIA TBK
PERTAMBANGAN BATU KAPUR,1734,INDONESIA,USD,PT BUMI ALAM SERAYA,84.0,RIBUAN,NAN,2024,ADRO,ALAMTRI RESOURCES INDONESIA TBK
TRANSMISI TENAGA LISTRIK,646,INDONESIA,USD,PT JARINGAN INTERKONEKSI BATAM ABADI,100.0,RIBUAN,NAN,0,ADRO,ALAMTRI RESOURCES INDONESIA TBK
TRANSMISI TENAGA LISTRIK,3012,INDONESIA,USD,PT JARINGAN INTERKONEKSI KARIMUN ABADI,100.0,RIBUAN,NAN,0,ADRO,ALAMTRI RESOURCES INDONESIA TBK
PERTAMBANGAN,26653,INDONESIA,USD,PT JULOI COAL,84.0,RIBUAN,NAN,0,ADRO,ALAMTRI RESOURCES INDONESIA TBK
PENGOLAHAN LOGAM,626344,INDONESIA,USD,PT KALIMANTAN ALUMINIUM INDUSTRY,54.0,RIBUAN,NAN,0,ADRO,ALAMTRI RESOURCES INDONESIA TBK
INVESTASI,71442,INDONESIA,USD,PT KALIMANTAN ENERGI HIJAU,100.0,RIBUAN,NAN,0,ADRO,ALAMTRI RESOURCES INDONESIA TBK
PERTAMBANGAN,2148,INDONESIA,USD,PT KALTENG COAL,84.0,RIBUAN,NAN,0,ADRO,ALAMTRI RESOURCES INDONESIA TBK
INVESTASI,10,INDONESIA,USD,PT KARIMUN INDUSTRI SURYA SEMESTA,90.0,RIBUAN,NAN,0,ADRO,ALAMTRI RESOURCES INDONESIA TBK
PENYEDIAAN TENAGA LISTRIK,5891,INDONESIA,USD,PT KARIMUN SARANA SURYA,90.0,RIBUAN,NAN,0,ADRO,ALAMTRI RESOURCES INDONESIA TBK
INVESTASI,279,INDONESIA,USD,PT KORIDOR ANUGERAH MENTARI INDONESIA,100.0,RIBUAN,NAN,0,ADRO,ALAMTRI RESOURCES INDONESIA TBK
PERTAMBANGAN,110652,INDONESIA,USD,PT LAHAI COAL,84.0,RIBUAN,NAN,2016,ADRO,ALAMTRI RESOURCES INDONESIA TBK
PERDAGANGAN DAN PEMBANGKITAN LISTRIK,130824,INDONESIA,USD,PT MAKMUR SEJAHTERA WISESA,87.0,RIBUAN,NAN,2013,ADRO,ALAMTRI RESOURCES INDONESIA TBK
PERTAMBANGAN,1210115,INDONESIA,USD,PT MARUWAI COAL,84.0,RIBUAN,NAN,2020,ADRO,ALAMTRI RESOURCES INDONESIA TBK
INVESTASI,64668,INDONESIA,USD,PT MENTARANG TIRTA ENERGI,100.0,RIBUAN,NAN,0,ADRO,ALAMTRI RESOURCES INDONESIA TBK
PENYEDIA TENAGA LISTRIK,4,INDONESIA,USD,PT PEMBANGKIT INDONESIA ALFA,100.0,RIBUAN,NAN,0,ADRO,ALAMTRI RESOURCES INDONESIA TBK
PENYEDIA TENAGA LISTRIK,91,INDONESIA,USD,PT PEMBANGKIT INDONESIA DELTA,100.0,RIBUAN,NAN,0,ADRO,ALAMTRI RESOURCES INDONESIA TBK
PENYEDIA TENAGA LISTRIK,2596,INDONESIA,USD,PT PEMBANGKIT INDONESIA EPSILON,100.0,RIBUAN,NAN,0,ADRO,ALAMTRI RESOURCES INDONESIA TBK
PENYEDIA TENAGA LISTRIK,1070,INDONESIA,USD,PT PEMBANGKIT INDONESIA ETA,100.0,RIBUAN,NAN,0,ADRO,ALAMTRI RESOURCES INDONESIA TBK
PENYEDIA TENAGA LISTRIK,3,INDONESIA,USD,PT PEMBANGKIT INDONESIA GAMMA,100.0,RIBUAN,NAN,0,ADRO,ALAMTRI RESOURCES INDONESIA TBK
PENYEDIA TENAGA LISTRIK,3,INDONESIA,USD,PT PEMBANGKIT INDONESIA ZETA,100.0,RIBUAN,NAN,0,ADRO,ALAMTRI RESOURCES INDONESIA TBK
JASA PERTAMBANGAN,879249,INDONESIA,USD,PT SAPTAINDRA SEJATI,100.0,RIBUAN,NAN,2002,ADRO,ALAMTRI RESOURCES INDONESIA TBK
PERTAMBANGAN,2173,INDONESIA,USD,PT SUMBER BARITO COAL,84.0,RIBUAN,NAN,0,ADRO,ALAMTRI RESOURCES INDONESIA TBK
PENGELOHAN RUMPUT LAUT,6988298664,MAKASSAR,IDR,PT GIWANG CITRA LAUT,99.99,PENUH,BELUM,2022,AGAR,PT ASIA SEJAHTERA MINA TBK
PERDAGANGAN DAN JASA,693652906946,BANDUNG,IDR,PT KAGUM MAHA KARYA JAYA,99.99,PENUH,OPERASI,2013,AKKU,PT ANUGERAH KAGUM KARYA UTAMA TBK
PERDAGANGAN DAN JASA,23053236,JAKARTA,IDR,PT KAMALA KHAN MAHA INVESTASI,99.99,PENUH,BELUM,0,AKKU,PT ANUGERAH KAGUM KARYA UTAMA TBK
JASA MANAJEMEN HOTEL,13437261740,BANDUNG,IDR,PT PERMATA NUSANTARA HOTELINDO,99.98,PENUH,OPERASI,2011,AKKU,PT ANUGERAH KAGUM KARYA UTAMA TBK
PERDAGANGAN,253581,HONG KONG,IDR,INTERNATIONAL RESOURCES LTD,98.0,RIBUAN,TIDAK AKTIF,1991,AKPI,ARGHA KARYA PRIMA IND. TBK
PERDAGANGAN,84000,SINGAPURA,IDR,CHEMICAL PETROLEUM INTERNATIONAL TRADING PTE LTD,100.0,JUTAAN,AKTIF,2024,AKRA,PT AKR CORPORINDO TBK
PERDAGANGAN KIMIA DASAR,79595,JAKARTA,IDR,PT AKR NIAGA INDONESIA,99.99,JUTAAN,AKTIF,2013,AKRA,PT AKR CORPORINDO TBK
PELAYARAN DOMESTIK,867263,JAKARTA,IDR,PT AKR SEA TRANSPORT,99.99,JUTAAN,AKTIF,2013,AKRA,PT AKR CORPORINDO TBK
JASA LOGISTIK,255182,JAKARTA,IDR,PT AKR TRANSPORTASI INDONESIA,99.9,JUTAAN,AKTIF,2013,AKRA,PT AKR CORPORINDO TBK
JASA LOGISTIK,612297,JAKARTA,IDR,PT ANDAHANESA ABADI,99.99,JUTAAN,AKTIF,1982,AKRA,PT AKR CORPORINDO TBK
"PERDAGANGAN, PERUSAHAAN HOLDING",2107729,JAKARTA,IDR,PT ANUGERAH KRIDA RETAILINDO,99.99,JUTAAN,AKTIF,2018,AKRA,PT AKR CORPORINDO TBK
PERDAGANGAN DAN PERTAMBANGAN BATUBARA,756,JAKARTA,IDR,PT ANUGRAH KARYA RAYA,99.99,JUTAAN,AKTIF,2011,AKRA,PT AKR CORPORINDO TBK
PABRIKAN BAHAN PEREKAT,377797,SURABAYA,IDR,PT ARJUNA UTAMA KIMIA,99.96,JUTAAN,AKTIF,1976,AKRA,PT AKR CORPORINDO TBK
DISTRIBUSI DAN PENGANGKUTAN,54898,SURABAYA,IDR,PT BERKAH BUANA ENERGI,65.0,JUTAAN,BELUM AKTIF,0,AKRA,PT AKR CORPORINDO TBK
"PEMBANGKITAN, PENGOPERASIAN, KONSTRUKSI DAN INSTALASI TENAGA LISTRIK",30914,SURABAYA,IDR,PT BERKAH RENEWABLE ENERGI,99.97,JUTAAN,BELUM AKTIF,0,AKRA,PT AKR CORPORINDO TBK
TERMINAL TANGKI PENYIMPANAN,1179575,JAKARTA,IDR,PT JAKARTA TANK TERMINAL,51.0,JUTAAN,AKTIF,2010,AKRA,PT AKR CORPORINDO TBK
JASA LOGISTIK,25083,SURABAYA,IDR,PT TERMINAL ENERGI PRIMER,99.99,JUTAAN,BELUM AKTIF,0,AKRA,PT AKR CORPORINDO TBK
JASA LOGISTIK,12171806,SURABAYA,IDR,PT USAHA ERA PRATAMA NUSANTARA,99.99,JUTAAN,AKTIF,2000,AKRA,PT AKR CORPORINDO TBK
PENGANGKUTAN DARAT,330226713259,"BATULICIN, KALIMANTAN SELATAN",IDR,PT REZKI BATULICIN TRANSPORT,99.76,PENUH,BEROPERASI,2012,AKSI,PT MINERAL SUMBERDAYA MANDIRI TBK
INDUSTRI/MANUFACTURING,267921379174,BANDUNG,IDR,PT ALFA POLIMER INDONESIA,99.0,PENUH,OPERASI,1998,ALDO,ALKINDO NARATAMA TBK
INDUSTRI/MANUFACTURING,1193420921356,SUBANG,IDR,PT ECO PAPER INDONESIA,99.0,PENUH,OPERASI,2014,ALDO,ALKINDO NARATAMA TBK
PERDAGANGAN/TRADING,277572103459,BANDUNG,IDR,PT SWISSTEX NARATAMA INDONESIA,99.0,PENUH,OPERASI,2006,ALDO,ALKINDO NARATAMA TBK
PERDAGANGAN BAHAN BAKU,566907378,HONG KONG,IDR,ALAKASA COMPANY LIMITED,100.0,RIBUAN,NAN,2000,ALKA,ALAKASA INDUSTRINDO TBK
PERDAGANGAN BAHAN BAKU,15719,HONG KONG,IDR,INDONESIA ALUMINA REFINERY LTD,99.0,RIBUAN,NAN,0,ALKA,ALAKASA INDUSTRINDO TBK
PERDAGANGAN BAHAN BAKU,14792544,INDONESIA,IDR,PT ALAKASA ALUMINA REFINERI,70.0,RIBUAN,NAN,0,ALKA,ALAKASA INDUSTRINDO TBK
INDUSTRI LOGAM,18366785,INDONESIA,IDR,PT ALAKASA ANDALAN MITRA SEJATI,99.0,RIBUAN,NAN,2019,ALKA,ALAKASA INDUSTRINDO TBK
REAL ESTAT YANG DIMILIKI SENDIRI ATAU DISEWA,13060228,INDONESIA,IDR,PT ALAKASA EXTRUSINDO,99.0,RIBUAN,NAN,2001,ALKA,ALAKASA INDUSTRINDO TBK
PERDAGANGAN,424352,INDONESIA,IDR,PT ALKA NIAGA INDUSTRI,99.0,RIBUAN,NAN,0,ALKA,ALAKASA INDUSTRINDO TBK
PERHOTELAN,181221339,BALI,IDR,PT MAKMUR BERKAH AMANDA HOTEL,87.99,RIBUAN,BEROPERASI,2018,AMAN,PT MAKMUR BERKAH AMANDA TBK
PERHOTELAN,177768121,PONTIANAK,IDR,PT MAKMUR BERKAH HOTEL,99.0,RIBUAN,PRA OPERASI,2024,AMAN,PT MAKMUR BERKAH AMANDA TBK
JASA PERBAIKAN DAN PEMASANGAN KACA OTOMOTIF,6060,INDONESIA,IDR,PT AUTO GLASS INDONESIA,99.95,JUTAAN,AKTIF,2001,AMFG,ASAHIMAS FLAT GLASS TBK
PERUSAHAAN INVESTASI,467840,SINGAPURA,IDR,ALFAMART RETAIL ASIA PTE LTD,100.0,JUTAAN,AKTIF,2014,AMRT,PT SUMBER ALFARIA TRIJAYA TBK
PENGOLAHANPENGEMBANGAN APLIKASI DATA DAN PERDAGANGAN SECARA E-COMMERCE,326624,TANGERANG,IDR,PT GLOBAL LOYALTY INDONESIA,75.0,JUTAAN,AKTIF,2014,AMRT,PT SUMBER ALFARIA TRIJAYA TBK
PERDAGANGAN ECERAN UNTUK PRODUK KONSUMEN,8355911,TANGERANG,IDR,MIDI UTAMA INDONESIA TBK,77.09,JUTAAN,AKTIF,2007,AMRT,PT SUMBER ALFARIA TRIJAYA TBK
PERDAGANGAN PERALATAN KESEHATAN,667487,TANGERANG,IDR,PT SUMBER INDAH LESTARI,65.0,JUTAAN,AKTIF,2013,AMRT,PT SUMBER ALFARIA TRIJAYA TBK
PERDAGANGAN BESAR UNTUK PRODUK KONSUMEN,1145225,TANGERANG,IDR,PT SUMBER TRIJAYA LESTARI,99.95,JUTAAN,AKTIF,2015,AMRT,PT SUMBER ALFARIA TRIJAYA TBK
AGRIBISNIS SAGU,11469945,"SORONG SELATAN, PAPUA BARAT",USD,PT ANJ AGRI PAPUA,99.99,PENUH,BEROPERASI,2017,ANJT,PT AUSTINDO NUSANTARA JAYA TBK
ENERGI TERBARUKAN,1220914,"BELITUNG, BANGKA BELITUNG",USD,PT AUSTINDO AUFWIND NEW ENERGY,99.22,PENUH,BEROPERASI,2013,ANJT,PT AUSTINDO NUSANTARA JAYA TBK
PERKEBUNAN KELAPA SAWIT,512087594,"BINANGA, SUMATERA UTARA",USD,PT AUSTINDO NUSANTARA JAYA AGRI,99.99,PENUH,BEROPERASI,1995,ANJT,PT AUSTINDO NUSANTARA JAYA TBK
PERKEBUNAN KELAPA SAWIT,44378609,"ANGKOLA SELATAN, SUMATERA UTARA",USD,PT AUSTINDO NUSANTARA JAYA AGRI SIAIS,99.99,PENUH,BEROPERASI,2009,ANJT,PT AUSTINDO NUSANTARA JAYA TBK
PRODUK KONSUMEN,86886,JAKARTA,USD,PT AUSTINDO NUSANTARA JAYA BOGA,99.99,PENUH,BEROPERASI,2014,ANJT,PT AUSTINDO NUSANTARA JAYA TBK
AGRIBISNIS,11374989,JEMBER,USD,PT GADING MAS INDONESIA TEGUH,80.0,PENUH,BEROPERASI,2000,ANJT,PT AUSTINDO NUSANTARA JAYA TBK
PERKEBUNAN KELAPA SAWIT,10352203,"EMPAT LAWANG, SUMATERA SELATAN",USD,PT GALEMPA SEJAHTERA BERSAMA,99.99,PENUH,BEROPERASI,2022,ANJT,PT AUSTINDO NUSANTARA JAYA TBK
PERKEBUNAN KELAPA SAWIT,84992982,"KETAPANG, KALIMANTAN BARAT",USD,PT KAYUNG AGRO LESTARI,99.99,PENUH,BEROPERASI,2014,ANJT,PT AUSTINDO NUSANTARA JAYA TBK
AGRIBISNIS SAGU,255103,"SORONG SELATAN, PAPUA",USD,PT LESTARI SAGU PAPUA,51.0,PENUH,PRA OPERASI,0,ANJT,PT AUSTINDO NUSANTARA JAYA TBK
PERKEBUNAN KELAPA SAWIT,90985058,"SORONG SELATAN, PAPUA",USD,PT PERMATA PUTERA MANDIRI,99.99,PENUH,BEROPERASI,2020,ANJT,PT AUSTINDO NUSANTARA JAYA TBK
PERKEBUNAN KELAPA SAWIT,116858567,"SORONG SELATAN DAN MAYBRAT, PAPUA",USD,PT PUTERA MANUNGGAL PERKASA,99.99,PENUH,BEROPERASI,2020,ANJT,PT AUSTINDO NUSANTARA JAYA TBK
PERKEBUNAN KELAPA SAWIT,76443771,"BELITUNG, BANGKA BELITUNG",USD,PT SAHABAT MEWAH DAN MAKMUR,99.99,PENUH,BEROPERASI,1994,ANJT,PT AUSTINDO NUSANTARA JAYA TBK
PERUSAHAAN INVESTASI,3887896,AUSTRALIA,IDR,ASIA PACIFIC NICKEL PTY LTD,100.0,JUTAAN,BEROPERASI,2003,ANTM,ANEKA TAMBANG TBK
EKSPLORASI DAN OPERATOR TAMBANG,183975,INDONESIA,IDR,PT ANTAM RESOURCINDO,99.99,JUTAAN,BEROPERASI,1997,ANTM,ANEKA TAMBANG TBK
"PEMBANGUNAN, PERDAGANGAN, PERINDUSTRIAN, PERTANIAN DAN PERTAMBANGAN",183096,INDONESIA,IDR,PT BORNEO EDO INTERNATIONAL,100.0,JUTAAN,TIDAK DIKETAHUI,0,ANTM,ANEKA TAMBANG TBK
"PERKEBUNAN, PERINDUSTRIAN, PENGANGKUTAN HASIL PERKEBUNAN, PERDAGANGAN DAN JASA",22923,INDONESIA,IDR,PT BORNEO EDO INTERNATIONAL AGRO,100.0,JUTAAN,TIDAK DIKETAHUI,0,ANTM,ANEKA TAMBANG TBK
"JASA, PERDAGANGAN, DAN PERINDUSTRIAN",13396,INDONESIA,IDR,PT BORNEO EDO SEJAHTERA,100.0,JUTAAN,TIDAK DIKETAHUI,0,ANTM,ANEKA TAMBANG TBK
"EKSPLORASI, KONSTRUKSI DAN PENGEMBANGAN TAMBANG, PENAMBANGAN, PRODUKSI, PENGOLAHAN DAN PEMURNIAN, PENGANGKUTAN DAN PENJUALAN DI INDUSTRI EMAS",126415,INDONESIA,IDR,PT CIBALIUNG SUMBERDAYA,100.0,JUTAAN,BEROPERASI,2010,ANTM,ANEKA TAMBANG TBK
EKSPLORASI DAN OPERATOR TAMBANG BATUBARA,9697,INDONESIA,IDR,PT CITRA TOBINDO SUKSES PERKASA,100.0,JUTAAN,BEROPERASI,2011,ANTM,ANEKA TAMBANG TBK
EKSPLORASI DAN OPERATOR TAMBANG,12720,INDONESIA,IDR,PT DWIMITRA ENGGANG KHATULISTIWA,100.0,JUTAAN,TIDAK DIKETAHUI,0,ANTM,ANEKA TAMBANG TBK
PERINDUSTRIAN DAN PERDAGANGAN,133746,INDONESIA,IDR,PT EMAS ANTAM INDONESIA,100.0,JUTAAN,BEROPERASI,2021,ANTM,ANEKA TAMBANG TBK
EKSPLORASI DAN OPERATOR TAMBANG NIKEL,4112468,INDONESIA,IDR,PT GAG NIKEL,100.0,JUTAAN,BEROPERASI,2018,ANTM,ANEKA TAMBANG TBK
