BidangUsaha,JumlahAset,Lokasi,MataUang,Nama,Persentase,Satuan,StatusOperasi,TahunKomersil,KodeEmiten,NamaEmiten
ASURANSI JIWA,9042595,"PANIN LIFE CENTRE LT. 6, JL. LETJEN S PARMAN KAV 91, JAKARTA",IDR,PT PANIN DAI-ICHI LIFE DIMILIKI PANIN INTERNASIONAL,95.0,JUTAAN,SUDAH BEROPERASI SECARA KOMERSIAL,1992,PNIN,PANINVEST TBK
"JASA KONSULTASI BISNIS, MANAJEMEN & ADMINISTRASI",35337263,"PANIN LIFE CENTRE, JL. LETJEN S PARMAN KAV 91, JAKARTA",IDR,PANIN FINANCIAL TBK,67.86,JUTAAN,SUDAH BEROPERASI SECARA KOMERSIAL,1974,PNIN,PANINVEST TBK
PERDAGANGAN DAN JASA,63749,JAKARTA,IDR,PT PANIN GENINHOLDCO,99.99,JUTAAN,BELUM BEROPERASIONAL,2021,PNIN,PANINVEST TBK
"JASA KONSULTASI BISNIS, MANAJEMEN DAN PENASEHAT KEUANGAN",3911252,"PANIN LIFE CENTRE LT. 6, JL. LETJEN S PARMAN KAV 91, JAKARTA",IDR,PT PANIN INTERNASIONAL,63.16,JUTAAN,BELUM BEROPERASI SECARA KOMERSIAL,1998,PNIN,PANINVEST TBK
KONSULTASI MANAJEMEN BISNIS DI BIDANG KEARSIPAN,3911252,"PANIN LIFE CENTER LT. 6, JL. LEDJEND S PARMAN KAV 91, JAKARTA",IDR,PT PANIN INTERNASIONAL,63.16,JUTAAN,TELAH BEROPERASI SECARA KOMERSIAL,1998,PNLF,PANIN FINANCIAL TBK
INVESTASI PENYERTAAN SAHAM LANGSUNG,295650629238,JAKARTA,IDR,PT ADIL BERKAT SENTOSA,99.99,PENUH,TIDAK BEROPERASI,0,POLI,PT POLLUX HOTELS GROUP TBK
"KONSTRUKSI, PENYEDIAAN AKOMODASI, PENYEDIAAN MAKAN MINUM DAN REAL ESTAT",0,BATAM,IDR,PT AMAN BERKAT CEMERLANG,99.99,PENUH,TIDAK BEROPERASI,0,POLI,PT POLLUX HOTELS GROUP TBK
"KONSTRUKSI, PENYEDIAAN AKOMODASI, PENYEDIAAN MAKAN MINUM DAN REAL ESTAT",0,BATAM,IDR,PT BATAM BINTANG BAHANA,99.99,PENUH,TIDAK BEROPERASI,0,POLI,PT POLLUX HOTELS GROUP TBK
"PEMBANGUNAN, JASA DAN PERDAGANGAN",18175632400,SEMARANG,IDR,PT BAWEN INVESTAMA PERDANA,99.99,PENUH,BEROPERASI,2019,POLI,PT POLLUX HOTELS GROUP TBK
"PEMBANGUNAN, JASA DAN PERDAGANGAN",33634547005,SEMARANG,IDR,PT BESEN CITRA PERMATA,99.99,PENUH,TIDAK BEROPERASI,0,POLI,PT POLLUX HOTELS GROUP TBK
"PEMBANGUNAN, JASA DAN PERDAGANGAN",234068023844,JAKARTA,IDR,PT BUMI PASIFIK KENCANA,99.99,PENUH,BEROPERASI,0,POLI,PT POLLUX HOTELS GROUP TBK
PEMBANGUNAN DAN PEMBERIAN JASA,360962130426,SEMARANG,IDR,PT BUMI WARDANA,99.99,PENUH,TIDAK BEROPERASI,0,POLI,PT POLLUX HOTELS GROUP TBK
MANAJEMEN PROPERTI DAN PEMBANGUNAN/PROPERTY MANAGEMENT AND DEVELOPMENT,2142585067,JAKARTA,IDR,PT CAKRAWALA BHAYANGKARA PERDANA,99.99,PENUH,TIDAK BEROPERASI,0,POLI,PT POLLUX HOTELS GROUP TBK
"PEMBANGUNAN,PENGELOLAAN DAN PENYEWAAN GEDUNG,PERKANTORAN, MALL, HOTEL,RUKO, DAN TAMAN HIBURAN/ CONSTRUCTION,MANAGEMENT AND RENTAL OF BUILDINGS, OFFICES,MALLS, HOTELS, SHOPHOUSES, AND AMUSEMENT PARKS",1502341501246,JAKARTA,IDR,PT CAKRAWALA SAKTI KENCANA,99.99,PENUH,BEROPERASI,2011,POLI,PT POLLUX HOTELS GROUP TBK
INVESTASI PENYERTAAN SAHAM LANGSUNG,1260973610922,JAKARTA,IDR,PT CEMERLANG SENTOSA MULIA,99.09,PENUH,TIDAK BEROPERASI,0,POLI,PT POLLUX HOTELS GROUP TBK
"PEMBANGUNAN, JASA DAN PERDAGANGAN",224568622814,SEMARANG,IDR,PT DUTA MEGAH LAKSANA,52.13,PENUH,BEROPERASI,2015,POLI,PT POLLUX HOTELS GROUP TBK
"PEMBANGUNAN, PERHOTELAN, DAN PENGELOLA APARTEMEN",186994761639,SEMARANG,IDR,PT GRAHA MASINDO PRATAMA,99.99,PENUH,BEROPERASI,2013,POLI,PT POLLUX HOTELS GROUP TBK
"PEMBANGUNAN, PERHOTELAN, DAN PENGELOLA APARTEMEN",48686057321,SEMARANG,IDR,PT GRAHA SATU TIGA TUJUH,99.98,PENUH,BEROPERASI,2013,POLI,PT POLLUX HOTELS GROUP TBK
"PEMBANGUNAN, JASA DAN PERDAGANGAN",981894996,SEMARANG,IDR,PT MATARAM GEMILANG ABADI,99.0,PENUH,TIDAK BEROPERASI,0,POLI,PT POLLUX HOTELS GROUP TBK
PEMBANGUNAN DAN PEMBERIAN JASA,64519557444,SEMARANG,IDR,PT MORINDO MASINDO,99.99,PENUH,BEROPERASI,2009,POLI,PT POLLUX HOTELS GROUP TBK
"PEMBANGUNAN, JASA DAN PERDAGANGAN",225978200297,SEMARANG,IDR,PT PAHALA AGUNG,99.99,PENUH,BEROPERASI,2013,POLI,PT POLLUX HOTELS GROUP TBK
PEMBANGUNAN DAN PEMBERIAN JASA,14395322100,JAKARTA,IDR,PT PASIFIK MASINDO,99.99,PENUH,TIDAK BEROPERASI,0,POLI,PT POLLUX HOTELS GROUP TBK
PEMBANGUNAN DAN PEMBERIAN JASA,10582762248,JAKARTA,IDR,PT PASIFIK ORIENTAL MASINDO,99.99,PENUH,TIDAK BEROPERASI,0,POLI,PT POLLUX HOTELS GROUP TBK
PERHOTELAN,20498206,SEMARANG,IDR,PT ROYAL PHANTOM PROPERTIES,99.99,PENUH,TIDAK BEROPERASI,0,POLI,PT POLLUX HOTELS GROUP TBK
KONSTRUKSI DAN REAL ESTAT,77904554203,JAKARTA,IDR,PT SCOTIA SENTOSA INDONESIA,99.88,PENUH,TIDAK BEROPERASI,0,POLI,PT POLLUX HOTELS GROUP TBK
"PEMBANGUNAN, JASA DAN PERDAGANGAN",191151672126,SEMARANG,IDR,PT SILIWANGI BIMANTARA PERDANA,99.98,PENUH,TIDAK BEROPERASI,0,POLI,PT POLLUX HOTELS GROUP TBK
PERHOTELAN,59068925826,SEMARANG,IDR,PT SINO PROPERTINDO INTERNASIONAL,99.0,PENUH,TIDAK BEROPERASI,0,POLI,PT POLLUX HOTELS GROUP TBK
MANAJEMEN PROPERTI DAN PEMBANGUNAN,11408559487,JAKARTA,IDR,PT WIDYA BHAKTI,99.99,PENUH,TIDAK BEROPERASI,0,POLI,PT POLLUX HOTELS GROUP TBK
PEMBANGUNAN DAN PEMBERIAN JASA,26572586927,JAKARTA,IDR,PT WISMA SEMBILAN DELAPAN,99.98,PENUH,TIDAK BEROPERASI,0,POLI,PT POLLUX HOTELS GROUP TBK
REAL ESTAT,0,SEMARANG,IDR,PT AIR BERKAT CEMERLANG,99.0,PENUH,TIDAK AKTIF,2022,POLU,PT GOLDEN FLOWER TBK
INDUSTRI & PERDAGANGAN GARMEN,0,SEMARANG,IDR,PT GFA SENTOSA INDONESIA,99.0,PENUH,TIDAK AKTIF,2021,POLU,PT GOLDEN FLOWER TBK
REAL ESTAT,0,SEMARANG,IDR,PT GUNUNG BERKAT SEMESTA,99.0,PENUH,TIDAK AKTIF,2022,POLU,PT GOLDEN FLOWER TBK
AKTIVITAS RUMAH SAKIT SWASTA,0,SEMARANG,IDR,PT RUMAH SAKIT MAJAPAHIT,99.0,PENUH,TIDAK AKTIF,2021,POLU,PT GOLDEN FLOWER TBK
PERDAGANGAN BESAR DAN ECERAN,0,SEMARANG,IDR,PT SEHAT MANDIRI SEMESTA,99.0,PENUH,TIDAK AKTIF,2023,POLU,PT GOLDEN FLOWER TBK
JASA KEUANGAN,682,BELANDA,USD,POLYSINDO INTERNATIONAL FINANCE COMPANY B.V,100.0,JUTAAN,NON AKTIF,1994,POLY,ASIA PACIFIC FIBERS TBK
GARMEN,167,JAKARTA,USD,PT TEXMACO GRAHA BUSANA,91.0,JUTAAN,PAILIT,1994,POLY,ASIA PACIFIC FIBERS TBK
TEKSTIL,228,KARAWANG,USD,PT TEXMACO JAYA TBK,92.0,JUTAAN,PAILIT,1972,POLY,ASIA PACIFIC FIBERS TBK
JASA HANDLING DAN STEVEDORING CONTAINER UNTUK KOMODITAS EKSPOR/IMPOR,1374017410,JAKARTA,IDR,PT MUSTIKA ALAM LESTARI,99.99,RIBUAN,2004,2004,PORT,PT NUSANTARA PELABUHAN HANDAL TBK
"PERDAGANGAN, OPERATOR TERMINAL DAN JASA PERBAIKAN DAN PEMELIHARAAN",317782536,JAKARTA,IDR,PT PARVI INDAH PERSADA,100.0,RIBUAN,2010,2010,PORT,PT NUSANTARA PELABUHAN HANDAL TBK
BONGKAR MUAT BARANG,526219103,JAKARTA,IDR,PT PBM ADIPURUSA,83.34,RIBUAN,1986,1986,PORT,PT NUSANTARA PELABUHAN HANDAL TBK
INVESTASI,3000000000,JAKARTA,IDR,PT ABC BALI LAUT,99.99,PENUH,PRA-OPERASI,0,POSA,PT BLISS PROPERTI INDONESIA TBK
PERDAGANGAN,155008109,JAKARTA,IDR,PT BERKAT PERDANA MAKMUR,99.99,PENUH,BEROPERASI,2019,POSA,PT BLISS PROPERTI INDONESIA TBK
PUSAT PERBELANJAAN DAN FASILITAS LAINNYA,197005662080,JAKARTA,IDR,PT BLISS PEMBANGUNAN SEJAHTERA,99.99,PENUH,BEROPERASI,2015,POSA,PT BLISS PROPERTI INDONESIA TBK
PROPERTI,3000000000,JAKARTA,IDR,PT BST PERLAUTAN BALI,99.99,PENUH,PRA-OPERASI,0,POSA,PT BLISS PROPERTI INDONESIA TBK
INVESTASI,174963388406,JAKARTA,IDR,PT LAHAN MAKMUR LNDAH,99.99,PENUH,BEROPERASI,2016,POSA,PT BLISS PROPERTI INDONESIA TBK
INVESTASI,164644406,JAKARTA,IDR,PT MERDEKA AGUNG SEMPURNA,99.99,PENUH,BEROPERASI,2016,POSA,PT BLISS PROPERTI INDONESIA TBK
"PUSAT PERBELANJAAN, HOTEL DAN FASILITAS LAINNYA",96098731170,JAKARTA,IDR,PT PUSAT BISNIS PONOROGO,99.99,PENUH,BEROPERASI,2013,POSA,PT BLISS PROPERTI INDONESIA TBK
INVESTASI,202944890216,JAKARTA,IDR,PT TANJUNG PINANG INDAH,99.99,PENUH,BEROPERASI,2016,POSA,PT BLISS PROPERTI INDONESIA TBK
PUSAT PERBELANJAAN DAN FASILITAS LAINNYA,202934242981,JAKARTA,IDR,PT TANJUNG PINANG SAKTI,90.0,PENUH,BEROPERASI,2016,POSA,PT BLISS PROPERTI INDONESIA TBK
PUSAT PERBELANJAAN DAN FASILITAS LAINNYA,174957468305,JAKARTA,IDR,PT UTAMA TEGUH ABADI,99.99,PENUH,PRA-OPERASI,0,POSA,PT BLISS PROPERTI INDONESIA TBK
"PT BAHTERA LISTRINDO JAYA DIDIRIKAN UNTUK INDUSTRI PENGOLAHAN, PENGANGKUTAN DAN PERGUDANGAN, AKTIVITAS PENYEWAAN DAN SEWA GUNA USAHA TANPA HAK OPSI, KETENAGAKERJAAN, AGEN PERJALANAN DAN USAHA LAINNYA",13777423,INDONESIA,IDR,PT BAHTERA LISTRINDO JAYA,99.99,PENUH,BEROPERASI,2018,POWR,PT CIKARANG LISTRINDO TBK
REAL ESTATE,5588571456,JAKARTA,IDR,PT AMAN BAE BERJAYA,99.99,PENUH,BELUM BEROPERASI,2023,PPGL,PT PRIMA GLOBALINDO LOGISTIK TBK
REAL ESTATE,23473226297,JAKARTA,IDR,PT AMAN BAE PERKASA,99.99,PENUH,BEROPERASI,2021,PPGL,PT PRIMA GLOBALINDO LOGISTIK TBK
REAL ESTATE,35337013275,JAKARTA,IDR,PT AMAN BAE SENTOSA,99.99,PENUH,BEROPERASI,2021,PPGL,PT PRIMA GLOBALINDO LOGISTIK TBK
ANGKUTAN MULTIMODA,200308239541,JAKARTA,IDR,PT ARMADA BERJAYA TRANS TBK,45.79,PENUH,BEROPERASI,2012,PPGL,PT PRIMA GLOBALINDO LOGISTIK TBK
JASA KONSTRUKSI,2934234589980,JAKARTA,IDR,PT LANCARJAYA MANDIRI ABADI,51.0,PENUH,BEROPERASI,1997,PPRE,PT PP PRESISI TBK
REALTI DAN PROPERTI,305016733389,SURABAYA,IDR,PT GITANUSA SARANA NIAGA,99.99,PENUH,BEROPERASI,1996,PPRO,PT PP PROPERTI TBK
REALTI DAN PROPERTI,86984478202,YOGYAKARTA,IDR,PT GRAHAPRIMA REALTINDO,99.0,PENUH,BELUM BEROPERASI,2018,PPRO,PT PP PROPERTI TBK
REALTI DAN PROPERTI,837585323959,BALIKPAPAN,IDR,PT HASTA KREASIMANDIRI,99.0,PENUH,BEROPERASI,1995,PPRO,PT PP PROPERTI TBK
REALTI DAN PROPERTI,81217329849,CILEGON,IDR,PT LIMASLAND REALTI CILEGON,70.0,PENUH,BELUM BEROPERASI,2018,PPRO,PT PP PROPERTI TBK
REALTI DAN PROPERTI,290060393709,PEKANBARU,IDR,PT PEKANBARU PERMAI PROPERTINDO,97.5,PENUH,BEROPERASI,2018,PPRO,PT PP PROPERTI TBK
REALTI DAN PROPERTI,400792036332,BEKASI,IDR,PT PP PROPERTI JABABEKA RESIDEN,52.6,PENUH,BELUM BEROPERASI,2016,PPRO,PT PP PROPERTI TBK
REALTI DAN PROPERTI,578233280442,SURABAYA,IDR,PT PP PROPERTI SURAMADU,60.0,PENUH,BELUM BEROPERASI,2018,PPRO,PT PP PROPERTI TBK
REALTI DAN PROPERTI,390014315215,MAJALENGKA,IDR,PT PPRO BIJB AEROCITY DEVELOPMENT,68.3,PENUH,BELUM BEROPERASI,2018,PPRO,PT PP PROPERTI TBK
REALTI DAN PROPERTI,753602575685,SURABAYA,IDR,PT PPRO SAMPURNA JAYA,77.14,PENUH,BELUM BEROPERASI,2017,PPRO,PT PP PROPERTI TBK
REALTI DAN PROPERTI,334966186103,DEPOK,IDR,PT WISMA SERATUS SEJAHTERA,55.0,PENUH,BEROPERASI,2012,PPRO,PT PP PROPERTI TBK
PORTAL WEB DAN/ATAU PLATFORM DIGITAL DENGAN TUJUAN KOMERSIAL,319318,"JL. KRAMAT RAYA NO. 150 LANTAI 9, DESA/KELURAHAN KENARI, KEC. SENEN, KOTA ADM. JAKARTA PUSAT",IDR,PT PRODIA DIGITAL INDONESIA,99.0,JUTAAN,AKTIF,2022,PRDA,PT PRODIA WIDYAHUSADA TBK
PERUSAHAAN JASA,11146,MALAYSIA,USD,J & P RESOURCES GOLD OHQ SDN BHD,99.99,PENUH,TIDAK DIKETAHUI,2008,PSAB,J RESOURCES ASIA PASIFIK TBK
PERTAMBANGAN,103842282,INGGRIS,USD,J RESOURCES GOLD LTD,99.99,PENUH,PRODUKSI,1996,PSAB,J RESOURCES ASIA PASIFIK TBK
PERUSAHAAN INVESTASI,119104624,BELANDA,USD,J RESOURCES NETHERLAND BV,99.99,PENUH,TIDAK DIKETAHUI,2002,PSAB,J RESOURCES ASIA PASIFIK TBK
PERTAMBANGAN,197634355,JAKARTA,USD,PT ARAFURA SURYA ALAM,99.99,PENUH,EKSPLORASI,0,PSAB,J RESOURCES ASIA PASIFIK TBK
PERTAMBANGAN,491460490,SULAWESI UTARA,USD,PT J RESOURCES BOLAANG MONGONDOW,79.99,PENUH,PRODUKSI,2004,PSAB,J RESOURCES ASIA PASIFIK TBK
JASA PERTAMBANGAN,17814851,SULAWESI UTARA,USD,PT J RESOURCES MINING SERVICES INDONESIA,99.97,PENUH,TIDAK DIKETAHUI,2020,PSAB,J RESOURCES ASIA PASIFIK TBK
PERDAGANGAN UMUM DAN JASA,888024289,JAKARTA,USD,PT J RESOURCES NUSANTARA,99.99,PENUH,TIDAK DIKETAHUI,2011,PSAB,J RESOURCES ASIA PASIFIK TBK
PERTAMBANAGAN,3625,JAKARTA,USD,PT MULIA BUMI PERSADA,99.79,PENUH,EKSPLORASI,0,PSAB,J RESOURCES ASIA PASIFIK TBK
PERTAMBANGAN,39,JAKARTA,USD,PT MULIA BUMI SERUYUNG,99.79,PENUH,EKSPLORASI,0,PSAB,J RESOURCES ASIA PASIFIK TBK
PERTAMBANGAN,81110928,JAKARTA,USD,PT SAGO PRIMA PRATAMA,99.79,PENUH,PRODUKSI,2014,PSAB,J RESOURCES ASIA PASIFIK TBK
PERTAMBANGAN,166491,JAKARTA,USD,PT SULAWESI ANUGERAH JAYA,99.96,PENUH,TIDAK DIKETAHUI,2020,PSAB,J RESOURCES ASIA PASIFIK TBK
PERTAMBANGAN,150803,JAKARTA,USD,PT SULAWESI BUKIT ANUGERAH,99.96,PENUH,TIDAK DIKETAHUI,0,PSAB,J RESOURCES ASIA PASIFIK TBK
JASA PERTAMBANGAN,5661529,MALAYSIA,USD,SPECIFIC RESOURCES SDN BHD,99.99,PENUH,TIDAK DIKETAHUI,1992,PSAB,J RESOURCES ASIA PASIFIK TBK
INDUSTRI DAN PERDAGANGAN,6321153663,SURABAYA,IDR,PT ANEKA BUMI KENCANA,99.99,PENUH,BEROPERASI,1984,PSDN,PRASIDHA ANEKA NIAGA TBK
PRODUKSI KOPI,519110184304,SURABAYA,IDR,PT ANEKA COFFEE INDUSTRY,69.15,PENUH,BEROPERASI,1995,PSDN,PRASIDHA ANEKA NIAGA TBK
INDUSTRI DAN PERDAGANGAN,421152196,SINGARAJA,IDR,PT TIRTHA HARAPAN BALI,99.99,PENUH,BEROPERASI,1973,PSDN,PRASIDHA ANEKA NIAGA TBK
PERKEBUNAN DAN PERINDUSTRIAN,1700310821148,JAKARTA,IDR,PT ANUGERAH ENERGITAMA,99.99,PENUH,BEROPERASI KOMERSIAL,2009,PSGO,PT PALMA SERASIH TBK
PERKEBUNAN,16271372,JAKARTA,IDR,PT ANUGERAH KEBUN KALTIM,99.0,PENUH,BELUM BEROPERASI,0,PSGO,PT PALMA SERASIH TBK
PERKEBUNAN,30288467678,JAKARTA,IDR,PT ANUGERAH KEBUN MANDIRI,99.0,PENUH,BELUM BEROPERASI,0,PSGO,PT PALMA SERASIH TBK
PERKEBUNAN,131066059985,JAKARTA,IDR,PT ANUGERAH LAHAN KALTIM,99.99,PENUH,BELUM BEROPERASI,0,PSGO,PT PALMA SERASIH TBK
KONSTRUKSI,35537981067,KALIMANTAN TIMUR,IDR,PT BATU BORNEO PERDANA,99.98,PENUH,BEROPERASI KOMERSIAL,2013,PSGO,PT PALMA SERASIH TBK
PERKEBUNAN,709583814,KALIMANTAN TIMUR,IDR,PT CIPTA HIJAU BUMI ETAM,99.99,PENUH,NAN,0,PSGO,PT PALMA SERASIH TBK
PERKEBUNAN,317737190180,JAKARTA,IDR,PT GLOBAL PRIMATAMA MANDIRI,99.99,PENUH,BEROPERASI KOMERSIAL,2016,PSGO,PT PALMA SERASIH TBK
PERKEBUNAN DAN PERINDUSTRIAN,945657770316,JAKARTA,IDR,PT NUSARAYA AGRO SAWIT,99.99,PENUH,BEROPERASI KOMERSIAL,2015,PSGO,PT PALMA SERASIH TBK
"PERKEBUNAN, PERDAGANGAN DAN PERINDUSTRIAN",362180141961,JAKARTA,IDR,PT PALMA SERASIH INTERNASIONAL,99.99,PENUH,BEROPERASI KOMERSIAL,2020,PSGO,PT PALMA SERASIH TBK
JASA AKOMODASI,8179983,JAKARTA,IDR,PT PLANET MERAH DELAPAN,99.66,PENUH,PRA OPERASI,0,PSKT,PT RED PLANET INDONESIA TBK
PERDAGANGAN UMUM,4493015779,JAKARTA,IDR,PT PLANET MERAH DEPOK,99.98,PENUH,PRA OPERASI,0,PSKT,PT RED PLANET INDONESIA TBK
JASA AKOMODASI,7169680,JAKARTA,IDR,PT PLANET MERAH SEMBILAN,99.6,PENUH,PRA OPERASI,0,PSKT,PT RED PLANET INDONESIA TBK
JASA AKOMODASI,9386560,JAKARTA,IDR,PT PLANET MERAH SEPULUH,99.93,PENUH,PRA OPERASI,0,PSKT,PT RED PLANET INDONESIA TBK
JASA AKOMODASI,51797446995,BEKASI,IDR,PT RED PLANET HOTEL BEKASI,99.99,PENUH,BEROPERASI,2014,PSKT,PT RED PLANET INDONESIA TBK
JASA AKOMODASI,61538393836,MAKASSAR,IDR,PT RED PLANET HOTEL MAKASSAR,99.99,PENUH,BEROPERASI,2014,PSKT,PT RED PLANET INDONESIA TBK
JASA AKOMODASI,86569531255,PALEMBANG,IDR,PT RED PLANET HOTEL PALEMBANG,99.99,PENUH,BEROPERASI,2014,PSKT,PT RED PLANET INDONESIA TBK
JASA AKOMODASI,64171163046,PEKANBARU,IDR,PT RED PLANET HOTEL PEKANBARU,99.99,PENUH,BEROPERASI,2013,PSKT,PT RED PLANET INDONESIA TBK
JASA AKOMODASI,69611167463,SURABAYA,IDR,PT RED PLANET HOTEL SURABAYA,99.99,PENUH,BEROPERASI,2014,PSKT,PT RED PLANET INDONESIA TBK
JASA AKOMODASI,83098028289,JAKARTA,IDR,PT RED PLANET HOTELS INDONESIA,99.99,PENUH,BEROPERASI,2012,PSKT,PT RED PLANET INDONESIA TBK
JASA AKOMODASI,60968734555,SOLO,IDR,PT RED PLANET HOTELS SOLO,99.99,PENUH,BEROPERASI,2013,PSKT,PT RED PLANET INDONESIA TBK
JASA AKOMODASI,2385378657,TANGERANG,IDR,PT RED PLANET HOTELS TANGERANG,99.98,PENUH,PRA OPERASI,0,PSKT,PT RED PLANET INDONESIA TBK
"PEMBANGUNAN, PERDAGANGAN, PERINDUSTRIAN, PENGANGKUTAN DARAT, PERTANIAN, PERCETAKAN, PERBENGKELAN DAN JASA",1461721752,JAKARTA,IDR,PT SOLUSI BINTANG CEMERLANG,99.95,PENUH,PRA OPERASI,0,PSKT,PT RED PLANET INDONESIA TBK
JASA ANGKUTAN LAUT,7443400,SINGAPURA,USD,PELITA LOGISTIC PTE LTD,100.0,PENUH,BELUM BEROPERASI,0,PSSI,PT IMC PELITA LOGISTIK TBK
JASA ANGKUTAN LAUT,96776667,JAKARTA,USD,PT PELITA GLOBAL LOGISTIK,99.0,PENUH,BEROPERASI,2021,PSSI,PT IMC PELITA LOGISTIK TBK
JASA ANGKUTAN LAUT,13879989,JAKARTA,USD,PT PELITA SAMUDERA SREEYA,99.0,PENUH,BEROPERASI,2023,PSSI,PT IMC PELITA LOGISTIK TBK
JASA ANGKUTAN LAUT,21458651,JAKARTA,USD,PT PUSAKA LAUTAN BERLIAN,99.0,PENUH,BEROPERASI,2022,PSSI,PT IMC PELITA LOGISTIK TBK
PENAMBANGAN BATUBARA,55010,TANJUNG ENIM,IDR,PT BATUBARA BUKIT KENDI,99.39,JUTAAN,DIHENTIKAN SEMENTARA,1997,PTBA,BUKIT ASAM TBK
PERTAMBANGAN DAN PERDAGANGAN,313,"TANJUNG ENIM, SUMATERA SELATAN",IDR,PT BUKIT ASAM BANKO,99.99,JUTAAN,BELUM BEROPERASI,0,PTBA,BUKIT ASAM TBK
"RUMAH SAKIT, KLINIK, POLIKLINIK, POLIKLINIK SPESIALIS, DAN BALAI PENGOBATAN",107029,TANJUNG ENIM,IDR,PT BUKIT ASAM MEDIKA,97.5,JUTAAN,OPERASI,2014,PTBA,BUKIT ASAM TBK
PENAMBANGAN GAS METANA BATUBARA,73,JAKARTA,IDR,PT BUKIT ASAM METANA ENIM,99.99,JUTAAN,BELUM BEROPERASI,0,PTBA,BUKIT ASAM TBK
PENAMBANGAN GAS METANA BATUBARA,34,JAKARTA,IDR,PT BUKIT ASAM METANA OMBILIN,99.99,JUTAAN,BELUM BEROPERASI,0,PTBA,BUKIT ASAM TBK
PERDAGANGAN BATUBARA,749894,JAKARTA,IDR,PT BUKIT ASAM PRIMA,99.99,JUTAAN,OPERASI,2007,PTBA,BUKIT ASAM TBK
MELAKUKAN INVESTASI,254991,JAKARTA,IDR,PT BUKIT ENERGI INVESTAMA,99.6,JUTAAN,OPERASI,2015,PTBA,BUKIT ASAM TBK
"PERDAGANGAN, JASA, PERBENGKELAN, PEMBANGUNAN, PERINDUSTRIAN, DAN PENGANGKUTAN",173853,JAKARTA,IDR,PT BUKIT ENERGI SERVICE TERPADU,99.62,JUTAAN,OPERASI,2015,PTBA,BUKIT ASAM TBK
MELAKUKAN INVESTASI PADA PERUSAHAAN LAIN,3884637,JAKARTA,IDR,PT BUKIT MULTI INVESTAMA,99.91,JUTAAN,OPERASI,2014,PTBA,BUKIT ASAM TBK
REAL ESTATE DAN KONSTRUKSI,47389,JAKARTA,IDR,PT BUKIT MULTI PROPERTI,99.9,JUTAAN,OPERASI,2019,PTBA,BUKIT ASAM TBK
PRODUSEN ENERGI LISTRIK,5390309,TANJUNG ENIM,IDR,PT BUKIT PEMBANGKIT INNOVATIVE,59.75,JUTAAN,OPERASI,2015,PTBA,BUKIT ASAM TBK
PELAYARAN,461094,JAKARTA,IDR,PT BUKIT PRIMA BAHARI,99.99,JUTAAN,OPERASI,2014,PTBA,BUKIT ASAM TBK
JASA ANGKUTAN BATUBARA,112685,JAKARTA,IDR,PT BUKITASAM TRANSPACIFIC RAILWAY,10.0,JUTAAN,BELUM BEROPERASI,0,PTBA,BUKIT ASAM TBK
PERKEBUNAN KELAPA SAWIT DAN HASIL OLAHAN KELAPA SAWIT,812893,TANJUNG AGUNG,IDR,PT BUMI SAWINDO PERMAI,99.99,JUTAAN,OPERASI,2007,PTBA,BUKIT ASAM TBK
PRODUSEN ENERGI LISTRIK,37096385,TANJUNG ENIM,IDR,PT HUADIAN BUKIT ASAM POWER,45.0,JUTAAN,OPERASI,2023,PTBA,BUKIT ASAM TBK
PENAMBANGAN BATUBARA,698178,"PALARAN, KALIMANTAN",IDR,PT INTERNASIONAL PRIMA COAL,51.0,JUTAAN,OPERASI,2010,PTBA,BUKIT ASAM TBK
JASA PELABUHAN,143696,JAKARTA,IDR,PT PELABUHAN BUKIT PRIMA,99.99,JUTAAN,OPERASI,2014,PTBA,BUKIT ASAM TBK
JASA PELABUHAN,37575,JAKARTA,IDR,PT PENAJAM INTERNASIONAL TERMINAL,72.0,JUTAAN,OPERASI,2016,PTBA,BUKIT ASAM TBK
JASA PENAMBANGAN,2025547,TANJUNG ENIM,IDR,PT SATRIA BAHANA SARANA,95.0,JUTAAN,OPERASI,2014,PTBA,BUKIT ASAM TBK
INFRASTRUKTUR,468518,JAKARTA,IDR,PT SINERGI MITRA LESTARI,25.0,JUTAAN,DALAM TAHAP PENGEMBAGAN,2019,PTBA,BUKIT ASAM TBK
MENDIRIKAN DAN MENJALAN USAHA REAL ESTAT PERGUDANGAN,25569745,JAKARTA SELATAN,IDR,PT DINAMIKA USAHA PERGUDANGAN,99.6,PENUH,BELUM BEROPERASI,2021,PTDU,PT DJASA UBERSAKTI TBK
REAL ESTAT,9761095187,JAKARTA SELATAN,IDR,PT DINAMIKA USAHA PROPERTINDO,64.21,PENUH,BEROPERASI,2022,PTDU,PT DJASA UBERSAKTI TBK
REAL ESTAT,15059492755,JAKARTA SELATAN,IDR,PT DJASA UBERSAKTI PROPERTI,99.8,PENUH,BELUM BEROPERASI,2021,PTDU,PT DJASA UBERSAKTI TBK
PELAYARAN DALAM NEGERI,24521161,JAKARTA,USD,PT PELAYARAN STRAITS PERDANA,99.99,PENUH,AKTIF,2011,PTIS,INDO STRAITS TBK
JASA KONTRAKTOR TAMBANG,12108556,JAKARTA,USD,PT STRAITS MINING SERVICES,99.0,PENUH,AKTIF,2011,PTIS,INDO STRAITS TBK
INDUSTRI MORTAR ATAU BETON SIAP PAKAI,23316941275,"KOMP. GREEN VILLE BLOK AW NO. 65 RT/RW. 007/014, KEL. DURI KEPA, KEC. KEBON JERUK, JAKARTA",IDR,PT PRATAMA BETON NUSANTARA,99.0,PENUH,AKTIF,2023,PTPW,PT PRATAMA WIDYA TBK
"SOLUTION PROVIDER IN GEOLOGY, MINING AND EPC",2768,AUSTRALIA,USD,PETROS SOLUTION PTY LTD,100.0,RIBUAN,ACTIVE,2021,PTRO,PETROSEA TBK
MINING SUPPORT SERVICES,65130,SOUTH TANGERANG,USD,PT KARYA BHUMI LESTARI,99.99,RIBUAN,ACTIVE,2018,PTRO,PETROSEA TBK
COAL MINING,14473,SOUTH TANGERANG,USD,PT KEMILAU MULIA SAKTI,99.99,RIBUAN,ACTIVE,2023,PTRO,PETROSEA TBK
TRADING AND CONTRACTOR,964,BALIKPAPAN,USD,PT KINARYA BANGUN SESAMA,99.99,RIBUAN,ACTIVE,2021,PTRO,PETROSEA TBK
"PORT OPERATION, TRANSPORTATION CONTRACTING , AND THE RENDERING OF SERVICE",13019,SOUTH JAKARTA,USD,PT KUALA PELABUHAN INDONESIA,95.0,RIBUAN,ACTIVE,1995,PTRO,PETROSEA TBK
"HOLDING COMPANY, PROFESSIONAL ACTIVITIES, SCIENTIFIC AND TECHNIQUE",310,WEST JAKARTA,USD,PT PETROSEA INFRASTRUKTUR NUSANTARA,99.9,RIBUAN,ACTIVE,2024,PTRO,PETROSEA TBK
SPECIAL PORT MANAGEMENT,1980,SOUTH TANGERANG,USD,PT POSB INFRASTRUCTURE INDONESIA,99.8,RIBUAN,ACTIVE,2015,PTRO,PETROSEA TBK
ENGINEERING SERVICES,412,SOUTH TANGERANG,USD,PT REKAKARSA KARYA NUSANTARA,99.9,RIBUAN,ACTIVE,2022,PTRO,PETROSEA TBK
INVESTMENT,3,SINGAPORE,USD,PTP INVESTMENT PTE LTD,100.0,RIBUAN,DORMANT,2005,PTRO,PETROSEA TBK
PENGEPISAN LOGAM/METAL STAMPING,6154436,BATAM,USD,PT SM ENGINEERING,99.96,PENUH,AKTIF,2002,PTSN,SAT NUSAPERSADA TBK
JASA/SERVICES,0,BATAM,USD,PT SNI INTERNASIONAL,99.98,PENUH,TAHAP PENGEMBANGAN/DEVELOPMENT STAGE,0,PTSN,SAT NUSAPERSADA TBK
PERDAGANGAN ECERAN SOFTWARE/SOFTWARE RETAIL TRADING,2982,BATAM,USD,PT TATA SARANA NUSAPERSADA,50.0,PENUH,TAHAP PENGEMBANGAN/DEVELOPMENT STAGE,0,PTSN,SAT NUSAPERSADA TBK
RESTORAN CEPAT SAJI RAMEN,22623805,JAKARTA,IDR,PT PIONEERINDO SUGAKICO INDONESIA,65.0,RIBUAN,AKTIF,2017,PTSP,PIONEERINDO GOURMET INTERNATIONAL TBK
RESTORAN AYAM GORENG,44046411,BANDUNG,IDR,PT PUTRA ASIA PERDANA INDAH,51.0,RIBUAN,AKTIF,1985,PTSP,PIONEERINDO GOURMET INTERNATIONAL TBK
REAL ESTATE,8264858574,JAKARTA,IDR,PT GRAHA PUJI BAHANA,99.96,PENUH,DALAM PENGEMBANGAN,0,PUDP,PUDJIADI PRESTIGE TBK
REAL ESTAT,167984423315,JAKARTA,IDR,PT GRAHA PUJI PROPERTINDO,99.99,PENUH,OPEASI,2013,PUDP,PUDJIADI PRESTIGE TBK
PERHOTELAN,80332765555,BANTEN,IDR,PT HOTEL MARBELLA PENGEMBANG INTERNASIONAL,99.14,PENUH,OPERASI,1997,PUDP,PUDJIADI PRESTIGE TBK
REAL ESTAT,29465917412,JAKARTA,IDR,PT JAKARTA INTERNASIONAL PROPERTY,99.9,PENUH,OPERASI,2001,PUDP,PUDJIADI PRESTIGE TBK
PENGELOLAAN GEDUNG,33026138915,JAKARTA,IDR,PT JAKARTA INTERNATIONAL PROPERTY MANAGEMENT,99.0,PENUH,NON AKTIF,2001,PUDP,PUDJIADI PRESTIGE TBK
REAL ESTATE,6353286662,SERANG,IDR,PT KOTA SERANG BARU PERMAI,90.0,PENUH,OPERASI,1996,PUDP,PUDJIADI PRESTIGE TBK
REAL ESTAT,258319517,JAKARTA,IDR,PT MARBELLA PROPERTY,99.9,PENUH,TIDAK OPERASI,0,PUDP,PUDJIADI PRESTIGE TBK
REAL ESTAT,396031512,JAKARTA,IDR,PT PUDJIADI GAPURA VILLA ARBELAH,64.7,PENUH,TIDAK OPERASI,0,PUDP,PUDJIADI PRESTIGE TBK
REAL ESTATE,396031512,ANYER,IDR,PT PUDJIADI GAPURA VILLA MARBELLA,64.7,PENUH,DALAM PENGEMBANGAN,0,PUDP,PUDJIADI PRESTIGE TBK
REAL ESTAT,10532211633,JAKARTA,IDR,PT UBUD BALI ASRI,99.99,PENUH,TIDAK OPERASI,0,PUDP,PUDJIADI PRESTIGE TBK
PROPERTI,317574212554,PULAU BATAM,IDR,PT PURI KARYA BERSAMA,70.0,PENUH,BEROPERASI,2021,PURI,PT PURI GLOBAL SUKSES TBK
PROPERTI,17094701328,PULAU BATAM,IDR,PT PURI PERMAI INTISENTOSA SUKSES,60.0,PENUH,BEROPERASI,2023,PURI,PT PURI GLOBAL SUKSES TBK
PENGEMBANG PROPERTI,2976715721,JAKARTA,IDR,PT ARTISAN WAHYU,83.33,RIBUAN,GANDARIA CITY,2010,PWON,PAKUWON JATI TBK
PENGEMBANG PROPERTI,202356840,JAKARTA,IDR,PT CEMERLANG INDO PROPERTI,90.0,RIBUAN,BELUM BEROPERASI,0,PWON,PAKUWON JATI TBK
PENGEMBANG PROPERTI,618001429,JAKARTA,IDR,PT CENTRUM UTAMA PRIMA,70.0,RIBUAN,BELUM BEROPERASI,0,PWON,PAKUWON JATI TBK
PENGEMBANG PROPERTI,461253167,SURABAYA,IDR,PT DWIJAYA MANUNGGAL,75.0,RIBUAN,ROYAL PLAZA,2006,PWON,PAKUWON JATI TBK
PENGEMBANG PROPERTI,6101895977,JAKARTA,IDR,PT ELITE PRIMA HUTAMA,99.99,RIBUAN,KOTA KASABLANKA,2012,PWON,PAKUWON JATI TBK
PENGEMBANG PROPERTI,2107072513,JAKARTA,IDR,PT GRAMA PRAMESI SIDDHI,83.73,RIBUAN,PAKUWON MALL BEKASI,2020,PWON,PAKUWON JATI TBK
PENGEMBANG PROPERTI,25328284,JAKARTA,IDR,PT PAKUWON NUSANTARA ABADI,99.99,RIBUAN,BELUM BEROPERASI,0,PWON,PAKUWON JATI TBK
PENGEMBANG PROPERTI,8305262696,SURABAYA,IDR,PT PAKUWON PERMAI,67.13,RIBUAN,PAKUWON MALL,2003,PWON,PAKUWON JATI TBK
TIDAK AKTIF / DORMANT,2052700,SURABAYA,IDR,PT PAKUWON REGENSI,51.0,RIBUAN,TIDAK AKTIF / DORMANT,0,PWON,PAKUWON JATI TBK
PENGEMBANG PROPERTI,655487087,JAKARTA,IDR,PT PAKUWON SENTOSA ABADI,99.92,RIBUAN,BLOK M PLAZA,1991,PWON,PAKUWON JATI TBK
PENGEMBANG PROPERTI,320783031,JAKARTA,IDR,PT PERMATA BERLIAN REALTY,99.99,RIBUAN,SOMERSET,2007,PWON,PAKUWON JATI TBK
KONSTRUKSI,25043921,SURABAYA,IDR,PT PRIMA CIPTA KONSTRUKSI,99.99,RIBUAN,BELUM BEROPERASI,0,PWON,PAKUWON JATI TBK
NAN,586010525197,INDONESIA,IDR,PT ETHICA INDUSTRI FARMASI,99.99,PENUH,SUDAH BEROPERASI,1946,PYFA,PT PYRIDAM FARMA TBK
"INDUSTRI KIMIA DASAR ORGANIK YANG MENGHASILKAN BAHAN KIMIA KHUSUS, INDUSTRI SABUN DAN BAHAN PEMBERSIH KEPERLUAN RUMAH TANGGA, INDUSTRI KOSMETIK UNTUK MANUSIA, TERMASUK PASTA GIGI, INDUSTRI BAHAN FARMASI UNTUK MANUSIA, INDUSTRI PRODUK FARMASI UNTUK MANUSIA",373606406484,INDONESIA,IDR,PT HOLI PHARMA,99.99,PENUH,SUDAH BEROPERASI,1968,PYFA,PT PYRIDAM FARMA TBK
"PERDAGANGAN BESAR ATAS OBAT FARMASI, OBAT TRADISIONAL, KOSMETIK, ALAT LABORATORIUM, ALAT FARMASI, ALAT KEDOKTERAN DAN PELATIHAN KERJA INDUSTRI KREATIF",6365841,INDONESIA,IDR,PT PYFA AETHERIA INDONESIA,99.0,PENUH,BELUM BEROPERASI,0,PYFA,PT PYRIDAM FARMA TBK
"PERDAGANGAN BESAR ATAS DASAR BALAS JASA ATAU KONTRAK, AKTIVITAS PERUSAHAAN HOLDING, AKTIVITAS AKUNTANSI, PEMBUKUAN DAN PEMERIKSA, AKTIVITAS KONSULTASI MANAJEMEN LAINNYA, AKTIVITAS KONSULTASI BISNIS DAN BROKER BISNIS, DAN AKTIVITAS PENYEDIA GABUNGAN JASA ADMINISTRASI KANTOR",28384651222,INDONESIA,IDR,PT PYFA INVESTAMA MEDIKA,99.0,PENUH,SUDAH BEROPERASI,2022,PYFA,PT PYRIDAM FARMA TBK
"PORTAL WEB DAN/ATAU PLATFORM DIGITAL DENGAN TUJUAN KOMERSIAL, PERDAGANGAN ECERAN BARANG DAN OBAT FARMASI UNTUK MANUSIA DI APOTIK, PERDAGANGAN ECERAN BARANG DAN OBAT FARMASI UNTUK MANUSIA BUKAN DI APOTIK",22640367573,INDONESIA,IDR,PT PYFA SEHAT INDONESIA,99.0,PENUH,BELUM BEROPERASI,0,PYFA,PT PYRIDAM FARMA TBK
NAN,4214740583600,AUSTRALIA,IDR,PYFA AUSTRALIA PTY LTD,100.0,PENUH,SUDAH BEROPERASI,2024,PYFA,PT PYRIDAM FARMA TBK
"PENJUALAN ECERAN SUPLEMEN KESEHATAN, PENJUALAN ECERAN KOSMETIK DAN PERLENGKAPAN MANDI (TERMASUK PRODUK PERAWATAN KULIT",4300406542752,SINGAPURA,IDR,PYFA HEALTH SINGAPORE PTE LTD,99.0,PENUH,SUDAH BEROPERASI,2024,PYFA,PT PYRIDAM FARMA TBK
JASA PENYEDIAAN FASILITAS LPG,4562,JAKARTA,USD,PT HEKSA ENERGI MITRANIAGA,85.0,RIBUAN,BEROPERASI,2020,RAJA,RUKUN RAHARJA TBK
INVESTASI,99813,JAKARTA,USD,PT PANJI RAYA ALAMINDO,67.0,RIBUAN,BEROPERASI,2007,RAJA,RUKUN RAHARJA TBK
JASA ENERGI,6612,JAKARTA,USD,PT PETROTECH PENTA NUSA,100.0,RIBUAN,BEROPERASI,2004,RAJA,RUKUN RAHARJA TBK
