Jumlah,Kategori,Nama,Pengendali,Persentase,KodeEmiten,NamaEmiten
1193171513.0,More Than 5%,ASTRA INTERNATIONAL TBK,True,61.99,AALI,ASTRA AGRO LESTARI TBK
1592831618.0,More Than 5%,PT BEYOND MEDIA,True,40.47,ABBA,MAHAKA MEDIA TBK
542042122.0,More Than 5%,PT SOLIC KREASI BARU,False,13.77,ABBA,MAHAKA MEDIA TBK
282886300.0,More Than 5%,MEDIAHUIS IRELAND LIMITED,False,7.19,ABBA,MAHAKA MEDIA TBK
538555304.0,More Than 5%,OONA INDONESIA PTE LTD,True,86.75,ABDA,ASURANSI BINA DANA ARTA TBK
1474573133.0,More Than 5%,PT TIARA MARGA TRAKINDO,True,53.55,ABMM,ABM INVESTAMA TBK
702349867.0,More Than 5%,VALLE VERDE PTE LTD,True,25.51,ABMM,ABM INVESTAMA TBK
10272189700.0,More Than 5%,PT KAWAN LAMA SEJAHTERA,True,60.0,ACES,PT ASPIRASI HIDUP INDONESIA TBK
16115027968.0,More Than 5%,PT KARYA SUPRA PERKASA,True,91.17,ACST,PT ACSET INDONUSA TBK
19999900000.0,More Than 5%,PT ADHI KARYA (PERSERO) TBK,True,89.9995,ADCP,PT ADHI COMMUTER PROPERTI TBK
100000.0,More Than 5%,KOPERASI JASA ADHI SEJAHTERA,False,0.0004,ADCP,PT ADHI COMMUTER PROPERTI TBK
538896713.0,More Than 5%,WATER PARTNERS BOTTLING SA,True,91.3544,ADES,AKASHA WIRA INTERNATIONAL TBK
5408773791.0,More Than 5%,PT DANANTARA ASSET MANAGEMENT (PERSERO),False,64.33,ADHI,PT ADHI KARYA (PERSERO) TBK
1.0,More Than 5%,NEGARA REPUBLIK INDONESIA,True,0.0,ADHI,PT ADHI KARYA (PERSERO) TBK
920700000.0,More Than 5%,PT BANK DANAMON INDONESIA TBK,True,92.07,ADMF,ADIRA DINAMIKA MULTI FINANCE TBK
1925414417.0,More Than 5%,PROVESTMENT LIMITED,True,50.0,ADMG,POLYCHEM INDONESIA TBK
994150000.0,More Than 5%,GAJAH TUNGGAL TBK,False,26.0,ADMG,POLYCHEM INDONESIA TBK
405356593.0,More Than 5%,PT SATYA MULIA GEMA GEMILANG,False,10.0,ADMG,POLYCHEM INDONESIA TBK
34525541100.0,More Than 5%,ALAMTRI RESOURCES INDONESIA TBK,True,84.451,ADMR,PT ALAMTRI MINERALS INDONESIA TBK
14045425500.0,More Than 5%,PT ADARO STRATEGIC INVESTMENT,True,45.663,ADRO,ALAMTRI RESOURCES INDONESIA TBK
450000000.0,More Than 5%,PT INDO KREASI PRATAMA,True,45.0,AGAR,PT ASIA SEJAHTERA MINA TBK
299927300.0,More Than 5%,PT SINAR TERANG ASIA RAYA,False,29.99,AGAR,PT ASIA SEJAHTERA MINA TBK
21487162037.0,More Than 5%,PT BANK RAKYAT INDONESIA (PERSERO) TBK,True,86.8502,AGRO,PT BANK RAYA INDONESIA TBK
43792362385.0,More Than 5%,INDUSTRIAL BANK OF KOREA,True,91.49,AGRS,PT BANK IBK INDONESIA TBK
3066343009.0,More Than 5%,PT ASURANSI CENTRAL ASIA,True,62.578,AHAP,ASURANSI HARTA AMAN PRATAMA TBK
88756991.0,More Than 5%,PT AIMS INDO INVESTAMA,True,40.34,AIMS,PT ARTHA MAHIYA INVESTAMA TBK
68493151.0,More Than 5%,PT DELTA WIBAWA BERSAMA,False,31.13,AIMS,PT ARTHA MAHIYA INVESTAMA TBK
5430357300.0,More Than 5%,PT PANGAN SEJAHTERA INVESTAMA,True,58.3169,AISA,PT FKS FOOD SEJAHTERA TBK
1441374472.0,More Than 5%,PT ASTA ASKARA SENTOSA,False,15.479,AISA,PT FKS FOOD SEJAHTERA TBK
1036756100.0,More Than 5%,PT RENALDI JAYA EKA INTI,False,16.07,AKKU,PT ANUGERAH KAGUM KARYA UTAMA TBK
721187100.0,More Than 5%,PT BINTANG BERSINAR CEMERLANG,False,11.18,AKKU,PT ANUGERAH KAGUM KARYA UTAMA TBK
394611900.0,More Than 5%,PT GEMA BUSANA RAYA,False,6.11,AKKU,PT ANUGERAH KAGUM KARYA UTAMA TBK
358795300.0,More Than 5%,PT KOREK API GUNA MANDIRI,False,5.56,AKKU,PT ANUGERAH KAGUM KARYA UTAMA TBK
221072988.0,More Than 5%,PT TIARA INTIMAHKOTA,False,36.11,AKPI,ARGHA KARYA PRIMA IND. TBK
167029008.0,More Than 5%,PT PRISMATAMA NUGRAHA,False,27.28,AKPI,ARGHA KARYA PRIMA IND. TBK
92133534.0,More Than 5%,PT NAWA PANDUTA,True,15.05,AKPI,ARGHA KARYA PRIMA IND. TBK
12787818600.0,More Than 5%,PT ARTHAKENCANA RAYATAMA,True,63.7,AKRA,PT AKR CORPORINDO TBK
662400000.0,More Than 5%,PT BATULICIN ENAM SEMBILAN TRANSPORTASI,True,92.0,AKSI,PT MINERAL SUMBERDAYA MANDIRI TBK
1810571784.0,More Than 5%,PT GOLDEN ARISTA INTERNATIONAL,True,67.04,ALDO,ALKINDO NARATAMA TBK
425393555.0,More Than 5%,PT GESIT PERKASA,True,83.7939,ALKA,ALAKASA INDUSTRINDO TBK
2537631978.0,More Than 5%,PT HUSIN INVESTAMA,True,66.5,ALMI,ALUMINDO LIGHT METAL INDUSTRY TBK
600020374.0,More Than 5%,PT ALIM INVESTINDO,True,15.72,ALMI,ALUMINDO LIGHT METAL INDUSTRY TBK
330080000.0,More Than 5%,PT GUNA INVESTINDO,True,8.65,ALMI,ALUMINDO LIGHT METAL INDUSTRY TBK
93459476.0,More Than 5%,PT MARINDO INVESTAMA,True,2.45,ALMI,ALUMINDO LIGHT METAL INDUSTRY TBK
38438704.0,More Than 5%,PT PRAKINDO INVESTAMA,True,1.01,ALMI,ALUMINDO LIGHT METAL INDUSTRY TBK
36463704.0,More Than 5%,PT MULINDO INVESTAMA,True,0.96,ALMI,ALUMINDO LIGHT METAL INDUSTRY TBK
35068704.0,More Than 5%,PT MASPION,True,0.92,ALMI,ALUMINDO LIGHT METAL INDUSTRY TBK
4001242013.0,More Than 5%,FAIRFAX ASIA LIMITED,True,80.0,AMAG,ASURANSI MULTI ARTHA GUNA TBK
388000000.0,More Than 5%,BANK PAN INDONESIA TBK,False,7.76,AMAG,ASURANSI MULTI ARTHA GUNA TBK
3158500000.0,More Than 5%,PT GRIYA PRIMA AMANDA,True,81.54,AMAN,PT MAKMUR BERKAH AMANDA TBK
13832054873.0,More Than 5%,TOLARAM PTE LTD,True,75.252,AMAR,PT BANK AMAR INDONESIA TBK
1210726588.0,More Than 5%,PT JAGAT RAYA IMAJINASI,False,6.587,AMAR,PT BANK AMAR INDONESIA TBK
1035714286.0,More Than 5%,INVESTREE SINGAPORE PTE LTD,False,5.635,AMAR,PT BANK AMAR INDONESIA TBK
193240400.0,More Than 5%,AGC INC,True,44.53,AMFG,ASAHIMAS FLAT GLASS TBK
180677700.0,More Than 5%,PT RODAMAS,True,41.63,AMFG,ASAHIMAS FLAT GLASS TBK
630638300.0,More Than 5%,SPHERE CORPORATION SDN BHD,True,58.39,AMIN,PT ATELIERS MECANIQUES D INDONESIE TBK
20839251059.0,More Than 5%,PT SIGMANTARA ALFINDO,True,50.19,AMRT,PT SUMBER ALFARIA TRIJAYA TBK
4650030000.0,More Than 5%,PT CENTRAL ENERGI PRATAMA,True,49.733,ANDI,PT ANDIRA AGRO TBK
699970000.0,More Than 5%,PT ANUGERAH PERKASA SEMESTA,True,7.486,ANDI,PT ANDIRA AGRO TBK
0.0,More Than 5%,KEJAKSAAN AGUNG,False,0.0,ANDI,PT ANDIRA AGRO TBK
3057981688.0,More Than 5%,FIRST RESOURCES LIMITED,True,91.169,ANJT,PT AUSTINDO NUSANTARA JAYA TBK
15619999999.0,More Than 5%,PT MINERAL INDUSTRI INDONESIA (PERSERO),True,65.0,ANTM,ANEKA TAMBANG TBK
1.0,More Than 5%,NEGARA REPUBLIK INDONESIA,True,0.0,ANTM,ANEKA TAMBANG TBK
1897730677.0,More Than 5%,PT ASERRA CAPITAL,True,53.51,APEX,APEXINDO PRATAMA DUTA TBK
220767550.0,More Than 5%,AUGUSTA INVESTMENTS I PTE LTD,False,6.23,APEX,APEXINDO PRATAMA DUTA TBK
185122847.0,More Than 5%,BNYM RE ACP II TRADING LLC 2039927457,False,5.21,APEX,APEXINDO PRATAMA DUTA TBK
622214760.0,More Than 5%,PT ARITA GLOBAL,False,57.84,APII,PT ARITA PRIMA INDONESIA TBK
151125260.0,More Than 5%,ARITA ENGINEERING SDN BHD,False,14.05,APII,PT ARITA PRIMA INDONESIA TBK
801304000.0,More Than 5%,PT MACO AMANGRAHA,True,58.8,APLI,ASIAPLAST INDUSTRIES TBK
18777785148.0,More Than 5%,PT INDOFICA,True,82.724,APLN,PT AGUNG PODOMORO LAND TBK
192487500.0,More Than 5%,PT SARANA MULTILAND MANDIRI,False,0.848,APLN,PT AGUNG PODOMORO LAND TBK
21109650000.0,More Than 5%,PT RAJAWALI CORPORA,True,85.0,ARCI,PT ARCHI INDONESIA TBK
1524123200.0,More Than 5%,PT BASIS UTAMA PRIMA,False,6.137,ARCI,PT ARCHI INDONESIA TBK
100000.0,More Than 5%,PT WIJAYA ANUGERAH CEMERLANG,False,0.0,ARCI,PT ARCHI INDONESIA TBK
1229818254.0,More Than 5%,PT ARGO MANUNGGAL LAND DEVELOPMENT,False,38.74,ARGO,ARGO PANTES TBK
510175438.0,More Than 5%,PT KUKUH MANUNGGAL PROPERTINDO,False,16.07,ARGO,ARGO PANTES TBK
422807017.0,More Than 5%,TREVOR GLOBAL LTD,False,13.32,ARGO,ARGO PANTES TBK
384722470.0,More Than 5%,PT ARGO MANUNGGAL TRIASTA,False,12.12,ARGO,ARGO PANTES TBK
98500000.0,More Than 5%,PT DHARMA MANUNGGAL,True,3.1,ARGO,ARGO PANTES TBK
1090579700.0,More Than 5%,PT CALORIE VIVA UTAMA,True,31.786,ARII,ATLAS RESOURCES TBK
303000000.0,More Than 5%,JAPET RES PTE LTD,False,8.831,ARII,ATLAS RESOURCES TBK
892326600.0,More Than 5%,PT ARKHA TANTO PRIMA,True,44.62,ARKA,PT ARKHA JAYANTI PERSADA TBK
200000000.0,More Than 5%,PT JAF ASIA INVESTMENT,False,10.0,ARKA,PT ARKHA JAYANTI PERSADA TBK
1392760000.0,More Than 5%,PT ARKORA BAKTI INDONESIA,True,47.52,ARKO,PT ARKORA HYDRO TBK
777487893.0,More Than 5%,PT ENERGIA PRIMA NUSANTARA,False,26.55,ARKO,PT ARKORA HYDRO TBK
295038107.0,More Than 5%,ACEI SINGAPORE HOLDINGS PRIVATE LTD,False,10.07,ARKO,PT ARKORA HYDRO TBK
1065432500.0,More Than 5%,PT SUPRAKREASI ERADINAMIKA,False,14.51,ARNA,ARWANA CITRAMULIA TBK
396499000.0,More Than 5%,FIDELITY FUNDS ASIAN SMALLER COMPANIES POOL,False,5.4,ARNA,ARWANA CITRAMULIA TBK
123522776.0,More Than 5%,PT SRIHANA UTAMA,True,35.46,ASBI,ASURANSI BINTANG TBK
87302164.0,More Than 5%,PT NGRUMAT BONDO UTOMO,True,25.06,ASBI,ASURANSI BINTANG TBK
81653688.0,More Than 5%,PT WARISAN KASIH BUNDA,False,23.44,ASBI,ASURANSI BINTANG TBK
281593800.0,More Than 5%,EQUITY DEVELOPMENT INVESTMENT TBK,True,73.3,ASDM,ASURANSI DAYIN MITRA TBK
23076000.0,More Than 5%,ARTHAVEST TBK,False,6.0,ASDM,ASURANSI DAYIN MITRA TBK
20371200.0,More Than 5%,PT PRIMA TUNAS INVESTAMA,False,5.3,ASDM,ASURANSI DAYIN MITRA TBK
1036752580.0,More Than 5%,ASTRA INTERNATIONAL TBK,True,76.87,ASGR,ASTRA GRAPHIA TBK
20288255040.0,More Than 5%,JARDINE CYCLE CARRIAGE LIMITED,True,50.11,ASII,ASTRA INTERNATIONAL TBK
1083519966.0,More Than 5%,DANA PENSIUN PERKEBUNAN,True,77.39,ASJT,ASURANSI JASA TANIA TBK
2684208800.0,More Than 5%,PT ASURANSI JIWA KRESNA,False,29.96,ASMI,PT ASURANSI MAXIMUS GRAHA PERSADA TBK
90215000.0,More Than 5%,PT INDOMITRA PRIMA SEJATI,True,1.01,ASMI,PT ASURANSI MAXIMUS GRAHA PERSADA TBK
349995000.0,More Than 5%,PT ANDALAN SAKTI INTI,True,51.18,ASPI,PT ANDALAN SAKTI PRIMAINDO TBK
5132387864.0,More Than 5%,PT MANUNGGAL PRIME DEVELOPMENT,True,26.12,ASRI,ALAM SUTERA REALTY TBK
2982450000.0,More Than 5%,PT TANGERANG FAJAR INDUSTRIAL ESTATE,True,15.18,ASRI,ALAM SUTERA REALTY TBK
129709300.0,More Than 5%,PT ARGO MANUNGGAL LAND DEVELOPMENT,True,0.66,ASRI,ALAM SUTERA REALTY TBK
128600140.0,More Than 5%,PT RAGAM VENTURINDO,False,10.57,ASRM,ASURANSI RAMAYANA TBK
121714032.0,More Than 5%,KOREAN REINSURANCE COMPANY,False,10.0,ASRM,ASURANSI RAMAYANA TBK
851951100.0,More Than 5%,PT ADI DINAMIKA INVESTINDO,True,23.08,ASSA,ADI SARANA ARMADA TBK
651400000.0,More Than 5%,PT DAYA ADICIPTA MUSTIKA,False,17.65,ASSA,ADI SARANA ARMADA TBK
950000000.0,More Than 5%,PT TRIMITRA PRAWARA,True,76.0,ATAP,PT TRIMITRA PRAWARA GOLDLAND TBK
863645841.0,More Than 5%,TIS INC,False,37.301,ATIC,PT ANABATIC TECHNOLOGIES TBK
664387148.0,More Than 5%,PT ARTHA INVESTAMA JAYA,False,28.695,ATIC,PT ANABATIC TECHNOLOGIES TBK
120000287.0,More Than 5%,PT SAM INVESTAMA,False,5.183,ATIC,PT ANABATIC TECHNOLOGIES TBK
55906430.0,More Than 5%,PT FLAMINGGO MANDIRI,False,2.415,ATIC,PT ANABATIC TECHNOLOGIES TBK
3855786337.0,More Than 5%,ASTRA INTERNATIONAL TBK,True,80.0,AUTO,ASTRA OTOPARTS TBK
22674971000.0,More Than 5%,PT TANCORP SURYA SENTOSA,True,36.6,AVIA,PT AVIA AVIAN TBK
20129652900.0,More Than 5%,PT WAHANA LANCAR REJEKI,True,32.49,AVIA,PT AVIA AVIAN TBK
3902748900.0,More Than 5%,ARCHIPELAGO INVESTMENT PRIVATE LIMITED,False,6.3,AVIA,PT AVIA AVIAN TBK
594720000.0,More Than 5%,PT ANUGRAH CAKRAWALA DUNIA,True,69.69,AYLS,PT AGRO YASA LESTARI TBK
17697006407.0,More Than 5%,MNC KAPITAL INDONESIA TBK,True,39.805,BABP,PT BANK MNC INTERNASIONAL TBK
10423122655.0,More Than 5%,WINFLY LTD,False,23.444,BABP,PT BANK MNC INTERNASIONAL TBK
4445000000.0,More Than 5%,PT PRIMA CAKRAWALA SENTOSA,False,9.998,BABP,PT BANK MNC INTERNASIONAL TBK
3213433333.0,More Than 5%,PT GLOBAL MEDIACOM TBK,False,7.228,BABP,PT BANK MNC INTERNASIONAL TBK
3034200264.0,More Than 5%,MNC TOURISM INDONESIA TBK,False,6.825,BABP,PT BANK MNC INTERNASIONAL TBK
14904480000.0,More Than 5%,PT CAPITAL GLOBAL INVESTAMA,True,74.7,BACA,PT BANK CAPITAL INDONESIA TBK
2348950000.0,More Than 5%,PT KHARISMA CIPTA TOWERINDO,True,59.7,BALI,PT BALI TOWERINDO SENTRA TBK
7591658246.0,More Than 5%,PT ALADIN GLOBAL VENTURES,True,51.4,BANK,PT BANK ALADIN SYARIAH TBK
224620000.0,More Than 5%,PT ADICIPTA GRIYA SEJATI,True,33.94,BAPA,BEKASI ASRI PEMULA TBK
120000000.0,More Than 5%,PT PAPUA TIMBER JAYA,False,18.13,BAPA,BEKASI ASRI PEMULA TBK
105986100.0,More Than 5%,PT INTI FIKASA SEKURITAS,False,16.02,BAPA,BEKASI ASRI PEMULA TBK
2250675350.0,More Than 5%,PT GRHA AGUNG PROPERTINDO,True,40.25,BAPI,PT BHAKTI AGUNG PROPERTINDO TBK
1663542650.0,More Than 5%,PT NUGRAHA PRIMA GRIYATAMA,False,29.75,BAPI,PT BHAKTI AGUNG PROPERTINDO TBK
1066187400.0,More Than 5%,BAFIN NEDERLAND BV,True,82.01,BATA,SEPATU BATA TBK
2600000000.0,More Than 5%,NA FASTENERS PTE LTD,True,54.17,BAUT,PT MITRA ANGKASA SEJAHTERA TBK
749900000.0,More Than 5%,PT FAS BERSAMA INVESTAMA,False,15.62,BAUT,PT MITRA ANGKASA SEJAHTERA TBK
99170686.0,More Than 5%,PT GRAHA SENTOSA PERSADA,True,28.08,BAYU,BAYU BUANA TBK
35551851.0,More Than 5%,UNION BANCAIRE PRIVEE UBP SA SINGAPORE BRANCH,False,10.07,BAYU,BAYU BUANA TBK
27755615.0,More Than 5%,BANK JULIUS BAER AND CO LTD SINGAPORE,False,7.86,BAYU,BAYU BUANA TBK
22955600.0,More Than 5%,BANK OF SINGAPORE LIMITED,False,6.49,BAYU,BAYU BUANA TBK
67729950000.0,More Than 5%,PT DWIMURIA INVESTAMA ANDALAN,True,54.942,BBCA,PT BANK CENTRAL ASIA TBK
13228508531.0,More Than 5%,PT MEGA CORPORA,True,60.88,BBHI,PT ALLO BANK INDONESIA TBK
2497816903.0,More Than 5%,PT BUKALAPAK.COM TBK,False,11.49,BBHI,PT ALLO BANK INDONESIA TBK
1521117930.0,More Than 5%,ABADI INVESTMENT PTE LTD,False,7.0,BBHI,PT ALLO BANK INDONESIA TBK
1303815386.0,More Than 5%,PT INDOLIFE INVESTAMA PERKASA,False,6.0,BBHI,PT ALLO BANK INDONESIA TBK
125655736951.0,More Than 5%,KOOKMIN BANK CO LTD,True,67.0,BBKP,PT BANK KB INDONESIA TBK
31900000000.0,More Than 5%,STIC EUGENE STAR HOLDING INC,False,17.0,BBKP,PT BANK KB INDONESIA TBK
1112584069.0,More Than 5%,PT SARI DASA KARSA,True,67.6,BBLD,BUANA FINANCE TBK
87688200.0,More Than 5%,BANK OF SINGAPORE LIMITED,False,5.33,BBLD,BUANA FINANCE TBK
3658020000.0,More Than 5%,PT MESTIKA BENUA MAS,True,89.44,BBMD,PT BANK MESTIKA DHARMA TBK
22378387749.0,More Than 5%,PT DANANTARA ASSET MANAGEMENT (PERSERO),False,60.0,BBNI,PT BANK NEGARA INDONESIA (PERSERO) TBK
1.0,More Than 5%,NEGARA REPUBLIK INDONESIA,True,0.0,BBNI,PT BANK NEGARA INDONESIA (PERSERO) TBK
80610976875.0,More Than 5%,PT DANANTARA ASSET MANAGEMENT (PERSERO),False,53.1879,BBRI,PT BANK RAKYAT INDONESIA (PERSERO) TBK
1.0,More Than 5%,NEGARA REPUBLIK INDONESIA,True,0.0,BBRI,PT BANK RAKYAT INDONESIA (PERSERO) TBK
5997334652.0,More Than 5%,PT MARCO POLO INDONESIA,True,70.728,BBRM,PELAYARAN NASIONAL BINA BUANA RAYA TBK
1066666666.0,More Than 5%,NAM CHEONG PIONEER SDN BHD,True,12.579,BBRM,PELAYARAN NASIONAL BINA BUANA RAYA TBK
635536000.0,More Than 5%,PT SINAR BINTANG MAKMUR,False,7.495,BBRM,PELAYARAN NASIONAL BINA BUANA RAYA TBK
2756042477.0,More Than 5%,PT FINACCEL TEKNOLOGI INDONESIA,True,75.0,BBSI,PT KROM BANK INDONESIA TBK
182533737.0,More Than 5%,PT SUN LAND INVESTAMA,False,4.97,BBSI,PT KROM BANK INDONESIA TBK
178971567.0,More Than 5%,PT SUN ANTARNUSA INVESTMENT,False,4.87,BBSI,PT KROM BANK INDONESIA TBK
3499950000.0,More Than 5%,PT AGUNG ALAM ANUGRAH,True,72.92,BBSS,PT BUMI BENOWO SUKSES SEJAHTERA TBK
796862800.0,More Than 5%,PT AGUNG ANUGRAH INVESTAMA,False,16.6,BBSS,PT BUMI BENOWO SUKSES SEJAHTERA TBK
8420666647.0,More Than 5%,PT DANANTARA ASSET MANAGEMENT (PERSERO),False,60.0,BBTN,PT BANK TABUNGAN NEGARA (PERSERO) TBK
1.0,More Than 5%,NEGARA REPUBLIK INDONESIA,True,0.0,BBTN,PT BANK TABUNGAN NEGARA (PERSERO) TBK
4598768727.0,More Than 5%,PT AKULAKU SILVRR INDONESIA,True,34.45,BBYB,PT BANK NEO COMMERCE TBK
962931705.0,More Than 5%,PT GOZCO CAPITAL,False,7.21,BBYB,PT BANK NEO COMMERCE TBK
736968376.0,More Than 5%,ROCKCORE FINANCIAL TECHNOLOGY CO LTD,False,5.52,BBYB,PT BANK NEO COMMERCE TBK
23524335155.0,More Than 5%,PT MNC ASIA HOLDING TBK,True,55.2,BCAP,MNC KAPITAL INDONESIA TBK
3900000000.0,More Than 5%,JALAN PANTAI LIMITED,False,9.15,BCAP,MNC KAPITAL INDONESIA TBK
3708705000.0,More Than 5%,HT INVESTMENT DEVELOPMENT LTD,False,8.7,BCAP,MNC KAPITAL INDONESIA TBK
2782427300.0,More Than 5%,UOB KAY HIAN HONG KONG LTD,False,6.53,BCAP,MNC KAPITAL INDONESIA TBK
13081512691.0,More Than 5%,J TRUST CO LTD,True,72.23,BCIC,PT BANK JTRUST INDONESIA TBK
3466227648.0,More Than 5%,J TRUST ASIA PTE LTD,False,19.14,BCIC,PT BANK JTRUST INDONESIA TBK
251471458.0,More Than 5%,PT JTRUST INVESTMENT INDONESIA,False,1.39,BCIC,PT BANK JTRUST INDONESIA TBK
557147100.0,More Than 5%,PT BUMI CITRA INVESTINDO,True,38.96,BCIP,BUMI CITRA PERMAI TBK
73439900.0,More Than 5%,PT BENTENG TERANG SEJAHTERA,False,5.14,BCIP,BUMI CITRA PERMAI TBK
9038053192.0,More Than 5%,MUFG BANK LTD,True,92.47,BDMN,PT BANK DANAMON INDONESIA TBK
5732270843.0,More Than 5%,ASIA AGRI INTERNATIONAL PTE LTD,True,70.59,BEEF,PT ESTIKA TATA TIARA TBK
34289755661.0,More Than 5%,PEMERINTAH PROVINSI BANTEN,True,66.11,BEKS,PT BANK PEMBANGUNAN DAERAH BANTEN TBK
5717884100.0,More Than 5%,TRISULA INTERNATIONAL TBK,True,78.87,BELL,PT TRISULA TEXTILE INDUSTRIES TBK
724549700.0,More Than 5%,PT SOUTHERN CROSS TEXTILE INDUSTRY,False,9.99,BELL,PT TRISULA TEXTILE INDUSTRIES TBK
500000.0,More Than 5%,PT TRISULA INSAN TIARA,False,0.01,BELL,PT TRISULA TEXTILE INDUSTRIES TBK
2695947180.0,More Than 5%,PT BATULICIN ENAM SEMBILAN TRANSPORTASI,True,78.36,BESS,PT BATULICIN NUSANTARA MARITIM TBK
208854100.0,More Than 5%,PT MEGA ASTA RAYA,False,6.07,BESS,PT BATULICIN NUSANTARA MARITIM TBK
4643604400.0,More Than 5%,PT ARGO MANUNGGAL LAND DEVELOPMENT,True,48.13,BEST,BEKASI FAJAR INDUSTRIAL ESTATE TBK
964750000.0,More Than 5%,NSL CLIENT SEGREGATED AC,False,10.0,BEST,BEKASI FAJAR INDUSTRIAL ESTATE TBK
0.0,More Than 5%,DAIWA HOUSE INDUSTRY CO LTD,False,0.0,BEST,BEKASI FAJAR INDUSTRIAL ESTATE TBK
7688125938.0,More Than 5%,TRINUGRAHA CAPITAL CO SCA,True,51.12,BFIN,BFI FINANCE INDONESIA TBK
767866700.0,More Than 5%,DB SPORE SES CLT AC,False,5.11,BFIN,BFI FINANCE INDONESIA TBK
8036410000.0,More Than 5%,EQUITY DEVELOPMENT INVESTMENT TBK,True,33.53,BGTG,PT BANK GANESHA TBK
5736363400.0,More Than 5%,EQUITY GLOBAL INTERNATIONAL LIMITED,False,23.93,BGTG,PT BANK GANESHA TBK
1388305300.0,More Than 5%,UOB KAY HIAN PTE LTD,False,5.79,BGTG,PT BANK GANESHA TBK
2700000000.0,More Than 5%,PT BHAKTI ARTHA GLOBAL,True,54.0,BHAT,PT BHAKTI MULTI ARTHA TBK
300000000.0,More Than 5%,PT SURYA DUTA MAS,False,6.0,BHAT,PT BHAKTI MULTI ARTHA TBK
0.0,More Than 5%,EASTERN PEAK GROUP CORPORATION,False,0.0,BHAT,PT BHAKTI MULTI ARTHA TBK
13238835716.0,More Than 5%,HT INVESTMENT DEVELOPMENT LTD,True,15.85,BHIT,PT MNC ASIA HOLDING TBK
8321109800.0,More Than 5%,CARAVAGGIO HOLDINGS LIMITED,False,9.96,BHIT,PT MNC ASIA HOLDING TBK
5262220112.0,More Than 5%,PT BHAKTI PANJIWIRA,True,6.3,BHIT,PT MNC ASIA HOLDING TBK
526475716.0,More Than 5%,PT GOLDEN LESTARI,True,86.56,BIMA,PRIMARINDO ASIA INFRASTRUCTURE TBK
1400830852.0,More Than 5%,PT INDOLIFE PENSIONTAMA,True,22.83,BINA,PT BANK INA PERDANA TBK
1114213066.0,More Than 5%,PT SAMUDRA BIRU,False,18.16,BINA,PT BANK INA PERDANA TBK
1034416550.0,More Than 5%,UOB KAY HIAN PTE LTD,False,16.86,BINA,PT BANK INA PERDANA TBK
726190057.0,More Than 5%,PT GAYA HIDUP MASA KINI,False,11.84,BINA,PT BANK INA PERDANA TBK
593387750.0,More Than 5%,DBS BANK LTD,False,9.67,BINA,PT BANK INA PERDANA TBK
1949465800.0,More Than 5%,RUHONG HOLDING PTE LTD,True,85.68,BINO,PT PERMA PLASINDO TBK
174000000.0,More Than 5%,PT INTAN PARIWARA,False,7.65,BINO,PT PERMA PLASINDO TBK
3345072195.0,More Than 5%,SAFIRE CAPITAL PTE LTD,True,66.52,BIPP,BHUWANATALA INDAH PERMAI TBK
326725000.0,More Than 5%,PT VICTORIA INVESTAMA TBK,False,6.5,BIPP,BHUWANATALA INDAH PERMAI TBK
709857979.0,More Than 5%,PT PUSAKA CITRA DJOKOSOETONO,True,28.4,BIRD,PT BLUE BIRD TBK
46401800.0,More Than 5%,PT PURNOMO INVESTAMA,True,1.9,BIRD,PT BLUE BIRD TBK
39450000.0,More Than 5%,PT CHANDRA INVESTAMA,True,1.6,BIRD,PT BLUE BIRD TBK
930000000.0,More Than 5%,PT AGRINDO PRATAMA,True,31.0,BISI,BISI INTERNATIONAL TBK
190687500.0,More Than 5%,FIELD INVESTMENT HOLDINGS PTE LTD,True,6.36,BISI,BISI INTERNATIONAL TBK
190687500.0,More Than 5%,VALLEY INVESTMENT HOLDINGS PTE LTD,True,6.36,BISI,BISI INTERNATIONAL TBK
190687500.0,More Than 5%,VISTA INVESTMENT HOLDINGS PTE LTD,True,6.36,BISI,BISI INTERNATIONAL TBK
184189100.0,More Than 5%,UBS AG,False,6.14,BISI,BISI INTERNATIONAL TBK
152683500.0,More Than 5%,UNITED OVERSEAS BANK NOMINEES PRIVATE LIMITED,False,5.09,BISI,BISI INTERNATIONAL TBK
122250000.0,More Than 5%,SJ BISI HOLDINGS PTE LTD,True,4.08,BISI,BISI INTERNATIONAL TBK
4053172595.0,More Than 5%,PEMERINTAH DAERAH PROVINSI JAWA BARAT,True,38.52,BJBR,BANK PEMBANGUNAN DAERAH JAWA BARAT DAN BANTEN TBK
3133499547.0,More Than 5%,PEMERINTAH DAERAH SE JAWA BARAT DAN BANTEN,False,29.78,BJBR,BANK PEMBANGUNAN DAERAH JAWA BARAT DAN BANTEN TBK
761921189.0,More Than 5%,PEMERINTAH DAERAH KABUPATEN BANDUNG,False,7.24,BJBR,BANK PEMBANGUNAN DAERAH JAWA BARAT DAN BANTEN TBK
7676913648.0,More Than 5%,PEMERINTAH DAERAH TINGKAT I PROVINSI JAWA TIMUR,True,51.1266,BJTM,BANK PEMBANGUNAN DAERAH JAWA TIMUR TBK
134835213825.0,More Than 5%,PT SAKTI GENERASI PERDANA,True,80.4,BKSL,SENTUL CITY TBK
32195726062.0,More Than 5%,QATAR NATIONAL BANK QPSC,True,91.57,BKSW,PT BANK QNB INDONESIA TBK
4383489018.0,More Than 5%,PT TUNGGALADHI BASKARA,True,17.41,BLTA,BERLIAN LAJU TANKER TBK
2366547505.0,More Than 5%,PT ELANG MEGAH INTI,False,9.4,BLTA,BERLIAN LAJU TANKER TBK
445708436.0,More Than 5%,CGI HOLDINGS LIMITED,True,51.0,BLTZ,PT GRAHA LAYAR PRIMA TBK
349574856.0,More Than 5%,COREE CAPITAL LIMITED,False,40.0,BLTZ,PT GRAHA LAYAR PRIMA TBK
117943900.0,More Than 5%,PT CETAK BIRU KAPITAL,False,28.22,BLUE,PT BERKAH PRIMA PERKASA TBK
14590476265.0,More Than 5%,KASIKORN VISION FINANCIAL COMPANY PTE LTD,True,80.6,BMAS,PT BANK MASPION INDONESIA TBK
1870763156.0,More Than 5%,PT ALIM INVESTINDO,False,10.33,BMAS,PT BANK MASPION INDONESIA TBK
443901808.0,More Than 5%,KASIKORNBANK PUBLIC COMPANY LIMITED,False,2.45,BMAS,PT BANK MASPION INDONESIA TBK
181026624.0,More Than 5%,PT KASIKORN VISION FINANCIAL INDONESIA,False,1.0,BMAS,PT BANK MASPION INDONESIA TBK
4935430900.0,More Than 5%,PT BUNDA INVESTAMA INDONESIA,False,57.37,BMHS,PT BUNDAMEDIK TBK
48533333333.0,More Than 5%,PT DANANTARA ASSET MANAGEMENT (PERSERO),False,52.0,BMRI,PT BANK MANDIRI (PERSERO) TBK
7466666666.0,More Than 5%,INDONESIA INVESTMENT AUTHORITY,False,8.0,BMRI,PT BANK MANDIRI (PERSERO) TBK
1.0,More Than 5%,NEGARA REPUBLIK INDONESIA,True,0.0,BMRI,PT BANK MANDIRI (PERSERO) TBK
695199832.0,More Than 5%,CHANCE STAND FINANCE LIMITED,True,59.97,BMSR,BINTANG MITRA SEMESTARAYA TBK
7520655000.0,More Than 5%,PT MNC ASIA HOLDING TBK,True,45.99,BMTR,PT GLOBAL MEDIACOM TBK
1133440000.0,More Than 5%,PT TAKJUB FINANSIAL TEKNOLOGI,True,33.45,BNBA,BANK BUMI ARTA TBK
1000396641.0,More Than 5%,PT SURYA HUSADA INVESTMENT,True,29.53,BNBA,BANK BUMI ARTA TBK
600237984.0,More Than 5%,PT DANA GRAHA AGUNG,False,17.72,BNBA,BANK BUMI ARTA TBK
370982305.0,More Than 5%,PT BUDIMAN KENCANA LESTARI,False,10.95,BNBA,BANK BUMI ARTA TBK
22991336581.0,More Than 5%,CIMB GROUP SDN BHD,True,91.4452,BNGA,PT BANK CIMB NIAGA TBK
255399748.0,More Than 5%,PT COMMERCE KAPITAL,False,1.0158,BNGA,PT BANK CIMB NIAGA TBK
34312479550.0,More Than 5%,SORAK FINANCIAL HOLDINGS PTE LTD,True,45.0205,BNII,PT BANK MAYBANK INDONESIA TBK
25882393996.0,More Than 5%,MAYBANK OFFSHORE CORPORATE SERVICES,True,33.9596,BNII,PT BANK MAYBANK INDONESIA TBK
6653168749.0,More Than 5%,VITAL SOLUTION FUND,False,8.7295,BNII,PT BANK MAYBANK INDONESIA TBK
32244827604.0,More Than 5%,BANGKOK BANK PUBLIC COMPANY LIMITED,True,89.12,BNLI,BANK PERMATA TBK
274000000.0,More Than 5%,PT KURNIAMITRA DUTA SENTOSA TBK,False,23.71,BOBA,PT FORMOSA INGREDIENT FACTORY TBK
172784000.0,More Than 5%,TEXTURE MAKER ENTERPRISE CO LTD,False,14.95,BOBA,PT FORMOSA INGREDIENT FACTORY TBK
1122137000.0,Director,PT FALCON ASIA INVESTAMA,True,29.5,BOGA,PT BINTANG OTO GLOBAL TBK
533000000.0,More Than 5%,PT ASURANSI CENTRAL ASIA,False,8.88,BOLA,PT BALI BINTANG SEJAHTERA TBK
1350000000.0,More Than 5%,PT GARUDA MULTI INVESTAMA,True,57.6,BOLT,PT GARUDA METALINDO TBK
233691100.0,More Than 5%,UOB KAY HIAN PTE LTD,False,9.97,BOLT,PT GARUDA METALINDO TBK
2193552006.0,More Than 5%,WOORI CARD CO LTD,True,82.04,BPFI,PT WOORI FINANCE INDONESIA TBK
208108444.0,More Than 5%,PT BATAVIA PROSPERINDO INTERNASIONAL TBK,False,7.78,BPFI,PT WOORI FINANCE INDONESIA TBK
2381968773.0,More Than 5%,PT BATAVIA PROSPERINDO INTERNASIONAL TBK,True,67.4,BPTR,PT BATAVIA PROSPERINDO TRANS TBK
370212200.0,More Than 5%,PT VICTORIA INVESTAMA TBK,False,10.48,BPTR,PT BATAVIA PROSPERINDO TRANS TBK
353400000.0,More Than 5%,OSCARMAS,False,10.0,BPTR,PT BATAVIA PROSPERINDO TRANS TBK
277193068.0,More Than 5%,KORDSA TEKNIK TEKSTIL AS,True,61.59,BRAM,INDO KORDSA TBK
25231500.0,More Than 5%,PT RISJADSON SURYATAMA,False,5.61,BRAM,INDO KORDSA TBK
23740608436.0,More Than 5%,PT BANK MANDIRI (PERSERO) TBK,True,51.47,BRIS,PT BANK SYARIAH INDONESIA TBK
10720230418.0,More Than 5%,PT BANK NEGARA INDONESIA (PERSERO) TBK,True,23.24,BRIS,PT BANK SYARIAH INDONESIA TBK
7092761655.0,More Than 5%,PT BANK RAKYAT INDONESIA (PERSERO) TBK,True,15.38,BRIS,PT BANK SYARIAH INDONESIA TBK
1.0,More Than 5%,NEGARA REPUBLIK INDONESIA,True,0.0,BRIS,PT BANK SYARIAH INDONESIA TBK
35592738434.0,More Than 5%,EMIRATES TARIAN GLOBAL VENTURES SPC,False,25.1,BRMS,BUMI RESOURCES MINERALS TBK
10784607811.0,More Than 5%,GLAS TRUST SINGAPORE LTD,False,7.6,BRMS,BUMI RESOURCES MINERALS TBK
9339504548.0,More Than 5%,PT MAYBANK SEKURITAS INDONESIA,False,6.59,BRMS,BUMI RESOURCES MINERALS TBK
7773275868.0,More Than 5%,PT CGS INTERNATIONAL SEKURITAS INDONESIA,False,5.48,BRMS,BUMI RESOURCES MINERALS TBK
7194378600.0,More Than 5%,CGS INTERNATIONAL SECURITIES SINGAPORE PTE LTD,False,5.07,BRMS,BUMI RESOURCES MINERALS TBK
3765383689.0,More Than 5%,BUMI RESOURCES TBK,True,2.66,BRMS,BUMI RESOURCES MINERALS TBK
534252162.0,More Than 5%,PT DWI SATRYA UTAMA,True,54.57,BRNA,BERLINA TBK
102414000.0,More Than 5%,KOMODO FUND,False,10.46,BRNA,BERLINA TBK
8522862464.0,More Than 5%,PT PARAGA ARTA MIDA,True,40.26,BSDE,PT BUMI SERPONG DAMAI TBK
5425964486.0,More Than 5%,PT EKACENTRA USAHAMAJU,True,25.63,BSDE,PT BUMI SERPONG DAMAI TBK
