Jumlah,Kategori,Nama,Pengendali,Persentase,KodeEmiten,NamaEmiten
202800000.0,More Than 5%,DANA PENSIUN KARYAWAN PANIN BANK,False,9.566,HADE,PT HIMALAYA ENERGI PERKASA TBK
1071927700.0,More Than 5%,PT NUR INTERNASIONAL SAMUDRA,False,40.82,HAIS,PT HASNUR INTERNASIONAL SHIPPING TBK
3613117337.0,More Than 5%,RUBICON INVESTMENTS HOLDING PTE LTD,True,55.23,HDFA,RADANA BHASKARA FINANCE TBK
2430707293.0,More Than 5%,PT TIARA MARGA TRAKINDO,False,37.15,HDFA,RADANA BHASKARA FINANCE TBK
796679400.0,More Than 5%,PT DAVEST INVESTAMA MANDIRI,True,52.25,HDIT,PT HENSEL DAVEST INDONESIA TBK
1110824000.0,More Than 5%,ASTRA INTERNATIONAL TBK,False,7.23,HEAL,PT MEDIKALOKA HERMINA TBK
251913200.0,More Than 5%,PT STARTEL COMMUNICATION,True,30.25,HELI,PT JAYA TRISHINDO TBK
229810100.0,More Than 5%,PT AVIA NUSANTARA KHATULISTIWA,False,27.59,HELI,PT JAYA TRISHINDO TBK
170700000.0,More Than 5%,PT KOMALA TRI VARIA,True,20.5,HELI,PT JAYA TRISHINDO TBK
84793600.0,More Than 5%,UOB KAY HIAN PTE LTD,False,10.18,HELI,PT JAYA TRISHINDO TBK
3232699113.0,More Than 5%,PT HUMPUSS,False,45.52,HITS,HUMPUSS INTERMODA TRANSPORTASI TBK
2331552091.0,More Than 5%,PT MENARA CAKRA BUANA,False,32.83,HITS,HUMPUSS INTERMODA TRANSPORTASI TBK
107523239925.0,More Than 5%,PT PHILIP MORRIS INDONESIA,True,92.44,HMSP,HM SAMPOERNA TBK
5801826646.0,More Than 5%,PT BUYUNG INVESTAMA GEMILANG,True,59.95,HOKI,PT BUYUNG POETRA SEMBADA TBK
819000000.0,More Than 5%,PT GRAHA MULIA INDOTAMA,True,52.0,HOMI,PT GRAND HOUSE MULIA TBK
1158231900.0,More Than 5%,PT HARAPAN GROUP SUKSES,True,54.37,HOPE,PT HARAPAN DUTA PERTIWI TBK
106518100.0,More Than 5%,PT MERANTI SAMUDRA PERKASA,False,5.0,HOPE,PT HARAPAN DUTA PERTIWI TBK
5088443900.0,More Than 5%,PT WIJAYA WISESA REALTY,True,85.3945,HRME,PT MENTENG HERITAGE REALTY TBK
10000.0,More Than 5%,PT TWIN INVESTMENT,False,0.0002,HRME,PT MENTENG HERITAGE REALTY TBK
3269608000.0,More Than 5%,PT TERANG ANUGRAH ABADI,True,71.0,HRTA,PT HARTADINATA ABADI TBK
10786374000.0,More Than 5%,PT KARUNIA BARA PERKASA,True,79.792,HRUM,HARUM ENERGY TBK
12500000.0,More Than 5%,PT BARA SEJAHTERA ABADI,True,0.093,HRUM,HARUM ENERGY TBK
12319527400.0,More Than 5%,PT KARYA PACIFIC INVESTAMA,False,39.39,IATA,PT MNC ENERGY INVESTMENTS TBK
7571473566.0,More Than 5%,PT MNC ASIA HOLDING TBK,True,24.21,IATA,PT MNC ENERGY INVESTMENTS TBK
835634253.0,More Than 5%,INTRACO PENTA TBK,True,55.07,IBFN,PT INTAN BARU PRANA TBK
261378386.0,More Than 5%,PT INTA TRADING,True,17.23,IBFN,PT INTAN BARU PRANA TBK
1350586095.0,More Than 5%,PT IFORTE SOLUSI INFOTEK,True,99.98,IBST,INTI BANGUN SEJAHTERA TBK
9391678000.0,More Than 5%,INDOFOOD SUKSES MAKMUR TBK,True,80.53,ICBP,INDOFOOD CBP SUKSES MAKMUR TBK
143437624.0,More Than 5%,PT TRUST PENATA PROPERTINDO,False,13.16,ICON,ISLAND CONCEPTS INDONESIA TBK
85895000.0,More Than 5%,PT ANUGERAH GRIYA PERSADA,False,7.88,ICON,ISLAND CONCEPTS INDONESIA TBK
62187000.0,More Than 5%,ISLAND REGENCY GROUP LIMITED,False,5.71,ICON,ISLAND CONCEPTS INDONESIA TBK
54669376.0,More Than 5%,PT ASABRI (PERSERO),False,5.02,ICON,ISLAND CONCEPTS INDONESIA TBK
0.0,More Than 5%,PT TRUST SECURITIES,False,0.0,ICON,ISLAND CONCEPTS INDONESIA TBK
434549100.0,More Than 5%,PT IDEA ASIA INVESTAMA,False,40.9,IDEA,PT IDEA INDONESIA AKADEMI TBK
4800200000.0,More Than 5%,PT ADRINDO INTI PERKASA,True,51.0,IFII,PT INDONESIA FIBREBOARD INDUSTRY TBK
2353000000.0,More Than 5%,SMB KENZAI CO LTD,False,25.0,IFII,PT INDONESIA FIBREBOARD INDUSTRY TBK
867000000.0,More Than 5%,PT FAJAR MINING RESOURCES,True,40.8,IFSH,PT IFISHDECO TBK
833000000.0,More Than 5%,PT WAHANA TRILINTAS MINING,False,39.2,IFSH,PT IFISHDECO TBK
772122420.0,Director,PT KINGSFORD HOLDINGS,True,79.42,IGAR,CHAMPION PACIFIC INDONESIA TBK
52500000.0,Commisioner,KALBE FARMA TBK,False,5.4,IGAR,CHAMPION PACIFIC INDONESIA TBK
279360000.0,More Than 5%,PT BERKAH DELAPAN SAMUDERA,True,33.52,IKAN,PT ERA MANDIRI CEMERLANG TBK
1119486000.0,More Than 5%,SUMITOMO ELECTRIC INDUSTRIES LTD,True,91.46,IKBI,SUMI INDO KABEL TBK
2550000.0,More Than 5%,PT TAIYO SINAR RAYA TEKNIK,False,0.21,IKBI,SUMI INDO KABEL TBK
1976765774.0,More Than 5%,GALLANT VENTURE LTD,True,49.49,IMAS,INDOMOBIL SUKSES INTERNASIONAL TBK
725850161.0,More Than 5%,PT TRITUNGGAL INTIPERMATA,False,18.17,IMAS,INDOMOBIL SUKSES INTERNASIONAL TBK
608000000.0,More Than 5%,PT TRIMEGAH SEKURITAS INDONESIA TBK,False,15.23,IMAS,INDOMOBIL SUKSES INTERNASIONAL TBK
200562566.0,More Than 5%,PT SEJAHTERA RAYA PERKASA,False,5.02,IMAS,INDOMOBIL SUKSES INTERNASIONAL TBK
7959422871.0,More Than 5%,INDOMOBIL SUKSES INTERNASIONAL TBK,True,91.97,IMJS,PT INDOMOBIL MULTI JASA TBK
24874395000.0,More Than 5%,PT HARIMAS TUNGGAL PERKASA,False,45.84,IMPC,PT IMPACK PRATAMA INDUSTRI TBK
23929426194.0,More Than 5%,PT TUNGGAL JAYA INVESTAMA,False,44.09,IMPC,PT IMPACK PRATAMA INDUSTRI TBK
2499999999.0,More Than 5%,PT BIO FARMA (PERSERO),True,80.664,INAF,INDOFARMA TBK
227533850.0,More Than 5%,PT ASABRI (PERSERO),False,7.342,INAF,INDOFARMA TBK
0.0,More Than 5%,NEGARA REPUBLIK INDONESIA,True,0.0,INAF,INDOFARMA TBK
208990400.0,More Than 5%,PT HUSIN INVESTAMA,True,32.98,INAI,INDAL ALUMINIUM INDUSTRY TBK
49680000.0,More Than 5%,PT MARINDO INVESTAMA,True,7.84,INAI,INDAL ALUMINIUM INDUSTRY TBK
48299600.0,More Than 5%,PT MASPION,True,7.63,INAI,INDAL ALUMINIUM INDUSTRY TBK
39744000.0,More Than 5%,PT GUNA INVESTINDO,True,6.27,INAI,INDAL ALUMINIUM INDUSTRY TBK
39744000.0,More Than 5%,PT MULINDO INVESTAMA,True,6.27,INAI,INDAL ALUMINIUM INDUSTRY TBK
39744000.0,More Than 5%,PT PRAKINDO INVESTAMA,True,6.27,INAI,INDAL ALUMINIUM INDUSTRY TBK
575348186.0,More Than 5%,PT ALAM TULUS ABADI,True,40.0,INCF,PT INDO KOMODITI KORPORA TBK
3583533690.0,More Than 5%,PT MINERAL INDUSTRI INDONESIA (PERSERO),True,34.0,INCO,VALE INDONESIA TBK
3570993764.0,More Than 5%,VALE CANADA LIMITED,True,33.88,INCO,VALE INDONESIA TBK
1210370563.0,More Than 5%,SUMITOMO METAL MINING CO LTD,False,11.48,INCO,VALE INDONESIA TBK
4396103450.0,More Than 5%,FIRST PACIFIC INVESTMENT MANAGEMENT LTD,True,50.07,INDF,INDOFOOD SUKSES MAKMUR TBK
440241050.0,More Than 5%,INDORAMA HOLDINGS BV,True,67.28,INDR,PT INDO-RAMA SYNTHETICS TBK
163600000.0,More Than 5%,PT IRAMA INVESTAMA,True,25.0,INDR,PT INDO-RAMA SYNTHETICS TBK
5782102070.0,More Than 5%,PT INDOPRIMA GEMILANG,True,88.11,INDS,INDOSPRING TBK
199604541.0,More Than 5%,EQUATOREX SDN BHD,True,45.58,INDX,TANAH LAUT TBK
101720239.0,More Than 5%,HEYDAY INVESTMENT LIMITED,False,23.23,INDX,TANAH LAUT TBK
1968882699.0,More Than 5%,PT INDIKA INTI INVESTINDO,True,37.789,INDY,INDIKA ENERGY TBK
1463155591.0,More Than 5%,PT TELADAN RESOURCES,True,28.083,INDY,INDIKA ENERGY TBK
3143477898.0,More Than 5%,PT APP PURINUSA EKAPERSADA,True,57.4573,INKP,INDAH KIAT PULP & PAPER TBK
11059595.0,More Than 5%,PT CAKRAWALA MEGA INDAH,False,0.2022,INKP,INDAH KIAT PULP & PAPER TBK
10395200.0,More Than 5%,PT WIRAKARYA SAKTI,False,0.19,INKP,INDAH KIAT PULP & PAPER TBK
1200221900.0,More Than 5%,PT SAMUDERA INDUSTRI,True,66.38,INOV,PT INOCYCLE TECHNOLOGY GROUP TBK
0.0,More Than 5%,PT HILON INDONESIA,False,0.0,INOV,PT INOCYCLE TECHNOLOGY GROUP TBK
2908909842.0,More Than 5%,PT CAKRA INTI UTAMA,False,14.38,INPC,BANK ARTHA GRAHA INTERNASIONAL TBK
1361238977.0,More Than 5%,PT PIRUS PLATINUM MURNI,False,6.73,INPC,BANK ARTHA GRAHA INTERNASIONAL TBK
1322157253.0,More Than 5%,PT CERANA ARTHA PUTRA,False,6.54,INPC,BANK ARTHA GRAHA INTERNASIONAL TBK
1134617030.0,More Than 5%,PT ARTHA GRAHA NETWORK,False,5.61,INPC,BANK ARTHA GRAHA INTERNASIONAL TBK
1087913290.0,More Than 5%,PT PUSPITA BISNISPURI,False,5.38,INPC,BANK ARTHA GRAHA INTERNASIONAL TBK
839439091.0,More Than 5%,PT ARTHAMULIA SENTOSAJAYA,False,4.15,INPC,BANK ARTHA GRAHA INTERNASIONAL TBK
712647774.0,More Than 5%,PT KARYA NUSANTARA PERMAI,False,3.52,INPC,BANK ARTHA GRAHA INTERNASIONAL TBK
4051971279.0,More Than 5%,PT GRAHATAMA KREASIBARU,True,36.24,INPP,INDONESIAN PARADISE PROPERTY TBK
3147549873.0,More Than 5%,TREE OF BLESSINGS PTE LTD,False,28.15,INPP,INDONESIAN PARADISE PROPERTY TBK
1118197174.0,More Than 5%,PT PROPERTINDO PRIMA INVESTAMA,False,10.0,INPP,INDONESIAN PARADISE PROPERTY TBK
894557738.0,More Than 5%,ELYSIUM INVESTMENT PARTNERS LTD,False,8.0,INPP,INDONESIAN PARADISE PROPERTY TBK
885150900.0,More Than 5%,CGS INTERNATIONAL SECURITIES SINGAPORE PTE LTD,False,7.92,INPP,INDONESIAN PARADISE PROPERTY TBK
518613000.0,More Than 5%,PT SURYA PERKASA SENTOSA,True,79.79,INPS,PT INDAH PRAKASA SENTOSA TBK
45000000.0,More Than 5%,PT SINAR RATU SENTOSA,True,6.92,INPS,PT INDAH PRAKASA SENTOSA TBK
1285265467.0,More Than 5%,ALLIED HILL LIMITED,True,92.54,INRU,TOBA PULP LESTARI TBK
354745132.0,More Than 5%,PT SPALLINDO ADILONG,True,10.61,INTA,INTRACO PENTA TBK
325318789.0,More Than 5%,PT SHALUMINDO INVESTAMA,True,9.73,INTA,INTRACO PENTA TBK
323940000.0,More Than 5%,PEAK AIM DEPELOPMENT LIMITED,True,54.74,INTD,INTER-DELTA TBK
1877480863.0,More Than 5%,HEIDELBERG MATERIALS AG,True,53.4,INTP,INDOCEMENT TUNGGAL PRAKARSA TBK
860562600.0,More Than 5%,APAC INVESTMENT 2 PTE LTD,True,90.598,IPAC,PT ERA GRAHAREALTY TBK
1296144749.0,More Than 5%,PT PELINDO MULTI TERMINAL,True,71.28,IPCC,PT INDONESIA KENDARAAN TERMINAL TBK
100682600.0,More Than 5%,PT PELABUHAN INDONESIA INVESTAMA,False,5.537,IPCC,PT INDONESIA KENDARAAN TERMINAL TBK
4063504600.0,More Than 5%,PT PELINDO JASA MARITIM,True,76.89,IPCM,PT JASA ARMADA INDONESIA TBK
569551400.0,More Than 5%,PT PELABUHAN INDONESIA INVESTAMA,False,10.78,IPCM,PT JASA ARMADA INDONESIA TBK
1903153710.0,More Than 5%,JEFFLYNE GOLDEN HOLDINGS PTE LTD,True,29.537,IPOL,INDOPOLY SWAKARSA INDUSTRY TBK
1849531010.0,More Than 5%,PT SUPERNOVA FLEXIBLE PACKAGING,False,28.704,IPOL,INDOPOLY SWAKARSA INDUSTRY TBK
1491910560.0,More Than 5%,NOBLE OX INTERNATIONAL LTD,False,23.154,IPOL,INDOPOLY SWAKARSA INDUSTRY TBK
26687076691.0,More Than 5%,PT GLOBAL MEDIACOM TBK,True,63.24,IPTV,PT MNC VISION NETWORKS TBK
1260502200.0,More Than 5%,PT GLOBAL DINAMIKA KENCANA,True,78.78,IRRA,PT ITAMA RANORAYA TBK
21170843008.0,More Than 5%,OOREDOO HUTCHISON ASIA PTE LTD,True,65.6444,ISAT,PT INDOSAT TBK
3106499996.0,More Than 5%,PT PERUSAHAAN PENGELOLA ASET,False,9.6323,ISAT,PT INDOSAT TBK
2687020352.0,More Than 5%,PT TIGA TELEKOMUNIKASI INDONESIA,False,8.3316,ISAT,PT INDOSAT TBK
1.0,More Than 5%,NEGARA REPUBLIK INDONESIA,False,0.0,ISAT,PT INDOSAT TBK
4115551030.0,More Than 5%,PT CAKRA BHAKTI PARA PUTRA,True,57.27,ISSP,PT STEEL PIPE INDUSTRY OF INDONESIA TBK
500000000.0,More Than 5%,PEMBERTON ASIAN OPPORTUNITIES FUND,False,6.96,ISSP,PT STEEL PIPE INDUSTRY OF INDONESIA TBK
418560000.0,More Than 5%,PT ASTRINDO NUSANTARA INFRASTRUKTUR TBK,True,41.9,ITMA,SUMBER ENERGI ANDALAN TBK
74563100.0,More Than 5%,PT FERSINDO NUSA JAYA,False,7.46,ITMA,SUMBER ENERGI ANDALAN TBK
66192500.0,More Than 5%,PT TRUKINDO PERSADA SEJAHTERA,False,6.62,ITMA,SUMBER ENERGI ANDALAN TBK
55748200.0,More Than 5%,PT SOLUSI KARYA SUKSES,False,5.58,ITMA,SUMBER ENERGI ANDALAN TBK
736071000.0,More Than 5%,BANPU MINERALS SINGAPORE PRIVATE LIMITED,True,65.143,ITMG,INDO TAMBANGRAYA MEGAH TBK
219941120.0,Director,PT JAST INFOTEK GRUP,True,20.3,JAST,PT JASNITA TELEKOMINDO TBK
216515120.0,Director,KSTAR CAPITAL PTE LTD,False,20.0,JAST,PT JASNITA TELEKOMINDO TBK
135036466.0,Director,UOB KAY HIAN PTE LTD,False,12.4,JAST,PT JASNITA TELEKOMINDO TBK
15015345027.0,More Than 5%,PT SARANA AGRO INVESTAMA,True,92.5,JAWA,JAYA AGRA WATTIE TBK
365597400.0,More Than 5%,PT PRIMA GLOBALINDO LOGISTIK TBK,False,45.79,JAYA,PT ARMADA BERJAYA TRANS TBK
450525000.0,More Than 5%,PT MONASPERMATA PERSADA,True,59.593,JECC,JEMBO CABLE COMPANY TBK
132891500.0,More Than 5%,PT INDOLIFE PENSIONTAMA,False,17.578,JECC,JEMBO CABLE COMPANY TBK
49050000.0,More Than 5%,FUJIKURA LTD,False,6.488,JECC,JEMBO CABLE COMPANY TBK
49050000.0,More Than 5%,FUJIKURA ASIA LIMITED,False,6.488,JECC,JEMBO CABLE COMPANY TBK
8753037308.0,More Than 5%,PT SURYA GLOBAL NUSANTARA,True,38.761,JGLE,PT GRAHA ANDRASENTRA PROPERTINDO TBK
2767921425.0,More Than 5%,BANQUE DE LUXEMBOURG,False,12.257,JGLE,PT GRAHA ANDRASENTRA PROPERTINDO TBK
1822592196.0,More Than 5%,EFG BANK AG,False,8.071,JGLE,PT GRAHA ANDRASENTRA PROPERTINDO TBK
932401192.0,More Than 5%,PT KRESNA AJI SEMBADA,True,40.03,JIHD,JAKARTA INTERNATIONAL HOTELS & DEVELOPMENT TBK
164604361.0,More Than 5%,PT CATUR KUSUMA ABADI SEJAHTERA,False,7.07,JIHD,JAKARTA INTERNATIONAL HOTELS & DEVELOPMENT TBK
9929587750.0,More Than 5%,PT PEMBANGUNAN JAYA,True,60.89,JKON,JAYA KONSTRUKSI MANGGALA PRATAMA TBK
6500176516.0,More Than 5%,JAPFA LTD,True,55.43,JPFA,JAPFA COMFEED INDONESIA TBK
8744075000.0,More Than 5%,PT PEMBANGUNAN JAYA,True,63.59,JRPT,JAYA REAL PROPERTY TBK
2135209800.0,More Than 5%,BNP PARIBAS SINGAPORE BRANCH WEALTH MANAGEMENT,False,15.53,JRPT,JAYA REAL PROPERTY TBK
5080509839.0,More Than 5%,PT DANANTARA ASSET MANAGEMENT (PERSERO),False,70.0,JSMR,PT JASA MARGA TBK
1.0,More Than 5%,NEGARA REPUBLIK INDONESIA,True,0.0,JSMR,PT JASA MARGA TBK
1182556569.0,More Than 5%,PT JAN DARMADI INVESTINDO,True,51.0,JSPT,JAKARTA SETIABUDI INTERNASIONAL TBK
375402106.0,More Than 5%,STIBER INVESTMENTS SARL,False,16.19,JSPT,JAKARTA SETIABUDI INTERNASIONAL TBK
213557597.0,More Than 5%,JPMCB NA RE JPMCB SINGAPORE BRANCH,False,9.21,JSPT,JAKARTA SETIABUDI INTERNASIONAL TBK
3129590000.0,More Than 5%,PT JASUINDO MULTI INVESTAMA,True,45.67,JTPE,JASUINDO TIGA PERKASA TBK
1370410000.0,More Than 5%,TOPPAN GRAVITY LIMITED,False,20.0,JTPE,JASUINDO TIGA PERKASA TBK
4999999999.0,More Than 5%,PT BIO FARMA (PERSERO),True,89.82,KAEF,KIMIA FARMA TBK
1.0,More Than 5%,NEGARA REPUBLIK INDONESIA,True,0.0,KAEF,KIMIA FARMA TBK
452266400.0,More Than 5%,PT SARANAKELOLA INVESTA,True,77.03,KARW,MERATUS JASA PRIMA TBK
1982392237.0,More Than 5%,PT OMEDATA ELECTRONICS,True,49.47,KBLI,KMI WIRE AND CABLE TBK
451017200.0,More Than 5%,PT SIBALEC,True,40.27,KBLM,KABELINDO MURNI TBK
389300000.0,More Than 5%,PT MESINDO AGUNG NUSANTARA,True,34.76,KBLM,KABELINDO MURNI TBK
73711600.0,More Than 5%,PT ERDIKHA ELIT SEKURITAS,False,6.58,KBLM,KABELINDO MURNI TBK
588167378.0,More Than 5%,PT REKSA PUSPITA KARYA,False,33.76,KBLV,FIRST MEDIA TBK
160276213.0,More Than 5%,PT TRIJAYA PUTRA MULIA,False,9.2,KBLV,FIRST MEDIA TBK
0.0,More Than 5%,PT CIPTADANA CAPITAL,False,0.0,KBLV,FIRST MEDIA TBK
1271968800.0,More Than 5%,PT KITASUBUR UTAMA,True,78.52,KDSI,KEDAWUNG SETIA INDUSTRIAL TBK
1110920000.0,More Than 5%,PT PARAMATA INDAH LESTARI,True,30.3,KEEN,PT KENCANA ENERGI LESTARI TBK
916578200.0,More Than 5%,TEPCO RENEWABLE POWER INCORPORATED,False,25.0,KEEN,PT KENCANA ENERGI LESTARI TBK
13770000.0,More Than 5%,PT TIRTA ENERGI SENTOSA,False,0.38,KEEN,PT KENCANA ENERGI LESTARI TBK
3716642250.0,More Than 5%,PT GARUDAFOOD PUTRA PUTRI JAYA TBK,True,66.07,KEJU,PT MULIA BOGA RAYA TBK
1019531250.0,More Than 5%,PELICAN COMPANY LIMITED,False,18.13,KEJU,PT MULIA BOGA RAYA TBK
361608925.0,More Than 5%,PT TUDUNG PUTRA PUTRI JAYA,False,6.43,KEJU,PT MULIA BOGA RAYA TBK
1606165931.0,More Than 5%,PT FAJAR SEJAHTERA MANDIRI NUSANTARA,False,56.53,KETR,PT KETROSDEN TRIASMITRA TBK
774578883.0,More Than 5%,PT GEMA LINTAS BENUA,False,27.26,KETR,PT KETROSDEN TRIASMITRA TBK
139443300.0,More Than 5%,PT BAHTERA BINTANG NUSANTARA,True,4.91,KETR,PT KETROSDEN TRIASMITRA TBK
13741458453.0,More Than 5%,SCG DECOR PUBLIC COMPANY LIMITED,True,92.04,KIAS,KERAMIKA INDONESIA ASSOSIASI TBK
120390280.0,More Than 5%,PT KEDAWUNG SUBUR,True,43.62,KICI,KEDAUNG INDAH CAN TBK
86664000.0,More Than 5%,DK LIM SONS INVESTMENT PTE LTD,True,31.4,KICI,KEDAUNG INDAH CAN TBK
2400359372.0,More Than 5%,ISLAMIC DEVELOPMENT BANK,False,11.526,KIJA,KAWASAN INDUSTRI JABABEKA TBK
1000050100.0,More Than 5%,PT KINO INVESTINDO,True,70.0,KINO,PT KINO INDONESIA TBK
160371700.0,More Than 5%,NUSANTARA FMCG LIMITED,False,11.23,KINO,PT KINO INDONESIA TBK
350300000.0,More Than 5%,PT ARTAV MOBILE INDONESIA,True,32.56,KIOS,PT KIOSON KOMERSIAL INDONESIA TBK
83369534.0,More Than 5%,PT PRAMBANAN INVESTASI SUKSES,False,7.74,KIOS,PT KIOSON KOMERSIAL INDONESIA TBK
262500000.0,More Than 5%,PT GRAFINDO KARYA NUSANTARA,True,52.5,KJEN,PT KRIDA JARINGAN NUSANTARA TBK
29615300.0,More Than 5%,REKSADANA NARADA SAHAM INDONESIA,False,5.92,KJEN,PT KRIDA JARINGAN NUSANTARA TBK
1855447105.0,More Than 5%,ENERGY COLLIER PRIVATE LIMITED,False,37.11,KKGI,RESOURCE ALAM INDONESIA TBK
1391585329.0,More Than 5%,PT SEJAHTERAH JAYA CITA,True,27.83,KKGI,RESOURCE ALAM INDONESIA TBK
413611772.0,More Than 5%,SINAR NUSANTARA SDN BHD,False,8.27,KKGI,RESOURCE ALAM INDONESIA TBK
260372700.0,More Than 5%,LX INTERNATIONAL SPORE PTE LTD,False,5.217,KKGI,RESOURCE ALAM INDONESIA TBK
2369392.0,More Than 5%,PT KURNIA JAYA RAYA SCRIPLESS,False,0.05,KKGI,RESOURCE ALAM INDONESIA TBK
104150.0,More Than 5%,PT TRI EKASARI KALIMANTAN PLYWOOD,False,0.0024,KKGI,RESOURCE ALAM INDONESIA TBK
104150.0,More Than 5%,PT SAWUT PRIMA PERMAI,False,0.002,KKGI,RESOURCE ALAM INDONESIA TBK
104150.0,More Than 5%,PT SINAR KAPUAS KALBAR,False,0.002,KKGI,RESOURCE ALAM INDONESIA TBK
104150.0,More Than 5%,PT KURNIA JAYA RAYA WARKAT,False,0.001,KKGI,RESOURCE ALAM INDONESIA TBK
104150.0,More Than 5%,KAPUAS RAYA ARMADA PERMAI LINES,False,0.001,KKGI,RESOURCE ALAM INDONESIA TBK
41.0,More Than 5%,PT PRAKARSA TANISEJATI SCRIPLESS,False,0.0,KKGI,RESOURCE ALAM INDONESIA TBK
104150.0,More Than 5%,PT PRAKARSA TANISEJATI WARKAT,False,0.0,KKGI,RESOURCE ALAM INDONESIA TBK
104150.0,More Than 5%,PT BUMI RAYA UTAMA WOOD INDUSTRIES,False,0.0,KKGI,RESOURCE ALAM INDONESIA TBK
52075.0,More Than 5%,PT BUMI SUBUR LESTARI TANI,False,0.0,KKGI,RESOURCE ALAM INDONESIA TBK
104150.0,More Than 5%,PT KETAPANG INDAH PLYWOOD INDUSTRIES,False,0.0,KKGI,RESOURCE ALAM INDONESIA TBK
104150.0,More Than 5%,PT KHATULISTIWA INDAH WOOD INDUSTRIES,False,0.0,KKGI,RESOURCE ALAM INDONESIA TBK
104150.0,More Than 5%,PT KURNIA KAPUAS PLYWOOD INDUSTRIAL,False,0.0,KKGI,RESOURCE ALAM INDONESIA TBK
4903185740.0,More Than 5%,PT LADANG IRA PANEN,True,10.47,KLBF,KALBE FARMA TBK
4824509485.0,More Than 5%,PT GIRA SOLE PRIMA,True,10.31,KLBF,KALBE FARMA TBK
4718121940.0,More Than 5%,PT SANTA SEHA SANADI,True,10.08,KLBF,KALBE FARMA TBK
4439895440.0,More Than 5%,PT LUCASTA MURNI CEMERLANG,True,9.48,KLBF,KALBE FARMA TBK
4352057040.0,More Than 5%,PT DIPTANALA BAHANA,True,9.3,KLBF,KALBE FARMA TBK
3844639040.0,More Than 5%,PT BINA ARTA CHARISMA,True,8.21,KLBF,KALBE FARMA TBK
440000100.0,More Than 5%,PT DIMA INVESTINDO,True,55.0,KMDS,PT KURNIAMITRA DUTA SENTOSA TBK
169523811.0,More Than 5%,PT MIKI OJISAN INDOMITRA,False,21.19,KMDS,PT KURNIAMITRA DUTA SENTOSA TBK
5134603987.0,More Than 5%,HSF S PTE LTD,True,62.5,KMTR,PT KIRANA MEGATARA TBK
2464609474.0,More Than 5%,PT TRIPUTRA PERSADA MEGATARA,False,30.0,KMTR,PT KIRANA MEGATARA TBK
2032714700.0,More Than 5%,PT KOBEXINDO INVESTAMA,True,89.45,KOBX,KOBEXINDO TRACTORS TBK
888836488.0,More Than 5%,SCG DISTRIBUTION COMPANY LIMITED,True,90.62,KOIN,KOKOH INTI AREBAMA TBK
97520000.0,More Than 5%,PT DASABINA ADITYASARANA,True,31.25,KONI,PERDANA BANGUN PUSAKA TBK
508001397.0,More Than 5%,PT MULYA TARA MANDIRI,True,72.86,KOPI,PT MITRA ENERGI PERSADA TBK
52295001.0,More Than 5%,SHIZUOKA GAS CO LTD,False,7.5,KOPI,PT MITRA ENERGI PERSADA TBK
49792800.0,More Than 5%,PT GLOBAL PERKASA INVESTINDO,False,7.14,KOPI,PT MITRA ENERGI PERSADA TBK
4006525306.0,More Than 5%,PT DMS INVESTAMA,True,38.0,KOTA,PT DMS PROPERTINDO TBK
0.0,More Than 5%,PT FLYING FOX NUSANTARA,False,0.0,KOTA,PT DMS PROPERTINDO TBK
25473847680.0,More Than 5%,PT MNC ASIA HOLDING TBK,True,26.11,KPIG,MNC TOURISM INDONESIA TBK
15725026164.0,More Than 5%,UOB KAY HIAN HONG KONG LTD,False,16.12,KPIG,MNC TOURISM INDONESIA TBK
8779326700.0,More Than 5%,HT INVESTMENT DEVELOPMENT LTD,False,9.0,KPIG,MNC TOURISM INDONESIA TBK
15477117520.0,More Than 5%,PT BIRO KLASIFIKASI INDONESIA (PERSERO),True,80.0,KRAS,KRAKATAU STEEL (PERSERO) TBK
2652400334.0,More Than 5%,PT KRESNA PRIMA INVEST,True,14.57,KREN,PT QUANTUM CLOVERA INVESTAMA TBK
2506467300.0,More Than 5%,PT ASURANSI JIWA KRESNA,False,13.77,KREN,PT QUANTUM CLOVERA INVESTAMA TBK
352902780.0,More Than 5%,GRACE CAPITAL INVESTMENT LTD,False,27.297,KUAS,PT ACE OLDFIELDS TBK
199762140.0,More Than 5%,PT ANUGRAH PRIMA INVESTAMA,True,15.452,KUAS,PT ACE OLDFIELDS TBK
117700040.0,More Than 5%,PT BONA DEKA JAVA,False,9.104,KUAS,PT ACE OLDFIELDS TBK
1029853200.0,More Than 5%,PT GRAHA MULIA INDOTAMA,True,36.88,LAND,PT TRIMITRA PROPERTINDO TBK
989466800.0,More Than 5%,PT TRIDAYA BANGUN CIPTA,False,35.43,LAND,PT TRIMITRA PROPERTINDO TBK
770368845.0,More Than 5%,PT INTIPUTERA BUMITIRTA,True,19.42,LAPD,LEYAND INTERNATIONAL TBK
720000000.0,More Than 5%,LAYMAND HOLDINGS PTE LTD,False,18.15,LAPD,LEYAND INTERNATIONAL TBK
508260231.0,More Than 5%,KERATON INVESTMENT LTD,False,12.81,LAPD,LEYAND INTERNATIONAL TBK
627808000.0,More Than 5%,PT LCK INVESTAMA PRIMA INDONESIA,True,62.78,LCKM,PT LCK GLOBAL KEDATON TBK
202252900.0,More Than 5%,PT MAJU MEKAR MAKMUR,False,20.23,LCKM,PT LCK GLOBAL KEDATON TBK
1345000000.0,More Than 5%,PT JALAN TERANG SAMUDRA,False,23.19,LEAD,PT LOGINDO SAMUDRAMAKMUR TBK
1313058200.0,More Than 5%,PACIFIC OFFSHORE PTE LTD,True,22.64,LEAD,PT LOGINDO SAMUDRAMAKMUR TBK
1680000000.0,More Than 5%,MITSUI SUMITOMO INSURANCE CO LTD,True,80.0,LIFE,PT MSIG LIFE INSURANCE INDONESIA TBK
262500000.0,More Than 5%,PT SINAR MAS MULTIARTHA TBK,False,12.5,LIFE,PT MSIG LIFE INSURANCE INDONESIA TBK
2159290763.0,More Than 5%,AXIATA INVESTMENTS (INDONESIA) SDN BHD,True,75.42,LINK,PT LINK NET TBK
550316196.0,More Than 5%,PT XLSMART TELECOM SEJAHTERA TBK,False,19.22,LINK,PT LINK NET TBK
150060000.0,More Than 5%,LION HOLDINGS PTE LTD,True,28.849,LION,LION METAL WORKS TBK
150060000.0,More Than 5%,LION HOLDINGS SDN BHD,True,28.849,LION,LION METAL WORKS TBK
132313291.0,More Than 5%,PT LANGGENG BAHAGIA,True,13.12,LMPI,LANGGENG MAKMUR INDUSTRI TBK
57901002.0,More Than 5%,DIREKTORAT JENDERAL KEKAYAAN NEGARA KEMENTERIAN KEUANGAN,False,5.741,LMPI,LANGGENG MAKMUR INDUSTRI TBK
24527000.0,More Than 5%,LION HOLDINGS PTE LTD,True,25.549,LMSH,LIONMESH PRIMA TBK
6400000.0,More Than 5%,TRINIDAD INVESTMENT PTE LTD,False,6.667,LMSH,LIONMESH PRIMA TBK
1783927000.0,More Than 5%,PT HANWHA LIFE INSURANCE INDONESIA,True,59.46,LPGI,LIPPO GENERAL INSURANCE TBK
543000000.0,More Than 5%,PT INTI ANUGERAH PRATAMA,False,18.1,LPGI,LIPPO GENERAL INSURANCE TBK
447000000.0,More Than 5%,HANWHA GENERAL INSURANCE CO LTD,False,14.9,LPGI,LIPPO GENERAL INSURANCE TBK
347246400.0,More Than 5%,MULTIPOLAR TBK,True,81.71,LPIN,MULTI PRIMA SEJAHTERA TBK
18161073458.0,More Than 5%,PT INTI ANUGERAH PRATAMA,True,25.62,LPKR,LIPPO KARAWACI TBK
11259645290.0,More Than 5%,SIERRA INC,False,15.88,LPKR,LIPPO KARAWACI TBK
7371500000.0,More Than 5%,PT PRIMANTARA UTAMA SEJAHTERA,False,10.4,LPKR,LIPPO KARAWACI TBK
3662826200.0,More Than 5%,DBS BANK LTD,False,5.17,LPKR,LIPPO KARAWACI TBK
592237809.0,More Than 5%,PT INTI ANUGERAH PRATAMA,True,50.6,LPLI,STAR PACIFIC TBK
234658167.0,More Than 5%,HX TRADING LIMITED,False,20.05,LPLI,STAR PACIFIC TBK
0.0,More Than 5%,PT SANGGRAHA NUSA RAYA,False,0.0,LPLI,STAR PACIFIC TBK
960021796.0,More Than 5%,AURIC DIGITAL RETAIL PTE LTD,True,42.51,LPPF,MATAHARI DEPARTMENT STORE TBK
209992000.0,More Than 5%,MULTIPOLAR TBK,False,9.3,LPPF,MATAHARI DEPARTMENT STORE TBK
1747636749.0,More Than 5%,PT INTI ANUGERAH PRATAMA,True,67.52,LPPS,PT LENOX PASIFIK INVESTAMA TBK
199999998.0,More Than 5%,PT LORENA,True,57.14,LRNA,PT EKA SARI LORENA TRANSPORT TBK
47595500.0,More Than 5%,PT GADING DANALESTARI,False,13.6,LRNA,PT EKA SARI LORENA TRANSPORT TBK
4058425010.0,More Than 5%,SALIM IVOMAS PRATAMA TBK,True,59.508,LSIP,PP LONDON SUMATRA INDONESIA TBK
7570300.0,More Than 5%,INDOFOOD AGRI RESOURCES LTD,False,0.111,LSIP,PP LONDON SUMATRA INDONESIA TBK
882864000.0,More Than 5%,PT CATURKARSA MEGATUNGGAL,True,56.59,LTLS,PT LAUTAN LUAS TBK
113784540.0,More Than 5%,SERIAL SYSTEM PTE LTD,False,15.9,LUCK,PT SENTRAL MITRA INFORMATIKA TBK
900141542.0,More Than 5%,PT DELTA WIBAWA BERSAMA,True,59.42,LUCY,PT LIMA DUA LIMA TIGA TBK
1282143142.0,More Than 5%,DRAGON AMITY PTE LTD,True,57.27,MAIN,MALINDO FEEDMILL TBK
44559550.0,More Than 5%,PT LEONG HUP JAYAINDO,False,1.99,MAIN,MALINDO FEEDMILL TBK
0.0,More Than 5%,LEONG HUP SINGAPORE UOB KAYHIAN PTE LTD,False,0.0,MAIN,MALINDO FEEDMILL TBK
19618986600.0,More Than 5%,PT MITRA ADIPERKASA TBK,True,68.83,MAPA,PT MAP AKTIF ADIPERKASA TBK
1718804138.0,More Than 5%,PT MITRA ADIPERKASA TBK,True,71.98,MAPB,PT MAP BOGA ADIPERKASA TBK
480834533.0,More Than 5%,GA ROBUSTA F B COMPANY PTE LTD,False,20.136,MAPB,PT MAP BOGA ADIPERKASA TBK
2862.0,More Than 5%,PT PREMIER CAPITAL INVESTMENT,False,0.0,MAPB,PT MAP BOGA ADIPERKASA TBK
8466000000.0,More Than 5%,PT SATYA MULIA GEMA GEMILANG,True,51.0,MAPI,PT MITRA ADIPERKASA TBK
2119299600.0,Director,PT BEYOND MEDIA,True,40.35,MARI,PT MAHAKA RADIO INTEGRA TBK
860034567.0,Director,PT MAHAKA MEDIA,False,16.37,MARI,PT MAHAKA RADIO INTEGRA TBK
1610830489.0,More Than 5%,TECABLE HK CO LIMITED,True,42.39,MARK,PT MARK DYNAMICS INDONESIA TBK
786413062.0,More Than 5%,PT DYNA CAPITAL INDO,False,20.7,MARK,PT MARK DYNAMICS INDONESIA TBK
584957747.0,More Than 5%,PT MARK CAPITAL INDO,False,15.39,MARK,PT MARK DYNAMICS INDONESIA TBK
9180557273.0,More Than 5%,SOCGEN SA COMPAGNIE GENERALE DES ETABLISSEMENTS MICHELIN,True,99.97,MASA,MULTISTRADA ARAH SARANA TBK
738500000.0,More Than 5%,PT DANABINA SENTANA,True,52.674,MASB,PT BANK MULTIARTA SENTOSA TBK
263750000.0,More Than 5%,PT MULTI ANEKADANA SAKTI,False,18.812,MASB,PT BANK MULTIARTA SENTOSA TBK
21100000.0,More Than 5%,PT HALIM SAKTI,False,1.505,MASB,PT BANK MULTIARTA SENTOSA TBK
6323077933.0,More Than 5%,PT MAYAPADA KARUNIA CORPORATION,True,24.16,MAYA,PT BANK MAYAPADA INTERNASIONAL TBK
3219962707.0,More Than 5%,PT MAYAPADA KASIH CORPORATION,True,12.31,MAYA,PT BANK MAYAPADA INTERNASIONAL TBK
2290586666.0,More Than 5%,PT GATSU GRIYA MEGATAMA,False,8.75,MAYA,PT BANK MAYAPADA INTERNASIONAL TBK
